,author,body,created_utc,id
2982,Blood_Bowl,"Can this person please be banned (assuming you didn't already, of course)?   I'm pretty certain they're a ban-evading individual that was recently banned.",1584569119,fkvh560
2983,listen_itsfine,"HR here. Yes, it could be covered under worker’s compensation. It would be up to the insurance companies discretion if it was transmitted at work. 

Fun fact - can also be an OSHA recordable.",1584571999,fkvm2qk
2984,jpetty265,"Interesting, how difficult do you think it would be to prove? Assuming a person's majority of time is spent at work and home",1584573123,fkvnzvt
2985,Mikashuki,"He's coming really close, we're discussing using the politics in disaster threads for this.",1584573828,fkvp6ys
2986,At_an_angle,"The only thing I don't understand is why link a crappy file sharing site that promoted porn?

You can literally goto https://www.douglascountyhealth.com/ and read it in it's original form.  

Direct link: https://www.douglascountyhealth.com/images/COVID-19/Order_Less_than_10_signed_and_voted._3-18-2020.pdf",1584575570,fkvs4i4
2987,[deleted],[removed],1584578873,fkvxlcy
2988,The_Zammer,"Insurance Professional here. Yes, it is compensable if it can be proven that you caught it at work. But note that there is a waiting period before benefits kick in and it will be hard to prove",1584580405,fkw019a
2989,BleedingRainbovv,"It’s not really the dress code that’s the issue, some people like their dress code and environment they provide, but their fire rate is very high!",1584580908,fkw0txg
2990,jpetty265,Thank you for helping!,1584581073,fkw13cp
2991,[deleted],[removed],1584581979,fkw2i23
2992,AToiletsGreatestFear,Overreaction is a pandemic.,1584583325,fkw4kyz
2993,chefjeff1982,Unfortunately if we dont comply it will get worse as far as restrictions go. I for one am not a fan of the national guard being called up or curfews. Just stay home unless working or an emergency. Need interaction? Facetime or something.,1584584419,fkw68wk
2994,stevewhite_news,We have since spoken with the woman herself. She had been traveling in Europe and out of an abundance of caution she came directly home and has not been out of her home since she returned.,1584586524,fkw9c13
2995,[deleted],[removed],1584589317,fkwd924
2996,[deleted],[removed],1584591677,fkwgbcz
2997,listen_itsfine,"Honestly, I’m not sure. It sounds like there would need to be other cases at work to prove spread. 

SHRM (Society of HR Management) is having almost daily webinars to update changes in policy and legislation.",1584593757,fkwis5k
2998,pecanpierre447,Thank you for this update.,1584603692,fkwsbqv
2999,Gmosphere,Hastings area resident here: Fuck,1584616066,fkx2a1o
3000,PM_your_Lego,Ben Sasse voted against the Federal Relief bill.,1584621684,fkx83ju
3001,yeshaveanother,Ignorance and arrogance cause pandemics.,1584625177,fkxcrki
3002,itsbeansokay,"Now if we can do something about the ""businesses as usual"" for alot of the companies here...",1584633557,fkxqouh
3003,2whatisgoingon2,Thank goodness for her. I was worried because someone who travels is probably pretty social also.,1584634795,fkxswer
3004,maquila,The article doesnt even mention the counties included.,1584647476,fkyf367
3005,stpierre,"Cass, Douglas, Sarpy, and Washington.

It must be hard work to be a journalist writing about an order that affects four counties and **not bother to mention which four counties**. I know journalism is a dying profession but you don't have to try that hard to kill it, WOWT.",1584647599,fkyfaxs
3006,sycamoar,I was definitely WTF out loud about what other counties it was.,1584647890,fkyftiu
3007,jpetty265,I saw that too. It does however link the release which lists them,1584648409,fkygqnw
3008,jpetty265,"Sorry for not including in title, thanks for backing me up. The article does link to the release which details it in full",1584648451,fkygt87
3009,suprduprwintrscoopr,"Opinions? Honestly, I feel it's completely warranted. This is hurting almost everybody in some way, but check out the graphs on this page: https://www.worldometers.info/coronavirus/  

We're on what, week 12? Already over half the body count of swine flu in 12 WEEKS, even with all these extreme measures.  

This is going to get much worse before it gets better and we all need to do our part to at least help flatten the curve so our medical resources can be used to treat as many people as possible over time.",1584650070,fkyjobz
3010,crafting-ur-end,"Why would you want to have more than 10 guests considering the situation? 

I suppose they wouldn’t know unless you were being loud and rowdy; one of your neighbors would have to report something.",1584652151,fkynafb
3011,paytonnotputain,"It might have been edited since, but it says them now",1584656610,fkyutcy
3012,Drafter13401,"Oh, the humanity!

Seriously though, that's some major douchbaggery.",1584656996,fkyvgnm
3013,fajitaman69,"So basically just the service industry is being shat on. Grocery stores are busier than ever and malls are exempt. Factories/offices that employee waaaaay more people working in close quarters continue business as usual?

What's the point?",1584657322,fkyvzxu
3014,BonelessWings,12k in the US died from swine flu. The numbers you linked are worldwide. Your point still stands though.,1584657768,fkywq5l
3015,[deleted],[deleted],1584657814,fkywstv
3016,Mikashuki,Have you never walked through a drive through before?,1584657900,fkywxz4
3017,suprduprwintrscoopr,"I deleted my other reply. I was actually referencing [2010 WHO estimates for worldwide deaths.](https://www.who.int/csr/don/2010_08_06/en/)  But yes, it looks like they've updated estimates since then.",1584658798,fkyyf87
3018,RavenRages,"Yea, except they have signs saying not to do that.",1584658873,fkyyjml
3019,Mikashuki,Global pandemic and closed dining rooms is probably a good excuse to break that guideline,1584658917,fkyym87
3020,Tholtken,r/trashy,1584661572,fkz2vvz
3021,Raw_Venus,having a large family and they bring friends over,1584667667,fkzca9g
3022,decorama,Idiocracy is taking hold.,1584671694,fkzicup
3023,teebob21,"Dammit! Why didn't I think of this!

No one would spare a square!",1584674478,fkzmejo
3024,teebob21,That ship sailed long ago,1584674504,fkzmfwc
3025,thundergonian,"Those Areas no Rest for the wicked, I suppose",1584675139,fkznbz4
3026,Paddygirl123,Factories need to continue to produce so we have sufficient supplies,1584682023,fkzvwhd
3027,creed_1999,Jokes on them though. The toilet paper in those places are usually like sand paper. They gonna cut their booty holes on that,1584684536,fkzyhdf
3028,[deleted],[removed],1584705719,fl0glgg
3029,lalallaalal,"Don't bring friends over, simple solution",1584708962,fl0k96p
3030,[deleted],[removed],1584711523,fl0np84
3031,greg-sprinkles,"If there's the capability to test 200 people each day, then why are there only 240 negative cases tested so far in the entire state? ( [source](http://dhhs.ne.gov/Pages/Coronavirus.aspx) )

Denying tests to those with symptoms and telling them to just self-isolate isn't going to help the spread if they still have to go into work. Not to mention the fact that around 18% of people with COVID-19 are completely asymptomatic.

In my opinion, people here aren't going to take this seriously until we start seeing some accurate numbers. I understand that we don't have enough tests, but let's not hoard the ones we do have.",1584712084,fl0oht0
3032,drunkinwalden,They don't really have the capability of testing 200 a day. If they did that for a week they couldn't test anyone until they restock their supplies. Since they only had a few months to prepare for this and there was a M*A*S*H marathon that wiped out two weeks nothing could be done.,1584714485,fl0s286
3033,CrockTalk38,"This is crazy! I work at Sandhills. We have all been sent multiple emails specifically stating if any employee feels they need to work from home, all they need to do is tell their manager, and then make sure they actually work while they’re home. I personally know multiple employees who are doing this for various reasons.

They have suspended all travel for their employees and have sent reminders to anyone’s who had recently traveled to stay at home.

This post is unfair and doesn’t come close to telling the whole story.",1584716790,fl0vrjy
3034,DeLincolnIcious,"Maybe for a separate thread, but what do you (all) think about Good Life Fitness keeping the gym open?  Is it different because someone is volunteering to go workout and work is a different arena?   

That is still potentially the same risk to the community as a whole, to me.",1584717630,fl0x5op
3035,CrockTalk38," No... they were not told that. They were told stay home if you’re sick. And that the company wasn’t banning on campus work. And if you decide to work from home, just tell your manager.",1584718519,fl0ynm6
3036,Blood_Bowl,"As a teacher, the designation of ""essential critical"" hurts my brain.",1584719180,fl0zshn
3037,kuchokora,"I don't know about other days, but I know two individuals that were tested last Friday/Saturday in Omaha that haven't received results yet. They're being told that it's now an 11 day turnaround.",1584719224,fl0zv4e
3038,HMStruth,"The idea of “stay home if you’re sick” doesn’t really work well in this scenario when some people don’t show severe symptoms, sick days are discouraged, and it takes two weeks for the symptoms to manifest and for those two weeks you can still spread the virus. Then compound the fact that individual managers look down on employees who want to stay home out of “paranoia.” 

The government discourages groups of 10 people  getting together except when its 60 people in an open air office apparently.  The responsible thing to do as an employer would be to have all non-essential employees work from home, especially when more than half your staff works exclusively at a computer work station anyway. 

But you shouldn’t be shocked by Sandhills ancient work policies, seeing as they refuse to meet industry standards for retirement benefits, vacation days, ect. Sandhills execs are more concerned about the color of your button-down than your personal health.",1584720272,fl11pq9
3039,CrockTalk38,"But they can work from home. We were all told we can work from home, even if we’re not feeling sick",1584721335,fl13l62
3040,greg-sprinkles,That wait time is absurd when there are [tests](https://www.fiercebiotech.com/medtech/fda-grants-roche-coronavirus-test-emergency-green-light-within-24-hours) that can show results in 3.5 hours.,1584721455,fl13srh
3041,HMStruth,"As advised by nearly every authority, the situation should be “If you aren’t essential personnel then work from home.” As of right now the situation is “get your managers approval to work from home if you’re uncomfortable about coming in.” 

There shouldn’t be any hint of culpability about an employees decision to work from home.",1584722281,fl15aip
3042,CrockTalk38,"There isn’t. It’s not, get their approval. It’s let them know your plans.

True, the company isn’t forcing employees to stay home. It’s each person’s decision",1584722668,fl15zym
3043,theobfuskate,"Generally speaking, the NE DHHS handles dental licenses and [complaints](http://dhhs.ne.gov/Pages/Investigations.aspx).",1584723571,fl17mig
3044,modi123_1,Glad to hear you are concerned about small-town local dentistry whole not residing here.,1584724493,fl19a32
3045,borgasie,Awesome this is exactly what I was looking for! Thank you!,1584724869,fl19yd0
3046,borgasie,Thanks! I lived there most of my life and actually was a patient there for most of it but I think he is out of touch with this.,1584724925,fl1a21r
3047,donedidgot,"Pretty narrow title on this one.  The article pretty much says ""absolutely anyone having anything to do with food supply"". When you take that into account and consider every job that contributes to keeping trucks on the road,  it may be easier to list who isn't essential rather than who is.",1584729437,fl1i38b
3048,VaporIcecream,Wait there are asymptomatic carriers of coronavirus? Whoa.,1584734019,fl1q62n
3049,yoyoboi_conradicle,I just hope we still have detastling lol. I need money,1584735941,fl1tgbj
3050,deeretech129,"It's a long ways out, with a little hope things will be settled by then :)",1584736309,fl1u2cf
3051,yoyoboi_conradicle,I hope! I'm almost broke!,1584736353,fl1u4y0
3052,Mikashuki,The rapid tests can have up to a 20% false positive rate,1584743913,fl26bkb
3053,1coldbreeze,Awesome!,1584747308,fl2bmsb
3054,GentleOmnicide,"Let me guess, they went to Colorado last week...",1584748211,fl2d0tq
3055,[deleted],[removed],1584749540,fl2f2ga
3056,Drafter13401,What a great person!,1584751718,fl2icka
3057,genrej,Does anyone know how many signatures they have yet?,1584755274,fl2njg7
3058,mumer,"Why do you need to have that many people over? Can it not wait? People are cancelling weddings and funerals. Pretty sure whatever you’re wanting to do with friends and family is absolutely not important enough to spread a virus around for.

Also yeah it applies to having gatherings in private spaces. 

Just don’t do it, wait until this thing is figured out.",1584755460,fl2nt56
3059,faithofthewalkers,I think that you should connect with the people that run [this grocery delivery operation.](https://www.reddit.com/r/Omaha/comments/fkzqf9/if_you_need_groceries_delivered_to_your_door/?utm_source=share&amp;utm_medium=ios_app&amp;utm_name=iossmf),1584756506,fl2paz2
3060,ObliterateNatalie,"Awesome. Thank you, I’ll look into this.",1584756579,fl2peo4
3061,Drafter13401,What is this doing here?,1584759524,fl2tj7l
3062,huskerguy07,I bet the American scientist working for our government living in Wuhan released the virus just to prevent the Nebraska initiative from getting enough signatures!,1584762505,fl2xgj2
3063,swattages,Thanks for pitching in!,1584772253,fl382ep
3064,ToiletIcer,Bet,1584812249,fl4f796
3065,huskerguy07,Complete sarcasm,1584815891,fl4l5o9
3066,Samurai_Churro,"I love the idea, but maybe don't start on April Fool's Day. It's hard enough to trust strangers as it is.",1584816911,fl4ms84
3067,FarmFreshPrince,If anyone is short on meat there's plenty of producers in the state that would help out if they can. Don't be afraid to reach out!,1584822055,fl4uwzv
3068,FarmFreshPrince,If anyone is short on meat there's plenty of producers in the state that would help out if they can. Don't be afraid to reach out!,1584822060,fl4uxa7
3069,FarmFreshPrince,"u/borgasie 

It is only recommended, not mandated that offices close in Nebraska. It is up to the office's, and ultimately the patients discretion because they are the ones scheduling appointments.",1584822457,fl4vir5
3070,FarmFreshPrince,I'm guessing he had issue with something they snuck in there?,1584822760,fl4vz2j
3071,ColeBrodine,Would have been great if they could have mentioned where she traveled to or from?  Perhaps mode of transport? Or perhaps just general locations she has been at recently?,1584825119,fl4zkp2
3072,Zook,Nah let's let people panic more,1584827565,fl53d19
3073,2whatisgoingon2,"Ya, they took away the popcorn.",1584829094,fl55q95
3074,yetanotherbrick,Hopefully they can get back on track after since [polling at the end of 2017 put 77% in favor of medical marijuana.](https://www.omaha.com/livewellnebraska/survey-finds-support-for-legalizing-medical-marijuana-in-nebraska/article_3cb127e9-5663-5d5f-a3c8-1d8c347db224.html),1584829126,fl55s4n
3075,2whatisgoingon2,"Maybe, but the parking lots are still full so...",1584829160,fl55tyq
3076,neuroctopus,What a find! Very cool.,1584830488,fl57urv
3077,_Pliny_,Looks like a Solomon Butcher photograph,1584837152,fl5hyfs
3078,Blood_Bowl,You mean there was one that Trump didn't fire?,1584841154,fl5npu6
3079,huskerguy07,"Haha, downvoting me. Get a sense of humor people.",1584841827,fl5oo0r
3080,tinytorn,"I shared this with my mom. She said the same thing!! She grew up on a ranch north of Taylor, and there’s an old photo of my great grandparents in front of their sod house he took. Small world!!",1584843014,fl5qc0e
3081,tinytorn,Beautiful photo!!! Thank you for sharing!!,1584843086,fl5qfmj
3082,echobase_2000,"Took our kids to school to get their stuff. Some staff members were putting chrome books and supplies on carts and wheeling it to the curb. They’d step back and a parent would get out and put it in the car and drive away. So bizarre. 
It has to suck to be a teacher right now.",1584848226,fl5xe4z
3083,DeLincolnIcious,Any updates?  I know things are changing pretty regularly everywhere as more and more info and stats come out.,1584891635,fl71nyv
3084,kuchokora,"They are still getting paid now, right? Not to downplay how much it sucks for them, but imagine losing your job because you worked in an industry that can't possibly survive this.",1584894972,fl75y4w
3085,Drafter13401,He's not getting my vote.,1584900065,fl7egrp
3086,8bit_drew,"Alisha Shelton is challenging Sasse's seat in this years election.  

[Campaign Website](https://sheltonforsenate.com/)

[@Shelton4Senate](https://twitter.com/Shelton4Senate?s=09)",1584900518,fl7f903
3087,Secretitnerd1,Her campaign is high on talking points on light on substance.,1584901076,fl7g7pn
3088,guyfromnebraska,Contact the courthouse or county directly,1584902318,fl7ib3c
3089,throwayohay,"From her website: ""Nearly three million children in our country witness gun violence  every year and approximately 100 Americans are killed from guns every  single day. One million women alive today have been shot or shot at by  an intimate partner while access to a gun in a domestic violence  situation makes it five times more likely that a woman will be killed.  Two-thirds of gun deaths are suicides, and in context, the U.S. gun  suicide rate is 10 times that of other high-income countries.

It’s beyond time that we use common sense to tackle this pandemic.""

&amp;#x200B;

Oh more ""common sense"".  How's that working out for everyone clamoring to get a gun in this current, ACTUAL pandemic?  This is why folks like Sasse and Ricketts keep getting elected.  How about drop the gun stuff?  How about not being so vague with ""common sense""?",1584902687,fl7ixpn
3090,miriamwebster,No worries. I will be voting👍🏻,1584902713,fl7izab
3091,fajitaman69,"I didn't realize they were closed until yesterday late evening. Of course I tried calling today but no one is going to answer on a Sunday. 

I need to make travel plans soon.",1584902737,fl7j0p3
3092,TheFoodElevator,To justify this vote he said he'd rather leave it up to states to handle these things. Absolutely laughable considering who our governor is,1584902791,fl7j3zf
3093,Nearsighted_Beholder,"She even places it above healthcare and economics on her website and openly conflates suicide rates with gun violence.  They aren't the same issue.

She's a crusader for regressive rights.",1584903172,fl7jr5h
3094,redneckrockuhtree,"In other words, ""Carry on, let's continue to do nothing"" and abdicating any and all responsibility. Sounds about right for Ben'S asse.",1584903310,fl7jzjw
3095,throwayohay,"We need people in political office that actually trust their constituents to enjoy the fruits of liberty.  This isn't a daycare.  That goes for our typical Republicans that run in this state too.  Get off your anti-drug/sex/gambling/etc. moral high horse that's 20 years too old.  

&amp;#x200B;

This state needs MORE revenue streams, not higher taxes.",1584903881,fl7kxrz
3096,guyfromnebraska,"But the whole county can't be closed. C
Maybe call the sheriff if you can't get in contact with someone else",1584904039,fl7l7d2
3097,gl522,Nebraska does not care about Ben Sasse.,1584904477,fl7lxgr
3098,fajitaman69,Good idea. Thanks.,1584904527,fl7m0li
3099,kclinden,Prob cause he didn’t agree with the plan...,1584905268,fl7n9cg
3100,purplepartybarge,"We never even get to hear Sasse's talking points, presumably because he's lodged himself somewhere so deep in Donald Trump's G.I. tract that he can't get out. But at least he has plenty of Republican company up there. We , his constituents, just don't get to see him here, in the state he represents.

Sasse does have a website where you can get all the substance you can stand, though, so long as you understand ""substance"" to mean pictures of Ben trying and failing to pretend he's comfortable outside a wainscotted office.",1584906206,fl7otd9
3101,purplepartybarge,"Or maybe he's just too busy writing another book lecturing adults about how they're not adults (ostensibly because they don't agree with him on everything).

The only thing Ben Sasse has a plan for is periodically riling up the anti-choice base here in Nebraska just enough to get re-elected so he can go on doing absolutely nothing useful.",1584906334,fl7p0z3
3102,purplepartybarge,"It's the ol' Nebraska Republican switch-a-roo. If you're a Republican state official, you complain endlessly about federal agencies (the way Slama does about the Corps of Engineers) without ever really offering up any concrete solutions yourself. If you're a Republican federal official, you just repeat ""state's rights"" until the cameras run out of juice and you can go back to tweeting about your book tour and college football.",1584906851,fl7pvys
3103,stevewhite_news,"Under Nebraska law, teachers are still paid during a pandemic. It dates back to the Spanish flu.",1584906994,fl7q4f8
3104,yuxbni76,"A lot of Republicans grumbled before voting YES, but you had to be very comfortable in your seat to actually vote NO on that bill. Like a Nebraska senator.",1584908082,fl7rx72
3105,iwantmoregaming,That’s still more than Sasse is to offer.,1584909744,fl7unet
3106,Aquahawk911,But he sells Runzas on game days! That means he cares right???,1584910111,fl7v8sa
3107,Secretitnerd1,"Yes, I want to trade one ass kissing, self serving bureaucrat for another. That’s exactly what we should do.",1584911691,fl7xuk9
3108,Secretitnerd1,Not really. They are two sides of the same coin.,1584911710,fl7xvpi
3109,purplepartybarge,"Nah, I think you're actually just fine with this *particular* ass-kissing, self-serving politician, so you're going to paint his opponent with the same brush so you get to carry his water *and* pretend like you're some kind of free-thinking, above-it-all ""independent"".",1584911817,fl7y225
3110,Secretitnerd1,"Yes! That’s exactly right! I like it when my representatives do nothing for me! The less the better! 

If she didn’t have the most bland talking points ever on her one page web site I might have more to say.

Aside from the fact that her common sense control talking point is a load of horse shit. We have back ground checks, they are required everywhere and by everyone. If I sell you a gun private party and you’re a prohibited person, I AM GOING TO JAIL. There is no excuse.",1584912008,fl7yddt
3111,Sundaymorningbkfst,Well... used too https://www.google.com/amp/s/journalstar.com/news/local/education/sasse-won-t-be-hawking-runzas-after-husker-fan-protests/article_bc2c2c4b-c37e-59ba-89fd-b81fafc9570c.amp.html,1584912174,fl7yn0e
3112,Blood_Bowl,Speaking of Ben Sasse...,1584912313,fl7yv2v
3113,Red_Flagg,Too bad she's a gun control facist.,1584912659,fl7zfj4
3114,LookARedSquirrel84,What a fucking wiener.,1584913071,fl803y7
3115,Aquahawk911,Yeah I remember that,1584913720,fl816kw
3116,Henry_Bowman,"Just another example of Democrats losing votes to Republicans because they crusade against guns. ""Party of science"" lmao.",1584914166,fl81wvk
3117,yugats,What revenue streams do states have other than taxes?,1584917130,fl86w54
3118,purplepartybarge,"Hold on, trying to clean up here after the massive spit-take I did when you implied Ben Sasse and his talking points are *something other* than bland.

And, yeah, we know Republicans like when their representatives do nothing for them, just so long as they do really shitty things to people who *aren't like* them.",1584917164,fl86y6k
3119,Henry_Bowman,If you can increase your tax base you can increase the revenue without actually increasing taxes. Probably just sloppy wording on his part.,1584917252,fl873j9
3120,Blood_Bowl,"&gt;Yet, even my attorney was unable to give me a clear answer. Can anyone help me out?

Maybe I'm off-base, but this seems like exactly the sort of thing you're paying your attorney to find out...isn't it?",1584917597,fl87nvc
3121,yugats,"I assumed, but maybe there is something we are overlooking. 

I've long said that what Nebraska needs to fix its property tax mess is a flat income tax with absolutely no loopholes or deductions. Everybody, regardless of income level or job (including farming) just pay X %.",1584917671,fl87s6y
3122,fajitaman69,Sure I guess. Although I understand circumstances are unique. She said she would let me know as soon as possible.,1584917896,fl885q3
3123,Nearsighted_Beholder,"Agreed.  Nobody cares about dope or hemp.  The way federal laws exist, firearm owners and those with security clearance were always going to steer clear.  Those communities dont often overlap l.

The only issue with the sex/gambling is NIMBYism, and I somewhat agree.  This isn't Vegas, there aren't shows and night life surrounding the boats.  It's just largely elderly.  There's no energy in those places and they are surrounded by trashy trailer parks.

Casinos bring a lot of social problems.  If one breaks ground, I dont know what the surrounding areas will become.",1584918703,fl89h7k
3124,[deleted],[removed],1584919757,fl8b7g5
3125,[deleted],[removed],1584922780,fl8fxyt
3126,lalallaalal,"I would like much stricter gun laws, but I agree it should be dropped from the Dem platform. I think there are a lot of gun nuts that would flip if it was dropped.",1584923861,fl8hlcm
