,author,body,created_utc,id
0,AdeptChallenge,not him but that does sound kinda dope i wanna see,1577772701,fcmeve0
1,slimeprincess,Dinkers in Omaha,1577773917,fcmg26m
2,berberine,"Like I said. I don't see any stories identifying where in western Nebraska these were sighted. You won't name the town or link to a story from your local newspaper about it. 

Why are there plenty of stories about where in Colorado these have been sighted, but not Nebraska? If you work in a newspaper you should be investigating why this is happening and have some kind of story on it, especially if the locals are calling you about it.",1577777200,fcmizgn
3,jeansntshirt,So someone who has been found guilty of spousal abuse should be allowed to own a gun?,1577793503,fcmuyol
4,AssMaster7000,I like my personal privacy on reddit...? There’s only a handful of employees lmao I think that’s not unreasonable for me to give the name of the paper. Also it’s not my story. It’s my boss’s as he’s a self proclaimed “drone enthusiast.” Look around this week and I’m sure you’ll see weekly papers publish it.,1577799949,fcn0t35
5,owenloveslife,"I'm a certified pilot, and keep up with the ""scene"" quite a bit - this is one of two things. They're either testing new tech in a sparsely populated area, or the FAA is creating paranoia around drones to push new regulations. New regulations are indeed being discussed right now, where the FAA wants to put transponders into all newly manufactured drones that will lend a hand in tracking drone locations/pilots.   


However, despite that, I believe it's just testing of tech. These are smaller drones that your big, fighter-pilot style bombers, so the miniaturized tech necessary to remotely pilot drones of this size is still pretty new.",1577810256,fcnetdb
6,riverguy56,You don’t find formations of large drones flying at night in the middle of the nations largest concentration of ICBMs disturbing?,1577812429,fcnilpb
7,kwridlen,I witnessed 4 in a line moving West to East. There appeared to be 10 miles between them. This was about 1930. I again saw two coming from the North moving South at about 2045. They appeared to be about 400 to 600 feet up. It was tough to estimate a size.,1577812565,fcnivqs
8,owenloveslife,"From what I've read they have about 6 foot fixed wingspans. If they were any more than 400 feet up, they were operating illegally, but from what I've read, that's a given. These drones are definitely operating from beyond visual line of sight, and past dusk, so whoever is flying these things is intentionally flaunting regulations.",1577812937,fcnjn3z
9,plasticbuddha,"I grew up in Imperial/Benkelman/Wauneta area in 80s and 90s, and this air space has long been used by the US Military for flight test and training. Low altitude bombers flew over my GF's farm by Max, NE almost every day. We saw B1 bombers and stealth tech before they were really public knowledge.  I would not be at all surprised to learn that these are military test exercises.",1577813152,fcnk3g4
10,bareback_cowboy,400-600 ft? Goose shot ought to do the trick.,1577813678,fcnl8kt
11,kwridlen,It really seems to be coordinated. I had been alerted to there presence shortly after 1900. I witnessed them until 2200 then they were all gone.,1577814048,fcnm05l
12,kwridlen,I have heard a lot of people say that. What would the legal problems with shooting one down be?,1577814103,fcnm43h
13,Epluribusunicorn,Grand Island here. Pretty sure there was one west of town last night. Looked like a plane that wasn’t moving.,1577814128,fcnm5w7
14,kwridlen,As far as the sightings in Colorado the military has denied any involvement. I have not heard any reports from law enforcemnt in Nebraska. Last night  were the first sightings in Chase County as far as I know.,1577814232,fcnmd4j
15,kwridlen,I was watching on FlightRadar 24 to see what aircraft were around.,1577814316,fcnmilt
16,JesseA420,"Grand island here, also seen what I assumed to be a large drone pretty high up last weekend. Was around 8pm on the east edge of town, and definitely wasn't a plane because i watched it do a perfect 90 degree directional change.",1577815276,fcnoa2z
17,kwridlen,I have witnessed the same types of movements.,1577816641,fcnqq0j
18,bareback_cowboy,"The obvious one would be vandalism - criminal mischief. Others would be shooting violations - shooting after dark, near a road, etc. But if you were on your own property that's not an issue. And it would only be an issue if someone reported their missing drone. As this has made national news and there's a lot of shady things about it, I doubt anyone would file a report, unless it's some military drone.

Long story short, the odds are in your favor for not getting in trouble, especially if you keep your mouth shut if the police were to come ask questions.",1577816888,fcnr6gl
19,blytheann,"They are trying to figure out why us Western Nebraskans are so awesome, so they are spying on us ;).  

\^Joke.  To be clear.",1577817266,fcnrwrj
20,hollimer,"sounds like a bumper sticker. 

[some libertarian] 2020: nerds trying stuff out without govt intervention",1577817440,fcns91b
21,[deleted],[removed],1577819191,fcnve4q
22,huskermut,Just wait til they fly over Banner County. They won't be around for long after that.,1577819214,fcnvfm3
23,redneckrockuhtree,Unless it's the military in which case they may well be testing something that won't get reported in detail.,1577819808,fcnwfqe
24,_Pliny_,Please shoot one down and report back. This is weird stuff.,1577820458,fcnxnms
25,kwridlen,Wierd and concerning yes. I however will not be shooting one down unless it is deemed a threat to myself or my family.,1577820549,fcnxu0p
26,_Pliny_,I understand and that’s sensible. Has it been over your property/home?,1577821111,fcnyxk6
27,kwridlen,Yes both.,1577821187,fcnz35v
28,bikersquid,The not shooting the drones is a great comment,1577823286,fco3bvu
29,Swampfoot,"Shooting at an aircraft (including drones), is a federal crime [punishable by up to 20 years in prison.](https://www.law.cornell.edu/uscode/text/18/32)

[p.s. - I don't make the rules.](https://www.forbes.com/sites/johngoglia/2016/04/13/faa-confirms-shooting-drone-federal-crime-so-when-will-us-prosecute/#4d34ab932a25)",1577825150,fco6rgb
30,kwridlen,Good to know!,1577825464,fco7ben
31,omnipresent_sailfish,"Screw up the drone's optics with a laser pointer.

Or, train a hawk to take those suckers down.",1577828578,fcoc245
32,dunderchief83,"Unless they have a waiver.

However, after a quick check of the approved waivers for operating multiple sUAs at once there are only a few in Colorado (Denver and Littleton area) and none in Nebraska.

It's worth noting that not all of the waivers list an operational area and instead list a separate waiver or the waiver application (which isn't attached).",1577828908,fcocjes
33,Hooch17565,Havent heard about anything in Dundy County yet.,1577829349,fcod6dq
34,itsmemisfit,"Just get a ww2 flak cannon, there can't be a fire if there's nothing left",1577829349,fcod6f6
35,foulpudding,"Just a friendly reminder, it’s against the law and against FAA regulations to shoot down any aircraft, this includes drones. 

That means that if you do shoot at them, you’ll want to be wearing good seasonal camo and a facemask in case the drones are equipped with cameras. 

But seriously, it’s illegal to shoot down drones.",1577829774,fcodrzh
36,dunderchief83,"Some observations as a professional drone pilot (FAA licensed under Part 107 since 2016).

Assuming that:

* The UFOs are in fact ""drones"" then they are most likely multirotors based on reported flight characteristics (grid pattern).
* The 6 foot size estimate is even close to accurate (big ""if"" considering they were only spotted at night.).
* The reported group sized is between 5-30 (iirc). 

The size and number of drones flying in unison makes this a big budget thing ruling out hobbyists. Possible operators would include government agencies, military, medium to large private companies, research institutions, and criminal organisations (I'm putting this one waaaay down the list).

If the operators are anything but government or military they would need to apply for these waivers from the FAA to be used (legally) as they are currently: 

* Daylight Operations
*  Operation of Multiple Small UAS (unless there are 5-30 pilots flying in perfect unison)
*  Operation Over People (possibly according to reports)
*  Visual Line of Sight Aircraft Operation (possibly considering reported distances traveled)

The FAA posts all the Part 107 (commercial drone) waivers issued on their [website](https://www.faa.gov/uas/commercial_operators/part_107_waivers/waivers_issued/). I've looked through all the currently posted  107.35 – Operation of Multiple Small UAS waivers. Most list an operational area with a few being in Colorado (Denver and Littleton areas) and none in Nebraska. Those that don't list an area reference a different document or the waiver application itself which is not attached electronically.

FYI: I searched 107.35 instead of 107.29 - Daylight Operations for time. 107.29 has 135 pages of results and 107.35 has only 2 :)

Given the assumed size and number of drones I'd be interested to know if anyone has heard them. Drones are not as quiet as TV/Movies would have you believe.

Maybe you can't tell by now but this series of events has my attention. I'm working on a Google Map of sighting locations and I'm contemplating contacting the TV station in Denver that's done a few stories on the subject.

If you have seen them in person or know someone who has I'd be interested in talking about your experience.",1577833469,fcoj2rq
37,dunderchief83,"XPosted From The Chase County Post

Some observations as a professional drone pilot (FAA licensed under Part 107 since 2016).

Assuming that:

* The UFOs are in fact ""drones"" then they are most likely multirotors based on reported flight characteristics (grid pattern).
* The 6 foot size estimate is even close to accurate (big ""if"" considering they were only spotted at night.).
* The reported group sized is between 5-30 (iirc).

The size and number of drones flying in unison makes this a big budget thing ruling out hobbyists. Possible operators would include government agencies, military, medium to large private companies, research institutions, and criminal organisations (I'm putting this one waaaay down the list).

If the operators are anything but government or military they would need to apply for these waivers from the FAA to be used (legally) as they are currently:

* Daylight Operations
* Operation of Multiple Small UAS (unless there are 5-30 pilots flying in perfect unison)
* Operation Over People (possibly according to reports)
* Visual Line of Sight Aircraft Operation (possibly considering reported distances traveled)

The FAA posts all the Part 107 (commercial drone) waivers issued on their [website](https://www.faa.gov/uas/commercial_operators/part_107_waivers/waivers_issued/). I've looked through all the currently posted  107.35 – Operation of Multiple Small UAS waivers. Most list an operational area with a few being in Colorado (Denver and Littleton areas) and none in Nebraska. Those that don't list an area reference a different document or the waiver application itself which is not attached electronically.

FYI: I searched 107.35 instead of 107.29 - Daylight Operations for time. 107.29 has 135 pages of results and 107.35 has only 2 :)

Given the assumed size and number of drones I'd be interested to know if anyone has heard them. Drones are not as quiet as TV/Movies would have you believe.

Maybe you can't tell by now but this series of events has my attention. I'm working on a Google Map of sighting locations and I'm contemplating contacting the TV station in Denver that's done a few stories on the subject.

If you have seen them in person or know someone who has I'd be interested in talking about your experience.",1577833572,fcoj7tc
38,centurion005,Where do I get one of those,1577836871,fconsa8
39,centurion005,Where do I get one of those???,1577836904,fcontx7
40,itsmemisfit,A&amp;M surplus might have one lmao,1577836933,fconvba
41,kwridlen,https://m.facebook.com/story.php?story_fbid=10157715230564192&amp;id=513394191,1577838037,fcopdhv
42,joshyshermo,Walmart parking lot safe haven.,1577838045,fcopdvr
43,midwestmack1,"I'm waiting for them to fly over Banner County. If they are spotted there and aren't grounded, you can pretty much assume they're military of some sort.",1577846897,fcp0omn
44,midwestmack1,Reminder: don't shoot drones. Make a makeshift net for them or come up with a homemade EMP you can knock them down with.,1577847064,fcp0voy
45,[deleted],[removed],1577849411,fcp3l4b
46,Whoden,Super extra duper mega not cool: Being a piece of shit harassing people minding their own business not bothering or hurting anyone. Terrorizing a whole family because they got a little fuzzy.,1577849576,fcp3s17
47,mommaneedscoffee,"I just talked to a friend who saw them over his farm near McCook this evening. 
This is actually pretty creepy.",1577850026,fcp4alt
48,kwridlen,Still have them flying here.,1577850455,fcp4s6u
49,mommaneedscoffee,"I've heard that there were approximately 15 spotted bear Elm Creek this evening. 
I'm guessing our tiny farm will see them tomorrow...",1577851858,fcp69xf
50,dunderchief83,"Thanks for my first gold, kind stranger!",1577857626,fcpbx5t
51,CUNextThurs,So last year... or last decade.,1577861292,fcpf5l2
52,kameljoe21,"They are hybrid gas drones such as the Perimeter 8 which is as their web site says..   
There are also a number of other companies that build and sell these expensive hybrid drones...   


 

The  Perimeter 8 UAV features an impressive 12 lb. / 5.5 kg payload capacity  with 1 hour of endurance and a no-payload endurance of over 5 hours.  The Perimeter 8 is just as easy to operate as the Perimeter 4, but has  full propeller, motor, and ESC redundancy. This redundancy in addition  to electronic fuel injection and a 5 minute battery backup reserve  flight time ensures the safety of high-value payloads.",1577869638,fcppzw1
53,kameljoe21,"Most hobbyists have drones that cost maybe a few grand.   
These drones have flight times of 1 hour plus which will set you back anywhere from 15k for an all electric one with a flight time of 30 mins to hybrid gas drones that can cost upwards of 100k...   
This is just one example, there are some that cost 120k which is a fire drone from Walkera as well...   


 

### [Walkera  Gas Electric Hybrid Drone With 1.5 Hours Flight Time 12 mile Range  Commercial, Octocopter, Camera Included, 3 Axis Gimbal, 4K, 16 MP,  Optional](https://www.google.com/aclk?sa=l&amp;ai=DChcSEwibwKHhh-LmAhUO28AKHRttDVoYABADGgJpbQ&amp;sig=AOD64_208lqowz5sR5Zfh6HW61ArQZvjLw&amp;ctype=5&amp;q=&amp;ved=0ahUKEwjfj5nhh-LmAhUPH80KHcwKD7MQpysIGA&amp;adurl=)

Walkera · Drone · With Camera

Walkera  Gas Electric Hybrid Drone With 1.5 Hours Flight Time (12 Mile Range)  great for drones, model name: gas electric hybrid QL1500 20KM RANGE

[See more details at B&amp;H Photo-Video-Audio »](https://www.google.com/aclk?sa=l&amp;ai=DChcSEwibwKHhh-LmAhUO28AKHRttDVoYABADGgJpbQ&amp;sig=AOD64_208lqowz5sR5Zfh6HW61ArQZvjLw&amp;ctype=5&amp;q=&amp;ved=0ahUKEwjfj5nhh-LmAhUPH80KHcwKD7MQiy8IHA&amp;adurl=)**$80,000.00**\+$2,320.00 tax. Free shipping[B&amp;H Photo-Video-Audio](https://www.google.com/aclk?sa=l&amp;ai=DChcSEwibwKHhh-LmAhUO28AKHRttDVoYABADGgJpbQ&amp;sig=AOD64_208lqowz5sR5Zfh6HW61ArQZvjLw&amp;ctype=5&amp;q=&amp;ved=0ahUKEwjfj5nhh-LmAhUPH80KHcwKD7MQrSsIHg&amp;adurl=)96% positive [(163,280)](https://www.google.com/url?q=https://www.google.com/shopping/ratings/account/metrics%3Fq%3Dbhphotovideo.com%26c%3DUS%26v%3D4%26hl%3Den&amp;sa=U&amp;ved=0ahUKEwjfj5nhh-LmAhUPH80KHcwKD7MQ2isIHw&amp;usg=AOvVaw2TJ5ROG-3fS9GCIu1dY-mT)",1577870175,fcpqvoy
54,kameljoe21,"How expensive are your drones...   
What do you have?",1577870218,fcpqy6k
55,huskerguy07,"Well my biggest one at the moment was only $350 or so. But I really question if these are drones the way that everybody keeps meaning the word. I am in McCook and they flew over and passed home last night. They're flying in a fixed pattern and there have been reports of some turning around but no credible reports of those stopping and reversing. So I'm very strongly leaning towards the idea that these are fixed-wing drones. Which when the FAA started interfering a lot, about five years ago, they changed everything to legally being called a drone. Also, for quadcopter style drones to fly as far as with these have been reported flying is almost impossible right now. We have hella good technology but they're poorly efficient for distance even with LiPO batteries. I had a foam board fixed-wing drone that I made myself. It had a 7-foot wingspan and it cost me all the $50. I could have put GPS in it or cameras to fly by site and it wasn't easily flown 35 miles. So I think these are rather cheap to buy fix sling drones or homemade fix swing drones. Also for these two be big sticks foot wingspan quadcopters they require commercial license is almost certainly because they will be over 55 lb. Sorry if there's a ton of typos. I'm voice texting this on my way to work.",1577877979,fcq3l2d
56,huskerguy07,Not if it's a fixed-wing. And that's a high speed were talking about these things flying I'm really leaning towards that possibility. There'd be no way to see the structure or hear multiple rotors.,1577878109,fcq3sq6
57,Rabbitastic,Go work on some real crimes you state-sponsored terrorists.,1577894844,fcr070q
58,iamthe0w1,I'm glad the Lincoln police can gloat about probably destroying a family over a few grams of smoke while meth and pain killer issues run rampant. Great job boys in blue.  Keep the streets safe from the giggles,1577896616,fcr4ds4
59,The_nastiest_nate,Empty parking lots are a no no,1577903968,fcrn2z6
60,[deleted],[removed],1577904709,fcrp297
61,kwridlen,The sightings in Chase County have increased last night (12-31)  Chase County Sheriff has issued a statement on Facebook. I was unable to post a link to it.,1577908625,fcryxhe
62,redditfishing,Can't believe it's been 2 years since it happened,1577911286,fcs4cic
63,Zeddiebear,"I got a row machine, so Im going to try and commit to that. Also, watch every single Academy Awards Best Pictures.  Just watched Kings Speech and now about half way through Hurt Locker. Also did 15 minutes on my row machine a couple hours ago.",1577911410,fcs4np6
64,rebmthom,Awesome! Do you watch movies while you row?,1577911526,fcs4y9c
65,XA36,DUIs aren't real crimes?,1577914630,fcscj1b
66,conservation_bro,"I've got some experience with surveying from drones.  If I had to guess, the drones are actually flying all day, its just that people don't notice them until later in the day when it gets dusky and the lights become more visible.  

There is oil exploration in the area.

The drones appear to be focused on the Colorado side of the border.

Nebraska has full coverage LiDAR ground survey for the state in the public domain.

Colorado appears to not have LiDAR for the area this is happening.

So I think its a terrestrial LiDAR survey from drones.  To get high resolution, they could be flying swaths as little as 75-100 yards wide which would explain the longer duration and number of drones.

The argument against this is that this would be a horribly inefficient way to go about this.  Whereever they are based would have to have a LOT of battery charging capacity.

Just my guess though.",1577914786,fcscxe1
67,Rabbitastic,"Didn't sound like they were hurting anyone or stealing anything to me.

Anything can be a crime if that's how you define it.

Some people make being a certain race a crime, or sexuality.

I guess I'm just a weirdo who doesn't like living in a police state.",1577916731,fcshp5a
68,thegrundleking,"If you're sitting in a car in some random parking lot hotboxing, then you're almost certainly planning on driving impaired. The fact that the whole family is a group of fuck-ups is not LPD's fault.",1577917857,fcsjkhx
69,thegrundleking,"...and, you know, idiots that drive while high.",1577917915,fcsjoct
70,Whoden,So are we now in a minority report pre-crime dystopia where we can arrest people when they haven't even committed a crime yet?,1577918119,fcsk19v
71,teebob21,"Good luck with your longterm story, Mr./Ms. Costello.

My resolution is to not lose money this year on my small-scale farm.",1577918425,fcskiu9
72,thegrundleking,"A single car sitting in an empty parking lot is suspicious, especially if the police know that the business is closed. The police have no idea what is going on. The car owner could be trying to rob the store, or someone might be getting raped in there. So the police check it out...as they should.

When they find a crime, even one you don't consider serious, they enforce the law. That's their job. If you don't like the law, work on getting it changed or move somewhere else with more favorable laws.

Or...you know...smoke weed at your own home where there's almost no chance the police show up. If course, if you're a minor and can't smoke weed at home...well, even states that have legalized weed still don't allow minors to use it.",1577918835,fcsl5rz
73,Whoden,A single car sitting in a parking lot is not illegal. The police do not need to know what is going on. Did he see the guy approach the store with any sort of tool? Someone getting raped in the car is extremely unlikely. Did it even look like a struggle was going on?,1577919338,fcslxnn
74,[deleted],[removed],1577919813,fcsmnm6
75,[deleted],[removed],1577920578,fcsnqao
76,[deleted],[removed],1577920830,fcso36c
77,Grand_Cookie,I like tulsi gabbard.,1577930589,fct1pcw
78,Jupiter68128,"I don't think it matters as I'm pretty sure Trump will get Nebraska's 5 electoral votes.  Nebraskans love Trump because he is a Christian (the kind that doesn't have a church and makes his own rules), he has invigorated rural economies (schools are no longer closing and consolidating), he is against wind energy because he knows it would give us cancer, and best of all he has reduced the national deficit to zero, just like he promised.  And as an added bonus he was not born in Kenya like Obama which all of the people in Nebraska believe, especially in rural areas.",1577930619,fct1qsx
79,Boxer2380,"My first choice is Bernie, with Elizabeth Warren as a good second. I also like Andrew Yang.",1577931263,fct2mib
80,Blood_Bowl,"I wouldn't even consider most of those you've listed, simply because they are no longer viable.  

However, while I'm not thoroughly enamored of anyone yet, I do currently lean toward Buttigieg.  I like his demeanor and his perspective on so many issues.

That said - in the general, I'm wholeheartedly voting for whomever faces off against Trump, since the Republican Party has sadly given me no other option.",1577931541,fct2zqo
81,WinterNikki,Bernie or Andrew Yang,1577931731,fct38ue
82,EpiskoposGambit,"Nebraska split its electoral votes in 2008 with one going to Obama but will probably not split again this year.

Trump is not well loved by the rural folk I've interacted with but many of them are single issue voters and will almost always fall in line with the Republican Party.",1577933077,fct52bi
83,Zeddiebear,"Yeah, rowed while I watched Hurt Locker. Today I kinda binged, started with Kings Speech, Hurt Locker, Green Book, Moonlight, now watching Spotlight. But, most likely will be watching at least something while I row.",1577933186,fct57qx
84,dooBeCS,"I came here to say this, and add that while I think Yang could be president in 4-16 years, only Bernie currently has the swing power needed this election.",1577934147,fct6hz9
85,dooBeCS,"While I am not sure of the statistics you are using for those claims, (not that I don't believe you) I would like to say that the floods have decimated and continue to damage communities, and no one has said anything about it, that I've seen. So that seems it could go either way.",1577934266,fct6npn
86,thechickenfucker,You clearly haven’t been interacting with the rural folk.,1577935566,fct8ce4
87,thechickenfucker,308 living in a 402 world,1577935605,fct8e3v
88,BadFactor99,High dollar operation. It is interesting that no one mentioned anything about missile silos in the area. Seems a sensitive area for high resolution surveillance.,1577936586,fct9mbe
89,kitttkattt44,I am taking my house back from all the clutter I’ve amassed in the past 13 years.  I can’t wait till everything I own has a specific place to be and not just moving it from place to place because I don’t know where else to put it.,1577937074,fcta828
90,WinterNikki,"I feel about the same way. Yang might be what I want, but Bernie might be what the country needs right now and I'm also okay with that.",1577937143,fctab2w
91,extrajalapeniospls,305 girl in the 308,1577937397,fctam9c
92,4gotn1,"I've gotten about a 50/50 reply about Trump to most folks out here west of Kearney actually. 

I hear more people in the city support Trump than rural folks. And most of the rural ones that do (support Trump) don't operate ranches for farms.",1577937519,fctarkm
93,DexterityM16,"Tulsi is a Russian bot, just stick with Bernie.",1577938093,fctbggt
94,Mikashuki,"&gt;who have or are about to declare 


90% of those have already dropped out....",1577938459,fctbw50
95,AKA_Wildcard,Bernie Sanders by a landslide,1577938627,fctc376
96,polarb68111,"Bernie all the way, Yang is cool, but probably beat down the road.  #berniesandera r/BernieSanders",1577939501,fctd4ii
