,author,body,created_utc,id
1838,bleedcamo,I'm lucky enough to get to buy flour here. Makes all the difference in Grandma's cinnamon rolls. The owners are nice people and the prices are fair. $16 for 25 lbs. This is a gem.,1581981306,fhyq6l1
1839,kwridlen,Have you tried their pancake mix?,1581981408,fhyqc8g
1840,Obscene_Fetus,I think you should come check it out.,1581981521,fhyqioo
1841,drkinferno72,Why though?,1581983197,fhyt5xz
1842,roshjothe,"No way! I’m over in Omaha so I’m not sure where to find their flour, but I’d love to support Nebraska business if it is here!",1581984979,fhyvwzd
1843,kwridlen,I will check and see if I can find a solution.,1581986224,fhyxrxa
1844,retracedylan,"Thata pretty cool, what makes it fascinating to you? People? Culture? Landscape?",1581986372,fhyxzq9
1845,Salted_Sloth,Lots of people from Bavaria came and settled in northeast Nebraska and lots of people of German heritage in general. I feel like the two areas are complete different but some how similar,1581987265,fhyzbbl
1846,photobanana,Following.,1581988491,fhz15z8
1847,kwridlen,I will stop down there tomorrow and ask about all their products being out of stock on their website.,1581988757,fhz1kks
1848,CatatonicTaterTot,Fun fact - my Bavarian ancestors emigrated to Nebraska in the late 19th century.,1581991995,fhz6ikx
1849,Mikashuki,Holy shit this is adorable. I might be able to get some neat shots of Omaha for ya,1581996555,fhzd9u4
1850,aaronec,"That'd be amazing, thank you. If you do, you can just direct message them to me.",1581998041,fhzfbze
1851,medney,This is exciting! I would love to take part,1581999101,fhzgr20
1852,aaronec,Great! Just post up a photo in reply to this post or as a direct message when you get it. Thanks so much!,1581999231,fhzgx4q
1853,TheRealTurdFergusonn,I keep a stack of novelty postcards from Nebraska just for occasions like this. Let me know where to send one!,1582000759,fhzivzj
1854,bigdreamslittledick,That's pretty cool.,1582010380,fhzsxlq
1855,MagicMulberry,"If Courtney wants her love for Mark to reach the Fiji Islands too, lmk. This is freakin cute",1582016444,fhzxkn8
1856,aaronec,"You don’t need to actually send mail from anywhere, but writing the note on a postcard and taking a picture of that would be great!",1582027488,fi05sl3
1857,aaronec,That would be amazing if you could!,1582027718,fi060af
1858,riverfan2,"The bulk of German immigrants before WW2 were from the northwest of Germany (Schleswig-Holstein for example).  They formed three settlement houses that eventually turned into the ""Plattdeutsch Verhein"" and then was rented out to Father Flanagan's Boys Home (now Boystown).  The Plattdeutsch Verhein became the German-American Society after WW2 when more immigration from other parts of Germany was noted.  They have a small museum of the immigration story and a lot of parties.

Germans who came to Russia and were known as ""Volga Deutsch"" came to SE Nebraska.  There is a small museum to them in Lincoln.

German speaking Swiss migrated to the northwestern part of the state and were memorialized by the author Mari Sandoz in her biography of her father ""Old Jules"".

Ethnic Germans were the vast majority of Nebraskans at the beginning of the 20th century and continue to represent a large percentage of the population.",1582036859,fi0h4yc
1859,riverguy56,"I could perhaps agree with you except dead people are voting, people are voting twice, and people are voting in more than one state. Doesn’t take much to get a state ID. You don’t need to get a drivers license, just the ID.",1582037983,fi0iu0p
1860,Mr_Smithy,"It's not a comment, it's a joke. You can like it or not like it.",1582039699,fi0lin9
1861,kwridlen,I apologize. I just did not get it I guess.,1582039907,fi0lunj
1862,Mikashuki,I just repost the news bud.,1582042058,fi0perf
1863,PureParsnips,"When I was a kid, I loved watching documentaries about tornadoes. And hence I was fascinated by the Midwest.",1582047067,fi0y74m
1864,PureParsnips,"What's the gay life like?

I feel like I could be a real sensation in rural Nebraska as a gay German on grindr!",1582047101,fi0y9b3
1865,PureParsnips,I am very much interested in rural America!,1582047125,fi0yayk
1866,PureParsnips,"It just seems like a place where you get to know the real America.

But it also seems a bit like a ""nothing""-place, which I don't mean negatively.",1582047173,fi0yegf
1867,Obscene_Fetus,"I'm not gay so take everything I say with a grain of salt but, usually in the big cities out west there is a healthy gay scene and being ""exotic"" I'm sure you'll crush it.",1582047280,fi0ym34
1868,PureParsnips,"I'd love to have nice, cute American boy for me!

But I also watched Boys Don't Cry!",1582047698,fi0zf24
1869,bleedcamo,Yep. Great gift idea too.,1582048637,fi117r9
1870,Mikashuki,"To be fair, I don't think anybody had any warning that they were bringing them here. No agencies released any press releases or any interagency communications. I knew they were flying the cruise ship people back to the US but there was no mention they were coming to Omaha, hence the suprise when they actually landed here.",1582048776,fi11h43
1871,kwridlen,"I stopped down and spoke with them today. They had an equipment break down. They are back up and running. The items will be in stock on the website by the end of the week. The website is:

www.waunetarollermill.com",1582049755,fi13aiz
1872,kwridlen,"Should be in stock by the end of the week. 

www.waunetarollermill.com",1582049856,fi13h35
1873,kwridlen,"They had an equipment failure. They are back up and running. Should be in stock by the end of the week. 

www.waunetarollermill.com",1582049928,fi13lmy
1874,Cakin,"I sent one a few year's ago, must be a Pinterest thing now.",1582052773,fi18kcl
1875,Insanonaut,"Ok, but there are a lot of things surprising in this world. Why is it leading to outrage and fear?",1582053572,fi19yon
1876,riverguy56,Got’cha,1582054377,fi1bdoi
1877,EchoTango77,Good episode of The Dollop podcast on this [https://allthingscomedy.com/podcasts/86---tom-dennison-and-the-omaha-riot](https://allthingscomedy.com/podcasts/86---tom-dennison-and-the-omaha-riot),1582057790,fi1hdis
1878,mycatisanorange,Whoa,1582064858,fi1u6hc
1879,Mikashuki,The Adolescents?,1582067090,fi1xxml
1880,Con_Rico,What my school calls 6 7 and 8 graders,1582067141,fi1y0kl
1881,Mikashuki,Is this poster up at your school or what?,1582067183,fi1y2xi
1882,Con_Rico,It’s a hand out paper but yes,1582067247,fi1y6jj
1883,Mikashuki,"Ok, cause by itself it's written kinda weird. This context makes more sense.",1582067352,fi1ycly
1884,solventstencils,Reverse image search leads me to [this](https://digitalcollections.nypl.org/items/510d47de-7c1e-a3d9-e040-e00a18064a99)  and tells me that it’s the [corner](https://goo.gl/maps/PUxKna2tdMytdbXq9)  of 24th and lake.,1582068184,fi1zo5q
1885,BigO94,"These hosts are insufferable, but this was an interesting podcast to listen to.",1582069221,fi21bh1
1886,BigO94,"If you're looking for a historical fiction based on this event, would recommend ""Kings of Broken Things"" by Theodore Wheeler.",1582069300,fi21fyn
1887,EchoTango77,Oh yeah they’re an acquired taste at first. Just expect they will joke around a lot and their podcasts are much better.,1582071369,fi24ndc
1888,BigO94,"By the end I started to understand what they're going for and was having fun. I was expecting a traditional history podcast lecture packed with info. Their format makes sense, you can take a short narrative and turn it into an hour by interjecting jokes and commentary.",1582077040,fi2d7rm
1889,Liquidretro,Comic Sans 😂 automatically demots this to 3 &amp; 4th grade levels.,1582087175,fi2rpqh
1890,EljerGoldwater,Do they still have that giant mural of an angry Bo Pelini on the side of the building near the end of the main drag?,1582157512,fi58t0e
1891,thelma_edith,"There is a site like this for several different states and it's nothing but spam and ""work from home"" type jobs",1582223991,fi7m7hu
1892,funkthulhu,"They have A LOT of episodes on file now.  The live shows are also a hoot.  If you appreciate the comedic ""laugh at our history or you'll cry"" style of story-telling, they are top notch.  

Hope we get some converts, there's a lot of our past that needs a spotlight.",1582239347,fi8fk0r
1893,Woman1234pretty,"Stop spreading lies, when you see any posts like that coming from us let me know and they will be removed, all the jobs are real, the links take you DIRECTLY to the hiring page and you can post feedback about the companies we work with and show proof they are scam or MLM and we will remove them immediately, but people like you just throw accusations in the air without any base, there are A LOT of people who require jobs and we work really hard to hire the best talent for the companies we work with.

Please post a single ""work from home"" offers that are scam please.",1582303177,fiakxki
1894,riverfan2,"She was convicted of many counts of murder.  Today, she would have got felony murder charges and if tried as an adult, still be in prison.  She was released early.  She was allowed to leave the state.  She has all she deserved.",1582303743,fialw39
1895,siouxpernerd,Agree. Cedar County especially  is very different yet something is similar to that Bavaria region.,1582308143,fiatm15
1896,siouxpernerd,I grew up close by. I remember cubbies.,1582308213,fiatqng
1897,Mikashuki,"&gt;LB 816, introduced by Omaha State Senator John McCollister, would add suicide prevention to firearms safety courses and expand the time allowed for a firearms purchase certificate background check.",1582325141,fibmgj0
1898,smokinjokin2097,"Your saying it took 3 months to issue the certificate, right? From NE but don't know much about our gun laws",1582327148,fibpkld
1899,Mikashuki,3 months to issue my CCW,1582327184,fibpmm2
1900,smokinjokin2097,"That would be concealed carry, right?",1582327230,fibpp5h
1901,Liquidretro,Yes,1582327851,fibqn9p
1902,Henry_Bowman,"A right delayed is a right denied. Also, if you already own a firearms why should you still be subject to the waiting period if it's about suicide reduction?",1582328029,fibqwy7
1903,retracedylan,Hahaha these guys look exactly like I imagine they would. To a T,1582328736,fibrzqa
1904,smokinjokin2097,"So the biggest thing here is that it's going to take more time to get the permit. Other than an inconvenience of waiting, what's the big issue here? What am I missing?",1582328812,fibs3vt
1905,Mikashuki,A right delayed is a right denied.,1582328879,fibs7jc
1906,bareback_cowboy,"I support gun rights unequivocally but goddamn do I hate fucking rednecks.

1. Don't bring guns into the capitol. It serves zero purpose other than to rile people up.
2. When being interviewed on the news, don't spout off technical information about guns that the majority of people don't care about.

I stopped listening at that point because those assholes were just so cringey.

If you're going to advocate for a position, don't come across like a total fucking bell-end.",1582328896,fibs8hn
1907,spartan7621,Would you go through a waiting period to purchase other tools to save your life like a fire extinguisher or AED?,1582329157,fibsmfk
1908,Henry_Bowman,What's the point in waiting. We have computers with a thing called the internet where a background check takes a few minutes. These Sheriff Departments run hundreds to thousands of individuals through NCIC daily already and get instant results. Why delay these results for prospective gun owners?,1582329235,fibsqn2
1909,smokinjokin2097,"So maybe this is more of an administrative issue, like being at the DMV. It takes longer than it should and that could be solved, or improved. If the quality/thoroughness of the back round check doesn't change, then I guess a law delaying that process even further would be annoying. I didn't realize it was that quick to do a background check tho",1582329744,fibthlz
1910,Henry_Bowman,"It gets even worse. As it currently stands I can get a permit to purchase that is valid for 5 years. Hypothetically, I can get convicted of a crime that bars ownership of firearms and still posses this permit. So I go to a gun store, asked to buy a gun and present this permit. Since the permit is still within the 5 years the gun seller does not have to contact the FBI for an instant background check (that would show the conviction and deny the sale). So as long as I lie on the form I can get a gun and [be almost worry free about being prosecuted for lying.](https://www.usatoday.com/story/opinion/2018/09/19/gun-buyers-lie-and-try-only-12-prosecuted-editorials-debates/1288699002/)

Like I said in my original post: this bill is a ""solution"" in search of a problem.",1582330184,fibu594
1911,huskergirlie,I'd love to know what that guy's wife looks like.,1582330673,fibuusw
1912,huskergirlie,"""Emotion is not something that is meant to change laws""

Interesting. I can agree with that for the most part. I wonder what his views on abortion are in this case.",1582330854,fibv4pp
1913,smokinjokin2097,"So it's a tighter restriction without the benefit of increasing public safety. Ok. A lot of these articles away people to come up with a quick conclusion without getting both sides. The dudes in the video sounded like fucking morons, so thanks for clarifying that. Really",1582331242,fibvpcy
1914,smokinjokin2097,"True shit. It makes people come to the conclusion that those moron rednecks are clearly wrong, and the law is clearly just, but it's more complicated than that. OP broke it down for me in another comment thread, and gave me waaay better explanation than those fucks.",1582331526,fibw4eq
1915,retracedylan,www.peopleofwalmart.com,1582331642,fibwakl
1916,thechickenfucker,"They talk about families not being able to afford housing then state their were 8 kids.  8 kids.  Housing would be more affordable with, you know, not 8 kids",1582336616,fic3d5p
1917,Tom_A_Foolerly,I honestly show this off to my non nebraskan friends,1582337130,fic432k
1918,stevewhite_news,"Two families to get to eight kids, but point taken.",1582337236,fic48fs
1919,murmur_mutter,"at football, bad at football. The state is not so bad otherwise.",1582340682,fic93cu
1920,Mikashuki,NeBraSkA BaD,1582340973,fic9hkz
1921,thechickenfucker,The point should be screamed from the rooftops.  You’re not entitled to be disenfranchised if you have an irresponsible amount of kids.,1582341226,fic9tzm
1922,victorious_secret69,Bad at taxing our citizens to death.,1582341527,fica8r2
1923,SemmerSun,"This is my cousin's home, number 48",1582341592,ficabx3
1924,Blood_Bowl,That's what I was thinking - all of those Google searches unquestionably came from Husker fans.,1582342990,ficc7gh
1925,Blood_Bowl,Stupid is as stupid does.,1582343042,ficc9yo
1926,Mikashuki,4 is an insaine amount if you can't afford them to begin with.,1582343481,ficcusq
1927,BlindManBaldwin,The white supremacist who organized this recited the 14 words there. Praised by the governor.,1582344790,ficehmm
1928,Blood_Bowl,"Apparently, someone thinks I was talking about gun owners in general instead of these morons in particular.",1582344842,ficejzj
1929,Mikashuki,"You are mistaken on who organized this. The NFOA was the primary orginization that organized this turnout. This was a public comment period open to the public for testimony of the proposed legislation. That means anyone can show up and take, which unfortunately one white supremacist did. Ask anyone that was there and 99.9% will agree that white supremacist views should never be held anywhere. Please do some research next time.",1582345118,ficewa3
1930,huskergirlie,"As an OG Wyomingite, I can confirm it is windy.",1582346459,ficgiul
1931,candl2,Obviously these are searches within the state.,1582346567,ficgnd4
1932,[deleted],[removed],1582346785,ficgwis
1933,Mikashuki,Exactly. Well said.,1582347356,fichjzj
1934,Colorado_15,Agreed!!!! Sorry Not Sorry Nebraska Sucks,1582352804,ficnjqv
1935,Colorado_15,"I conquer, Wyoming is extremely windy, there as some pretty landscapes there and No State Taxes!!! Which awesome..",1582352906,ficnzum
1936,EndoExo,"Pretty sure Alabama's result is also due to football, because no one but Lynyrd Skynyrd thinks the state of Alabama is good.",1582354001,ficptmo
1937,thundergonian,"I concur as well, though I've never spent more than a week at a time in the state.",1582358892,ficx7jy
1938,thundergonian,It's not for everyone,1582358912,ficx83m
1939,human_1914,"Well to be honest, there are a lot of things on those legend I'd rather Nebraska NOT be... so I'll take bad.",1582364264,fid94sx
1940,Mikashuki,"Left wing, doubtful, I have no idea what your first part of that question even means",1582367550,fidivrv
1941,retracedylan,I would say we are pretty good at that lol,1582368945,fidn35i
1942,RudeEtuxtable,No it is not.  Plenty of rights are conditioned for the benefit of a greater society.  Wait for a few more weeks won't hurt anyone,1582374790,fie3rhe
1943,Mikashuki,That logic applies to privileges not rights,1582376567,fie9icv
1944,RudeEtuxtable,"How about getting a permit for a rally?  Delays prior to a criminal hearing? Voting registration?  Having to register your child and vaccinate them prior to schoolool enrollment? 

Lots of rights are delayed or conditioned. The right to free speech, religious worship, due process etc are all based on reasonable limitations.",1582377579,fiecjqu
1945,Mikashuki,"If you have to ask the government for permission to exercise your rights, they have taken them away from you and declared them a priviledge.  Let's make a twitter permit next and say you have to wait 10 days to get your twitter permit because you COULD say something stupid online. That's what this is. Government is not society's babysitter.",1582377837,fiedlxf
1946,deepfriedcheese,"When I did it the top autocomplete was ""flat.""",1582378307,fief8rg
1947,RudeEtuxtable,"That's called taking things to their illogical extremes. Of course no one wants a permit to tweet. And no court would allow it.  But the reality of the social contract is that rights are limited and we have all agreed to this.  That is the price of admission of being part of a society.  Without reasonable limitations, rights of one person interfere with the rights of others. 

For example, I have the right under the first amendment to practice my religion but you also have the right to not be discriminated against when applying for a job. What happens then if a church job is only offered to members of that sect?  Two rights collide.   This is the real world where rights are not black and white and overlap. 

With respect to guns, there are already limitations. You can't buy and sell guns of any kind in any forum you want.  You can't carry a gun into a private residence if that person had told you not to.  You can't own a gun if your a felon in many places.",1582380973,fieoox4
1948,Huskerfan7,I don’t live there but I have been in Yutan at a track meet. Yeah it’s defiantly a small town for sure.,1582381343,fiepr6h
1949,pretenderist,[Here’s what I think of when I see a picture of guys like this](https://i.gr-assets.com/images/S/compressed.photo.goodreads.com/books/1171248360l/92483._SY475_.jpg),1582382983,fieviyv
1950,bikersquid,More factory ones less family ones.  Pretty sad but its the way she goes now.,1582383117,fievwol
1951,DozerKid,As a Nebraskan I can confirm.,1582386629,fif7xgt
1952,talks_to_ducks,The Midwest was a hotbed of socialism in the early 1900s. The biggest remnant of that now is the public power districts in the state.,1582387479,fif9xkp
1953,deeretech129,It's bad if for the return on investment we get for the mass amount of taxes we pay.,1582388086,fifbivl
1954,deeretech129,"Just like every other business, the smaller family operated ones can't turn enough of a profit to support the family anymore so they sell the ground to the big guys.",1582391624,fifo8o7
1955,echobase_2000,Like 98% of farms are family farms,1582393091,fiftgfk
1956,Secretitnerd1,Every farm is an LLC or incorporated somehow. It’s how you do things these days for tax and legal reasons.,1582398580,fige15o
1957,AutoModerator,"Sorry, but your post has been removed because it contains URL campaign spam.  Please remove utm_content and anything after from your URL and please submit just a direct link to the article.

*I am a bot, and this action was performed automatically. Please [contact the moderators of this subreddit](/message/compose/?to=/r/Nebraska) if you have any questions or concerns.*",1582398611,fige4gg
1958,jtothewtothes,"True. What's happening, at least in my experience living in rural Nebraska is families own the land collectively and share the profits.

 So for a real life example, you have 3 brothers who all have their own families and houses. The 3 of them together can do more work and make more profit than just one farmer on his own, especially as their family (children) age and are able to help out. They then buy land that their older farmer friend are selling because either they are too old to farm it or not worth the profits being a single farmer. Farm numbers go do, total farmed land remains the same. This is what has been happening in at least in Platte and Nance Counties since the 1950s and shouldn't be a huge surprise. 

Also, as a side point, the notion the farmer are poor is just not accurate. Farmer were poor in early American and Nebraskan history because literally they grew/raised the food they ate and had very little access to markets to sell their products. Today farmers, at least in Nebraska, are firmly in the middle class, perhaps even the upper middle class. The average farm size in Nebraska from the article is 982 acres. Nobody who owns 982 acres of farmland in Nebraska is  poor.  The government has been heavily subsidizing farms, particulary corn production since LBJ's campaign against poverty in the 60s. Literally the entire corn industry is a made up economy by US government. No cattle 100 years ago ever ate corn like they do today. Corn is an unnatural food source for cattle. Corn is in thousands of foods at the grocery store that have nothing to do with corn. Corn is in our gasoline for pete's sake.... All of this is government sponsored to 1. Give farmers a job 2. Make food cheaper 3. Make fuel cheaper. As the saying goes, if a farmer wants to make more money, ""just put up another mailbox. """,1582399020,figfoip
1959,bikersquid,With the amount of space we have there is no reason not to have affordable housing.,1582402776,figrlh3
1960,siouxpernerd,Sad but not surprising and tbh. Basically you get big or get out and what sucks is you ha e to run it on a large scale to even make farming work. It sucks because I personally wish I could do it. My dad tried as a young man after coming back from Vietnam and increased the number of cattle and bought smaller farms but even then it wasn’t enough and thus we ended up cash renting in the 90s and now my mom is all that’s left and it’s either sell or rent it out. No way 300 acres is viable now. It wasn’t 30 years ago.,1582404466,figxwlp
1961,VaporIcecream,"About 60% of Nebraska is undeveloped and we have no reason to make residential living in the Metro competitive for renters to find housing. It would be an improvement for the state, renters, and property owners to create new economically responsible housing integrated with the environment. Keeping the housing market imbalanced as it is where finding a safe, affordable, sane place to live is as difficult as it is, is only going to increase these variables as desperate renters have to settle for what they can find. 
Developing the region that lies inside the bounds of the Metro, between Omaha and Lincoln on I-80, for really cheap housing would be a good investment for both communities.",1582409243,fihdt2f
1962,[deleted],[removed],1582414303,fihunnw
1963,bareback_cowboy,"This is a solution in search of a problem. I mentioned the zoning codes for lincoln in another thread on this issue - there are eight residential zones and 5 of them allow all these ""middle housing"" units. This law would basically force Lincoln to allow these items in zones R1 through R3, areas that are currently only open to single family residences and a density of between 4 to 6 homes per acre (IIRC - don't care enough to look up the specifics again).

BUT, this law allows the city to maintain the current setback requirements! So who gives a fuck? My home, in an R4 area, is already encroaching on the setbacks because it was built before they became law. Most homes in these older established neighborhoods already are too big under the current regulations. Result? It'll still be illegal to build these middle housing units in those areas because they won't be able to fit on the lots, and this law wouldn't change that.

This is a solution in search of a problem. If we actually had laws prohibiting these types of structures and if cities and towns were actually fighting against them, I could see a point to them, but that's simply not the issue in Nebraska.",1582438876,fij9nca
