,author,body,created_utc,id
1057,treyhest,"The issue at hand is that the policy requires your rental to be your primary place of residence (you live there 6mo/year) this is in place to make sure people can’t host a property rental business on the site w/o the regulations and restrictions actual property rental places have to go through. 

Which is good.",1580158532,ffri9kp
1058,victorious_secret69,Weird. Lincoln gov invading citizens private lives.,1580162993,ffrpl15
1059,mycatisanorange,Hmm 🤔 what do you mean? I thought it was funny.,1580163839,ffrqx5q
1060,mycatisanorange,I signed a while ago,1580163911,ffrr1be
1061,mycatisanorange,Haha I was tired when I came up with the name.. was supposed to be something like my cat is orange and only later I was like aw sh*t. All the other names I came up were taken 😆it’s just my luck I’d make a weird username and not notice right away!,1580164182,ffrrgsy
1062,Andyk123,"Letting homes sit empty for 50%+ of the year for the occasional short term rental drives up rents and home prices for permanent residents in the area. We should be trying to provide more living space, not taking it off the market for amateur hotels
 
I'm fine with AirBnb as a concept but people who rent out as a regular source of income should be subject to the same regulations that a landlord or a hotel are.",1580170755,ffs1d6g
1063,IngoTheGreat,"I'm so glad he survived without being seriously hurt. I hope the city takes this as a wakeup call and finds some way to address the situation. It's worth finding some way to either create bike lanes and let electric scooters use them (I would expect this to be a safe and workable situation, at least; correct me if I'm off), or find some way to move the ice and snow off the sidewalks.",1580171521,ffs2huq
1064,mycatisanorange,"Where is your source that they sit empty 50% of the year? Or are you thinking people only rent them for football games and not for visiting family, funerals, work or hospital visits?",1580189205,ffsqsr9
1065,mycatisanorange,"There are tons of negligent slumlords, yet we have done nothing ever specifically to address those. In Lincoln there has only been one significant problem property and that is a house on capital beach",1580189419,ffsr0zl
1066,brwilliams,Again proving there is not a single issue he can’t be on the wrong side of. It’s almost impressive.,1580189768,ffsreg8
1067,TomZeBomb,"Free money. And happy voters for you. But no, you choose none of them.",1580191508,ffst56c
1068,Ignotus3,It won't be legal in Nebraska until it's legal federally,1580197174,ffsxz5y
1069,Ignotus3,I really dislike looking at that smug photo of him,1580197209,ffsy06w
1070,CatatonicTaterTot,"""Nebraskans shouldn’t be dazed and confused by these well-funded sales tactics. Marijuana is an illegal drug according to federal law. It’s illegal because medical experts have determined, on the basis of solid scientific evidence, that the drug is harmful. It’s also illegal because public officials have recognized the social costs and dangers of marijuana use,"" said Gov. Ricketts in the column.

Literally none of this is true.",1580203665,fft2ki3
1071,bw57570,Pricketts knows how to play to his base. Be anti-abortion and anti-marijuana and they will always come running.,1580209460,fft6dmi
1072,XmodestXXmouseX,I stress strong opposition towards a governor whose head looks like a penis,1580212667,fft8whh
1073,yeshaveanother,"If the legality of a drug actually mattered to him, he wouldn't have used an illegal drug to revenge-murder a prisoner on behalf of the state.",1580212677,fft8wsa
1074,zenhonky,He’s so stupid. What a douche.,1580212928,fft94fm
1075,Whodoyoudo7,Underrated comment. Keen observation.,1580213395,fft9iwg
1076,swattages,"Well, it IS harmful to an extent, but it's about a hundred times less harmful than something like alcohol, or like 90% of the prescription drugs out there.",1580213588,fft9p2j
1077,swattages,I've honestly never seem someone work so hard to kill a guy.,1580213629,fft9qea
1078,MyHuskyBooker,F that guy. Just another reason why I chose to move out of Nebraska.,1580213826,fft9x3c
1079,Andyk123,"I'm not sure what you mean by ""source""? I doubt there's been a scientific study done on the AirBnb market in Lincoln. I'm really just using common sense. There's more uses for them here than football games, but I really doubt there's enough reasons to generate ~330 additional days of business for every unit in the city.

For example, right now on Tuesday morning there's ~165 entire houses/apartments available just within city limits for tonight. I'd be absolutely blown away if even a quarter of those were rented by this evening. That's why prices are higher than a standard monthly rental, because they have to account for vacant days.",1580215080,fftb4q6
1080,andrewsmd87,"Don't worry, most of the state will vote for him again",1580215155,fftb7eq
1081,yugats,He's up for reelection in '22.,1580215224,fftb9wh
1082,karlsparx,Well how nice for him.,1580215808,fftbvor
1083,decorama,"Odd, coming from a guy who attempted to bring illegal execution drugs into the state.",1580216025,fftc3zk
1084,LOOKATMEDAMMIT,"Even then, couldn't he make it illegal at a state level? Kinda like gambling?",1580217041,fftd6xu
1085,Ignotus3,Very good point,1580217190,fftdcs7
1086,Kidpidge,Not for governor.,1580217192,fftdcvp
1087,Bran_the_taco_man,I'm mad so I must attack his looks. Fuck him and his bald head,1580218589,fftexyx
1088,Veth,"&gt; Marijuana is an illegal drug according to federal law. It’s illegal because medical experts have determined, on the basis of solid scientific evidence, that the drug is harmful.

No, it's a Schedule I drug according to federal law, and therefore we can't test it thoroughly to get solid scientific evidence.",1580219632,fftg71e
1089,aliennative,"I wrote him to ask him to reconsider and he basically said this.  He also said that it didn't matter how anyone felt about marijuana, he wasn't going to support it.  

Any politician that refuses to represent you and your views/concerns has stopped being useful.  We need to vote him out.",1580220258,fftgysp
1090,[deleted],[removed],1580222741,fftk9ma
1091,SpinnerMaster,"&gt; attempted

more like he just went out and did it. Anyone who isnt frothing mad about how ricketts and his family basically said fuck you to the people of nebraska and forced the death penalty back on our state (lmao so much for their catholic ideals) is either delusional or is lying about the supposed ""benefits"" just so they can feel like they ""got revenge"" or some archaic horseshit.",1580224308,fftmhos
1092,Chrs987,"More jobs to, especially for people who are already stoners",1580226963,fftpq7n
1093,Whowatchesthewampas,Exactly right and very well said.,1580227020,fftpvpo
1094,[deleted],[deleted],1580227030,fftpwm2
1095,Luxowell,"Once more, Iowa will gladly accept those tax dollars.",1580227327,fftqp5c
1096,Luxowell,"Once more, Iowa will gladly accept those tax dollars.",1580227333,fftqpmf
1097,ruahusker2,He won't have much say if the state constitutional amendment makes it to the November ballot and passes.,1580228133,fftsqny
1098,ruahusker2,He won't have much say if the state constitutional amendment makes it to the November ballot and passes.,1580228141,fftsre1
1099,ruahusker2,He won't have much say if the state constitutional amendment makes it to the November ballot and passes.,1580228160,fftst6w
1100,ruahusker2,He won't have much say if the state constitutional amendment makes it to the November ballot and passes.,1580228177,fftsuri
1101,AaronKClark,You must be new here. Nebraskans never vote foe their own self-interest. If they did the state would be blue.,1580229551,fftw5pd
1102,AaronKClark,You must be new here. Nebraskans never vote foe their own self-interest. If they did the state would be blue.,1580229562,fftw6ne
1103,xAIRGUITARISTx,Not soon enough,1580229562,fftw6q1
1104,xAIRGUITARISTx,Not soon enough,1580229570,fftw7fh
1105,CoreyTrevor1,"The best years for farming of this generation were during Obama's administration, and the state overwhelmingly went for Trump even though he promised to tank the farm economy because china.",1580230235,fftxt9w
1106,Tr0llzor,doesnt he look like caillou,1580230338,ffty2ii
1107,Tr0llzor,doesnt he look like caillou,1580230345,ffty377
1108,Tr0llzor,doesnt he look like caillou,1580230352,ffty3r3
1109,Tr0llzor,doesnt he look like caillou,1580230371,ffty5iw
1110,edumacations,"Electric scooters (this kind anyway) are not meant to be used as transportation. I’m theory you ride this to a bus stop, maybe a few blocks at most, take the bus somewhere, and use this to get around at that location (shopping or whatever).",1580230846,fftz2ms
1111,The_nastiest_nate,Fuck Pete. Dudes family ownes the Chicago bears and he can't give the people what they want?,1580231367,fftzuca
1112,Hamuel,Why doesn’t the state Democratic Party take the opposite stance and talk about saving money and increasing tax revenue with legal marijuana?,1580231756,ffu0dxg
1113,edumacations,"Just move to Austin. Less red neck, culture, cool things to do.",1580232560,ffu1niq
1114,macdizzle11,"I have mixed feelings. It is undoubtedly a lot of money that the state could be potentially losing out on because of the influx of out of state campers that flood that lake during the summer. On the other hand, the place is absolutely flooded by people during the summer 😂 You can walk for a mile on the beach and not see a single opening to even set up a tent because there are so many campers. It is incredibly difficult to police this area. I usually go once a year in the summer and a few years ago a friend accidentally cut his foot on a rock. We went to the clinic to get it checked out and they were out of antibiotics because of the amount of dog bites that had taken place that weekend. It's a circus. So I see where they are coming from",1580233311,ffu2vax
1115,yuxbni76,"I expected this column to be stupid but it still surprised me. It reads like a 7th grader outlined his argument and let his older brother flesh it out. Which now that I think about it probably isn't far from what happened in real life.

It's so irritating when slimy turds act like they're making an argument from data. It's easy because hardly anyone follows up. But it's not like he's writing a persuasive essay here so he wouldn't have to go that route. It's just wank material for social conservatives.",1580233476,ffu354z
1116,onelapse,"Yea I go a few times a summer and last year I went Independence Day weekend. It was a madhouse but we happened to see an opening and my truck is capable so we ended up in a damn good spot minus the crazy overnight storms. 

The amount of RVs on the beach is excessive and they seem to produce the most litter and take up the most space. I have seen the same RV there multiple times in a single summer, just moved slightly each time but never saw the people. It’s like they keep it there over the weekdays and just go on the weekends and I’m not sure those are out of state people. 

I can understand vehicle size limits for primitive, 14 day stay limits and even paying an overnight fee. But having to book in advance is crazy to me and making assigned camping zones is as well",1580235381,ffu69pi
1117,macdizzle11,"I would be fine with limiting the amount of RVs, and not allowing them to stay stationary over the summer. Being able to tent camp on the beach would benefit greatly by limiting RVs.",1580235579,ffu6lkx
1118,Un_creative_name,"He is term limited, so we get 4 years without him before he comes back again.",1580236756,ffu8klh
1119,Un_creative_name,"No he isn't. He can't run this time, he's had his 2 consecutive terms. He can, however, run again after taking a term off.",1580236952,ffu8wjt
1120,[deleted],[deleted],1580236958,ffu8wws
1121,[deleted],[deleted],1580237156,ffu993o
1122,Payneshu,"It's so embarrassing that this man is a Gov. 

He is claiming Nebraska shouldn't legalize weed because it has harmful side effects, yet Nebraska offers opium as a pain remedy. I say the option to use weed over opium based solutions is reason enough to legalize it medicinally.

He is also claiming Nebraska shouldn't legalize it due to ""drugged driving"" numbers. I highly doubt people who have never drank and drove would suddenly take one too many puffs and get in a wreck. The man clearly doesn't know the difference between causation and correlation which should be reason enough to try someone else for a change.",1580237586,ffu9zdd
1123,onelapse,"Yea I realize not everyone wants to tent camp and it’s not ideal for some boaters but if someone has a small pull behind trailer, slide in camper or rooftop tent I think they take up as much as a vehicle + tent. Even a class B camper isn’t terrible. The RVs and large Campers HAVE to be parallel with the water so they take up a ton of space and are a pain to move around",1580237770,ffuaaqk
1124,Kezika,"Middle ground would be better, make some beaches non-camping and some beaches camping allowed.

Won't effect me personally too much, I have a very secret spot I know of from being the child of a former superintendent of Lake McConaughy that I use when I'm in that area. (By very secret I mean literally there won't be any traffic past it throughout the night ;) )",1580238823,ffuc2g8
1125,IngoTheGreat,Almost everything in this essay is misleading. It's just one bogus/misleading claim after another after another. What a piece of work...,1580239943,ffudyda
1126,[deleted],[removed],1580241636,ffugsr1
1127,MaxShipman,"Bravo, Governor Ricketts!",1580245420,ffun273
1128,Bartman383,"Cubs, not the Bears.",1580257330,ffv77v2
1129,bareback_cowboy,How is it that nobody realizes Nebraska governors are term limited?,1580258776,ffv9cyq
1130,jimmyharbrah,Weed him out,1580261789,ffvdu4w
1131,yugats,"Oh yea. I forgot about Nebraska's term limits. I usually disagree with a law meant to usurp voter preference, but in this case I will enjoy watching him leave.",1580261796,ffvdui6
1132,aliennative,"Nice, I see what you did there.  Lol",1580262504,ffveweg
1133,CatatonicTaterTot,"By his same logic we'd have to ban soda, chips, cookies and the like.",1580266183,ffvke78
1134,photogjayge,Eh Lake Mac is overrated.,1580266364,ffvknuj
1135,JoJackthewonderskunk,I thought they already went back ont the changes and werent going to do them,1580268465,ffvnqll
1136,swattages,"Anything that adds to the air pollution... oh wait, that would actually make more sense, health-wise.",1580268650,ffvo0ar
1137,RedFloppyShoes,"I have always found it interesting how Republican are always touting personal freedom, yet are wanting to ban things that qualify as personal freedom. Drugs fall into that category. I also find it odd that 

Democrats have taken the stance that because pot is natural, so it should be legal. Truth is, they just like to get high. Just be honest about it.(Republicans get high too, but try to pretend that they dont)

Personally, I think all drugs or all kinds should be legal. I have no interest in using any of them (aside from nicotine), but if someone wants them, let them have them. If they break any public safety laws, they should be punished.  If they want help, we should get them the help they want and need. This way we keep drug users out of jail and prevent overcrowding.

I am an Independent, so I have no allegiance to any party. 

Any politician who weighs in on this subject should be watched closely.  They are voting on things they dont understand, Ricketts included.",1580271143,ffvrf0s
1138,RedFloppyShoes,"Lincoln seems to do that quite often. Especially since Gaylor-Baird, she's a real gem.",1580273011,ffvtr4u
1139,onelapse,I linked the article to delay the vote in the post. Hundreds of people showed up to the vote and petitioned to make it less strict. I don’t know what changes they petitioned though was hoping someone involved might be on here,1580303929,ffwkj7x
1140,onelapse,Astros are overrated!,1580303981,ffwkli4
1141,SandbergForever,"BS! Most people can and do gamble responsibly. IA for the most part has better roads and lower taxes, why? The answer is in part the casinos. I worked at one for many years, yes some people had issues but most didn’t. Most players are from NE and are between the ages of 40-65 (more disposable income). Did it was about gambling I can promise lotto tickets do more harm to the poor and working class than casinos do, yet we have lotto sales here! Sports gambling? Bookies are a much bigger issue and A casino can regulate it. Crime, guess what? Omaha has more crime than CB. Another commenter said it best, it’s the pearl clutching that is the problem...",1580309864,ffwsdhb
1142,Parzival_Player_1,Where is this at?,1580310756,ffwtooe
1143,kwridlen,Just Northwest of Wauneta Nebraska in Chase County alon Old Highwy 6.  Great views!,1580310851,ffwttvi
1144,Parzival_Player_1,"&gt;Wauneta Nebraska

That's three hours away from me but this sounds like it might be a fun road trip with the kids this summer.",1580310984,ffwu124
1145,kwridlen,"Yes, while in Chase County you would want to visit the water powered mill in Champion and swim in the pond. There is a great museum in Champion as well. Just down the road is Enders Recreation area great fishing and boating.",1580311137,ffwu9d7
1146,rc19651,This! We used to hike the Grand Canyon when I was a kid and swim at Champion and Enders. Good times. There's a lot of pretty area out there.,1580311393,ffwunk6
1147,kwridlen,No place I would rather be!,1580311670,ffwv246
1148,AssMaster7000,"Thank you for the tip! I’m not all too far from Wauneta, new to the area, and I’ve been looking for fun things to do when the weather warms up again!",1580312594,ffwwhfn
1149,kwridlen,Come on out there is plenty to do here. If you come out in mid August stop in to the Chase County Fair and Expo. It is one of the best county fairs in the state!,1580312835,ffwwv1z
1150,AssMaster7000,"I’ve been to that for the last few years with my fiancé and it’s definitely fun! I have a feeling I’ll be at the Perkins county fair as well since I work in that county :) i always love the concerts at the fair, they’ve been excellent every year—except last year when the rock concert got rained out :’(",1580313019,ffwx5hc
1151,kwridlen,The weather is always unpredictable out here!,1580313069,ffwx8an
1152,AssMaster7000, It is! I’ve been a Nebraskan my whole life though so that I’m used to lol,1580313171,ffwxe1b
1153,retracedylan,I just drove my Wauneta this past weekend when the weather was very nice. The canyons around there are gorgeous,1580313444,ffwxtos
1154,jakeimmink,Huh?,1580316176,ffx280d
1155,easteriscancelled,"they're always hating on you at least, I find that really unfair because y'all are superior",1580316283,ffx2e8y
1156,jakeimmink,Delaware the state?,1580316308,ffx2fon
1157,easteriscancelled,"Yes, just look at their sub. They have a post flair that's ""F\*\*K NEBRASKA""",1580316510,ffx2rbk
1158,thundergonian,"Oh, man! I think I just found an excuse to go visit Chase County!

I moved into the state recently, and I’m trying to visit (or at least pass through) every county, and the counties of the southwest corner (in and around McCook) is the biggest blank spot on my map.",1580319289,ffx7djd
1159,EljerGoldwater,Why doesn't he just try to reinstate Prohibition while he's at it?,1580321322,ffxas7o
1160,wwWalterWhiteJr,But it only goes to 2012,1580321436,ffxaz2h
1161,[deleted],[removed],1580323061,ffxdqlh
1162,sk8ernine,"It's not overreach in the slightest, if you ask me. Nobody wants what's basically a hotel room in a quiet suburban neighborhood where shitheads from out of town can be obnoxious for a day then leave. I think the city has every right to require airbnb owners to occupy the residence they plan to rent. Otherwise they have no real accountability for what some obnoxious asshole football fans might do for example. Most other major cities have similar laws.",1580323662,ffxer5j
1163,Mikashuki,Emma is forever the name for girls,1580325074,ffxh713
1164,BigCrappola,"Most people use hard drugs responsibly.  Most people would use heavy military weaponry responsibly.  Most people are responsible.  It's the smaller percentage of people who ruin everything, no doubt.  I can't say that Iowa roads impress me, we all have salt and winter/spring heaving/thawing.  They all go to crap and the heaviest traveled always get fixed. 

How can you promise that Lotto tickets do more harm than casinos do?

Bookies AKA law breakers can be dealt with by law enforcement.

Omaha has more violent crime than Council Bluffs but Council Bluffs has a much higher property crime rate.

I don't think the entertainment value justifies the lives getting ruined at casinos.",1580325856,ffxika3
1165,SandbergForever,"I have never met a user of “hard” drugs that use responsibly, that’s a red herring. Bottom line is plenty of studies have been done on this and can casinos ruin lives? Sure, how about alcohol, shopping addictions, porn? I worked in the industry and have met more people who were ruined by shady corporations than casinos (Enron, Bernie Madoff, banks that gave out too many high risk mortgages to name a few). Also, those who have gambling addictions tend to have other addictions. If you’re advocating against casinos are you advocating for more money to go to mental health to stop addictions people have from self medicating?",1580332388,ffxtzn2
1166,freelance-t,"Wow, that is way out there in SW Nebraska. I live in the opposite corner, unfortunately. But next time I drive out to Colorado, I might try to find a route through there!",1580333001,ffxv332
1167,kwridlen,Highway 6 is a great drive through Nebraska. I would do it if you get the chance. There are a lot of great things to see and do along Highway 6.,1580333102,ffxv9md
1168,andrewsmd87,"If you're coming from the south east ish, you should stop by Mullen and do a tanking or kayaking trip with them as well",1580333605,ffxw5w0
1169,jeansntshirt,"also @/u/freelance-t oh yea taking the highways and byways is a great way to find things to do. 
The interstate killed tourism at the cost of driving time.",1580335027,ffxyomw
1170,kwridlen,So true!,1580335177,ffxyy3w
1171,BigCrappola,It's sure not a bad idea.  Is the next part of this going to be that gambling revenues will help pay that?,1580351491,ffyormj
1172,SandbergForever,"Not necessarily, but the casinos in IA are required to help fund 1-800-betsoff. I was just pointing out there are a ton of social ills out there and just because we can act like we’re better we really aren’t. We can allow things (within reason, ie, herion has no place being legalized) that others have proved to be ok. For example, just because I don’t agree that weed is as harmless as some would make you believe, doesn’t mean I think legalizing forms of it are without merit. Again, I worked in a casino and left because I don’t particularly like them, that doesn’t mean they’re evil. I’m just tired of the old school “we’ve always done it this way” thought process on gaming. Literally every state around us has casinos and if done correctly they can add a lot of funding and jobs.",1580354545,ffyt7vd
1173,photogjayge,"Lol, they are",1580360048,ffz0gxn
1174,TheBruceMeister,Way to go!,1580385853,ffzme7y
1175,berberine,"This is from four years ago in Sidney. While I covered all the hearings at the Sioux County Courthouse, my editor and publisher went to cover this hearing. In this longer, [youtube link](https://www.youtube.com/watch?v=m0HL4L6Pa-4&amp;feature=youtu.be), you can see my publisher right at the start of the video. My editor is sitting to his right and is scratching his head as the video starts.",1580389759,ffzqbsx
1176,huskermut,That's really common. People park their RVs in May and leave them until September. That needs to change.,1580390803,ffzriuw
1177,onelapse,"I’ve suspected it and it’s kind of obvious if you spend a couple weekdays on the beach, no one coming or going but come Friday a while gaggle shows up and are mad because people setup shop around them",1580391993,ffzsy90
1178,EverybodyLovesCrayon,"Since you covered them, can you give us more information?  How does fracking affect the water?  Would water from that same source be drinkable had fracking not occurred there?",1580407647,fg0h26r
1179,dwbrick,Bet they all voted for Trump too.,1580416691,fg0x0xd
1180,MaxShipman,Fracking kicks ass,1580423517,fg1a4ke
1181,bussathicknut,"The full picture says Christian men, why the censor?",1580426845,fg1gt6e
1182,ArchFrankDelBrown,I was complimenting the creators ...,1580426857,fg1gu0v
1183,acknowledgeme,Apparently you've never met Chris.,1580427220,fg1hj9j
1184,xAIRGUITARISTx,It’s not censored.,1580428329,fg1joy9
1185,Jupiter68128,My name is Chris.  This is verified.,1580429460,fg1lx2g
1186,EpiskoposGambit,It's been a rough couple years for Nebraska based Businesses.,1580432239,fg1rr6t
