,author,created_utc,id,link_flair_text,selftext,subreddit,title
1570,Btankersly66,1584980771,fnmt2l,Nan,"https://www.wweek.com/news/2020/03/20/in-portland-and-statewide-business-community-pushes-back-against-shelter-in-place/

Sure the economy will bounce back but if everyone is too sick or dead then what?  

Liberal Oregon will sacrifice lives to save small business.",oregon,Lobbyists want the sick and dying to continue doing business
1571,b-rad420,1584982223,fnn8b4,Nan,,oregon,"Oregon Executive order 20-06 - ""Persons who believe that they have been subjected to unconscionably excessive prices for essential consumer goods due to this disruption should report that conduct to the Oregon Department of Justice Consumer Protection hotline, at 503-378-8442."""
1572,oppositeofpepsi,1584982826,fnnew2,Nan,,oregon,Manzanita sending all non-full time residents home
1573,LostCoastWoke,1584984840,fno1kd,Nan,"Why? 

is covid-19 just not a concern to you? Do you not care? If the governor orders you to stay home today, will you? 

I’m not gonna throw any shade your way, just curious about your thought process 

Thank you",oregon,To all the people flocking to the coast and state parks this weekend....
1574,TickerTocks,1584985441,fno8g4,Nan,"Kate Brown's announcement was postponed so now I'm getting ready for my shift at an ""essential business"" wondering if she'll give the word today.",oregon,Anyone else with a swing or night shift waiting patiently to know if they're going to work today
1575,Nevra79,1584986301,fnoi5o,Nan,,oregon,"Quarantine orders could be a nightmare for domestic abuse victims. Check on your neighbors now, offer help, reach out..."
1576,murdermittensjuju,1584986351,fnoior,Nan,https://www.kezi.com/content/news/Brown-issues-stay-at-home-order-effective-immediately-569024401.html,oregon,"Brown issues 'stay at home' order, effective immediately"
1577,bumnub888,1584987079,fnorat,Nan,[https://www.oregonlive.com/coronavirus/2020/03/read-oregon-gov-kate-browns-new-executive-order.html?utm\_source=twitter&amp;utm\_campaign=oregonian\_sf&amp;utm\_medium=social](https://www.oregonlive.com/coronavirus/2020/03/read-oregon-gov-kate-browns-new-executive-order.html?utm_source=twitter&amp;utm_campaign=oregonian_sf&amp;utm_medium=social),oregon,Kate Brown's stay-home order
1578,PaaschRoads,1584988180,fnp3x9,Nan," 

Cardinal Glass, the largest employer in the Hood River Valley (and one of the largest in The Columbia River Gorge) produces residential and commercial window units. They've taken it upon themselves to decide they're an essential business and are going to remain open even with the Stay At Home Order issued by Kate Brown today, requiring lower-level employees to report to work if they're not using personal PTO. Upper management will be working from home for their safety. 

Cardinal has declared they \*could\* be asked to produce windows for temporary hospitals. They've not been contacted for this, or ever done it before, and are instead risking the lives of their approx 350 employees by forcing them to continue making profitable stock windows for customers while they ""wait to see"". 

The plant manager, Dave Windsor, has stated they will most likely see a case at the plant, they are after all a facility that puts workers in close contact. However he dismissed this as a typical virus like they've seen before, and that they'll ""clean that person's work station after they leave"". 

Does this seem safe? At a time where we are all being asked to take a step back, make hard decisions, and try to stop the spread of this unprecedented, highly contagious virus; Cardinal and Dave Windsor have decided to callously risk throwing their employees, and now the entire Columbia River Gorge, in front of the virus in the name of profits. 

PLEASE put pressure on this greedy corporation to close. Keep a skeleton crew on call for the dozen or so windows they hypothetically are going make for a hospital and shut the rest down. The community is worth more than this companies bottom line. ",oregon,COVID19- Large Employer in Hood River Refusing to Shut Down Non-Essential Manufacturing
1579,WookGang,1584988198,fnp44f,Nan,,oregon,Stay Safe and at Home!
1580,scarredkat,1584988542,fnp81t,Nan,,oregon,Breaking News: Stay at Home Policy Announced
1581,Rush58,1584988695,fnp9qv,Nan,,oregon,First confirmed case in Clatsop county
1582,splatterhead,1584988728,fnpa4a,Nan,,oregon,Executive Order: Stay Home Except for Essential Needs
1583,raincactus,1584988875,fnpbr9,Nan,"The Oregon [permit page](https://www.oregon.gov/bcd/Documents/brochures/2670.pdf) seems clear on that.  My north-coast city requires a mechanical permit but doesn't state clearly online whether the homeowner can do the work.  I'd rather know the answer before I ask them.

I've got a new Rheem 50 gallon in the basement that's almost exactly the same height as the 30 y.o. Rheem 40 gallon it replaces.

Possible issues.  

1. Water heater was positioned away from wall.  To meet seismic code, can I leave the water heater in the same place and loop 2 pieces of plumbers tape around it to strap it to a couple of 4x4 posts?  I'd anchor the posts in the cement floor and to the wooden ceiling (does it matter what a post is anchored to at the ceiling? I'd nail a couple feet of 2x10 to the ceiling to give some meat for a bracket around the post to hold onto).  Or am I going to have to move the heater to the cement wall to anchor it (in which case, I'm calling the plumber)?  
2. The exhaust pipe from the previous heater to the outside window was mostly zero-slope (flat).  Has there been any change in code that requires the pipe to continually slope upwards from the heater's hood to a higher vent in a window?
3. Is a drip pan sufficient or does code require a connection to a drain?  There's no drain nearby except the one 15' away (for the washing machine) that's fitted w/a 2.5"" pipe that's got an open connection 18"" off the ground. 
4. Any other changes in code in the last 30 years that make this DIY-unfriendly?",oregon,"Can homeowner replace gas water heater (same position, same gas connection) himself or do I have to hire a plumber?"
1584,hizzle08,1584989432,fnphyy,Nan,Hi all. Like many Oregon residents I have been temporarily laid off. I work at a climbing gym. I have been told my job is guaranteed once the gym reopens...but there is no telling when that will be. On the OR unemployment website you have to be actively searching for jobs in your community and within your field to receive unemployment. Nobody in the outdoor industry is hiring right now. Is anyone else running into similar problems?,oregon,Oregon Unemployment
1585,wheremystarksat,1584989987,fnpo6p,Nan,,oregon,"Oregon officially ordered to ""Shelter in Place"""
1586,modzark,1584992126,fnqbpx,Nan,,oregon,A pic from Angel's Rest I took a week ago
1587,Oregon_Yeti,1584992846,fnqjme,Nan,,oregon,Oregon is doing better than overall USA trend for Covid19 Confirmed Case but no where near to flatten the curve like South Korea and Japan. WA and CA have similar trend like OR.
1588,new-man-2020,1584993261,fnqo1l,Nan,,oregon,Stay home or get fined. 3.23.20
1589,FaintXD,1584993732,fnqt5s,Nan,"So I work at a small printshop not alot of employees but still concerned people. Today we assumed we would be going home due to the corona and the state wide issue of stay at home. Instead our owner(who hasn't been to work since virus) states we are to be quite and go in stealthy and stay open as we have a competitive edge due to everyone else closing around us.

I mean I get it he owns the business but to say anything like having a competitive edge while people getting sick and dieing seems pretty messed up not to mention neither the owner nor manager are in nor have plans to come in.",oregon,Boss says we have a competitive edge due to corona
1590,coronavirus-shame,1584993922,fnqv7p,Nan,,oregon,Coronavirus Name And Shame Website -- PLEASE REPORT VIOLATIONS
1591,Dogphones,1584997373,fnrw9s,Nan,"Most of us who are left standing are dealing with the realities of being short staffed and overworked. Hours are long. I don’t think anyone working now is being paid enough to subject themselves to the absolute masses of people we are dealing with. 
People have been unkind and impatient beyond what should be considered acceptable on a daily basis, let alone during a pandemic. 
We get it. You’re scared, we are too. And we don’t get the luxury of hiding away from the public like most other people right now. We are doing our best to keep these essential businesses alive so you can have access to things you need. We want to help. But we are scared. Please extend love and kindness to all of us who are serving you during this unprecedented, depressing catastrophe. 
If you have been extending this compassion to us already, I want to thank you from the bottom of my heart. You make all the difference. 
You have the power to make this softer and lighter for us, by being loving.",oregon,"A reminder to be extra kind, forgiving and courteous to people working at essential businesses right now"
1592,hoopism,1584999788,fnsn3r,Nan,,oregon,Oregon Coronavirus trends by county
1593,chuck__noblet,1584999889,fnso6q,Nan,,oregon,Hood River County has its first confirmed COVID-19 case
1594,Yeh_Old_Rums,1585000122,fnsqik,Nan,,oregon,A Bar in Eastern Oregon Defied Orders From the Governor and Stayed Open on St. Patrick’s Day
1595,chuck__noblet,1585000366,fnst25,Nan,,oregon,Hood River County Health reports first COVID-19 case
1596,Tmonte0311,1585002042,fntajv,Nan,"Hey guys, where the best place to live in Oregon if you love your rights and hate antifa",oregon,2a activist
1597,askportlandtv,1585002158,fntbs3,Nan,,oregon,Portlands opinion on the coronavirus
1598,pblood40,1585002343,fntdqo,Nan,,oregon,Wall Street Intends to Gouge Us During Crisis
1599,coronavirus_throw,1585002905,fntjfe,Nan,"Obligatory sorry if this doesnt belong here.

First off, this is a throwaway account, I will not be revealing how I got the info about this for fear of retaliation (hence the throwaway)

Here goes:

Asset recovery group (hereby referred to as ARG) is a debt collection group that specializes in collecting medical debt, headquartered here in oregon.

ARG has announced that they will be remaining open during this health crisis, and that they have no plans of shutting down.

They say that it's in the interest of their employees livelihoods when oregon government has already made it possible for these people to be paid unemployment at least while the coronavirus is spreading

The governor just announced a stay home order, with a 1250$ fine for disobeying it.

And I say again, these employees must go to work, they cant just not show up because of noncompliance of the company because then they wouldn't be eligible for unemployment for the time being.

A lot of their employees are understandably angry about the situation and how they have to keep trying to collect medical debt in this crisis which for many of them just feels morally wrong.

One more time for the people in the back, ARG will continue to collect on medical debt with no plans of closing.

I dont know if this is outrage worthy but it just boils my damn blood, what other business have you seen open that should be closed? How do you feel about ARG? Please discuss I would love to here your thoughts

Thank you for your time",oregon,"In these uncertain times, I'd like to shed light on this, please read on"
1600,oldpeoplestayhome,1585010020,fnvh6h,Nan,"I am a young person, and a health professions student. For the past two weeks, essentially since a state of emergency was declared, I have been hanging out at my apartment (in Portland), going out for an hour a day for some sun and exercise. I've had sub-social distance level contact with only my roommate and two other friends, otherwise relying on distance methods of keeping in touch. *I am doing these things exclusively in order to reduce the significant risk of death posed to older adults.* 65-75 year olds are old, as far as this virus is concerned; y'all are nearly twice as likely to be admitted to the ICU *and to die* as someone just 10 years younger!

Each time I have gone out, I have noticed that older folks make up a greater proportion of the people out-and-about than they did before. Running in my neighborhood, I look ahead to see if someone is coming towards me on the same sidewalk, and move into or across the street to stay over 6 feet away from them. Roughly four-fifths of the old folks I see do not do this. I have seen old people greeting groups of friends with embraces at Portland parks and beer gardens as I've passed. Older adults are the most dangerous vectors, *because your friends are also old.* I am going to have zero contact with people over 65 (including my parents!) until this is all over. *Are you?*

Early this morning, I went to the grocery store, for the first time in two weeks. It was very clear to me that, just by being at the store, I was having far more ""contacts"" in those 45 minutes than I had in the entire past two weeks. It was much more crowded than usual, and again, a greater fraction of the people out and about looked older than 65. Many of them appeared to be purchasing one days worth of groceries. I am familiar with this practice. My parents, both retired, made near daily trips to the grocery store before this all started. I get it: you have extra time, it's nice to go the grocery store, you can get fresh ingredients for whatever dinner seems most appealing that day. But *now is not the time to make daily trips. Stock up, and stay home.*

We (young people, mid-20s to 30s) are putting our lives, schools, work, and recreation totally on hold, solely for your benefit. If there wasn't a large, at risk populations that we were trying to protect, a lot of young people, including myself, would prefer to just get the virus now and get it over with. We are taking this seriously, so *please take this seriously*. Have as little contact, or close proximity to others, *as you possibly can*. That is not what I'm seeing when I (occasionally) leave my house. Being cooped up sucks for everyone, *but we are doing this exclusively for you*. If you are not taking *every* possible precaution, that is unconscionably reckless.",oregon,To Older Oregonians (65+)
1601,Shadow_The_Ghost,1585010656,fnvn8w,Nan,,oregon,Places To Visit This Weekend in Oregon
1602,new-man-2020,1585012133,fnw0qs,Nan,,oregon,Helpful map.
1603,fuckingbeachbum,1585013473,fnwctz,Nan,,oregon,Except for walking dogs you say?
1604,MaxM1111,1585014607,fnwncn,Nan,"Hello everyone, hope you are healthy &amp; well.   


I'm currently conducting research on our LGBTQ+ community's views towards the ongoing 2020 U.S. presidential election. I would greatly appreciate if you could fill-out the very brief (4 question), nonpartisan, anonymous survey [here](https://forms.gle/za7GFdtaa5vH9mvb9).  


Thanks :)",oregon,The 2020 Queer Vote
1605,selfintersection,1585014978,fnwqmh,Nan,,oregon,[OC] Live map of price gouging complaints from OR DOJ
1606,AVargas,1585015142,fnws3x,Nan,,oregon,[OC] Live map of price gouging complaints from the OR DOJ
1607,Dpurcell92,1585020927,fny5vh,Nan,,oregon,Another letdown
1608,do_as_I_say_notasido,1585021605,fnybdx,Nan,"Most all employees have been deemed essential, and are no longer allowed to telecommute. They will be doing their best to get claims out as fast as they can though.",oregon,Employment Department employees deemed essential and reassigned to work claims.
1609,bamifyoucan,1585023195,fnyoaj,Nan,I work at a construction home remodeling and property maintenance company in Benton county. I’m curious what if anything other people I’m similar fields have heard? We were briefed today about it and were told that we would made to drive separate work vehicles and implement a 6 foot rule. Nothing else. He mentioned if we don’t feel comfortable working than we have the option as well.,oregon,Construction workers input please.
1610,davidt3232,1585024372,fnyy6e,Nan,"Is it allowed to go from home A in city A to home B in city B, then go from city B to city A after the executive order from Kate Brown?",oregon,Allowed to move from home A in city A to home B in city B?
1611,terwilligercurves,1585024465,fnyyzi,Nan," *We have personally been working with task force members of the mayor of Portland, the Governor, and Rep. Earl Blumenauer on these ideas.  This is a simplified letter to hit at the heart of the matter.*

 To all concerned citizens,

Unprecedented times call for unprecedented creativity.  It is evident that we have what is in essence a two front war:  a global health pandemic, and an economic meltdown of unprecedented proportion.

The best recommended method to fight the pandemic is social distancing.  Therefore, we must implement immediately a stay-in-place policy across the nation and the world.  If the way to stop the virus is to stop the spread through interpersonal contact, this will be the quickest and most effective way to flatten the curve, and stop the virus in its tracks.  Let it play itself out in infected populations, and wait for the coast to clear.

Secondly, the cash flow crisis that is upon businesses and individuals must have a uniform policy across the board that keeps everyone “whole” as a result of the stay-in-place policy.  The economic consequences of the pandemic so far have dwarfed the medical impacts.  **The best way to combat the economic meltdown and cash flow crisis is to pause or freeze all debt, mortgage, lease, and rent payments in their tracks across the board for everyone.**  I have advocated for immediately passing a national law to do just this.  Once the crisis is over, allow business to recover and then un-pause.

We have frozen millions of businesses ability to make money, pay wages, and economic activity has screeched to a halt.  The only way to effectively keep our nation and the world from a meltdown is to simultaneously halt the need to make payments.  All banks and financial institutions must get on board with a uniform policy enacted across all platforms to make this work.  If banks cannot receive payments on the loans, we are facing another financial crisis.  By halting the requirement to make payments, banks can then work within the framework of the Federal Reserve System, and interbank lending to create and maintain liquidity for essential services.  We can reduce or stop business failure in its tracks, and thus, the need to bail out industries and financial institutions.  Federal and State aid can then be most effectively used for the basic survival needs of food and utilities.

We must have the mindset to create a national protocol for these situations; protocols for health systems and economic systems that protect everyone on both levels.  The current paradigm of tax credits, loans, and bailouts cannot possibly keep everyone “whole”.  The government cannot and should not create untenable amounts of debt or print money in the volume needed.

Many banks and individuals are working out these very solutions on their own.  What is needed is a coordinated, coherent and effective policy across the board for all people.  We must stand united and demand a national economic freeze for both our health needs and economic needs.

Please share this letter, its ideas, or both across every platform you have and to every political and business leader you can.  We must create a movement that begins with the premise that all people will equally be kept whole throughout this crisis.  That means with healthcare and economic needs.

&amp;#x200B;

tl;dr: In order to combat the economic fallout this pandemic is creating, we must push for a ""debt freeze"" to pause all debt, mortgage, lease, and rent payments. Without action, we will be hit hard by the economic mess COVID-19 is wreaking.",oregon,Protocols for Health and Economic Survival--Please Help!
1612,Kukuum,1585025147,fnz4mb,Nan,,oregon,FERC ruling far from the last word
1613,Gets_My_Goats,1585025307,fnz5x7,Nan,,oregon,"Cops searching for man who assaulted another on I-5, then drove away"
1614,Oldjoby,1585025509,fnz7ei,Nan,"Honestly I just want to do what’s right, we pulled our kids from school(on Wednesday) before they shutdown cause I was freaked out. At the time the recommendation was just social distancing.   Should we go back to ptown? Or should we stay in place and contiue trying isolate(been here 12 days). We have 3 under ten kids , we have been Going  to isolated beaches and woods everyday. Staying way, way clear of folks. As a family we just want to do the right thing. WhTs your advice. Happy to do whatever is the best for everyone.",oregon,"What should I do? Need advice, I’ve been at my second home on the Oregon coast for 12 days. Family has been social distancing, I’ve made a few trips for groceries, but have being super careful/Purcell no face touching. Should I return to Portland ? Or stay put ? We are by florence"
1615,Gets_My_Goats,1585029910,fo035c,Nan,,oregon,Linn County veteran tests positive for coronavirus after previously testing negative
1616,Localboy97355,1585032283,fo0idj,Nan,,oregon,Coronavirus model sees Oregon hospitals overwhelmed by mid-April; 'point of no return' for intervention to work: March 24-29
1617,Odysseuss87,1585053024,fo4bko,Nan,,oregon,For everyone finding out they are essential.
1618,Hanse00,1585064406,fo7658,Nan,"Please, everyone do yourselves a favor and read the actual executive order, it's only 8 pages long (And pages 3 - 5 contain most of the relevant content): [https://govsite-assets.s3.amazonaws.com/jkAULYKcSh6DoDF8wBM0\_EO%2020-12.pdf](https://govsite-assets.s3.amazonaws.com/jkAULYKcSh6DoDF8wBM0_EO%2020-12.pdf)

Notably a lot of people seem to be talking about whether or not their work is ""essential"". Well that doesn't matter, because there's no such concept as ""essential"" in the order.

There are certain businesses that are forced to be closed no matter what, there are certain businesses that are exempt from the order (Namely grocery, healthcare, medical, and pharmacies), and more or less everything else is covered by the paragraphs of this order.

Social distancing is **required** at more or less all businesses. Your boss doesn't get to say ""We're essential, so it doesn't matter"", that's not a thing.

Stay informed, and stay healthy.

(And no, I'm not a lawyer either, if you are concerned about being fired, maybe talk to one? But don't get yourself sick so that other people can profit off of your work, it's not worth it)",oregon,"PSA: There's no such thing as ""essential"" or ""non-essential"" work under the ""Stay Home, Save Lives"" executive order."
1619,guanaco55,1585067962,fo87hb,Nan,,oregon,FAQ: How Life Will Change More Under Oregon Governor's Stay Home Order
1620,markarrot,1585071775,fo9dfy,Nan,"  Hello everyone... my name is Mark Duncan and I am running as Oregon's next Governor. Everyday, I am asked all sorts of questions about me, Oregon politics and my plan. People want to know who I am, why I am running as governor and how do I expect to win. I have decided to write this article in hopes of answering people's questions 
  The first question I am going to answer is, ""Who am I?"", My name is Mark Duncan and I am 42 years old. I was born in Lakeview Oregon. I have lived all over Oregon and I currently live in southern Oregon. After graduating from high school, I took a few years off of school to work as a farm hand on my grandfathers farm. Farming was hard work and very time consuming. I was awake at 3am and wouldn't be back in bed until 11pm. In 2001, I decided to go back to school. I enrolled at Klamath Community College. I majored in history, minored in law and I took psychology for fun. After four years, I transferred to University of Oregon and then I went on to law school. After college, I found it hard to get work so I began a fighting career. I began boxing, kickboxing and doing MMA. I fought over 75 times professionally and each time I represented Oregon. People all over the country got a little taste of just how tough Oregonians are. I retired from fighting in the beginning of 2017. It was then that I began training at risk and low income kids in my gym for free. I am now a husband, a father of four young girls and I am chasing my next dream... to become Oregon's next governor. 
  Now, why would I want to be governor of Oregon? For far too long, I have seen this state deteriorate with Liberals in charge. I have witnessed taxes continue to climb, industries close or leave state because of insane restrictions. I have seen our education levels and scores hit an all time low wile the homeless population hits an all time high. I have watched super majorities build sanctuary for undocumented while stepping on the rights of legal Oregonians. Enough is enough, it is time to redeem Oregon. 
  How am I going to win the election? I will start by uniting the silenced 29 counties in Oregon under lower taxes, less restrictions on our industries and smaller government. I will unite them with business owners, land owners, workers and everyone else that has lost something or will loose something because of Liberal politics. The final phase will be to go into Portland and to charge the young fight fans and fighters. I will pull the largest number of 18-35 year old voters Oregon has ever seen. We will win and we will redeem Oregon!",oregon,Redeem Oregon With Duncan For Governor
