,author,created_utc,id,link_flair_text,selftext,subreddit,title
695,Ltdan994,1581533018,f2vvcr,Nan,"My fiancee and I have decided to elope out to Oregon and we were looking around Mt. Hood. It looks absolutely beautiful over there and as big hikers ourselves it would be perfect. I saw a few lakes around the area that were crystal clear with the mountains in the background which is kinda what we are looking for but open to other areas. I would really like to get the citizens of Oregons take on their favorite spots on/around Mt. Hood. We both live in Minnesota and love hiking the northern portion of the state. If you have pictures please message me so I can see what you see. Thank you very much for your time!

Dates: Thinking late July early August

Also if you know a great local photographer that does photos in the mountains would be great too.",oregon,Elopement on/around Mt. Hood
696,BurnKnowsBest,1581535136,f2weww,Nan,,oregon,Summer in eastern Oregon
697,mastersurrealist,1581535893,f2wlw8,Nan,"Is it just me or does it seem like any post critical of antifa gets removed immediately from the Portland subreddit? Some days it just feels like a ""Punch Nazis"" echo chamber.",oregon,Portland Mods and Antifa
698,Camde_n64,1581536960,f2ww5c,Nan,,oregon,So recently I learned Washington has an official tartan for the state. here is my Idea of an Oregon tartan
699,cmak154,1581538970,f2xf64,Nan,,oregon,Painted hills in Oregon at sunset.
700,guanaco55,1581539562,f2xkuq,Nan,,oregon,8 ways to stay safe while soaking in Oregon’s natural hot springs
701,guanaco55,1581539912,f2xnz8,Nan,,oregon,"Failing forestry: Nearly broke, Oregon forestry department seeks emergency infusion"
702,BurnKnowsBest,1581540066,f2xpdy,Nan,,oregon,Dissent Proves Costly In Eastern Oregon's Grant County - A career police officer claims to be the latest target of an activist sheriff.
703,Nevra79,1581545715,f2z74w,Nan,,oregon,"Just outside of Glass Butte last summer...a world away from the valley floor, and no less breathtaking."
704,2andthensomeletters,1581546322,f2zcx9,Nan,"I grew up in MD and spent every summer fishing and crabbing.  I moved to OR in the fall of 2018 and last summer was the first summer since I was maybe 3 that I didn't catch a single fish.  I recently bought my license and all of the tags and want to try and catch a salmon, which I hear are already running.  Any tips on locations and bait would be awesome (I live near Portland but I like short road trips).",oregon,Salmon fishing
705,chocolateandmermaids,1581549949,f309ko,Nan,,oregon,Cascade Locks
706,MannyDantyla,1581550906,f30hxe,Nan,,oregon,A Canadian energy company is funding an entire unit of an Oregon sheriff's department that deals with policing protesters
707,wile-ecoyote,1581552611,f30wot,Nan,What's there to do in the area? My main hobbies are climbing and mountain biking.,oregon,"Have the opportunity to move to Hines, Or should I go or no"
708,marco_esquandolas_,1581553902,f317hw,Nan,,oregon,"Mirror Lake Trail, Mt Hood National Forest"
709,Pancake_Gravy,1581558608,f32a3s,Nan,,oregon,Keep Oregon Green
710,oregone1,1581559035,f32dhp,Nan,,oregon,Last week I got time away from the kids to go to a brew fest. This week it’s my wife’s turn for a vacation.
711,pastca,1581562566,f335v7,Nan,Howdy folks! My little brothers and I are embarking on a little roadie this spring break and were looking to find some sweet new surf breaks along the oregon coast (grew up hittin indian beach and shortys). Starting from Fort Stevens and ending around Big Sur area in NorCal. Would love to get some insight while we get our plans in order! Much appreciated yall!,oregon,Surf Spots
712,overtacoma,1581564916,f33okt,Nan,,oregon,Wreck of the Peter Iredale steel wool pic from drone
713,overtacoma,1581566280,f33z8p,Nan,,oregon,Megler Bridge AstoriA
714,BurnKnowsBest,1581566423,f340cd,Nan,,oregon,A seat at the table
715,BurnKnowsBest,1581566837,f343l2,Nan,,oregon,My own private idaho.
716,DrRedmond,1581571496,f351cd,Nan,,oregon,"Absolutely amazing art work. Was somewhere between Gold Beach and Coos Bay. Was driving through, anyone know exactly where this is?"
717,Watoosky,1581572523,f358it,Nan,,oregon,Thornhollow grade on the Umatilla Indian Reservation in the foothills of the blue mountains.
718,og-ika,1581579670,f36ibf,Nan,,oregon,Crater lake
719,og-ika,1581579919,f36jtn,Nan,,oregon,Tumalo falls
720,og-ika,1581579984,f36k77,Nan,,oregon,Tumalo Falls
721,PowersDrums,1581603033,f3aigv,Nan,,oregon,"Made another ring, this one from a Mount Hood “America the Beautiful” clad quarter!"
722,Brosie-Odonnel,1581605580,f3b37j,Nan,,oregon,"South Sister, Middle Sister, and Broken Top at sunset"
723,liminalspacing,1581607966,f3bnlu,Nan,,oregon,Out of control.
724,guanaco55,1581608578,f3bt1c,Nan,,oregon,"Layoffs, Lawsuits, Lingering Questions Follow Concordia University's Announced Closure"
725,guanaco55,1581608661,f3btrc,Nan,,oregon,A TV Show About Three Kids and a Substitute Teacher Attempting to Remake “The Goonies” Is in the Works
726,IsaacMooney,1581608929,f3bvxv,Nan,,oregon,"Coast of Florence, Oregon."
727,MocoPDX,1581612338,f3cqmt,Nan,"So a group of 8 of us were meant to go fishing on a charter in Newport this Saturday. The captain says that won't happen as it will be very windy and rainy. So I'm asking you, /r/Oregon, what should we do instead? We're still leaving Sat morning and coming back Sunday. We have a house in Waldport. We'll be driving from Portland. Things to see/do/drink/eat along the way? Any suggestions are welcome!",oregon,Help! What to do on the Oregon Coast in the midst of rainy/windy weather?
728,Gmgood89,1581613192,f3cyfp,Nan,,oregon,"Saw this on FB and thought it was hilarious, and since it's an Oregon company, I think many of us know one or two of these folks!"
729,guanaco55,1581614366,f3d9he,Nan,,oregon,Oakridge residents fear business closures could foretell future 'ghost town'
730,mastersurrealist,1581616744,f3dv5t,Nan,,oregon,Do you think we could pass this on Oregon?
731,iaminsest,1581620329,f3evic,Nan,For the three sisters.,oregon,"I believe I thought of this Oregon joke on my way to central Oregon, from the valley.. Why does three fingered jack have three fingers?"
732,ThePNWBackPacker,1581620753,f3ezhk,Nan,,oregon,Golden Hour
733,MichaelTen,1581625283,f3g6sg,Nan,,oregon,"Southeast Portland neighbors losing patience with city, want squatters out"
734,lari_picea,1581625749,f3gayr,Nan,,oregon,"Steel Bridge, Portland OR."
735,Kukuum,1581626503,f3gi2p,Nan,,oregon,A Canadian Energy Company Bought an Oregon Sheriff’s Unit
736,Kukuum,1581628012,f3gw17,Nan,Visit [https://www.oswe.org/](https://www.oswe.org/)  to get engaged or just to learn more about the efforts/ideas.,oregon,Calling for Stakeholder Participation in Floating Off-shore Wind Renewable Energy Resilience Projects
737,BurnKnowsBest,1581631422,f3hrpt,Nan,,oregon,Oregon?!
738,Clackamas1,1581636193,f3ixgm,Nan,,oregon,"State Audit Finds Travel Oregon’s Soaring Budget Pays for Generous Compensation, Sloppy Contracting"
739,chirpingbirdie,1581636535,f3j09t,Nan,,oregon,High salaries for Travel Oregon execs called out in audit
740,DaRealDorseyBro,1581637205,f3j5ms,Nan,,oregon,A Skibowl pic from last Saturday!
741,guanaco55,1581640018,f3jsb9,Nan,,oregon,Fat salaries for Travel Oregon executives called out in audit
742,BurnKnowsBest,1581640595,f3jx0v,Nan,,oregon,BNSF
743,DrRedmond,1581647970,f3lijf,Nan,,oregon,The Gold Coast - the most amazing beaches in the world.
744,guanaco55,1581656548,f3n927,Nan,,oregon,"Oregon’s first free-fishing weekend of the year set for Saturday, Sunday"
745,Faster-Powell,1581661060,f3o2z7,Nan,,oregon,Felon charged for deadly shooting on Snoopy Lane in Salem
746,threerottenbranches,1581663802,f3ojl2,Nan,[https://www.oregonlive.com/environment/2020/02/oregon-landfill-accepted-2-million-pounds-of-radioactive-fracking-waste-from-north-dakota.html](https://www.oregonlive.com/environment/2020/02/oregon-landfill-accepted-2-million-pounds-of-radioactive-fracking-waste-from-north-dakota.html),oregon,Oregon landfill accepted 2 million pounds of radioactive fracking waste from North Dakota
747,hristy,1581682944,f3rfst,Nan,,oregon,Monthly Gaming Marathon - Casual Long Play / Speed Run Practice
748,cfinke,1581693170,f3tih8,Nan,,oregon,Group seeks to make southern Oregon part of Idaho
749,China_Hawk,1581694951,f3txdn,Nan,,oregon,"Happy Birthday, Oregon! Feb. 14, 1859"
750,guanaco55,1581695315,f3u094,Nan,,oregon,Bringing Back Oregon's Sea Otters Gets Federal Bucks For Feasibility Study
751,guanaco55,1581695424,f3u179,Nan,,oregon,Portland Renews Tax On Drivers Of Heavy Trucks
752,BurnKnowsBest,1581696802,f3uder,Nan,,oregon,ancient oregon
753,Votings_Good_Folks,1581697888,f3umxb,Nan,,oregon,Oregon Cap-And-Trade Bill Moves Forward As Tensions Flare
754,ScytheFaraday,1581701583,f3vk64,Nan,,oregon,"Thanks for 151 amazing years, Oregon! Here’s to the start of another great one!"
755,_BrianBoss_,1581703760,f3w3qf,Nan,"Hi Oregon, I have strange question but I think this is the best place to ask it, okay so I’ve sold something that I will be shipping and the address the buyer gave me is to a P.O. box located on “Eight Dollar Road, Cave Junction, OR” the zip code is 97523-1325 

Is this a legitimate location in Oregon? I can’t find it on google maps, the only thing coming up is eight dollar mountain? 

Thanks for your help in advance, Oregon! Much appreciated ☺️",oregon,Eight dollar road?
756,edweli,1581704256,f3w87h,Nan,,oregon,Retiro familiar en Tigard OR
757,GreenIguana33,1581710018,f3xp7v,Nan,,oregon,Happy birthday Oregon
758,lifeisapitch,1581710381,f3xsf2,Nan,,oregon,"Proposed changes to cap and trade bill use ideas from Republicans, Timber Unity"
759,nyalea17,1581715527,f3z2mm,Nan,Mine would be Weed and Cows.,oregon,"In two words, how would you describe oregon?"
760,sophiemargaret,1581724169,f413em,Nan,"Hi all,

I'm trying to get some info on Oregon and gravel cycling. So far I've managed to get a bit of info off Reddit but need more help. I'm currently looking at a page called Our Mother The Mountain.

Coming from Aus for two-three weeks. Where would be an ideal base camp to spend most time gravel cycling, no more than overnighters. And what time of the year?

\*I ride a single speed if that is any help. So I'd guess regions without HUGE mountain ranges.",oregon,Oregon gravel cycling. From Australia
761,JohnKimble111,1581726340,f41jp9,Nan,,oregon,"N. Portland tow yard owner says woman snuck in to get vehicle back, injured employee while fleeing scene"
762,MITDStainless,1581727952,f41whe,Nan,My parents are planning a trip around May-June to go to Oregon my parents are both big fishers and plan on fishing around rogue river. Is there any tips or company’s that are good. That I can help them out with they also will be traveling with a 5th wheel. Seems like most company’s webpages are out of date.,oregon,Parents planning a trip to Oregon
763,lessthanpi,1581732896,f42w8e,Nan,,oregon,"Happy 161st, Oregon! You're wonderful (and delicious)."
764,MichaelTen,1581733642,f431nf,Nan,,oregon,2.5 Million Pounds Of Radioactive Fracking Waste Illegally Dumped In Oregon Landfill
765,Valiantlycaustic,1581739693,f448ce,Nan,,oregon,Truffles!
766,ajm3232,1581752444,f46brw,Nan,"So after living in Arizona most of my life and seeing how Oregon weather is and it's also into the tech industry its caught my attention.

I love small towns, but I'm a software developer that would need work I can commute to. I dont mind a 30min commute if need be if it meant affordable rent and a quite town.

What places should I check out? What towns should I avoid? I've also got into car repair as a hobby and want to get into Rally Racing. Is there a smaller version of gambler 500? Does Oregon have any major crime issues? (Gf keeps thinking this is a thing even though we live 30mins away from Phoenix...) what are the emission testing like in the major counties? Anything else I should consider when checking it out?",oregon,Wanting to move/check out Oregon. Any advice or tips?
767,tehdimness,1581763721,f47w0h,Nan,,oregon,Crews remove 7 dump truck loads of trash from homeless camp on Oregon Coast
768,pantsnotrequired,1581779538,f4an3c,Nan,"Can anyone tell me from experience how supervision under parole or probation is in the state of Oregon? Primarily in the Corvallis area's district office.

I was recently accepted to graduate school at OSU, and am strongly considering the move. I am a parolee in another state, and would be transferring under the interstate compact. This would require me to be supervised under Oregon's terms, rather than my sending state's. I would be on parole for only six more after my proposed move date, and then probation for another 4 and half years (barring my return to court in my sentencing state to restructure my sentence or get an early termination). The case that this stems from involves some gang related violence and firearms (a past life), so I expect to be graded as a higher risk. 

My supervision here in my sentencing state is lax since I have been home for a couple years and have been doing very well professionally, academically, and in my community involvement. My parole officer here and I are very friendly when we see each other every 3 or 4 months. I do not use any drugs or engage in any crime, so I am not concerned about strict penalties for violation. I am solely concerned about the level of engagement and intrusiveness of state supervision into one's life in Oregon. I would hopefully avoid a situation where I am levied with excessive curfews, and unannounced home inspections, and arbitrary restrictions that may limit my opportunity for success in my academic work.

Thank you for your help. I really appreciate your input.",oregon,Parole/ Probation in Oregon
769,SimplifiedBackpacker,1581780204,f4as8l,Nan,In Portland. Selling the car today. Should I take the license plate off the car? I’ve read that you can but don’t have to. I’d like to to limit as much liability possible. Does this add more fees that the buyer has to pay at the dmv? Could use some advice here.,oregon,Selling a car on craigslist for the first time.
770,jonathanguyen,1581787996,f4cm1c,Nan,"Hi Oregon! 

I’m going to be in Bend this summer. Does anybody know where to hunt nearby? I heard that pheasant hunting is popular in Oregon. I’m a beginner so I’m not too familiar with hunting. It’s been on my bucket list to learn and become better. If anyone has suggestions on where/what/how, I would really appreciate it! Thank you.",oregon,Hunting
771,laststandsailor,1581789334,f4cxgx,Nan,,oregon,Sheriff plans to dismantle Mount Hood search-and-rescue tradition
772,xxMandi_Mausoleumxx,1581812617,f4igou,Nan,"I plan to move to Oregon (most likely the Portland area) in the next couple of years from Texas, where we don't have a state income tax and we do pay sales tax. I was researching online, but couldn't find anything really helpful. I will likely be working at a hospital as an administrative assistant, making around $17 ish an hour. I have a tiny home that will be put on a permanent RV lot and I'll be moving there debt free, so I don't have to worry about too much. However, I do need at least $1,000 a month take home to live, and I prefer some extra for traveling and saving. I file single and have no dependents, so what would my estimated take home be after all the taxes combined each month? I know Oregon is one of the highest taxed states, so I definitely want to make sure it's livable for my situation. I appreciate it!",oregon,What Percentage of Your Paycheck Do You Normally Take Home After All the Taxes are Taken Out?
773,MonkeyingAround604,1581819869,f4k0kv,Nan,,oregon,Devil's Churn this afternoon.
774,guanaco55,1581820271,f4k3l5,Nan,,oregon,"As colleges struggle to survive, Linfield says it has recovered and will expand"
775,Kukuum,1581824842,f4l1ck,Nan,,oregon,The false promise of “renewable natural gas”
776,CleanseMyDemons,1581830729,f4m631,Nan,"Just moved to Salem and need to know what areas are good and what areas are bad , also which is the company provides the fastest internet in Salem. Also is there good job opportunities in Salem . Just lay on me everything I need to know please and thank you.",oregon,Help me out
777,liquorsiccc,1581833203,f4ml6o,Nan,"and is this the best subreddit for this question?
i’m trying to see what are the most adorable places to live in oregon, I know Portland is out of the picture because of prices changing.
But i have been looking for work and i’m finding a lot more than where i’m at.

I guess my question would be what are the best places to live? and or that would be affordable for one person / someone to rent with a roomate?

and is parking always an issue like it is in portland? as in having to pay for parkkng",oregon,moving to oregon?
778,westgate141pdx,1581871316,f4t4xt,Nan,,oregon,"This view from our VRBO house - Sandy, OR"
779,fsninfo,1581871724,f4t8h5,Nan,,oregon,Utah vs Oregon (2/16/20) College Basketball Picks and Predictions
780,bb-ghoul,1581874401,f4twde,Nan,"The Atlantic ocean is usually pretty warm and nice for swimming. I realize that the waters off of Oregon's coast stay in the 50s, so what do you do when you want to have a ""beach day"" or just go swimming somewhere? (Besides a pool)",oregon,What do you guys do when you want to go swimming?
781,catbug1231,1581875607,f4u75f,Nan,,oregon,"Near Heceta Beach, what a beautiful day."
782,Faster-Powell,1581878431,f4uxo3,Nan,,oregon,Gov. Kate Brown endorses removal of 4 Snake River dams
783,TracePearson,1581880619,f4vhdq,Nan,,oregon,Paid By The Pipeline: A Canadian Energy Company Bought an Oregon Sheriff’s Unit
784,guanaco55,1581886902,f4x6fk,Nan,,oregon,Oregon Insight: Inbound migration rate is among the nation’s fastest
785,DrRedmond,1581887723,f4xe26,Nan,,oregon,"The Oregon trail, America’s finest folk lore. Grew up on the video game, just moved to Oregon from NY. Glad I get to finally experience it."
786,roger_smith_alien,1581888353,f4xju3,Nan,,oregon,2.5 Million Pounds Of Radioactive Fracking Waste Illegally Dumped In Oregon Landfill
787,fishflesh,1581895966,f4zc0c,Nan,,oregon,You know spring is close when the clover sprouts out of the moss on your truck.
788,DrRedmond,1581896594,f4zh2y,Nan,,oregon,"So my 70 year old mother who is a widow (father was 9/11 related cop, don’t really wanna talk about THAT though) still lives in Staten Island NY, one of the dirtiest and most polluted areas possibly on the planet not just NY. I’m trying to get her to move out here by sending post cards haha."
789,jamerson987,1581898321,f4zum3,Nan,"I’m attending University of Portland starting this fall 2020. I come from Carlsbad, califnita and own a Suzuki boulevard 805. I understand there is a lot of rain in the area; however, do you think it will be reasonable to drive still? I’m not sure if I want to bring my motorcycle to school with me, I would prefer to, but with the amount of rain falling, I don’t know if I can safely get around. What do you think?",oregon,Can I drive a motorcycle?
790,tigerfighter87,1581900541,f50c14,Nan,,oregon,Satanic net shed from the Cthulhu film in Astoria
791,Rhynosceros,1581902707,f50siy,Nan,,oregon,"It was so beautiful on the coast this weekend, I was able to explore the inside of Devil’s Punchbowl and it was breathtaking."
792,idk1577,1581902920,f50u52,Nan,,oregon,"From my first backpacking trip 6 years ago, Three Sisters Wilderness, Oregon"
793,idk1577,1581903435,f50y3x,Nan,,oregon,"From my first backpacking trip 6 years ago, Three Sisters Wilderness, Oregon"
794,out_of_the_l00p,1581905408,f51dzr,Nan,,oregon,Hiked up upper table rock despite yesterday’s rain. The mud wasn’t too bad except going down was tricky. My hiking buddy slipped on the mud twice which was very hilarious.
795,BloobityBloobity,1581907508,f51uo8,Nan,,oregon,Cougar Reservoir on New Year's Day
796,BloobityBloobity,1581907759,f51wou,Nan,,oregon,Mt Jefferson from my window at Timberline Lodge
797,overtacoma,1581907798,f51wzb,Nan,,oregon,Quiet Morning in Astoria
798,DrRedmond,1581910243,f52fui,Nan,,oregon,So I didn't really know much about this until I came out here to the ol Cascades myself. I've been all over Washington and Oregon and even Northern California for 6 weeks. Is this Cascadia movement for real?
799,Mabyacommunist,1581910783,f52jvv,Nan,,oregon,You just got to love the coast
800,Timevian,1581911863,f52rst,Nan,"What could be some wedding location ideas? I love the view at the Vista house, but that’s probably not going to happen. 

Any locals have some affordable ideas?",oregon,Wedding location ideas
801,ichawks1,1581913966,f536w0,Nan,,oregon,The Cascades bear Bend got a bit of snow last night!
802,dignity-putnam,1581915615,f53ixh,Nan,,oregon,Upper Twins Lake (02/16/20)
803,SpatialEdXV,1581918671,f544ir,Nan,,oregon,"A creek, in the woods."
804,SpatialEdXV,1581918701,f544p9,Nan,,oregon,"A creek, in the woods."
805,PissPosh,1581922651,f54uhk,Nan,,oregon,timelapse clouds at Fern Ridge today
806,MichaelTen,1581927767,f55pcs,Nan,,oregon,OSU receives $1 million donation to aid students struggling with homelessness
807,Shirko1978,1581937933,f57aa8,Nan,,oregon,Mt Hood 2019
808,colgaddafi4prez,1581945739,f58nyc,Nan,,oregon,Mt Ashland lodge 2/16/20
809,PasteyPotato,1581963738,f5d1a8,Nan,"&amp;#x200B;

https://preview.redd.it/v46a5c4t0jh41.jpg?width=3264&amp;format=pjpg&amp;auto=webp&amp;s=bf0291388acdbfd21c76114a0633868f9de9c3ce",oregon,"Minto-Brown Island Park, Salem, OR"
810,ElectronGuru,1581964235,f5d61w,Nan,,oregon,Cascadia subduction: everything west of the I5 will be gone
811,guanaco55,1581966090,f5dntu,Nan,,oregon,Oregonian readers respond: The widespread abuse of political power -- affects Democrats and Republicans alike
812,ThePDXredditor,1581966616,f5dswi,Nan,,oregon,CALLING ME - PNW - Cinematic Compilation
813,tydalt,1581969547,f5ekwx,Nan,,oregon,Ballot-initiative effort to move eastern Oregon counties to Idaho gains momentum; leader calls it ‘peaceful revolution’
814,RipCity_TID,1581969652,f5ely0,Nan,,oregon,Ballot-initiative effort to move eastern Oregon counties to Idaho gains momentum; leader calls it ‘peaceful revolution’
815,pdxgdhead,1581970050,f5epvi,Nan,,oregon,When everything aligns up perfectly in Astoria! Shot on iphone. Lewis and Clark would of been proud.
816,SolidWaste97,1581972253,f5fbdx,Nan,"In my area, we're full of vagrant drug addicts and the needle exchange does not accept syringes from the ""public"" because it's a ""confidential service for druggies"" or something like that, therefore what I've found is that you can bring dirty ass syringes from trash removal effort, give the exchange some BS information and exchange them for new syringes. So, can I just put unused ones in a small box and throw it in the trash? If I was to get rid of dirty syringes that have been littered by vagrant drug addicts, I'd have to take them to the transfer station. No way I'm doing that.",oregon,Can you legally dispose unused syringes in the trash?
817,solorex3,1581973183,f5fkft,Nan,My goal is to go to Oregon for a trip sometime this summer. I’ve seen pictures and read things and it looks amazing. Are there any towns or cool hiking spots that you guys would recommend?,oregon,Visit to Oregon
818,meghanibmarekib,1581984783,f5ij33,Nan,,oregon,"DRAGONYZ | Shop For Dragon Jewelry, Decor, Clothing &amp;amp; Accessories &amp;ndash; Dragonyz®"
819,MonkeyingAround604,1581986528,f5iyda,Nan,,oregon,Otter Point this afternoon
820,aaronec,1581995350,f5kzsc,Nan,"Hi all, I want to start by saying thank you for reading this post. If you can help out that would be amazing, but if not I appreciate you taking the time to read this.

My sister-in-law is finding people from all 50 U.S. states and all over the world and having them write a note and take a photo, then compiling them all into a photo book for her husband as a 30th birthday present. She has taken care of many states already, but we don't know anybody from your state to reach out to. The notes say something along the lines of ""Mark, Courtney's love for you is so big it has reached (location).""

Here are some examples:

https://i.imgur.com/ZZC38cG.jpg

https://i.imgur.com/Yp2zDR9.png

So what I am asking of you, r/Oregon, is to create a similar note and take it to a location that is iconic, recognizably from your state, or just somewhere that is special to you. It could be at a National Park or just off your back porch. Feel free to get creative with it. All I am trying to do is compile as many of these as possible so I massively appreciate anyone who contributes.

Thank you all so much!",oregon,Hey Oregon! I'm working on a project for a family member and would love your help.
821,NFRTRCUCK,1581998388,f5lob4,Nan,"I e-filed on 1/10, Federal accepted 1/14, State accepted 1/21, Federal deposited 2/5, curious about when I will get my State refund.",oregon,Have you received your Stare Tax Return yet?
822,guanaco55,1582001145,f5m91i,Nan,,oregon,Gov. Kate Brown endorses removal of 4 Snake River dams -- Says it's the best way to increase endangered salmon runs.
823,guanaco55,1582001324,f5maf9,Nan,,oregon,Oregon Capitol is on edge as threat of Republican walkout looms over controversial cap-and-trade plan
824,ToeJammies,1582007315,f5ngjs,Nan,,oregon,Residents seek secession from Oregon to ajoin Idaho
825,LoseUrself2D,1582020884,f5poep,Nan,"I'm thinking of going on a short camping trip for 1-2 days over spring break but I don't know any good trails/loops. Anyone have any recommendations? Also, would it be too cold to go backpacking in like end of March?",oregon,Camping/backpacking in Spring Break?
