,author,created_utc,id,link_flair_text,selftext,subreddit,title
0,Riptide360,1577770388,ehyj86,Nan,,oregon,Oregon Ducks Fan
1,hristy,1577770646,ehyl10,Nan,,oregon,Watch me Stream Games on Twitch
2,wheatfromthechaff,1577772424,ehyw65,Nan,,oregon,What do if you come across a mountain lion
3,whiteyprez,1577773739,ehz4cd,Nan,,oregon,"“Hey, let’s go for a hike!”"
4,meowsfordays,1577774209,ehz73x,Nan,,oregon,"Has anyone seen this Corolla floating around Oregon? It used to be my fathers car and it was driven in the Portland area until it was sold after an accident. I’d like to know where it is so if you know anything about it I’d appreciate a PM. It’s a 1999 model, would have been sold in summer 2016."
5,PP3V42G3H,1577776453,ehzkdb,Nan,"Looking to find some fun hiking and camping in the current season! Would be based out of Eugene, and would prefer to be east of the Willamette valley rather than towards the coast. Any suggestions?",oregon,Favorite winter hiking and or camping areas?
6,RolandMT32,1577777417,ehzphl,Nan,,oregon,"Oregon stores are gettinf rid of plastic grocery bags. Meanwhile, within the past few years, drink cartons started having plastic spouts installed on them. Wouldn't the older style milk cartons without the plastic spout be more environmentally friendly? We never needed these plastic spouts before"
7,RolandMT32,1577778371,ehzuid,Nan,,oregon,"Oregon grocery stores are getting rid of plastic grocery bags. Meanwhile, drink cartons started having plastic spouts installed on them. Wouldn't the older style cartons without the plastic spout be more environmentally friendly? We never needed these plastic spouts before. Why now?"
8,TheGreatestAlive,1577785900,ei0w3a,Nan,Anything interesting you all have heard about happening NYE? Where can i go watch good fireworks?,oregon,Suggestions for NYE?
9,guanaco55,1577805818,ei46oa,Nan,,oregon,Oregon Looks More Likely To Win 6th Congressional Seat Following 2020 Census
10,MichaelTen,1577809446,ei4zjm,Nan,,oregon,Portland makes list of rudest cities in the nation
11,evilLawnmower,1577809846,ei52uj,Nan,,oregon,"Bandon, Oregon [OC][5464x3640]"
12,snappyhome,1577821257,ei7qkk,Nan,,oregon,South Jetty near Astoria.
13,BoringAeneas,1577827850,ei95dc,Nan,,oregon,"From Intermountain West to Pacific Northwest, we bring every moment in with smiles. Happy New Year's everyone and thanks for being there for us!! 🙆🏻‍♂️🦊🎉💕"
14,jsvegas,1577829366,ei9gkv,Nan,,oregon,Today in downtown Los Angeles
15,_joshuita_,1577830913,ei9s1y,Nan,,oregon,Went to the NEW IN-N-OUT in KEIZER OREGON!!!
16,Regthatch,1577840784,eibtg8,Nan,,oregon,"New Year’s Eve sky over Bend, OR"
17,mostlikelytobree,1577847675,eid24d,Nan,Here's a link to the National Parks First Day Hikes. There will be free tours at various times at parks listed below. Don't have plans tomorrow? Have the day off? Get outside! Meet some new folks! [Oregon State Park list of tours ](https://oregonstateparks.org/index.cfm?do=v.dsp_featureArticle&amp;articleId=263),oregon,First Day Hikes Events
18,cbulley,1577877283,eihc5r,Nan,,oregon,You know Gray is my favorite color.
19,thomaddd,1577879014,eihji5,Nan,"Hey everyone! I am starting the hiring process for a correctional officer soon and would honestly love someone to share about their experience. I’m in the Portland area so I’m mostly looking at Coffee Creek Correctional and Columbia River Correctional. Or even if your not law enforcement but maybe a family member is- I would love to know what they think! 

If you have a lot to say we could even grab a lunch on me! 

Thank you so much",oregon,Any correctional officers here? Or LEO?
20,TimetravellersWifu,1577884160,eii6lk,Nan,Where you all hiking today?,oregon,Happy New Year!
21,guanaco55,1577894630,eijujq,Nan,,oregon,Surfing at Short Sand Beach | PEAK NORTHWEST
22,guanaco55,1577895797,eik2pj,Nan,,oregon,Water Crisis Puts Oregon Community At A Crossroads
23,guanaco55,1577896394,eik704,Nan,,oregon,"The Highest Paid Oregon Public Employee is a Basketball Coach -- Dana Altman, the University of Oregon men's basketball coach, makes a $2.8 million annual salary, more than 28 times what Gov. Kate Brown makes."
24,moik_KF,1577902705,eiljcd,Nan,,oregon,"An Alkali Lake in the Desert (Lake Abert, Eastern Oregon)"
25,Ceralt,1577905068,eim26t,Nan,,oregon,Tumbleweeds cause 10 hour shut down on New Year’s eve
26,rspix000,1577905260,eim3oc,Nan,,oregon,Black guest at Portland hotel sues over ‘no party’ promise
27,LowIn334,1577907330,eimkbb,Nan,,oregon,Beaver creek off of the Applegate River. Got the shivers being there.
28,MichaelTen,1577908488,eimtrl,Nan,,oregon,Oregon Community Faces Groundwater Crisis
29,lailoken503,1577912253,eino2q,Nan,"I'm starting a new job next Monday, and have been working on completing my pay documentations (W-4), one of which appears to be an Oregon W-4, thanks to Trump's tax reform.

Is it me or is this form way more complicated than it needs to be?

Do I need to find a CPA or tax professional to help me sort through all this?",oregon,New Oregon W-4 form
30,trueslicky,1577912280,einoaf,Nan,,oregon,New Year Brings New Protections For West Coast Seafloor Habitat
31,trueslicky,1577912529,einqaa,Nan,,oregon,CenturyLink Faces $4 Million Settlement With Oregon Department of Justice
32,dejectedluv,1577921373,eipmni,Nan,,oregon,"neptune, 7:27 pm."
33,Imalune,1577925295,eiqg85,Nan,,oregon,The fog rolling between Hoodoo and Three Fingered Jack on Monday
34,RedSkullBandit13,1577928259,eir2gg,Nan,,oregon,The coast can be so breathtaking
35,merging-targets,1577931049,eirn5o,Nan,,oregon,Happy New Year Yaquina!
36,faeriebones,1577931163,eirnzz,Nan,,oregon,"Harbor, Oregon"
37,iusedtoplayneopets,1577935593,eiskl0,Nan,,oregon,"Cave Junction, OR. Foggy days for weeks!"
38,MakeMeAnIrishCoffee,1577938741,eit6kv,Nan,,oregon,New Year's Day on the Clackamas in Canby
39,sassyfrass01,1577943391,eiu1o7,Nan,,oregon,Barview Jetty. Garibaldi Area.
40,new-man-2020,1577946997,eiunvz,Nan,,oregon,Snowshoeing near Mt. Hood.
41,sprhere,1577964668,eix539,Nan,"$40 OBO for  roughly 465 words' proof-reading (scattered in 29 pages) and Oregonize them as much as you can.

I would appreciate it if you could contact me for more detail and help me out.

Thanks.",oregon,Beermoney opportunity for Oregon slang speaker
42,Projectrage,1577975910,eiyzfq,Nan,,oregon,House of Representatives District 2 is lacking a progressive democrat candidate.
43,LeftOnBurnside,1577980677,eizysg,Nan,,oregon,"Oregon Built an Historically Low Amount of Housing Over the Past Decade, Even as Incomes Made Historic Gains"
44,ChiboDaBird,1577981144,ej02hm,Nan,,oregon,Sunrise by Silver Falls Park.
45,LeonFish,1577981912,ej08f1,Nan,,oregon,Overlooking the Columbia towards Hood River.
46,ChiboDaBird,1577997200,ej3t0p,Nan,"Hi, I’m a person with a sensitive digestive system that loves cider and wine. This is just a simple request to the Wine and Cider (and some micro brews) companies in Oregon. Please stop adding Sulfites to your products! Not only does it ruin a great product, especially wine but it’s bad for people! I’m not going to spend $35 on a bottle of Oregon wine or Cider if it has the words “Sulfites added” anywhere in the packaging. I got a great case of Willamette Winery and I can’t drink it. One of my relatives spent $300 on wine for me and I can’t drink a single bottle because of added Sulfites. 😡",oregon,Please stop adding Sulfites!
47,aigguomo,1577997905,ej3zbr,Nan,I subscribed and unsubscribed so many times... Once in a while I see a post worth to be on Oregon subreddit and I subscribe again... and then 1000 post only with crappy pictures which makes me unsubscribe... and then everything repeats.,oregon,Change my view: Oregon subreddit can be renamed CrappyEarthPornPictures
48,tulokas,1577999891,ej4gu7,Nan,,oregon,Boiler Bay
49,[deleted],1578001013,ej4qbb,Nan,[deleted],oregon,Probably off topic but the flight WOULD originate in Oregon
50,73233,1578003932,ej5fk6,Nan,,oregon,U-Haul won’t hire smokers where it can legally do so
51,ewfbwefbwebwebwef,1578003944,ej5fn5,Nan,"We are in the process of planning a small wedding ceremony (10 people) at crater lake and need to submit for a special use permit with the park. We need to decide on a location and alternative location listed on the linked map. The date of the wedding is the 2nd week of July. 

We have been to crater lake a few times, but have never had a chance to go much further than rim village due to snow/weather so we don't know which locations would be best. We want something with a good view of the lake, easily accessible (&lt;1mi), and away from too many crowds.  

Any input on locations or any other advice would be greatly appreciated.

[https://www.nps.gov/crla/planyourvisit/upload/permit-locations-508-4.pdf](https://www.nps.gov/crla/planyourvisit/upload/permit-locations-508-4.pdf)",oregon,Suggestions for Wedding Location at Crater Lake NP
52,TheWillRogers,1578004679,ej5lsp,Nan,,oregon,Sahalie Falls
53,DarkPony11,1578006517,ej61av,Nan,,oregon,This dude just chillin’ out in the Oregon countryside
54,djbofo_,1578008173,ej6f1b,Nan,,oregon,Soon to be printed ! A7iii + Tamron 17-28 f/2.8 (any thoughts?)
55,Favip,1578010671,ej6zrz,Nan,,oregon,Beautiful day at Sunset Beach
56,lockej2t,1578020308,ej92x9,Nan,,oregon,"First time to Silver Fall State Park, was not disappointed"
57,InfestedCats,1578023794,ej9t85,Nan,"Hello!

My girlfriend is going to be attending a month long artist residency near Summer Lake. OR. In the welcome packet sent by the organization, they detail that the only internet they have is a single, limited Satellite connection. They suggest people rely on their phone data plans/mobile hotspot for any continued access, without limitations. The organization specifically mentions ATT.

Can anyone suggest what the best carrier might be for a one month data plan in that area, connectivity wise?",oregon,"Mobile Data Availability near Summer Lake, OR"
58,Queenoffunkytown,1578024907,eja17a,Nan,"So me, my boyfriend, and our best friend decided last May that we were sick of where live and we want to be somewhere beautiful and fun. We decided on Oregon. We're saving like crazy since we are moving there sight unseen with no family, no jobs, and no apartment. 

I've started doing some research and we decided we wanted to live in the Beaverton area and I've been trying to look up the information but all of the sites I find kind of have these arbitrary list of the top things you should know about Oregon they're all like ""Oregon has this many Natural Parks"" or ""Oregon people love coffee and beer"" i just want some real information about The Beaverton area in Oregon or just Oregon in general. 

Best neighborhoods for working professionals, crime rates, good rental locations. ect. I just want to hear from people who really live there and not just numbers on a website or something. Any and all information would be wonderful.",oregon,Moving in November. I desperately need advice.
59,guanaco55,1578026298,ejab0i,Nan,,oregon,"Vortex 2020 is on: State-sponsored music festival will return, 50 years after the first one"
60,maskedcorrespondent,1578029175,ejausc,Nan,,oregon,"Ban me if you want, this is important"
61,ichawks1,1578034114,ejbqe7,Nan,,oregon,Pic I got of the Oregon Coast last night! :)
62,MichaelTen,1578040462,ejconv,Nan,,oregon,"Feds blame Oregon, California for national rise in homeless"
63,ThePNWBackPacker,1578067226,ejhbz9,Nan,,oregon,McLoughlin peaking through
64,NotACynic,1578078096,ejjxmp,Nan,I seem to recall that Australian fire fighters came here when Oregon was battling fire...anyone know if we've sent teams down there?,oregon,Any OR fire fighters going to Australia?
65,uosanlab,1578090144,ejmtzt,Nan,"Hi Oregon!

We're the University of Oregon's [Social and Affective Neuroscience Lab.](https://sanlab.uoregon.edu/)

We're currently recruiting for a **Healthy Eating Study** that needs overweight/obese community members in the **Eugene/Springfield area**. If you live a little further away but are still super dedicated to participating in our study you are absolutely still welcome to fill out our survey!

Participants can earn up to $470 throughout the course of the study!

We need people who are:

* 18-60 years old
* Overweight/obese BMI (25-40 BMI - [check your BMI](https://www.nhlbi.nih.gov/health/educational/lose_wt/BMI/bmicalc.htm))
* Highly motivated to *learn* to eat healthier
* Normal or corrected to normal vision (with glasses or contacts)
* Right-handed
* No current brain disorders or mental illnesses
* No medications that can affect normal cognitive function

Healthy Eating Study Commitment:

* 2 MRI brain scans
* 5 [Bodpod](https://www.cosmed.com/en/products/body-composition/bod-pod) body fat composition assessments
* 8 training sessions on the University of Oregon campus that aim to improve self-control around unhealthy foods
* **Total 15-17 hours over 13 months**.

Interested?

See if you're eligible: [www.healthyeatingstudy.com](https://oregon.qualtrics.com/jfe/form/SV_4MX15Yq70xiYNOB)

Questions?

Comment below or email us directly at [uosanlab@gmail.com](mailto:uosanlab@gmail.com)

&amp;#x200B;

https://preview.redd.it/xg5uan162n841.png?width=833&amp;format=png&amp;auto=webp&amp;s=c449a4dfaa1467d4c52f8fe4f01af13956c95bc6",oregon,UO neuroscience lab looking for overweight research participants!
66,JMTHawk,1578092723,ejnfa7,Nan,,oregon,"Turkey tail mushrooms, South Slough National Estuary"
67,collinsextonfan,1578094979,ejnxuc,Nan,"i hate oregon. i am driving to game with collin sexton to see. but slow driver make me show up bad parking no late,. FUCK THIS SHIY IM MOVING TO CANADA!!!!",oregon,FUCK OREGON
68,Kidchico,1578096430,ejo9zi,Nan,,oregon,"Rooster Rock. Took the ""easier"" way up"
69,jrodp1,1578099801,ejp1de,Nan,Trying to get u/rolleroman to respond. Was quick to respond when he thought I wasn't going through with it. Now I figured it would be a good opportunity to raise some money for schools. [Here's mine. ](https://i.imgur.com/0IGehUj.png),oregon,Anybody want to match my five dollar donation to the school and fund of their choice.
70,HelpMeFindMyMemories,1578107658,ejqqr6,Nan,,oregon,Help us out (and maybe have a bit of fun while you're at it!)
71,ASmileAndACompliment,1578119047,ejsxze,Nan,,oregon,My friend makes art from owl pellets. Here’s one she did of R2D2. Thought it’s worth sharing. She’s looking for more pellets if anyone knows where she can get some.
72,[deleted],1578148861,ejxdov,Nan,[deleted],oregon,A classic
73,meatus-deletus,1578156576,ejyyiy,Nan,As the title says I'm looking for news on a police chase that happened last night (1/3) on i-5 Southbound. I was headed to Corvallis from Salem and had about 6 or 7 police cars fly by chasing a little white car. I literally can't find a single news article on it.,oregon,Looking for info on police chase.
74,guanaco55,1578158062,ejzakm,Nan,,oregon,Oregon's best events for 2020: 40 things to mark on your calendars now
75,[deleted],1578160271,ejzsxi,Nan,[deleted],oregon,It's got me carrying everything now like superwoman
76,whoanellie418,1578160416,ejzu7g,Nan,,oregon,I don't even use carts anymore
77,Brian22NehalemBay,1578162080,ek0895,Nan,,oregon,"Kelly’s Marina-Nehalem Bay, Oregon"
78,ddessert,1578163490,ek0jvd,Nan,,oregon,"Sunset from Fort Klamath, South of Crater Lake, Mt. McLoughlin at left. [Jan 2, 2020]"
79,ddessert,1578164632,ek0t5r,Nan,,oregon,"Crater Lake from Rim Village [Jan 2, 2020]"
80,rspix000,1578176175,ek3g26,Nan,,oregon,Woman accused of using Muslim student's hijab to attack her
81,[deleted],1578180670,ek4fu2,Nan,[deleted],oregon,"Seeing Tame Impala at The Gorge in August. Some friends and I are traveling from Chicago, and none of us have ever been there. Any and all tips would be greatly appreciated!!"
82,super_hoommen,1578182357,ek4syj,Nan,,oregon,The sunrise from my house.
83,PCisLame,1578192076,ek6sj6,Nan,,oregon,Oregon Congressional Candidate Places Electoral Hopes on QAnon
84,sanjuankill,1578192250,ek6trk,Nan,"I know there was one yesterday in Portland. If you know of others in the works, whether Portland or any other cities, please post here.",oregon,Anyone know of anti-war protests being planned?
85,ProjectResearch__,1578225601,ekc5rp,Nan,"Hello everyone! I'm writing a project about old-beleivers in USA, especially the ones who live in Woodburn, Oregon and in Alaska who came from Russia after 1917-30s after the revolution.  We're making a video. It would be a series of interviews with some our information on this topic. So i have a few questions. 

1) Do they live in USA? 

2)  I want to know more about their influence on the american history, how do they live, what traditions do they have. I know about google, but I'm interested in interviews. Maybe a person who belongs to this community could give me an interview, tell me about their life, their traditions, etc. or,  also a historician's opinion could be valuable too. 

i think that's all for now. If you can help me with this topic, you can write it down in the comments or dm me. Thanks in  advance",oregon,"writing a project about old-beleivers in USA, looking for people who are aware in this topic and/or belong to this community"
86,jarafilms,1578241934,ekf7cx,Nan,,oregon,Cannon Beach
87,guanaco55,1578243920,ekfo5p,Nan,,oregon,12 classical music concerts to add to your winter calendar
88,philco112,1578243957,ekfogm,Nan,"Hey, we are in the market for a used car in Tillamook and would love to know if anyone of you has a recommendation for a Pre Purchase Car inspection.

&amp;#x200B;

we drove the car and the dealer is fine with us doing an inspection and even proposed a place. They have good reviews, however the are also former dealer employees and I would prefer to go completely independent with a PPI If possible.

&amp;#x200B;

google is not helping much so I am hoping to get some advice here.

&amp;#x200B;

thanks a lot!",oregon,Reputable place for a pre purchase car inspection around Tillamook?
89,Ryry975,1578253851,eki13w,Nan,Was genuinely shocked to see three chickens outside the hotel? Is that common here?,oregon,"I saw chickens outside my hotel in Sprinfield, OR?"
90,cjbaty,1578269617,eklklb,Nan,,oregon,"The east side of Ski Bowl, Mt Hood Saturday"
91,davidw,1578275633,ekmw6r,Nan,,oregon,"Golden Basin, near Horse Ridge, with snow squalls in the distance"
92,rawoyster,1578277382,ekn9kj,Nan,,oregon,"Spending a week on the Coast with my dog is the best way to start 2020, IMO."
93,kt541,1578284764,ekorve,Nan,Anyone been to Summer Lake Hot Springs?,oregon,Summer Lake Hot Springs
94,IdRatherNotBeNamed,1578287531,ekpall,Nan,"Does Oregon Institute of Technology offer HRT through the college itself? I've been looking through the website, but I can't seem to find a definitive answer.",oregon,Transgender Question
95,bc5211,1578293339,ekqb3t,Nan,"Does anyone know a place [like this](https://imgur.com/a/zGF3wb1) within about 2 hours of Portland? We're looking to get married (really more like we're eloping) in a beautiful natural setting and are weighing options.

Clarifying details: this will not be a traditional wedding ceremony. There will only be maybe 5 or 6 people attending. We're not looking to set up chairs for 50 people and have an aisle for a bride to walk down, etc. Please don't respond with places we can rent like Hoyt Arboretum's Redwood Grove.

Thanks in advance!",oregon,Forest Cathedral?
96,AlienIdeas,1578298402,ekr3yf,Nan,,oregon,"OSHA cites Portland’s Columbia Grain for North Dakota death, proposes $190K fine"
97,longfooey,1578299206,ekr8hx,Nan,Today I saw a Sasquatch and I was wondering who should I email about it? Forest Service? Animal control? Thank you in advance :) Serious replies only,oregon,I saw a Sasquatch today where is the place to report it?
98,magenta_placenta,1578324730,ekvmcb,Nan,,oregon,"To replace gas taxes, Oregon and Utah ask EVs to pay for road use"
99,cfinke,1578329553,ekwpc1,Nan,,oregon,"Secret Beach outside of Brookings, OR. No filter, no color correction. Photo was taken in 2017 during the worst part of the smoke, the day before the eclipse."
100,embracetherun,1578331317,ekx4j3,Nan,,oregon,Eugene in the early morning. [OC] [2160x2160]
101,ThePNWBackPacker,1578331318,ekx4jh,Nan,,oregon,East Applegate Ridge Trail
102,JMTHawk,1578332516,ekxed1,Nan,,oregon,Shore Acres State Park
103,ejaculatingphallus,1578345523,el0i5e,Nan,,oregon,The Housing Shortage in Profile: Construction in Oregon dropped to the lowest level since World War II
104,Jelfff,1578347461,el0z6e,Nan,"Below is a link to an interactive map I produced.  When the map opens the **Oregon state house districts** are displayed with semi-transparent coloring (red=R, blue=D).  The data for the map is hosted on a GIS server operated by the state.  I am \*assuming\* the data is current.

To change the map so it shows the **Oregon state senate districts**:

1. Click the basemap button (Next to the ""Menu"" button)

2. Look under the ""Overlay"" heading (mobile users scroll down)

3. Click the house layers to turn them off

4. Click the senate ""fill"" layer and then the senate ""boundary"" layer.

It may take a few seconds for the data to appear.  It depends on how busy the GIS server is and the speed of your internet connection.  

The map is displayed by GISsurfer which is a general purpose web map I developed as a public service and part of my way to ""pay it forward"".  There is a **""Map tips""** link in the upper left corner with some general ‘Help' information.

Open Oregon legislative district map:

[https://mappingsupport.com/p2/gissurfer.php?center=43.977144,-120.537377&amp;zoom=7&amp;basemap=USA\_basemap&amp;overlay=oregon\_state\_house\_fill,oregon\_state\_house\_boundary&amp;txtfile=https://mappingsupport.com/p2/political/oregon/oregon\_legislature.txt](https://mappingsupport.com/p2/gissurfer.php?center=43.977144,-120.537377&amp;zoom=7&amp;basemap=USA_basemap&amp;overlay=oregon_state_house_fill,oregon_state_house_boundary&amp;txtfile=https://mappingsupport.com/p2/political/oregon/oregon_legislature.txt)

Finally, here is a PDF I prepared with step-by-step instructions showing how anyone can use GIS data to make a Google map of any single state legislature district or congressional district.

[https://mappingsupport.com/p2/political/google-map-political-district.pdf](https://mappingsupport.com/p2/political/google-map-political-district.pdf)",oregon,Interactive map with Oregon legislative districts shaded by party
105,dendriticheart,1578348142,el150s,Nan,,oregon,The Rainbow Gallery at the Rice Museum in Hillsboro
106,dr_raymond_k_hessel,1578355160,el2sdm,Nan,Has anyone on here stayed in one of the homes in this community?  Just looking for overall thoughts about the area.  I've read that the walk down to the beach is pretty far but the houses themselves are really nice.,oregon,Olivia Beach Community - Lincoln City
107,beenjamminunc,1578359206,el3on9,Nan,"My wife and I are planning on moving to Oregon in this coming late May/early June. 

A little about ourselves, we both currently live in North Carolina. I am getting out of the military, and am hoping to get a job at a nursery, preferably working with cannabis. I understand that may not happen at first because of the influx of people attempting to do the same thing, so I'm expecting to get another job first. My wife is a licensed massage therapist, and hoping to find work at a Spa. 

We are trying to narrow down areas of Oregon that fit our criteria. We would like to live in a small town that is either in or near mountains, with lots of opportunities to do things outside. Preferably 30-60 minutes from a larger town or city. We do not want to be near Portland. So, any ideas as to where we should move?",oregon,Moving (not from California)
108,thinkB4WeSpeak,1578374427,el6wdc,Nan,,oregon,Oregon Insight: Income inequality keeps growing
109,boomless,1578378293,el7mc3,Nan,,oregon,Nestucca Bay Wildlife Refuge
110,Buildingisnewtome,1578418014,elekto,Nan,"Hey everyone I’m flying in Wednesday night, landing at PDX, and getting a rental car. I was looking at the forecast and saw that it’s snowing the day of and the days following. My question is will I need to use chains? I’ve never been to Oregon (visiting from SoCal) so all this is new to me. Thank you!",oregon,Chains?
111,Le_Mew_Le_Purr,1578420089,elf305,Nan,"I have a career opportunity in Salem and wonder what life is like in that city? Is there good entertainment? Restaurants? Are people generally prosperous, educated and cool? Are there many opportunities to socialize and enhance one’s life through groups, hobbies and activities? Are health services good quality and broad? I don’t have kids, so schools only matter to me in terms of being in a decently educated population.  Is it bikeable/walkable? Is it safe? What do you really appreciate about Salem?",oregon,What’s Salem like?
112,NaturallyStoned,1578422785,elfq7z,Nan,,oregon,King tides offer a taste of sea level rise
113,FarteGaas,1578430503,elhl4p,Nan,[removed],oregon,"Wag The Dog: First was feigned impeachment hearings meant to obstruct, now an attack on Iranians in Iraq. Here is what they are trying to distract from &amp; cover up to retain power. $86+ billion in bribes to the highest offices in this country. 600+ deaths from child rapes to prove loyalty. See latest"
114,UnrealBeachBum,1578436974,elj5g1,Nan,,oregon,The Most Popular Male Names In The United States By State (1960-2019)
115,_noncomposmentis,1578443513,elkmy6,Nan,TripCheck doesn't have any information regarding road conditions on Highway 74 (or 207 for that matter). Does anybody know of a resource I could use? I'm gonna have to drive out there for work a few times in the next few months.,oregon,Heppner Highway Road Conditions?
116,springchikun,1578448670,ellqza,Nan,,oregon,"Boquist called a ""bully"" as court rejects his suit against Dems"
