,author,created_utc,id,link_flair_text,selftext,subreddit,title
0,HighestCommonFactor,1577819444,ei7bex,Nan,[removed],SouthDakota,Anyone know a nickname for the Coughlin Campanile?
1,Xexxotic,1577821333,ei7r6w,Nan,,SouthDakota,We are all on it.
2,OffRoadRecon,1578006780,ej63le,Nan,,SouthDakota,Throw Back Thursday! Jeeping in the Black Hills!
3,zblinks,1578020498,ej94cw,Nan,[removed],SouthDakota,We are a big small state.
4,reddit----boi,1578058128,ejfeiu,Nan,,SouthDakota,Please read
5,JezusConareahShitler,1578068203,ejhkh0,Nan,,SouthDakota,The leader of the Republican Party in South Dakota works for Saudi Arabia.
6,bammoran,1578229483,ekcrkf,Nan,,SouthDakota,A ghost video I made last summer in Pierre SD made it on Top 5's it is number 2 please check it out.
7,pmacias94,1578247315,ekghah,Nan,"Hello everyone!I just recently got a new job in San Antonio, TX and will be needing to visit clients in Worthington, Minnesota. So here's my question, I believe it's best for me to fly to Sioux Falls, SD and drive back and forth daily. What's your advice into airport and driving conditions? Also, I've never been in SD or MN in my life before or ever had to drive in snow in TX lol. I'm panicking since my company is booking me an economy car (the smallest available lol) from Enterprise and will be having to drive to Worthington. I believe it takes an an hour and a half from Sioux falls to Worthington. Any tips on driving conditions, in day/night, driving in snow/ice,  or parts of the road to watch out for? (preferably will onlly use I-90) Also, how's the airport in your experience? Are flights usually delayed in or out? Has there been a lot of weather related cancellations lately? Will be there for 3 weeks and flying out sometime next week or so. Thanks in advance for all positive advice!",SouthDakota,Visiting Texan who doesn't know how to drive in the snow!
8,Riceperfect,1578249993,ekh3wg,Nan,"It might be near the Mcdonalds in Watertown or Caseys in north Souix city.
It has about $ 10, a military ID, Treynor school Id and a dewnited prepaid card. Contact me if you have seen it.",SouthDakota,LOST CAMO WALLET
9,HonestAbek,1578287771,ekpc9r,Nan,[removed],SouthDakota,Travel advice West River.
10,lpjunior999,1578314595,ekto6p,Nan,[removed],SouthDakota,"Dan Ahlers: Do the right thing, feed everybody"
11,redditor01020,1578349080,el1d8a,Nan,,SouthDakota,"A measure to legalize marijuana for adult use has officially qualified for South Dakota’s November ballot, the secretary of state’s office announced on Monday. The proposed constitutional amendment would allow adults 21 and older to possess and distribute up to one ounce of marijuana."
12,Dotsloyalist,1578352115,el22yb,Nan,,SouthDakota,South Dakota adult use cannabis legalization bill qualifies for 2020 ballot!
13,thevetyoubetcha,1578498789,eluhsi,Nan,"Hey everyone Im from delaware and i was looking into a remote place to live and get away/start a career in South Dakota...i do not mind extreme cold weather im  very interested in law enforcement i just got out of the Army i just world really love alot of recommendations, information, and advice on weather what to expect or even job openings im looking online as of right now",SouthDakota,Possibly moving?
14,LVsportsbetting,1578506544,elw9z5,Nan,,SouthDakota,South Dakota Casino 'Points for Pills' Conspirators Get Off with Probation
15,DeadWeaselRoad,1578546522,em510c,Nan,,SouthDakota,Runaway Teen. Keep eyes open! Please.
16,Meatteo,1578573076,em8zwr,Nan,[removed],SouthDakota,Best place to sell junk vehicle in Aberdeen?
17,UnrealBeachBum,1578597477,emef01,Nan,,SouthDakota,The Most Popular Male Names In The United States By State (1960-2019)
18,NukeyHov,1578599869,emez50,Nan,[removed],SouthDakota,I juggled at every State Capitol building in the lower 48 states...just because. South Dakota was my 17th state
19,dewythecat,1578614252,emiem6,Nan,"We are planning on relocating to Sioux Falls in the next couple years. I’m wondering what experienced RNs make per hour in Sioux Falls. Also what are patient ratios like. What is it like to be an RN in this area.  For those that comment, thank you so much for taking the time to comment on my post.",SouthDakota,Sioux Falls RNs
20,BaconCat42,1578616449,emiw9a,Nan,,SouthDakota,Governor Kristi Noem changes her tune on Hemp
21,AmazonReturnProcess,1578626223,eml00p,Nan,,SouthDakota,I saw this on the front page and it reminded me of something
22,IkkunKomi,1578645984,emoaov,Nan,,SouthDakota,When your husband's work hires Noem's marketing team for their items as well
23,LVsportsbetting,1578672595,emt13z,Nan,,SouthDakota,South Dakota Is Going to Give Sports Betting Legislation Another Try
24,quesopalace,1578684009,emvqmi,Nan,,SouthDakota,Over the summer I had made a post in this thread asking how to get out of Kimball. Here is how we spent our time there was for anyone who is curious
25,pbrstreetgang11,1578702236,emzur5,Nan,,SouthDakota,Lead
26,Criticalma55,1578898467,eo0n1s,Nan,,SouthDakota,"South Dakota Will Make Marijuana History Come November - For the first time ever, residents of a state will vote on recreational and medical cannabis in the same election."
27,zsreport,1578918164,eo3ewb,Nan,,SouthDakota,S.D. Attorney General to 'not take sides' in case that could determine future of ICWA
28,frankiemacdonald1984,1578956664,eoc2g5,Nan,,SouthDakota,"Major Winter Storm to Hit South Dakota on Friday January 17, 2020"
29,ProfesserKnox,1578957268,eoc7gy,Nan,,SouthDakota,"I found a random weird AM station ONLY playing Old Town Road, but always says something in between each Old Town Road about January 21st. If you play the Jan 21st messages backwards, it sounds like they're saying something."
30,count_memeulus,1579022093,eoo6dj,Nan,,SouthDakota,I don’t know where else this would be appropriate
31,devi59,1579022779,eooc11,Nan,,SouthDakota,"Spearfish is in the top 5, vote all week!"
32,1block,1579030038,eoq137,Nan,,SouthDakota,South Dakota taxpayers to pay for violating U.S. Constitution
33,DrMendy,1579091435,ep1pty,Nan,,SouthDakota,Couldn’t this be done in Pierre?
34,NWOSTING,1579102372,ep3r1s,Nan,,SouthDakota,Crosspost - NSFW - Looks like our ad campaign didn't help much. Don't jerk and drive.
35,jackallard17,1579107825,ep4xw2,Nan,,SouthDakota,Bernie Sanders is Bussing People From South Dakota to Canvas in Iowa
36,iamcannabisativa,1579113613,ep6bja,Nan,,SouthDakota,South Dakota Gov. Outlines Hemp Legalization 'Guardrails' (No Smokeable Hemp)
37,hartnessnick,1579116850,ep73hq,Nan,,SouthDakota,So these allowed or not?
38,Yang4SoDak,1579124851,ep91hd,Nan,,SouthDakota,New ITM podcast special: impacts the Iran conflict will have on South Dakota
39,tatanka01,1579128142,ep9tmy,Nan,,SouthDakota,"Trump confirms July 4 fireworks at Mt. Rushmore National Memorial, brushing aside environmental concerns"
40,Fuimofue,1579130682,epaesm,Nan,,SouthDakota,Republican Governor of South Dakota forbids boycotts of Israel (X-Post /r/ShitNeoconsSay)
41,Th3HashslinginSlashr,1579139816,epcdj6,Nan,I’ve read up on it n what not but I’m still confused. So a ballot in November for the legalization of medical and recreational use? What all’s that entail. How unlikely is this? I’m guessing it’s nearly impossible given how red if a state we are? How did it even get on the ballot then? I see a lot of people see Kristi Noem would be oppose to it cause her husband makes profit off it being illegal why so? Thanks,SouthDakota,Can someone give me a rundown on the cannabis legalization on the ballot coming up or what not going on right now
42,OffRoadRecon,1579143314,epd4bb,Nan,,SouthDakota,Wheeling in the Black Hills!
43,Tipsyfishes,1579193436,eplxij,Nan,,SouthDakota,South Dakota Legislature introducing bill to penalize doctors that aid trans youth.
44,thinkB4WeSpeak,1579210634,epq1o3,Nan,,SouthDakota,"As enrollment at S.D. universities fall, worries rise over possible program, personnel cuts"
45,CluelessSerena,1579211264,epq72j,Nan,"I moved from small town IA to Mitchell in Aug for a year long contract. There is nothing here. Nothing anywhere. 

I don't drink, and I have no friends or family here. How do you meet anyone, ever? I want to leave my apartment and my options are work or Walmart. Even your libraries suck.

I thought I would go on tinder just to socialize with *someone*, but everyone is in SF or Brookings with 5 photos of their trucks and dogs each, no degree, and already have 2 kids (im 23 not 32!)

This all sounds very negative and I don't want to shit on SD because its pretty here (when I can bare to go outside), and the few people I have met are nice (except that one guy that clips his nails in the office). I'm not coming from NYC and expecting broadway and my graduating class in high school was 83 so i know how small towns go. I just, I'm struggling. How do you all do it?",SouthDakota,"I'm going insane, how do you all do it?"
46,Oosamiij,1579298990,eq7daa,Nan,"I binged a bunch of YouTube videos on people saying things about their state, but didn't cross one that said this. I'm going to say Watertown. 

The roads are awful in the winter and so are the humans.",SouthDakota,What is the worst town in SD?
47,Jschuma83,1579312165,eqa3jn,Nan,,SouthDakota,Keeping our employees safe!
48,Advanced_CPU,1579325524,eqcg85,Nan,,SouthDakota,A reminder that sometimes there's a sun
49,Grimmy_is_a_banana,1579495624,er88gy,Nan,[removed],SouthDakota,Hey do they still do battle of the bands in Huron?
50,JohnKimble111,1579501315,er9ahu,Nan,,SouthDakota,"South Dakota Republicans introduce bill banning puberty blockers, transgender surgeries on minors"
51,Yang4SoDak,1579540073,erg20z,Nan,,SouthDakota,South Dakota Attorney General on equal rights amendment
52,Kegelz,1579557749,erki2v,Nan,[removed],SouthDakota,"Our public servants stance on legal marijuana, and veterans health."
53,thefinalgohl,1579574395,ero67e,Nan,,SouthDakota,Lookout Solar: ‘We are the first in Indian country to develop a large-scale solar project’
54,Capricornjenny,1579625124,erx8ql,Nan,"Hi citizens or visitors in South Dakota, I am a graduate student from Queen’s University in Canada. I am now doing a research to learn about hail protection in some cities from U.S. I hope to find out a better way to help people protect their cars from hailstorms (We actually call it hell storm!!). Because of limited budget as a student, I can't come to conduct an on-site survey. I would appreciate it if you could respond to my following survey: [https://survey.smith.queensu.ca/jfe/form/SV\_5BGkdtEBlmXO1rD](https://survey.smith.queensu.ca/jfe/form/SV_5BGkdtEBlmXO1rD)",SouthDakota,Is there any hailstorm in South Dakota?
55,icantfigurethis1out,1579630583,erylq4,Nan,"I'm planning on doing a road trip from Indiana to South Dakota + Yellowstone. I've gotten great stuff from  [https://www.reddit.com/r/SouthDakota/comments/8conkx/visiting\_south\_dakota/](https://www.reddit.com/r/SouthDakota/comments/8conkx/visiting_south_dakota/) , but if someone wants to add on to it, that'd be great.

&amp;#x200B;

What's the weather going to be like in the first week of March? That's when I'll be travelling.",SouthDakota,Visiting South Dakota in March?
56,Yang4SoDak,1579631197,eryqxg,Nan,,SouthDakota,Secretary of Education talks 2020 goals and SD’s future
57,Riverchicken886,1579646594,es2gq7,Nan,,SouthDakota,Stolen from r/dankmemes
58,ScienceNewsie,1579839702,et571e,Nan,,SouthDakota,New study shows pubertal suppression for transgender youth associated with lower odds of suicidality.
59,WestSquirrel,1579938557,etnyxs,Nan,"All seats in the house are up for re-election and 35 seats are up for re-election in the senate.

If you are led by a brain dead ''republican'' asshole vote them out and put in a democrat or third party person.

If you are led by a nice democrat re-elect them.

This is the only way to save our country.

**VOTE BLUE**",SouthDakota,News Regarding The Elections This Year.
60,SilverState815,1579968886,etsnrl,Nan,[removed],SouthDakota,My Correspondence with Mike Rounds Regarding the Impeachment
61,CouldaBeenADoctor,1579993876,etyaih,Nan,"Hello South Dakota. My friend is currently deployed in South Dakota and is looking for love. If any single ladies are interested in the man of your dreams, look elsewhere. But if you're looking for a kind bafoon PM me for pics.",SouthDakota,Good friend needs companionship. Please it's getting sad
62,kaymarie2002,1580012186,eu1zbg,Nan,"This is just a general question. I’ve found guys I’ve never met before and guys I have (and found them through social media sleuthing) and things still fizzle out.   
Ive heard one idea is to like a few pics and theyll add you on Snapchat. No ever done that lol. Any advice?",SouthDakota,I find a cute guy on Instagram. His Snapchat may or may not be in his bio. What do I do now?
63,EggIsMyFriend,1580094982,euhy1g,Nan,,SouthDakota,I'm on it.
64,SDPublicBroadcasting,1580145110,euqu98,Nan,"Friends of SDPB, I'd like to invite you all to subscribe to [In the Moment on YouTube](https://www.youtube.com/channel/UCyat7MTwgMWg9cpkDaR6Urw?view_as=subscriber).

If you have an interview you'd like to see, please, comment! You're the shareholders of SDPB, so please, tell us your ideas. Together, let's make South Dakota a more socially cohesive, civically informed community! Thank you :)

Also, consider subscribing to the ""In The Moment with Lori Walsh"" weekly podcast, where you can listen to weekly round-ups of news and arts/lifestyle coverage.",SouthDakota,In the Moment is now a YouTube Channel!
65,SDPublicBroadcasting,1580147574,eurhf9,Nan,"You are the shareholders of SDPB. We want to hear from you. How can your statewide public media improve?

New efforts we've made so far:

* Turning radio programs into podcasts (In the Moment with Lori Walsh, SDPB Statehouse)
* YouTube content: [In the Moment is now a channel](https://www.youtube.com/channel/UCyat7MTwgMWg9cpkDaR6Urw) and a [news channel](https://www.youtube.com/channel/UC4th_HJAhGdOgdme8NJAA1Q)",SouthDakota,How Can SDPB Improve?
66,Lowspeed_internet,1580188777,ev138i,Nan,S.Dakota legislators are attempting to ban the herb kratom that drastically helps with pain. My grandmother has been taking this herb for 3yrs and has completely stopped taking opioids. Does anyone else have any positive or negative experiences with this plant? Does this make you proud of the S.Dakota govt. or disappointed?,SouthDakota,Ban on Kratom
67,tonberrye,1580225296,ev70h1,Nan,"Alright South Dakota crew lets make this happen. If you haven't heard of the NMM before, well now you know. This place is a national treasure. Let our state win something for once and show off something other than meth - [https://www.10best.com/awards/travel/best-music-museum/](https://www.10best.com/awards/travel/best-music-museum/)",SouthDakota,Vote for the National Music Museum as USAToday's 10Best Musical Instrument Museums!
68,chompchom1,1580232286,ev8ftv,Nan,,SouthDakota,We need to stop the Brandon kids
69,SDPublicBroadcasting,1580240433,evad97,Nan,"House Bill 1057 seeks to criminalize gender-affirming clinical care in South Dakota. As the bill makes its way through the South Dakota legislature, Republican leader Lee Qualm told the New York Times that he is hearing from voters who have different opinions about the bill. The bill is scheduled for debate in the House tomorrow.   

What are some of these procedures the legislature seeks to block? What does the data tell us about variations in gender identity and gender expression?  

We've invited Anne Dilenschneider to join us. She has been working with transgender youth and adults since 1992. She is one of 87 providers in the world (and the only healthcare provider in the Dakotas) who has earned the World Professional Association for Transgender Health (WPATH) specialty credential in transgender healthcare.

[WATCH THE FULL INTERVIEW HERE](https://www.youtube.com/watch?v=jIV57TXUP8Y)",SouthDakota,House Bill 1057: What are the effects of criminalizing gender-affirming care?
70,SDPublicBroadcasting,1580244381,evbbl5,Nan,,SouthDakota,Senate Committee Passes Ban On Plastic Straw Bans
71,TheZombaslaya,1580314731,evp06a,Nan,[removed],SouthDakota,Anyone else hate driving into Minnesota and the speed limit dropping 10MPH for no reason on I-90?
72,SDPublicBroadcasting,1580323172,evr08j,Nan,,SouthDakota,An effort to continue rolling back gun restrictions stumbled out of the gate this week in the Legislature
73,sulco,1580331649,evt6yy,Nan,,SouthDakota,"SD Lawmaker compares trans health care for minors to Nazi experiments, then backtracks"
74,sodak748,1580332386,evte2o,Nan,,SouthDakota,South Dakota May Criminalize Lifesaving Healthcare for Trans Youth
75,chabanais,1580367881,ew1gwp,Nan,,SouthDakota,South Dakota Bill To Make Buying Guns and Ammo Tax Free
76,SDPublicBroadcasting,1580402153,ew83u0,Nan,,SouthDakota,"South Dakota will pay $350,000 to settle allegations that its Department of Social Services discriminated against Native Americans."
77,SDPublicBroadcasting,1580410893,ewae15,Nan,,SouthDakota,Rapid City Financial Therapist On When Financially Supporting Children Is A Problem
78,TriangularLogic,1580412440,ewartk,Nan,,SouthDakota,Here is why South Dakota's congressional delegation stands on legalizing marijuana
79,KelvinGraham,1580421394,ewd3g2,Nan,,SouthDakota,This state wants to buck the trend and keep their plastic straws and bags
80,YourGayUncleVinny,1580424591,ewdy8v,Nan,,SouthDakota,More Anti-LGBT+ Bills
81,Oosamiij,1580424609,ewdyer,Nan,"Senate Bill 88 is kind of messed up. 

An Act to require parental notification of self-injurious behavior expressed during counseling sessions.
Be it enacted by the Legislature of the State of South Dakota:
Section 1. That a NEW SECTION be added:
13-33A-12. Counseling services--Parental notification--Requirement.
If a counselor, school psychologist, or social worker, employed by a school district or nonpublic school in this state, determines during a counseling session that a student under the age of eighteen is articulating feelings of gender dysphoria, or determines that a student under the age of eighteen is articulating an interest in self-injurious behavior, the counselor, psychologist, or social worker shall provide notice of the determination to a parent of the student.
Section 2. That § 19-19-508.1 be AMENDED:
19-19-508.1. Student and counselor, psychologist, or social worker--Exceptions.
No counselor or school psychologist, certificated in accordance with the certification regulations of the South Dakota Board of Education Standards, or social worker licensed under chapter 36-26 and regularly employed as a Except as otherwise required in § 13-33A-12 or permitted in accordance with the Family Educational Rights and Privacy Act, 20 U.S.C. § 1232g, no counselor, school psychologist, or social worker for a private or public elementary or secondary school or school system in the State of South Dakota, employed by a school district or nonpublic school in this state, may divulge to any other person, or be examined concerning any information or communication given to the counselor, school psychologist, or social worker in the counselor's, school psychologist's, or social worker's official capacity by a student unless:

This privilege is waived in writing by the student; or

The information or communication was made to the counselor, school psychologist, or social worker for the express purpose of being communicated or of being made public; or

The counselor, school psychologist, or social worker has reason to suspect, as a result of that information or communication, that the student or some other persons have person has been subjected to child abuse or that the student's physical or mental health or the physical or mental health of other persons another person may be in jeopardy.



.........


Senate Bill 93
Introduced by: Senator Phil Jensen

An Act to establish conditions under which a parent may refuse consent for health care services.
Be it enacted by the Legislature of the State of South Dakota:
Section 1. That a NEW SECTION be added:
26-8A-2.1. Parental consent to health care--Refusal--Conditions.
Notwithstanding § 26-8A-2, a parent may refuse consent for the provision of any health care service to a minor child if the parent reasonably believes that the service would induce, confirm, or promote the child's belief that the child's gender is different from that which it was at birth or that the gender with which the child identifies is different from that which it was at birth.
Any parent who refuses consent in accordance with this section may not be subject to liability, to any penalty, or to any legal action for the refusal.
For purposes of this section, a health care service means medical treatment, including psychiatric care, and psychological and counseling services.",SouthDakota,Transgender Bills 88 and
82,zanthine,1580490578,ewrh1o,Nan,,SouthDakota,South Dakota’s making the international news for all the wrong reasons
83,zsreport,1580492434,ewrx8n,Nan,,SouthDakota,The $18 Million Ice Fishing Drug Bust
84,SDPublicBroadcasting,1580496062,ewstlm,Nan,[removed],SouthDakota,"South Dakota Podcasts (News, and Arts/Lifestyle)"
85,SDPublicBroadcasting,1580499212,ewtlaf,Nan,,SouthDakota,Legislators Shoot Down Repeal Of Gun Taxes
