,author,created_utc,id,link_flair_text,selftext,subreddit,title
167,robo261,1583325351,fdcdcb,Nan,"I have access to wind and water, and have the time, but havent seen much for kitesurfing in South Dakota. Does anyone have any tips on active groups or places that sell supplies? I'd be starting from scratch but look forward to learning something new this summer.",SouthDakota,Kitesurfing in SD?
168,LVsportsbetting,1583425573,fdxpnv,Nan,,SouthDakota,Question Goes to South Dakota's Voters
169,Oosamiij,1583452217,fe4jam,Nan,,SouthDakota,No Reusables At Starbucks
170,tacocrewman111,1583515220,fegpv0,Nan,,SouthDakota,Where are all the snow geese at?
171,levijohnson406,1583633997,ff5unb,Nan,,SouthDakota,Maybe This Is How Corona Virus Started?
172,AhhlterEggo,1583644946,ff821o,Nan,"Someone told me there was a lot of fracking in N and S Dakota, I was thinking of relocating somewhere, maybe Soux Falls. Lots of jobs?",SouthDakota,Is there fracking?
173,Gortonis,1583714268,ffm7pw,Nan,[removed],SouthDakota,South Dakota Snapchat
174,Sobzy11,1583716256,ffmnv4,Nan,,SouthDakota,Pine Ridge to vote on legalization of Marijuana
175,IkkunKomi,1583729284,ffpg57,Nan,"THERE WAS NONE! NOTHING!! Even if you search on an alphabetical list, you won't find anything. 

It should be on the front fucking page of precautions to take, symptoms, when to self isolate, when to go in, call a doctor before you go in, other information.

Other states have so much information on their pages.

Ours:
https://doh.sd.gov/


South Carolina:
https://www.scdhec.gov/


Wyoming (Not an outbreak there):
https://health.wyo.gov/


Alaska (Not an outbreak near there):
http://dhss.alaska.gov/Pages/default.aspx


Montana (Not an outbreak there):
https://dphhs.mt.gov/



And you get the point. This is disgraceful. We need information so that we can protect ourselves. We need information so that we can create a plan to ensure the safety of our family. There are people who are elderly, immunosuppressed, and have other underlying health issues. We need to take every step possible to protect those most vulnerable. If I seem upset, I apologize. But I am upset at how reckless this is. We need to be more responsible. We need to know NOT to buy all the medical masks, leaving those who need them to get to their appointments without it. We need to know when to go to a doctor and what to do beforehand to prevent the spread of the virus. We need to know basic information so that we can protect our loved ones. If they can't do that, find me someone who can.",SouthDakota,We are nationally in the middle of a Coronavirus outbreak &amp; I look to the state Doh website for information
176,zsreport,1583752066,fft15i,Nan,,SouthDakota,South Dakota tribe set to vote on legalizing marijuana
177,Oosamiij,1583864842,fgig03,Nan,"SD has taken 11 tests so far, all negative. Minnesota has taken 82 with 2 positives. Stores are running low on  certain items like masks, antibacterial soap, rubbing alcohol, etc.",SouthDakota,Are you worried about covid-19?
178,Slash_E-33,1583876997,fglsf6,Nan,[removed],SouthDakota,2 CONFIRMED CORONA VIRUS CASES IN MITCHELL!!!
179,TheCowrus,1583877441,fglwyp,Nan,,SouthDakota,South Dakota reports 5 'presumptive positive' cases of coronavirus with one death
180,GGoodman09,1583878534,fgm7n2,Nan,,SouthDakota,Pennington County man who tested positive for coronavirus first to die in state
181,StardusterPrime,1583882039,fgn539,Nan,,SouthDakota,"Five Coronavirus cases in SD, one death"
182,candycane123411,1583890029,fgp2qn,Nan,,SouthDakota,We have it.
183,archer_healer,1583906934,fgslwd,Nan,what are your thoughts on coronavirus in South Dakota?,SouthDakota,"Coronavirus is now in South Dakota, any thoughts?"
184,Save_The_Day_Night,1583921589,fguute,Nan,"**TheWorld.Data.Blog Is Providing Cure Solution, Real Knowledge About Corona Virus NCOV COVID-19**

The   authority, government and many organization are hiding a lot of real   info about the new corona virus from the public for whatever reasons   like lose the regime, cause chaos or continue enslave the people, not   just only China, Vietnam must also including USA, Europe, etc. All over   place.

So if you are seeking for   the truth information, real knowledge, uncensored news, open  discussion,  cure &amp; solution for the new corona virus named as NCOV,  COVID-19 or  SARS-COV-2, then the only webpage online is **theworld.data.blog** and **freejoy.aimoo.com**.

The   fact is that the media &amp; government are toying with people’s life.   They are only promoting fear and scare to face the truth. They were  not  telling the real information about the corona virus from the  beginning  and probably in the future as well.

Even   I as a Savior want to telling you the truth, real information about   this epidemic with just text-based message, they think me as fear-maker,   and delete all the messages online. Many of my information now even   scientist was confirmed like the started for this epidemic event from   October/November or the real features of this virus, but many still not   yet confirmed and verified yet.

If   they say cannot talk in the public or big media sites, then it would  be  ok, but instead they are deny in all fake free speech websites as  well.

You  need to understand that  even the top government officials, top doctors  who have access to top  notch medical care had died because of this new  corona virus, they  cannot protect themselves so there is freaking any  reason they can  protect normal people like most of you.

The   new corona virus is not yet peak, the full strength of that virus will   only appear in the summer time. The current situation is too dangerous   for normal people to deal with.

That   why from now I will provide free working cure &amp; solution at  private  matter for all of you, if you are rich (have more than 5  millions USD  worth of asset) then you must donate money, but all with  restrict  conditions and limited time. But only at **theworld.data.blog** or **freejoy.aimoo.com**.

But   if you are willing to open your mind, want to face the scary hard   truth, accept new knowledge then you can visit that websites. If you are   the anti-christ with big ego and do not want to change, then do not   visit.

Remember everything has the limit and I have the final decision of anything on that website.

The   authority cannot save you, only you can save you, and only the savior   can give you real working advice, cure &amp; solution to overcome this   crazy epidemic event.

Best Regard,

**The Savior Messiah Mahdi Maitreya Kalki Christ Any-Name**",SouthDakota,"TheWorld.Data.Blog Is Providing Cure Solution, Real Knowledge About Corona Virus NCOV COVID-19"
185,zblinks,1583977885,fh8onm,Nan,[removed],SouthDakota,A South Dakota Feature Film
186,zblinks,1583977889,fh8oov,Nan,[removed],SouthDakota,A South Dakota Feature Film
187,zblinks,1583977901,fh8osm,Nan,[removed],SouthDakota,A South Dakota Feature Film
188,zblinks,1583978336,fh8sob,Nan,[removed],SouthDakota,South Dakota Feature Film
189,zblinks,1583981930,fh9mt7,Nan,,SouthDakota,"When they kick out the media, some shit is going down."
190,candleisout,1583989095,fhb3t2,Nan,,SouthDakota,This is a funny thought I had
191,RedKappi,1584018876,fhg5d2,Nan,,SouthDakota,Sioux Falls lab developing potential covid-19 treatment
192,1970Roadrunner,1584049743,fhobjw,Nan,Title says it all. Facts are facts. There is no comparison between marijuana and alcohol in terms of negative effects. In a state where the governor is afraid to legalize hemp and will only do so begrudgingly....the people of Pine Ridge have spoken through their votes and made a well informed and educated decision.,SouthDakota,Congrats to Pine Ridge having the vision to legalize a plant that the uneducated politicians are afraid of in our state of South Dakota.
193,Oosamiij,1584060866,fhr5y4,Nan,,SouthDakota,The criticism of Noem is strong here/Editorial: The time to fight back is now
194,manbearpiglet92,1584121720,fi3n5t,Nan,,SouthDakota,Governor Noem called off school for the next week (3/16-3/20)
195,LaminatedPASTA,1584121883,fi3oqo,Nan,,SouthDakota,All public schools closed in SD starting next week.
196,FalconHawk5,1584156819,ficckb,Nan,,SouthDakota,"Spring break has been extended for an additional week for BHSU, and other SDBOR universities, due to coronavirus"
197,garrypig,1584329559,fjed8b,Nan,,SouthDakota,Anyone here seen UFOs or other supernatural things near Hot Springs or SW corner?
198,Leftwing_agitator,1584397535,fjtr1j,Nan,[removed],SouthDakota,Finding love in SD is hard...
199,2Sockbros,1584407587,fjwd4e,Nan,,SouthDakota,What are your opinions on the plans of a RMC raptor coming to South Dakota?
200,sayyfhatt,1584409432,fjwsuh,Nan,"I'm male, 18yrs old. Looking for guy/girl to meet up and have lots of fun ;)",SouthDakota,BROOKINGS SD
201,dannylenwinn,1584424099,fk00yy,Nan,,SouthDakota,"South Dakota Scientists rushing to develop coronavirus treatment. 'To speed up development, scientists at SAb are working through the complicated processes associated with bringing a treatment to the public by completing as many steps as possible at the same time.'"
202,bojanicabokalica,1584432724,fk1k5f,Nan,,SouthDakota,What do you think about Gov Kristi?
203,thesunindrag,1584445109,fk3rgv,Nan,[removed],SouthDakota,Is it worth traveling from NJ to take an internship in Custer?
204,SocialismTbh,1584515561,fklidn,Nan,,SouthDakota,"Governor Kristi Noem: Suspend the Collection of All Rent, Mortgage, &amp; Utility Payments for At Least 2 Full Months During the Coronavirus Crisis"
205,justinbbr,1584545029,fkr8ln,Nan,[removed],SouthDakota,Paid Research Study via Phone from HOME
206,Nightalia,1584550170,fkspdj,Nan,,SouthDakota,I made a map of the COVID-19 affected counties in South Dakota
207,jbjordan,1584551384,fkt209,Nan,[removed],SouthDakota,Voting preferences study - Receive $150
208,CantSayNo,1584556882,fkuo8l,Nan,,SouthDakota,SD is out of testing supplies. Won't process any new COVID-19 tests Wednesday.
209,joejance,1584575135,fkzu6v,Nan,,SouthDakota,State halts testing for lack of supplies
210,IkkunKomi,1584588013,fl2zwu,Nan,"I am quite nervous about writing this, as I know that this is a very hard topic that is not black and white. There is no right or wrong answer here. But I want to share what I am concerned with based on other patterns with states.

First let me state that I understand if we shut down things like bars, restaurants, etc. that many people will not have a check/tips/or any income. This is awful and should not even be an issue to begin with. I know this. I'm sorry I can't say more than that. This is a shitty situation from every single angle. I wish our state/nation was better prepared for this, but I don't really know what to say. This shutdown would impact my household as well.

In my town of about 21k in southeast SD, we had St. Patrick's Day yesterday. Bars, Restaurants, etc. were all open. Everyone was jammed packed. No one cared about Social Distancing, leaving a 6 foot distance, or anything similar to that (Facebook friend was bar hopping all night with lovely pictures). I will admit I have an autoimmune disease that compromises my immune system. I had to go to the doctors yesterday, with a follow-up to Walmart to pick up my prescription. People are traveling in groups. Sitting in the aisles chatting it up about a foot apart. No one is taking this seriously. This virus can literally hit anyone. Think of anyone in your life, it can impact them - including yourself. Your parents, grandparents, brothers, sisters, husband, wife, kids, cousins, best friends, worst enemies, etc. - it can impact all of them. We need to do what we can to protect those that we love around us. Our county is within a 75 mile(ish) area where every case is besides the west, but we have no cases yet. And as I am sure that many South Dakotans know, we might not have a high population, but our ratio to hospital resources to population is actually very low, specifically in rural areas.

The time to get ahead of this is now. When we went from 0 cases to 8 overnight, including one death, the rate of change was 8. The average national rate of change for this disease is 2. We are 4x worse nationally right now on average. The governor says that the reason that nothing is getting shut down is because it is not spreading that much right now. However, it is only a matter of time. The way that this virus presents itself in most cases with states is a slow curve up, then a rapid growth which can become impossible to handle.

An example of this would be Illinois.

Their cases went:

March 2: 4

March 8: 7

March 9: 11

March 10: 19

March 11: 25

March 12: 32

March 13: 46

March 14: 64

March 15: 93

March 16: 105

March 17: 160

March 18: 288

&amp;#x200B;

While their population is significantly larger than ours, their cases are similar to ours by the cluster of cases being in a concentrated area to begin with (the Chicago area vs the Sioux Falls area). I am not trying to scare anyone or the like, I am sharing how easily this can get out of control. But again, one thing that other states has above us is the fact they have a larger access to medical resources than we do. We, as a state, need to be smarter about this. People that are not staying at home are going to have a higher probability to get people infected and killed. Our medical system nationally is already strained to hell, between doctors and nurses and other medical professionals being worked to hell. We need to do all we can to alleviate it.

And while we did let schools out, which is good to protect the children, the likelihood that children are contracting the virus is about 10%. The likelihood that adults over 30 are is about 60%. Why would you close schools, that has a 10% chance to contract the virus, but not other non-essential travel or places? It seems counter-intuitive. We need to take every precaution possible to protect our citizens of our state, but also our country.

Which leads me back to the first thing I said, what do we do about the fact that it would financially ruin families if this happened. That honestly, I don't know. I'm sorry. I have a high amount of guilt even writing this, but I feel like I scream into the void every time I call her office. We have the opportunity right now to flatten the curve of our numbers before it gets excessive. We should take every precaution necessary, including those within the state and nationally for financial compensation.

Sorry for the long post. If you finished it, thanks +2. I hope you all stay healthy and safe during this time. We're all in this together and we will all get through it together. 

TL;DR: Shut it down. Take it seriously. Get ahead of the curve to not get overwhelmed.",SouthDakota,We Need to Shut Shit Down Now to Protect People
211,Zuzechan,1584693056,flrjvp,Nan,,SouthDakota,I’ve been following this since late Dec
212,Nightalia,1584723721,flyhxg,Nan,,SouthDakota,Corona Map 3/20/2020
213,Yang4SoDak,1584740146,fm398h,Nan,,SouthDakota,south dakota pbs has a site dedicated to coronavirus
214,joejance,1584751950,fm6efm,Nan,,SouthDakota,An open letter to public officials from local healthcare leaders
215,Dreamsofbluwater,1584761032,fm8izs,Nan,"On march 19th at 11am the number of pending coronavirus tests was 402, at 1am that number dropped to 385 pending tests.  Negative and positive results remained the same.",SouthDakota,Can anyone explain the discrepancy in pending covid test numbers from 11am March 19th to 1pm March 19th?
216,IkkunKomi,1584761161,fm8jzv,Nan,,SouthDakota,The Projected Rate of Transmission Per County That Shows Different Isolation Methods (Scroll to the Bottom)
217,DickKnutz,1584775061,fmb82p,Nan,Not released to media yet but they returned from Italy and didn’t quarantine when they got back. I only know because I went to school with 2 of them.,SouthDakota,At least 4 confirmed cases in Roberts County
218,DickKnutz,1584801631,fmfxuw,Nan,I didn’t post this because I figured it would be in the news by now but there is at least 4 confirmed cases in Roberts county. No idea why they haven’t said anything about it.,SouthDakota,Coronavirus Roberts County
219,dadmedstudent,1584814481,fmjcwc,Nan,"Both Sanford and Avera are currently sending tests to national reference laboratories (i.e. Quest, LabCorp, Mayo, etc.) instead of to the state due to limited capacity. Apparently only positive tests get reported to the state.",SouthDakota,YSK: The number of negative cases of COVID-19 reported by the governor in the state is inaccurate as it does not include tests performed at commercial laboratories.
220,ZV2Cox,1584829204,fmo7x2,Nan,[removed],SouthDakota,Sick &amp; Fear Losing Job
221,FormalBumblebee,1584831982,fmp1ll,Nan,[removed],SouthDakota,Do you like living in South Dakota?
222,Cowbeller,1584841661,fmrmcf,Nan,,SouthDakota,Does anyone recognize this location?
223,Wally4114,1584852803,fmuap0,Nan,https://www.argusleader.com/story/opinion/editorials/2020/03/20/editorial-protect-south-dakota-citizens-now/2884674001/,SouthDakota,"Gov. Noem - ""cannot say that there is community spread in our state because it hasn't been proven in the data."" The advantage South Dakotan can't be tested because we dont have test kits"
224,Wally4114,1584854232,fmul9d,Nan,"An open letter to public officials from local  leaders

Mayor and council members,

Open letter to Rapid City and South Dakota state government and public health officials on the need to more rapidly implement strategies to mitigate the COVID-19 pandemic.

This is an unprecedented time. We face the COVID-19 pandemic that will challenge every single one of us. While we appreciate the tireless efforts of those involved in managing this crisis, it falls short of what we feel will make a true impact.

Throughout the world, the most effective responses to the historic threat of COVID-19 have come from state and local governments. Using that history as evidence, we must shut down all unnecessary travel and utilize social distancing and self-isolation to stop the spread of the disease. Failing to heed warnings will lead to an exponential spread and will incapacitate our local healthcare system resulting in deaths.

We will face an overwhelming flood of patients requiring intensive care and ventilator support. Death rates for those over the age of 70 is over 8% and for those over 80, approaches 15%. Using even

conservative estimates, ventilator and intensive care beds will be exceeded. Supply lines are limited and will quickly be diminished. Waiting to act will kill more people while taking aggressive action now will help to limit the severity of this pandemic and allow the system to serve those most in need. Based on a recent Harvard study, the Rapid City area could experience 40,000 sick, 8000 hospitalized, and 400 requiring a ventilator (*we have fewer than 80 ventilators in Rapid City). Untold will die.
-----‐------------------

We must protect those most vulnerable in our community.

Therefore, we the physicians of the Black Hills, advocate implementing all of the following:

1. Self-isolate at home except for essential needs and practice social distancing;

2. Stop non-essential travel: most importantly airline and public transportation;

3. Close non-essential businesses: restaurants and other facilities that prepare and serve food (except for take-away), bars, salons, retail stores, clubs, gyms, schools, daycares, social events, and churches;

4. Conserve medical supplies;

5. Limit nonessential healthcare operations.

Crucial mitigation strategies, prompt intervention, and our remote location offer us a unique opportunity to stop the disease. We recognize that many of these interventions are already front of mind for our government; but our public officials also face competing priorities including concerns about the economic, political, and social impact of these measures.

The balance of those concerns is greatly outweighed by the health and safety risk facing our community and our responsibility to those most vulnerable among us. Now is the time to take further action. You must not hesitate; we need decisive action now


Signed by:

1. Stephen Miller, MD, President of Black Hills Medical Society

2. Stephen Miller, MD, President of Rapid City Emergency Medical Services (Emergency Room doctors)

3. Andrea Baier, MD – Chief of Medical Staff, Monument Health

4. Luke Mortimer, MD – President of Black Hills Ortho &amp; Spine Center

5. Lew Papendick, MD – Chairman of Black Hills Surgical Hospital

6. Margaret Kuehler, MD – Managing Partner, Black Hills Pediatrics

7. Rebecca Linquist, MD, President Rapid City Medical Center

8. Rob Schleiffarth, MD, President, West River ENT

9. Stuart Rice, MD, President, Black Hills Neurosurgery and Spine


https://rapidcityjournal.com/news/an-open-letter-to-public-officials-from-local-healthcare-leaders/article_ee898957-9855-579b-8603-9780f58c9b8c.html#tracking-source=home-the-latest",SouthDakota,**Doctors urge not to wait on Governor Kristi Noem to take action**
225,Kellyb86,1584856885,fmv3wa,Nan,,SouthDakota,Glory to GOD
226,Wally4114,1584857313,fmv6zg,Nan,"RAPID CITY, S,D. (KOTA/KEVN) - 

South Dakota state officials are waiving certain requirements for unemployment insurance.
Anyone applying for unemployment insurance will no longer be required to be actively searching for employment in order to receive benefits. The change will also accommodate those workers who are temporarily impacted by COVID-19, including those who are in an unpaid status or whose hours are reduced due to a shutdown or quarantine.
""This change applies to everyone filing for unemployment compensation,"" said Secretary Hultman. ""While many job search efforts are conducted online, waiving the requirement to search for work is in line with the social distancing practices needed to limit the spread of COVID-19 and potential exposure to the disease.""
The changes will remain in effect until Governor Kristi Noem (R-SD) lifts the state of emergency.
While the requirement is waived, the state is still encouraging people to search for new jobs. Just as many industries have announced major layoffs, others are looking to hire. Amazon and Domino's Pizza officials say they both plan to hire 10,000 new employees and Walmart announced it is looking to hire as many as 150,000 through the end of may.

To file a weekly request for payment, visit raclaims.sd.gov or call 605-626-3212. The application will ask: ""Did you make contacts for employment as instructed?"" Claimants should select, ""no"" and write ""not required"" in the comment box

https://www.blackhillsfox.com/content/news/State-loosens-unemployment-insurance-requirements-568995381.html",SouthDakota,"""State loosens unemployment insurance requirements in South Dakota amid Covid-19 pandemic"""
