,Unnamed: 0,author,created_utc,id,link_flair_text,selftext,subreddit,title
392,392,dumplingboy19,1581887754,f4xecf,Nan,Let me first just say that I’m writing this from my toilet and damn near blew out the back of the porcelain. I first found out about them in this subreddit and made a trip down; What a delicious hot dog it was! I knew I was in good hands when I saw a picture of Guy Fieri hanging on the wall.,RhodeIsland,Just had my first olneyville NY system hot dogs today
393,393,mjmvet1,1581903670,f51002,Nan,"This is a longshot, but is anyone out there a celiac sufferer? I'm looking for a restaurant in or near Wrentham to meet my family. Two members of the family have celiac, and it's damn near impossible to find the info on the restaurants' websites. Any ideas?",RhodeIsland,Wrentham MA Celiac friendly restaurants?
394,394,a_person_96,1581905746,f51gjc,Warwick,Is anyone experiencing a power outage in Warwick?,RhodeIsland,Power outage?
395,395,RawAndRealRetail,1581916675,f53qsq,Nan,,RhodeIsland,Here is our musical tour of the Warwick Mall.
396,396,Beezlegrunk,1581958541,f5bnbd,State Goverment,,RhodeIsland,Introducing RI Rank: State Legislator Performance Rankings — see how your Rhode Island General Assembly representatives vote and work for you on issues that matter
397,397,Tasanar,1581959850,f5bzzb,Narragansett,,RhodeIsland,RI Veterans Helping Veterans - Heroes' Horizons
398,398,Tasanar,1581959934,f5c0rd,Narragansett,,RhodeIsland,RI Veterans helping Veterans - Heroes' Horizons
399,399,Beezlegrunk,1581964735,f5dawu,State Wide,,RhodeIsland,"Join Clean Water Action, the Conservation Law Foundation, and Talking Toxins on Monday, Feb. 24th, at 5:45 at Providence Place Cinemas for a free screening of the film “Dark Waters” (starring Mark Ruffalo), about the dangers and negligence involved in toxic PFAS, the so-called “forever chemicals”"
400,400,KennyIrishman,1581968737,f5ed2n,Nan,,RhodeIsland,Rhode Island Priest says abortion is worse than pedophilia
401,401,ChewbaccaBreath,1581968808,f5edr1,Warwick,"I carry a pocket knife daily, just a normal folding knife but I’m wondering if that’s something the cops here actually care about or not. Have you guys ever heard of someone getting in trouble for this.",RhodeIsland,Has anybody ever heard of somebody getting in trouble for a pocket knife?
402,402,Justice_fore_all,1581971014,f5ez79,Nan,"We are coming from Worcester area considering buying a home on the very East end of Woonsocket, near where Cass Ave intersects with Mendon Road. We've heard mixed opinions on the city, and would love to hear more if anyone is willing to discuss.    
Is the city on the upswing? Is the area (near Cumberland) we are considering safe?    
We have no kids and commute off-hours to work, for background information.",RhodeIsland,Moving to Woonsocket?
403,403,jharvey55555,1581973885,f5frfe,Discussion,"Need to buy a gift for a coworker who is a big RI/Southern Mass beer drinker. Anyone have any good/creative ideas for what to purchase?   


For discussion's sake, let's pretend like there is no budget here.  


Thanks in advance!",RhodeIsland,Help buying gift for RI beer drinker
404,404,babith,1581975428,f5g69k,Nan,What are some good thrift stores that aren’t associated with Salvation Army in the state? Doesn’t really matter the area.,RhodeIsland,Thrift stores that aren’t associated with Salvation Army
405,405,smokejaguar,1581982194,f5hwsd,Nan,,RhodeIsland,Police: Five charged in narcotics investigation sparked by YouTube bragging
406,406,joeyrusso47,1581995028,f5kx72,Nan,"Live in Rhode Island, own a small marketing company and looking to fill our book shelves with any business related books but can't seem to find a place locally or online. Any idea/direction? Ideally looking to buy in bulk to save $$. 

\- Business   
\- Marketing  
\- Leadership  
\- Entrepreneur  
\- HR  
\- Branding  
\- Any similar category",RhodeIsland,Looking to buy used business/marketing books in Rhode Island
407,407,AdmiralEllis,1581996628,f5la9s,Nan,"Hello fellow Rhode Islanders,

A good friend of mine loves collecting sea glass, and though I'm a lifelong resident and know many of the beaches in the state, I have no clue which (or even which general area) would be the best for finding it. If any of you collect sea glass and know good spots to find it, I'd love to hear them before setting out on our quest.",RhodeIsland,Good Beaches for Sea Glass
408,408,ilikerocks19,1581997012,f5ldb2,Nan,"I'm wondering if I'm pulling a grass is greener type of thing but I'm over Texas and am looking to move. The east coast has always appealed to me, I like winters just fine (I'm from Chicago) and really appreciate the smaller, beautiful coastal cities. Is RI a good place to live? I know every place has it's ups and downs but I'm hoping to get some real honest opinions. TIA",RhodeIsland,Considering moving to Rhode Island
409,409,ChiefDev401,1582006231,f5n9ig,Nan,,RhodeIsland,Add the snapchat @featherheaddev
410,410,Beezlegrunk,1582037039,f5ssvt,Nan,,RhodeIsland,Rep. David Cicilline interviewed in “Frontline” episode about Amazon TONIGHT
411,411,Bandaloopdeloop,1582037977,f5t0kn,Nan,,RhodeIsland,Chilly Arms of Ocean- TKB Live on Cape Cod St Patrick’s Day 2018 - original ballad tribute to the late Sunil Tripathi
412,412,Beezlegrunk,1582038175,f5t26u,State Goverment,The employee in question is [this model citizen](https://www.bostonglobe.com/metro/rhode-island/2019/09/09/rhode-island-house-employee-has-sexual-assault-conviction-records-show/ASMicU4IIKo7DBG9RtrOjP/story.html) …,RhodeIsland,"House Speaker Nicholas Mattiello’s political campaign paid for two separate online background-check services in September around the same time that questions were raised about a House employee’s criminal history, but a spokeswoman for the campaign claims their creditcard account may have been hacked"
413,413,Ciabattabunns,1582047738,f5vjju,Nan,I spoke to a few places and I suppose it's more of a specialized thing because most mechanics won't do it. Does anyone have a recommendation for a place that will install a dash cam (hardwire) for me? Iv'e done it myself on a previous car but it was just so much of a hassle that I'd rather just pay someone. It's a Thinkware FA200 and I have the hardwire kit.,RhodeIsland,Mechanics that will install a dash cam?
414,414,OctoberRust13,1582061978,f5zb4v,Discussion,"I'm looking to register a vehicle (small, older pickup truck) that I won't be driving very often, primarily on weekends when working on home improvement projects so I dont want to pay an arm and a leg.

&amp;#x200B;

My SO and I currently share her car (I can walk to work) so I don't have a policy under my name right now but I did for many years both here in RI and for a fairly long stint in MA",RhodeIsland,what auto insurance do you have? what company is generally the cheapest?
415,415,internetrabbithole,1582066687,f60kpw,Nan,,RhodeIsland,An interesting title
416,416,Beezlegrunk,1582067366,f60r8i,Providence,,RhodeIsland,Called it: “State lets Wild Zebra strip club reopen”
417,417,iandavid,1582072642,f622jq,State Goverment,,RhodeIsland,"State considers merging RIPTA, RITBA into RIDOT"
418,418,NewServer2233,1582073192,f627h9,Nan,"Received a code for 4 free months but you have to be a new subscriber. Friends and family don't need/want it, so thought I would ask fellow Rhode Islanders! First person to comment can gave it.",RhodeIsland,Does anyone want a code for 4 free months of Apple Music?
419,419,hoplite616,1582080396,f63x0n,Nan,"Hey! I made a similar post in r/providence and I got some good responses, unfortunately the places mentioned are really out of my bands budget.  There's 4 of us and $60+ per person for a place is really a lot right now. I was wondering if anyone knew of any good practice spaces or non-conventional places in the state that we can rent for band practice. There's two guitarists, a bassist and a drummer.

People suggested renting out a storage unit, and I called a few different places and they all basically told me to fuck off. (2 different LifeStorages, Public Storage, iStorage, Cubesmart, Space Station Self Storage, uHaul etc.) and I'm not really sure who would be cool with it.

A couple people I work with talked about those warehouses in Olneyville by the Fete, but I can't seem to find any information on them online. 

I've also been trying to reach out to my own personal network to see if anyone has some space they'd let us use.

Ideally we'd like to meet ever Sunday around 5-6pm and end around 9-10pm. We're also super willing to enact some noise dampening methods to help reduce the amount of noise. I suppose a 10'x10' area would be more than adequate.

Thank you ahead of time to anybody that has any suggestions.",RhodeIsland,Practice Spaces that aren't Jamstage or Music Complex or something equally expensive
420,420,dontdaresayit,1582105460,f68llk,Nan,,RhodeIsland,Where is this??
421,421,Redstalin88,1582128076,f6cpsk,Nan,,RhodeIsland,Were you a victim of pickle park?
422,422,DeedzMcGraw,1582150404,f6iedk,Nan,Why is it that Wednesday traffic seems to be the worst of the week - after work that is. Am i crazy or do others notice this as well???,RhodeIsland,Traffic
423,423,tjisok,1582152091,f6itp6,Nan,"Anyone know of a shop in RI that will insoect a sedan with window tint? It's not super dark, but the shop I usually go to claims there can't be any tint on any of the windows.

Feel free to PM, it would be much appreciated. Thanks guys.",RhodeIsland,Window tint inspection?
424,424,jamezbren2,1582158339,f6kbyh,Lincoln,,RhodeIsland,"Just noticed this map in the background of the news broadcast from the Petoria episode. Quick reference to a map of Rhode Island shows that Quahog is actually real life Lincoln, RI"
425,425,Beezlegrunk,1582160041,f6kq9l,State Goverment,,RhodeIsland,"RI is suing Facebook to force it to turn over documents related to its $5 billion 2019 FTC fine for lying to users about their privacy, saying the size of the payment — $2 billion more than discussed — suggests the company deliberately overpaid in a bid to get Mark Zuckerberg off the hook personally"
426,426,PolarisX,1582170089,f6mzc3,Nan,"I keep seeing that RI is getting really tough on inspections. Has anyone failed for things like after market air intakes that don't have a CARB number, or after market tunes?

I can always swap back to stock, but I just want to know for myself where the state is with all that in actual practice.",RhodeIsland,Inspection Question
427,427,JeffFromNH,1582206513,f6tbfb,Nan,,RhodeIsland,Remembering the victims of the Station fire 17 years later.
428,428,Beezlegrunk,1582216535,f6vmta,State Wide,,RhodeIsland,Blasts from the Past: Rhode Island seeks to collect $29 MILLION in old traffic fines — even out-of-staters will be targeted with collection letters and the possibility of license suspension
429,429,[deleted],1582216904,f6vq21,Nan,[deleted],RhodeIsland,"Tonight marks 17 years since the infamous Station nightclub fire. John Barylick, a lawyer involved in many of the lawsuits that followed, gives an extremely detailed and captivating talk about the fire, its causes, and the legal aftermath"
430,430,KorrinStar,1582218590,f6w5a8,Nan,"I've been trying to find a rental in northern parts of the state for a month. I've paid too many application fees to just never be called again after the showing and it's starting to get real frustrating.

We have good credit and no criminal history. Plus, new rental posts don't pop up all the time. We also have cats, so limiting us to pet friendly properties as it is. 

We need at least a 2 bedroom, can budget up to $1,500 - ideally more like $1,300 being the most since we could save more. 

Any advice? We need to be northern RI territory, without crossing into MA. Yet, we'd also like to stay away from Providence. One of us commutes into MA for work and I myself need to stay resident of RI for other reasons I won't get into. We're looking primarily in Woonsocket, as much as we'd rather not live there, it would only be for a year.",RhodeIsland,"Advice on finding an apartment, please"
431,431,ant8127,1582220470,f6wm0w,Nan,,RhodeIsland,"SUPPORT LOCAL TALENT - Episode 25- WE'RE BACK!! .... but, where is the other host guy?!.. Hey guys, RI may be a small state, but we should still should big support of our own. Please take a minute to check out this Podcast from two locals, and share with friends. We are looking to get more exposure!"
432,432,nathanaz,1582220984,f6wqks,Nan,"Hey all - I'm looking for a good butcher to buy a pork belly (with skin) to make a porchetta.

What are you reco's for a top notch butcher, preferably in the Warwick area or south.

TIA",RhodeIsland,Looking for recommendations on a butcher
433,433,ScottBaller,1582223384,f6xccj,Nan,[removed],RhodeIsland,Looking for some info on “soccer” clubs in RI
434,434,gah514,1582226891,f6y8hq,Nan,"Looking for date spots and activities in Rhode Island, ideally the greater Providence area but open to anything. Hoping to get inspiration for something a little different than the usual dinner/bar spots. We both love good food and drink, but are looking for something a little different than the usual dinner/bar spots. Would love ideas about anything that allows us to be creative/hands on, or move around a bit. Doesn't need to be explicitly romantic, just something you enjoy doing with your partners/friends.",RhodeIsland,Favorite Date Spots in Rhode Island?
435,435,Billie_Belichick,1582234391,f705z1,Nan,I have delta dental but even with insurance I'm being quoted 1400 for an custom fabricated abutment and crown.  Through some research these numbers from my dentist seem high. I was wondering if anyone had recommendations.,RhodeIsland,Affordable Dentist for Crown
436,436,Styx_Renegade,1582234812,f709rp,Nan,"Also, is there any stations that ONLY do inspections?",RhodeIsland,Inspection Stations that won’t try and rip me off?
437,437,IcecreamCohn31,1582235524,f70gf1,Discussion,"I was born and raised in Rhode Island (currently live in the Boston area). Sometimes I feel like when you're from a place it's harder to think of things to do. Welllll... I wanted to plan a fun / unique Rhode Island day with my BF, who isn't from RI. But here's the catch, he's visited  Rhode Island a bunch already, so not much is new to him. Of course, he's done most of the ""typical"" things- cliff walk, drink dells, beach, gone on boat rides, wander around Providence... So I wanted to plan something a bit more unique/ out of the ordinary. Show him a new side of the state. Any ideas for some less-than-typical things to do in RI (during the winter)?",RhodeIsland,"A totally unique, non-generic, local day in RI..."
438,438,Mosstastic_22,1582245707,f72wef,Nan,"I actually went to URI myself and I can't quite remember when I started looking for off-campus places to live. I may begin listing a rental down the Narragansett area for the academic year but don't know when most students look... 

Any ideas current/ former students?",RhodeIsland,"Current or former URI students, when did you start looking for off-campus apartments for the upcoming academic year?"
439,439,Kinglilly95,1582263988,f76p0k,Nan,"Hello, I'm thinking about becoming a correctional officer. I was hoping that anyone in the area who has worked in the prisons in our state. If you could give me any guidance it would be greatly appreciated. I am just looking for some honest advice from people who have been through it. Specifically, those who have worked in prisons in the state. Thanks in advance",RhodeIsland,Correctional Officer Advice
440,440,Dreadphile,1582287662,f7abx3,Nan,,RhodeIsland,Horror fans in Rhode Island! Join us in Providence tonight for John Carpenter's masterpiece THE THING!
441,441,trabblepvd,1582306998,f7ens1,Nan,,RhodeIsland,Why won't RI protect kids from sexual predators with with custodial authority over children?
442,442,Beezlegrunk,1582313742,f7gbm9,State Goverment,,RhodeIsland,"ProJo: “The company managing staffing for the heavily taxpayer-subsidized RI Convention Center Authority is refusing to disclose the names, job titles, and [total earnings] of an estimated 1,800 employees hired directly out of union halls.” (The article is overtly anti-union but digs into finances.)"
443,443,5_Frog_Margin,1582319427,f7hqw8,Nan,,RhodeIsland,"Bathing beach, Narragansett Pier, Rhode Island 1910"
444,444,HanSwanson,1582324373,f7izc8,Nan,,RhodeIsland,Just a fun pic from Slatersville
445,445,HanSwanson,1582324416,f7izr2,Nan,,RhodeIsland,"Just a fun pic from Slatersville, river was oddly calm today."
446,446,HanSwanson,1582324443,f7izzp,Nan,,RhodeIsland,"Just a fun pic from Slatersville, river was oddly calm today."
447,447,icyfeathers,1582326933,f7jlkq,Cumberland,"Okay, so I've lived in RI 95% of my life and have never seen any craw/crayfish or heard anyone tell me so. I come from a family of fishermen so I definitely didn't believe it when my friend just told me that they saw crawfish years ago in the river in Valley Falls.

Then I googled it and saw that there are four different species that have been found in RI, so far. Has anyone ever spotted any and if you have, where?",RhodeIsland,Areas that have crawfish?
448,448,SeremosDumplings,1582363370,f7qcfs,Nan,"Looking for a dentist in the state that does dental implants, bonus points if they can put you under as I'm a bit dentist phobic.  Cost/distance is not an issue. Ideally someone who's gentle with people that have dental anxiety. Thanks",RhodeIsland,Best Dentist for a dental implant?
449,449,radioflea,1582371105,f7rfd8,East Providence,,RhodeIsland,Only In Rhode Island: DIY Bumper Sticker
450,450,mostcunningplan,1582376673,f7sa50,Nan,I have a few mechanical watches with eta selitta and Seiko 6r15 movements which will need servicing in the future. Does anyone know of a good watch repair or service center which does those? I found a couple of places in north Providence and the reviews for those weren't good. Gave one a try and the experience was poor. I'm located in Providence but would gladly drive a while to get to a good reliable place.,RhodeIsland,Looking for a good watch repair/service center
451,451,wutang2019,1582385175,f7txd5,Nan,,RhodeIsland,When I grow a tail on implode in the next 5 years from drinking poop water it shouldn’t be a surprise.
452,452,wutang2019,1582385269,f7ty2v,Nan,,RhodeIsland,When I grow a tail or implode in the next 5 years from drinking poop water it shouldn’t be a surprise...
453,453,mmmcake,1582388698,f7upz3,Newport,,RhodeIsland,I painted a Ma’s donut.
454,454,jamezbren2,1582389422,f7uw1j,Discussion,There's an L-39 Albatross in aggressor paint parked on one of the general aviation at PVD. Anyone know why?,RhodeIsland,Anyone know why there's an L-39 Albatross at T.F. Green?
455,455,sadspice666,1582396452,f7wlyy,Nan,Hello! I am fairly new to R.I. and hoping to get some suggestions on shops or artists that mostly do traditional style tattoos. I’ve done some research online but would love some personal recommendations!,RhodeIsland,Traditional tattoo artist recommendations?
456,456,safe-word,1582396648,f7wnk0,Nan,,RhodeIsland,East Providence Cinemas Boarded Up and Padlocked
457,457,Avocat2001,1582396944,f7wq9b,Portsmouth,I'm very interested in finding out more about my town through photos so if anyone has any old photos that would be fantastic! Thank you so much in advance :),RhodeIsland,"Does anyone have any old photos of Portsmouth, Rhode Island?"
458,458,xsonixx9,1582406512,f7z2af,Nan,I'm trying to get from Pawtucket to Newton everyday but paying for the train is to exspenive any easier and cheaper solutions,RhodeIsland,Need help
459,459,JeffFromNH,1582410491,f8001r,Nan,,RhodeIsland,Newport Polo on the beach
460,460,rspades,1582417903,f81ogb,Nan,"Hey guys, love your state 💕 worked at a dunks in PVD for a few months and remember hearing a weird term used for a certain type of coffee (may just be what you guys call a regular) but I can’t remember what it was! I had never heard it working for 5 years all over Mass and was told it was a RI thing. Anyone know what I’m talking about?",RhodeIsland,RI term for Dunkin’ coffee?
461,461,ApolloKid,1582477039,f8c3hg,Nan,"I’ve been going to these for years and they’ve all been terrific. I usually go to the chili and chicken wing contests but decided to give this one a shot. There were 8 vendors all in one corner/side of the room, the tickets sold out and the people were packed into this room like sardines. This event was so poorly executed that i don’t plan on going to any of their future events. Anyone else that went feel the same or have a similar experience?",RhodeIsland,Newport Winterfest Mac and Cheese Smackoff
462,462,Mfbackcase,1582482302,f8deui,Nan,Does anyone have or know anyone with kittens? Are there any petshops around with kittens? I'm looking for a pet.,RhodeIsland,Looking for kitten
463,463,Joepotatoes1399,1582501258,f8i3mk,Nan,,RhodeIsland,True
464,464,AngryCrow91,1582504917,f8iwuh,Visitor Question,,RhodeIsland,Whats going on with Rhode island caw caw
465,465,upside88,1582510029,f8k0lj,Nan,,RhodeIsland,PVD airport isn't really in Providence. Clever ad for the city of Warwick in Green Airport.
466,466,upside88,1582510042,f8k0p7,Nan,,RhodeIsland,PVD airport isn't really in Providence. Clever ad for the city of Warwick in Green Airport.
467,467,upside88,1582510082,f8k0zw,Nan,,RhodeIsland,PVD airport isn't really in Providence. Clever ad for the city of Warwick in Green Airport.
468,468,stretchasmile,1582510919,f8k7q8,Nan,,RhodeIsland,52 degrees today and could not resist the beach. Weekapaug.
469,469,ShitsKicksBricks,1582514082,f8kvyf,North Kingstown,"Is there any truth to the rumors, or is it just something dumb that got spread around?",RhodeIsland,Why do so many people say that the Seven Moons restraunt is a front for prostitution?
470,470,Beezlegrunk,1582526025,f8n7ls,Providence,,RhodeIsland,Opposition to the proposed Providence garbage-transfer station on Allen’s Avenue intensifies
471,471,nientedioriginale,1582538355,f8p3bv,Nan,"Does anyone have pictures from bickfords in the early or mid 90s they would be willing to share ?

Ending the night there so often , never once took a photo myself.",RhodeIsland,Bickford's Jefferson blvd ....Chuck !!
472,472,Donny-Arcane,1582548321,f8qpb5,Nan,,RhodeIsland,House fire in Pawtucket right now.
473,473,Beezlegrunk,1582557629,f8spoi,Cranston,,RhodeIsland,RI Republicans see Mattiello as vulnerable and are going after his seat — can they Fung him up …?
474,474,The_Trashcan_Man_Can,1582562195,f8tu6x,Nan,"Sorry for garbage post, ill delete it after a few responses. I did them first week jan, they were accepted 3 weeks ago with a message 'Allow One Week to Transfer Funds."" 

&amp;nbsp;

I have no circumstances (unpaid taxes) that would delay them. Anyone actually get their state taxes back?",RhodeIsland,Anyone get their state tax returns?
475,475,3amoorcarburetor,1582567128,f8v5cn,Nan,,RhodeIsland,how much would car insurance be for an 18 year old university student driving an old honda civic? if anyone can help id really appreciate it.
476,476,mattjnaz,1582571021,f8w6uz,Nan,Does anyone know why there was a burning pile of ash on the side of 95 SB right at exit 10 around 1:15?,RhodeIsland,Fire on 95
477,477,FilmAndFire,1582585850,f90536,Nan,,RhodeIsland,"A Thunderstorm Over Bristol, RI Circa 2010"
478,478,RIpolitics,1582587456,f90jjn,Nan,"Interviews with Sheldon Whitehouse, David Cicilline, Sage Francis, Wendy Schiller, Jorge Elorza, Sunrise PVD, Gene Valicenti, Kat Kerwin, Andy Gresh, Allan Fung, Jim Taricani, Kim Kalunian, R.J. Heim, Mario Hilario, Jim Langevin, Seth Magaziner, Lindsay Iadeluca, Matt Allen, Nirva Lafortune, breaking news/analysis/fun and much more, all conducted from my loft in Elmwood, Providence -&gt; 167 episodes up, new eps every Tues and Fri - The Bartholomewtown Podcast, [RIpodcast.com](https://RIpodcast.com) or search 'Bartholomewtown' whereva you get yr pods.  100% independently operated local media.",RhodeIsland,Rhode Island podcast every Tues + Fri at RIpodcast.com
479,479,mastermontavious,1582589412,f910in,Nan,"Looking for small venues to book a show for two versatile artists with different styles but the same vibe, any recommendations would be an extreme help. Thank you!",RhodeIsland,Any smaller venues booking new wave hip hop/melodic hip hop artists?
480,480,PCP02806,1582596238,f92n5p,Nan,[removed],RhodeIsland,Primary care physician recommendations?
481,481,void206551,1582605185,f94nwa,Discussion,If it's by town/city I'm in Charlestown on the border of Shannock.,RhodeIsland,"How long do Rhode Island building, plumbing, and electrical permits last?"
482,482,NewEnglandHappyMan,1582607306,f953q7,Nan,,RhodeIsland,"Dr John Campbell says we need to start moderating our behavior ""now"". No handshakes, hugs or social kissing for a few months. This will delay the spread."
