,Unnamed: 0,author,created_utc,id,link_flair_text,selftext,subreddit,title
767,767,epiphanette,1584535248,fkovyq,Nan,,RhodeIsland,Rhode Island blood bank is at critical low levels. Now is the time to donate blood if you can do so safely.
768,768,tyler765,1584539544,fkpu2g,Nan,,RhodeIsland,Does anyone know if NA meetings are still going on amid COVID 19?
769,769,Statewrkr2020,1584542927,fkqo9i,Nan,[removed],RhodeIsland,Rhode Island State Agencies implement Work from Home policy but are denying most requests
770,770,Killjoy4eva,1584543998,fkqyes,State Goverment,"# *** **Notes from Wednesday, March 16 - 12:00pm** ***

***press conference is upcoming***

*****

#DONATE:

#[COVID-19 Recovery Fund](https://www.uwri.org/2020/03/covid-19-response-fund/) 

# [GO DONATE BLOOD](https://www.ribc.org/)

*****

Notes from previous press conferences: 

* [Tuesday, Match 17th](https://www.reddit.com/r/RhodeIsland/comments/fk8684/tuesday_317_notes_rhode_island_covid19_press_conf/)

* [Monday, March 16th](https://www.reddit.com/r/RhodeIsland/comments/fjmgbp/monday_316_notes_rhode_island_covid19_press_conf/)

* [Sunday, March 15th](https://www.reddit.com/r/RhodeIsland/comments/fj6m5y/sunday_315_notes_rhode_island_covid19_press_conf/)

* [Saturday, March 14th](https://www.reddit.com/r/RhodeIsland/comments/fillov/notes_rhode_island_314_covid19_press_conf_w_gov/)

* [Friday, March 13th](https://www.reddit.com/r/RhodeIsland/comments/fi41yj/notes_from_todays_rhode_island_covid19_press/)


*****",RhodeIsland,Wednesday 3/18 - Notes: Rhode Island - COVID-19 Press Conf. w/ Gov. Raimondo
771,771,The_Corona-Virus,1584551858,fkt6v3,Nan,,RhodeIsland,"A message from Paul, at the Preserve Club and Residence in Richmond RI. “Safe and secure.... and corona free air”"
772,772,randomus3r00,1584565291,fkx3p0,Discussion,I work at a restaurant that closed and applied for UI and it says that I must provide documentation or searching for 3 full time jobs / week.  I’m a full time student and work weekends and applied to get by while the restaurant is closed.  Did I apply to the wrong department? TIA,RhodeIsland,Is the work search requirement for temporary unemployment due to COVID-19 still being honored?
773,773,ppiazza98,1584569864,fkyen0,State Goverment,"Does anyone know if Gina Raimondo is taking questions from the public relating to the virus? If so, where can we submit questions?",RhodeIsland,Questions about Corona Virus
774,774,DJShadow,1584570749,fkynhd,Nan,,RhodeIsland,Rhode Island Ranked #1 Most Aggressive State Against the Coronavirus
775,775,FawmahRhoDyelindah,1584575383,fkzwhq,Nan,[removed],RhodeIsland,Wicked nice Rocky Point t-shirt
776,776,brandi_kandi,1584578264,fl0mma,State Wide,,RhodeIsland,Anyone been to any psychics in RI? Recommendations? Any I should stay away from?
777,777,eyoj8270,1584578388,fl0nu6,Nan,What do you think?  Is a shelter in place in our future?,RhodeIsland,Odds of shelter in place?
778,778,CannabisaurusRex401,1584583650,fl1yye,State Wide,I'm assuming the DMV is closed?  Can it all be done online?,RhodeIsland,What's the process for license renewal during the quarantine?
779,779,soxfan1125,1584585080,fl2b3o,Nan,"What procedures are in place to get tested if one is displaying symptoms (everything except fever, with deep chest cough and body aches) and possible contact with positive person (3 individuals in work place building, not company)?

Individual in question does not have primary care doctor, nor can afford emergency room visit. They have self-quarantined and isolated since first symptoms and just learned of positive tests in the work place. Individual is mid 20s with history of respiratory illness.",RhodeIsland,COVID-19 testing?
780,780,Livinginasociety82,1584587597,fl2wkf,Nan,Thanks for your compassion and understanding during these hard times Governor Raimondo.,RhodeIsland,Gina not extending Sales Tax deadline this month. This is ultra helpful to all us small biz owners.
781,781,travadera,1584592039,fl3w8m,Nan,,RhodeIsland,"Providence Mayor Jorge Elorza: Lap dances ‘irresponsible’ amid coronavirus outbreak: Elorza said a strip club was among six businesses that allegedly violated his coronavirus orders. ""There was no 'social distancing' between some dancers and patrons at one local strip club over the weekend."""
782,782,NicksBricksYT,1584596959,fl4vtc,Nan,,RhodeIsland,Meanwhile....Coronavirus
783,783,gangjigang,1584603136,fl60oo,Nan,,RhodeIsland,"Does anybody need Cup and Extractor Blade? I can give you for free. Send me a message, if you need it.[US Only]"
784,784,jIBBS149,1584613395,fl7sai,Nan,If you are sick/scared  to go outside due to the virus i can deliver your goods! All i ask is that you pay for the goods and i will drive anywhere in RI to deliver your goods. Comment your phone number or message me and i will be in contact with you in hours.,RhodeIsland,Need goods? I will deliver
785,785,UnivrstyOfBelichick,1584621040,fl994c,Nan,Looking for an outdoor rifle range for target shooting/plinking. Do I have any options in Rhode island or do I have to jump the border? Thanks.,RhodeIsland,Outdoor rifle range
786,786,Upuser,1584622055,fl9grd,Nan,,RhodeIsland,"India Restaurant offering free meals to emergency and healthcare workers, also offering $11 grab-and-go meals"
787,787,bradagman,1584626718,flajw7,Nan,,RhodeIsland,Restaurant City Providence - Free Disposable Gloves
788,788,thrush77,1584629892,flbd7x,Nan,,RhodeIsland,Our own Senator Whitehouse co-sponsoring this controversial bill.
789,789,hypochondriac200,1584637185,fldflv,Nan,,RhodeIsland,I will not stand for this Rhode Island erasure
790,790,CellarDarling,1584637483,fldiw6,Nan,,RhodeIsland,URI suspends all face-to-face campuses on all University of Rhode Island campuses for the Spring semester due to COVID-19
791,791,RandomChurn,1584638690,fldvit,Nan,"My best friend is trying (yet again 😆🤣😂) to weasel out of it. But her brother just had his colon removed for a possibly-genetic issue). I say she has to go. She says, “Later!” What say you, RI Redditors?",RhodeIsland,"Would You Go For a Colonoscopy (Dr’s Office, Not Hospital)?"
792,792,00musdan,1584640684,flegnu,Nan,,RhodeIsland,Go to the brink for Link
793,793,Bjarki56,1584641612,fleqgn,Nan,,RhodeIsland,Diocese of Providence offering Stop &amp; Shop gift cards to those out of work | News Break
794,794,Kate989,1584643234,flf6u5,Nan,"Like many of you, I'm looking at being laid off entirely for the next few weeks, but there is a chance they'll keep me on for a few hours a week. I was trying to find an answer to the maximum number of hours per week that I could work and supplement my income with unemployment benefits, but I keep going in circles with the info I'm finding online, and the phone lines for unemployment are jammed. Does anyone have any insight to how this works? TIA.",RhodeIsland,Working part time while on Unemployment
795,795,LongitudinalSpam,1584643256,flf712,Nan,[removed],RhodeIsland,Thursday 3/19 - Notes: Rhode Island - COVID-19 Press Conf. w/ Gov. Raimondo - Bootleg edition
796,796,unhpian,1584647171,flgdz1,Nan,,RhodeIsland,"Despite promoting social distancing, closing schools, restaurants, and prohibiting gatherings greater than 25 people, thousands of state employees are being required to show up to their crowded workspaces to ensure non-essential services remain ""fully operational"""
797,797,sweetlittlebabies,1584648181,flgp6u,Nan,,RhodeIsland,RI Restaurants with Online Ordering and Take Out
798,798,Seasnek,1584648504,flgspv,Nan,,RhodeIsland,"If you have physical resources to share, it feels good to offer them out but you might be putting yourself and others at risk of spreading, Please reach out to an organization (will list in the comments) that have safety protocols in place to take your supplies and distribute them."
799,799,ChazzleMcRazzle,1584651219,flhlws,Nan,"Thats one of the unfortunate things about living in RI is that if they close liquor stores we cant get the alcohol at supermarkets, Walmarts, or convenience stores/gas stations. Do you think thats why they havent closed them yet is because you cant get alcohol anyplace else?",RhodeIsland,Do you think they will close liquor stores ?
800,800,Ragnaroknight,1584651597,flhpzv,Discussion,"In the event of a total shutdown, without these crucial employees showing up to work people are not going to be able to get essentials.They are already overworked from constant hoarding, probably getting close to the edge of snapping.

We need to do what we can for these people, and really most people who are still forced to work during this outbreak.",RhodeIsland,We should declare Grocery and Pharmacy workers as emergency personell following Minnesota and Vermont
801,801,whatisbrit,1584656710,flj6z0,Nan,This whole pandemic is starting to get ti me and I think I'd like to acquire the means to protect myself.,RhodeIsland,Does anyone know where I could obtain my blue card for owning a gun?
802,802,CellarDarling,1584657406,fljdt5,Nan,,RhodeIsland,"URI confirms first confirmed case of COVID-19, individual who is a staff member"
803,803,Both-Boat,1584659052,flju4x,Nan,Every random thought related to covid doesn't need a new thread. It would be a nice place to shoot the shit and talk about what's happening.,RhodeIsland,Mods will you please consider a stickied coronavirus discussion thread?
804,804,FlyingAvatar,1584665491,fllkru,Nan,[removed],RhodeIsland,Notes: Rhode Island - 3/19 - COVID-19 Press Conf. w/ Gov. Raimondo
805,805,wishihadaps4,1584670876,flmx1k,Nan,I don't see people paying attention to this thing in RI so I might have a chance to get some masks. Who sells them?,RhodeIsland,Where to get face masks?
806,806,wishihadaps4,1584670876,flmx1o,Nan,I don't see people paying attention to this thing in RI so I might have a chance to get some masks. Who sells them?,RhodeIsland,Where to get face masks?
807,807,Doomicvs,1584672699,flnd6n,State Wide,,RhodeIsland,"Survey Regarding Personal / Public Health, The Community, and Metaphysical Beliefs"
808,808,Alindquizzle,1584678530,floq20,Nan,"Anyone know where I can sell some spare wires, power banks, and a broken iPhone?",RhodeIsland,Scrap electronics
809,809,iyeetedurmum,1584681314,flpbof,Nan,fuck you rhode island,RhodeIsland,fuck you
810,810,LilPeanutt,1584687994,flqn49,Nan,"Does anyone else have memories of this store? I believe it was Pre-Claire’s. I remember my nanny (grandmother, always called her nanny) took my sister and I to the Canary and the Elephant and she treated me to one of those giant pins. It was of Jordan from NKOTB. 

I loved Jordan.",RhodeIsland,It’s a bit past 3am and I’m remembering a store in the RI mall: The Canary and the Elephant....
811,811,kfl85,1584702800,fltafm,Nan,If you have travel planned in the near future you might want to revisit your policy and see what is covered... Seems like the sh\*tbag insurance companies per the usual are trying not to cover people during this time.  [https://thehill.com/homenews/house/488337-house-panel-demands-explanations-from-travel-insurance-companies-not-covering](https://thehill.com/homenews/house/488337-house-panel-demands-explanations-from-travel-insurance-companies-not-covering),RhodeIsland,Heads up about Travel Insurance
812,812,MasonicGnat420,1584708056,flud11,Nan,Need to get this fixed ASAP,RhodeIsland,Tooth emergency! Any dentists open?
813,813,The_ThunderB1rd,1584709705,fluqbk,Nan,"For a pca.  People here can be jerks, but please, just don’t.  I really want a pca to help me when I go out to do something fun.  Please , understand that I would like someone younger, and that there wouldn’t be an interview, for a while.  The virus is scaring the shit out of me.  For help, I need help getting around, and in the bathroom.  It’s embarrassing, but I can’t wipe myself.  I need someone to help me so that I can go out and do life.  
P.s.  This a paying job.  Just not a lot.  
P.p.s.  I’d prefer to work with a woman, I’d be more comfortable with a woman for when I get emotional.  Please pm me if you’re interested.",RhodeIsland,I don’t know where to look
814,814,UpwardSpiral00,1584710726,fluz5z,State Wide,"Hoping to start an information thread here for folks in need during this trying time.

If you know of stores or other businesses (with specific locations please) that have supplies that people can go and purchase, please post in the comments. Meat, toilet paper, cleaning products, non-perishable foods, and probably a whole lot of other things I'm not thinking of. None of us need to be exposing ourselves any more than is necessary, and if you have info you can share, it will be beneficial to all of us in the long run.

Also, if you can think of ways that I can improve this post, please let me know. Thank you all, and please stay safe and well.",RhodeIsland,Grocery Shopping - Leads on scarce products
815,815,boojiprime,1584712315,flvd2k,Nan,,RhodeIsland,Assembled some LIVE Global Coronavirus Interactive Dashboards
816,816,Killjoy4eva,1584714848,flvzx0,State Goverment,"# *** Notes from Friday, March 20 - 1:00pm ***

***press conference is upcoming. this thread will be updated as it happens***



*****
#COVID-19 Hotline: 401-222-8022
*****
#DONATE:

#[COVID-19 Recovery Fund](https://www.uwri.org/2020/03/covid-19-response-fund/) 

# [GO DONATE BLOOD](https://www.ribc.org/)
*****
Notes from previous press conferences: 

* Thursday, March 19th - No notes, sorry....

* [Wednesday, March 18th](https://www.reddit.com/r/RhodeIsland/comments/fkqyes/wednesday_318_notes_rhode_island_covid19_press/)

* [Tuesday, Match 17th](https://www.reddit.com/r/RhodeIsland/comments/fk8684/tuesday_317_notes_rhode_island_covid19_press_conf/)

* [Monday, March 16th](https://www.reddit.com/r/RhodeIsland/comments/fjmgbp/monday_316_notes_rhode_island_covid19_press_conf/)

* [Sunday, March 15th](https://www.reddit.com/r/RhodeIsland/comments/fj6m5y/sunday_315_notes_rhode_island_covid19_press_conf/)

* [Saturday, March 14th](https://www.reddit.com/r/RhodeIsland/comments/fillov/notes_rhode_island_314_covid19_press_conf_w_gov/)

* [Friday, March 13th](https://www.reddit.com/r/RhodeIsland/comments/fi41yj/notes_from_todays_rhode_island_covid19_press/)

*****

*Disclaimer: I am not a journalist nor am I a health professional. I am simply a citizen attempting to break down the Governor's and RIDOH daily press briefing the best I can and make it easily digestible.*

*I am not affiliated with the state or any of the corporations or non-profit organizations that may be linked in this posting.*",RhodeIsland,Friday 3/20 - Notes: Rhode Island - COVID-19 Press Conf. w/ Gov. Raimondo
817,817,cherrywine1234,1584722231,fly2an,Nan,,RhodeIsland,Julian's PVD offering you a gift card in the same amount as your donation to their gofundme - ALL PROCEEDS GO TO STAFF. The restaurant closed on Sunday until further notice for safety of staff and the community.
818,818,GrapeRello,1584725546,flz1c8,Nan,,RhodeIsland,Anyone else been getting this message for days when checking on unemployment status?
819,819,JuniorPomegranate9,1584727388,flzked,Nan,"It's packed, workers are not wearing gloves, people are there with their kids. Stop going out, people.",RhodeIsland,Providence Whole Foods not practicing social distancing
820,820,Jezebez,1584727456,flzl5a,Nan,,RhodeIsland,Virtual Piano Bar - Saturday Night on FB live at 8pm.
821,821,eternashine,1584732600,fm13qm,Nan,"My 8 year old was bitten by a dog, had to go in the rescue to the hospital.  Any recommendations for a lawyer? Don't want drama, just someone who will get it done and I don't want to pay a retainer, only pay if we win.",RhodeIsland,Lawyer for a dog bite?
822,822,GreatStreetsFighter,1584736834,fm2brn,Discussion,"Like, say, Tiffany’s Jewelry (I know someone who works there)... they’ve got like 700 employees all in one building and they are literally the farthest thing from essential. I know folks need to work, but wouldn’t closing down businesses like these for a couple of weeks help slow the spread of the virus? 

How does one go about reporting places like this? Is that even reasonable or ethical to report them? Is that even a thing?",RhodeIsland,Why are places with 500+ employees still open?
823,823,Beezlegrunk,1584739466,fm32jq,State Wide,,RhodeIsland,"The RI Department of Environmental Management, citing “new reports of damaged pump stations and overwhelmed screening facilities in Rhode Island wastewater collection and treatment systems,” for the second time this week urged Rhode Islanders to stop flushing disinfectant wipes down their toilets."
824,824,TheRealNateC,1584740524,fm3cz9,Discussion,"Has anybody heard if there would be any action from the government (local, state, federal) regarding adjusting rental payments for those who’ve lost work to Coronavirus? I’ve heard people mention different rumors but have found no actual sources for what could be coming. Thanks!",RhodeIsland,Rent Payments
825,825,PalatioEstateEsq,1584741857,fm3q7x,Nan,,RhodeIsland,"People can't pay their rent, but I'm glad we got to save these $2.00."
826,826,mcsteam98,1584745716,fm4rsk,State Goverment,"Anyone heard of any rumors of a shelter in place within 72 hours in spite of what Raimondo said? Asking since my mom mentioned it a few hours ago and I'm not exactly buying it. And if it's legitimate, anyone have any sources?",RhodeIsland,Rumors of shelter in place order in spite of what governor said???
827,827,SmirkyGraphs,1584748555,fm5j8s,Nan,"Hello everyone,

I created a twitter bot to tweet out daily updates of COVID-19 in Rhode Island called @RI_COVID19. The bot tweets out after the RIDOH sends its digital press briefing usually around 6pm.

The tweets format is [measure]: [value] (+-[difference prior day]). 

The ""total"" is [pending] + [negative] + [positive].

If you're more of a visual person I've been updating a Tableau graph regularly [here](https://public.tableau.com/profile/smirkygraphs#!/vizhome/RhodeIslandCOVID-19Cases/ri-covid-19).",RhodeIsland,Rhode Island COVID-19 Twitter Bot
828,828,DS617,1584750426,fm60fs,Nan,"Hello all,

I have seen a few posts with questions and myself found the process quite a pain. I figured I'd do a brief guide, and help out with any questions if possible. DISCLAIMER I DO NOT WORK FOR THE STATE, just someone also laid off this week :(

First start here: https://dltweb.dlt.ri.gov/UI-INET-STAT/IntroPage.aspx 

Sign up on this site and make sure to choose layoff or loss of job due to covid 19 - the application consist of your personal information typically used for taxes. Info on your employer, salary, and contact information. Upon completion you will receive an e-mail typically in a few hours saying that your application has been received and being processed. This says within 48 hours but claims have been taking longer due to large numbers, I applied on Monday afternoon and didn't get anything back until yesterday.

So you will see another email that says if it is processed, once it is processed they send you a very vague page with some numbers you need to write down, and the link for payments ( If you do not get this then you may have to call). 

On the email that comes with confirmation there will be a link that takes you to a page with your claim info, it will tell you when you need to login to collect first payment, you have to go to the teleserve website and create a pin, but don't try to claim yet as it will just tell you to call in as you do not have a payment to collect until they say it starts.

I was quite confused by the whole process and was not in the best place while trying to figure it all out. So hopefully this helps, my own thoughts on why this may be taking longer are essentially they are reaching out to your former employer, asking what your weekly rate was, and if you got severance in order to setup your payments. 

So if you are seeing a long turn around they may be having trouble reaching your employer, or may be waiting for the severance info to calculate payments, as companies lay off larger amounts of people this obviously makes this whole process take longer. The website did crash multiple times this week, and is getting slammed so I think patience will be key thru this process.

Worst case you can call them, they are very friendly and understand this is a really shitty time for the people making claims so just be polite and let them know you have been waiting for +48 hours and just want to make sure there isn't something else they need from you.

Also in the meantime go to EmployRI.org and make a resume and account so you can stay in the guidelines, typically you are supposed to apply for 3 jobs a week. I do believe for Co-vid 19 claims this has been waived but never hurts to have a post out there to snag something especially since most companies doing layoffs may cease to exist, or will at least not be able to rehire until things settle down, and if for some reason they do not waive this you can have a backup plan ( on the flip side I applied for 3 jobs this week and was instantly turned down by the auto HR programs so again I don't think they will expect much in this regard)",RhodeIsland,Step by step guide for applying to Unemployment due to Coronavirus in RI
829,829,AnxiousMillennials,1584758167,fm7vqr,Nan,I work part time and get paid biweekly and will only have enough for rent if it’s true that we’re on the verge of being shut down completely possibly next week. I only know this since my boyfriends mom works at the hospital and have connections with police and others. I only have $20 to spend on groceries which won’t last me a month and have been reading posts about places in Boston giving out free stuff so I was hoping places in RI are doing the same? Churches maybe?,RhodeIsland,Any places giving out free food?
830,830,Lunaesa,1584774433,fmb4c3,Nan,"Hey everyone, let's consolidate all of the COVID-19 updates into one Megathread. Post official updates here.",RhodeIsland,RI Coronavirus Updates
831,831,smokejaguar,1584783121,fmcgwq,Nan,,RhodeIsland,"Due to high demand, Raimondo issues executive order extending firearm background check from 7 days to 30"
832,832,BubblySuccotash,1584796019,fmeow0,Nan,"With the lack of N95 masks, some healthcare workers are permitted to use sewn masks as a last resort.  I'd like to make some to donate.  Does anyone know if there is a place in RI that is accepting them?  

Side note for non-sewists: 'hand sewn' is the term being used for masks that are homemade, even if they are sewn with a machine. They are washed by the donation recipient before use.",RhodeIsland,Are there any healthcare institutions in RI accepting donations of hand sewn masks?
833,833,GrumpyOldGam3rDad,1584803951,fmgimp,Nan,,RhodeIsland,RI DMAT has a Corona testing site set up behind Dan's Place off of exit 5 in West Greenwich. FYI
834,834,Cherry578,1584807771,fmhimq,Nan,A friend told me Rhode Island might shut down tomorrow and I was just wondering if this is true.,RhodeIsland,Will Rhode Island be shutting down soon?
835,835,wutang2019,1584808978,fmhubr,Nan,,RhodeIsland,Price gouging begins at America’s Food Market.
836,836,Antonio9photo,1584810216,fmi6jf,Nan,,RhodeIsland,"Video showing how far your breath disperses when you cough, whilst using various types of protection."
837,837,subnub99,1584810434,fmi8rl,Nan,"Basically it's been pretty slow at work, and i've been bored. And I have also been trying to build my resume to become a web developer. So I wanted to help a local business out by upgrade their current website free of charge. 

The rules do state ""No Solicitation"",  but like I said this is a free service, but if this is solicitation I apologize and please remove this post!

I wanted to help a local business, so being based in Rhode Island is greatly prefered, also you will of course need to pay for hosting, but you probably already do this. 

I do have some projects you can check out to see my skill set, my web-portfolio is here: [https://subnub.github.io/#/](https://subnub.github.io/#/)

I also did a mock of me updating Coventry Animal Hospitals website, but they never answered so it is unfinished: [https://coventry-animal-hospital-demo.herokuapp.com/](https://coventry-animal-hospital-demo.herokuapp.com/)

My biggest project is myDrive, a Google Drive clone I made myself, which is pretty popular on Github (over 800 stars, and 25k views).

MyDrive Demo: [https://mydrive-demo.herokuapp.com/](https://mydrive-demo.herokuapp.com/)

MyDrive Github: [https://github.com/subnub/myDrive](https://github.com/subnub/myDrive) 

If you're interested, please either leave a comment, DM me, or email me at kyle.hoell@gmail.com",RhodeIsland,"Anyone need, or know anyone who would want a free website update?"
