,Unnamed: 0,author,created_utc,id,link_flair_text,selftext,subreddit,title
0,0,Beezlegrunk,1577769042,ehyaks,State Goverment,,RhodeIsland,"Two East Bay lawmakers will re-introduce the Safe Drinking Water Act to establish state standards for regulating industrial chemicals — including PFOA/S, and related compounds linked to cancer, Chromium-6 (which Erin Brockovich traced to cancers in California) and 1,4 dioxane — in Rhode Island water"
1,1,The_Trashcan_Man_Can,1577807435,ei4j0b,Nan,Title says it all. Low stakes is perfect. Looking for a regular poker group. Also thinking of starting one if enough people are interested; already heard interest from 2-3 people. PM me! Thanks!,RhodeIsland,Any Poker Groups out there?
2,2,york100,1577811557,ei5gwm,Nan,,RhodeIsland,How Your Christmas Tree Can Help Protect Rhode Island's Rivers
3,3,Beezlegrunk,1577815454,ei6e2s,State Goverment,,RhodeIsland,"Gov. Gina plans to propose the same gun-control bills in the upcoming legislative session that she and AG Neronha sought last session — including banning so-called “assault-style” weapons, high-capacity magazines, and guns on school grounds — which will likely be blocked again by Democratic leaders."
4,4,chuckstaton,1577817443,ei6urz,Nan,,RhodeIsland,Monty Are I Returns - Providence Monthly - by Chuck Staton
5,5,Damn_You_ScubaSteve,1577819890,ei7f8q,Nan,Anyone know a good butcher or meat market in the Bristol/East Bay area?,RhodeIsland,Best butcher in East Bay?
6,6,cryssyluvsbrian,1577824018,ei8c9c,Nan,,RhodeIsland,What is everyone doing tonight? Looking for something to do. Yeah i know its last minute but got a cute dress i want to rock lol.
7,7,uh-p0stle,1577829189,ei9fbs,Nan,Just looking for a recommendation. I keep going to the dealership for repairs but it's getting pricey. Looking to see if anyone has any type of referral or anyone they would recommend to work on our vehicles. If it matters we have a Honda and a Toyota.,RhodeIsland,Honest mechanic in North Kingstown
8,8,internetrabbithole,1577851124,eidmze,Nan,,RhodeIsland,Will be interesting to see what the next decade brings and not just for sports. Happy New Year Neighbors!
9,9,ChazzleMcRazzle,1577856284,eieihb,Nan,"Did they not do well ? Also what is there now ? Last time I looked, whatever was there wasnt open yet.",RhodeIsland,What happened to Johnny Rockets in Cranston (Chapel View ?)
10,10,pinkpookiebear,1577858943,eiey06,Tourism,"My family of 12 is going to Rhode Island the week after July 4th! I’m not sure which location to rent a home for the week and was hoping to find suggestions. 

My family is really big on pretty oceans/beaches where we can walk barefoot on the sand, go fishing, and take our catch home to eat! 

Do you have a suggestion which part of Rhode Island I should look at to stay?

Also what are your favorite places for:
- Restaurants/Food
- Shopping
- Fishing 
- Favorite Architecture / Mansions
- Attractions/Orchestra/Museums/Zoos/Aquariums/ Historical Areas/Interesting Places?",RhodeIsland,Rhode Island Visiting Suggestions?
11,11,smokejaguar,1577890634,eij4vv,Nan,,RhodeIsland,"Business booms, North Providence sets itself up for future"
12,12,thetaoofroth,1577896409,eik73y,Nan,,RhodeIsland,"Good article about RI getting smaller, and maybe not putting a landfill on the beach."
13,13,sesto,1577938371,eit44w,Nan,,RhodeIsland,Pawtucket city councilor accuses colleague of racist comments
14,14,smokejaguar,1577970478,eiy0z3,Nan,,RhodeIsland,Pawtucket police arrest 2 in woman's killing
15,15,missiemiss,1577973124,eiyh62,Nan,Hey there RI - I was wondering if anyone knew about a local rag house? (A rag house is where there is bulk donated clothing like t-shirts and jeans that can be picked through for buying) Like the old garmet district they use to have in providence - I’m willing to drive out of state if needed to like MA or CT. Thanks for the help!,RhodeIsland,Local rag houses?
16,16,Nasr1107,1577986552,ej1a8h,Nan,[removed],RhodeIsland,Need a help to find apartment
17,17,[deleted],1577990433,ej26l7,Nan,[deleted],RhodeIsland,This piece of shit.
18,18,smokejaguar,1577998367,ej43dx,Nan,,RhodeIsland,Health insurance mandate takes effect in Rhode Island
19,19,Beezlegrunk,1577999616,ej4ej6,State Goverment,,RhodeIsland,"GO GINA! ""When RI lawmakers ousted two state Health Dept. officials from the board that helps oversee its emergency medical services system, Gov. Raimondo replaced one of them with a retired North Providence fire captain who has a criminal history and has been disciplined by state health regulators"""
20,20,IdaKhuntski,1578002551,ej53n0,Nan,,RhodeIsland,Psychotic Pawtucket couple celebrate quickie engagement with murder and selfies
21,21,kfl85,1578060291,ejfszj,Nan,"Probably still going to lose a seat in the house come the 2020 census results.

 [https://www.providencejournal.com/news/20191230/rhode-islands-population-grew-slightly-in-2019](https://www.providencejournal.com/news/20191230/rhode-islands-population-grew-slightly-in-2019)",RhodeIsland,Rhode Island’s population grew slightly in 2019
22,22,PodgeOC27,1578073585,ejiui0,Nan,"How reliable are Uber in West Warwick/Coventry for getting to work in the morning?

Moving to Rhode Island at the start of February.

Thanks.",RhodeIsland,Uber in West Warwick/Coventry
23,23,hammertheisland,1578084426,ejlhd8,Nan,,RhodeIsland,"Hello, I'm from England and I'm still in a band called Rhode Island."
24,24,NYCNark,1578088284,ejmegc,Nan,,RhodeIsland,"Rhode Island for Bernie Kick Off Rally, Jan 11"
25,25,[deleted],1578094409,ejnt3m,North Providence,[deleted],RhodeIsland,Idk if anyone really cares but the Burger King on Mineral Spring closed up shop for good. No more onion rings.
26,26,Katidid24,1578096766,ejocpc,Nan,,RhodeIsland,Anyone down for karaoke tomorrow night? It would be fun to do an impromptu meetup!
27,27,sewall-graham,1578116148,ejsfql,Nan,,RhodeIsland,"Watch Hill Today, I Love This Little State..."
28,28,Beezlegrunk,1578153834,ejyd43,State Goverment,"&gt;“For decades the RI House and Senate leadership have used **gerrymandering** *to stifle competition within their caucus* and between the two major parties. *The result has been some of the most gerrymandered state legislative districts in the United States*.
&gt;&gt;
&gt;“Before the next round of **redistricting** begins in 2021, we believe the people of Rhode Island deserve the chance to take the process of redistricting out of the hands of those who benefit most; the politicians.”

— Common Cause Rhode Island executive director John Marion, in the *Providence Journal*",RhodeIsland,Another way the RI political system is broken
29,29,NameMan1234321,1578157017,ejz1zp,Nan,"Hoping to make some lampredotto, but abomasum has been tough to find.",RhodeIsland,Anyone know local farms that sell offal / tripe / sweetbreads?
30,30,[deleted],1578171368,ek2cgt,Nan,Nan,RhodeIsland,Has anyone noticed how bad the pollution is in Rhode Island? Are you all brainwashed or something? Wake up.
31,31,SunEyedGirl3,1578186854,ek5qcf,Nan,"This is not my dog or my post. I've just been asked to share to help find her dog's siblings and hopefully get a match to save her doggy! 

HELP NEEDED.

Eliot has started chemotherapy for lymphoma. This does not lead to a cure, only a 6-12 month remission at best. The only real chance of a cure is undergoing a bone marrow transplant from a 100% matching donor. Eliot’s breeder still has her mother, and the vets have said that our best shot at finding a match is having as many of her full siblings tested as possible, as each has a 25% chance of being a full match. Without a match the chances of this procedure working are around 18%. With a match they shoot up to 50-60%. The donor procedure is extremely low impact, non-invasive, and we would cover all costs. The initial ask is just a blood test to check for a match.

THE ASK: 
We want to locate as many of Eliot’s littermates as possible and have them tested to see if they are a match. Eliot comes from Chris Sousa’s Sousa’s Goldens in Tiverton RI. Her litter was born May 19, 2015. Her mother was a light colored golden named Rosie and her father was Tangloft Party Like a Rockstar. Dogs from this litter were likely picked up in late June or July 2015. 
Please share this as widely as possible (especially if you live in Rhode Island) and have any sibling parents contact us at charliehastwomoms@gmail.com or DM on here.

https://imgur.com/a/WXAlOt5",RhodeIsland,"Dog owner needs help, Looking for siblings of her pup"
32,32,Classic_Quote,1578221146,ekbj3q,Nan,[removed],RhodeIsland,New friends / wants to hangout?
33,33,xsonixx9,1578230644,ekcynx,Nan,I recently moved from a different state and I was wondering how long do I have to wait to be egible for our of state tuition form what I read it says 3 years and that's too long I was planning on starting in January but after being charged 5k just for one semester I was gonna hold off till summer.,RhodeIsland,OUT OF STATE TUITION
34,34,waheifilmguy,1578246288,ekg8dd,Nan,"Seems like the folks I've gotten bids from are jacking the estimate way up. 

It doesn't seem like one day job installing a $1000 unit should cost 5 times that.  

Anyone have a straight shooter in the area they can recommend?",RhodeIsland,I need an affordable plumber to replace a tankless heat/hot water unit in Cumberland
35,35,Styx_Renegade,1578251226,ekheji,Nan,My friend has a Wacom that needs fixing and we were going to see if we can go to 3rd party instead of shipping it to Wacom themselves.,RhodeIsland,Is there any 3rd party drawing tablet repair shoos around? Or maybe even CT or Mass?
36,36,wdale86,1578259646,ekjbjl,Nan,Best spots for Trivia in the greater Providence area?,RhodeIsland,Trivia
37,37,squixxz,1578260091,ekje6a,Nan,"Ever since I was in Michigan on a trip I fell in love with the stuff, it seems pretty much impossible to find in my area though, does anyone here know if there is any stores that may carry it locally? willing to go pretty much anywhere in RI/MA/CT",RhodeIsland,Faygo around RI/MA Area?
38,38,DickBentley,1578265072,ekkiq4,Nan,"I’m not exactly sure if this is the right place for this but I’ll give it a shot anyway.

So I’ve got some free time on the weekends and I’d like to give back to the community. This state and the people here have been real good to me and I only want to repay the favor. Just have no idea where to start. 

Anyone have any experience with volunteer work or where to point me?",RhodeIsland,Volunteer Work
39,39,Rolyat_Emad,1578280347,eknw2h,Nan,,RhodeIsland,Chafee files to run for president again
40,40,robloxianfriendo,1578290141,ekpr8m,Nan,,RhodeIsland,was there just an earthquake?
41,41,geekgirl717,1578311608,ekt5k0,Nan,"I have a pair of Timberland boots where the glue on the sole has come undone.  They looked as though they were stitched, but silly me!  Anyway, I like them enough to want to keep them and am wondering if anyone could recommend someone to go to? 

Thanks in advance!",RhodeIsland,Cobbler?
42,42,Beezlegrunk,1578322469,ekv4w4,State Goverment,,RhodeIsland,“It’s Time For RI's General Assembly to Raise the State’s Minimum Wage”
43,43,JSchecter11,1578327374,ekw7ax,Nan,"My sister loves pigs, and I want to surprise her with a mini pig meet &amp; greet as a gift. Does anyone know a place within reasonable distance of Narragansett (or someone that would bring pigs to Narragansett?)

Thanks in advance",RhodeIsland,Mini Pigs petting zoo/rental?
44,44,NOT_So_work_related,1578331642,ekx74m,Nan,"Hi r/RhodeIsland,

Does anyone have recommendations for an auto remote starter installation shop?  Groupon is displaying numerous choices.  I've checked out some of their websites and a number of them don't give me the ""warm fuzzies"".

Anyone with experiences they wish to share?

Thanks.",RhodeIsland,Recommendation for auto remote starter installation
45,45,supa_nibba,1578342361,ekzqlt,Nan,"So I’m dumb and got pulled over today. I received my second ticket in the span of 12 months, but my first was dismissed with community service. I was only marked for 5 over. Do you think the judge will be lenient again or do you think I have to pay and receive an ass whooping from my parents due to the increased insurance? Any advice would be appreciated.",RhodeIsland,Speeding ticket help me lmao
46,46,york100,1578347292,el0xlu,Nan,,RhodeIsland,Growing group of states back Rhode Island's climate suit vs. Big Oil
47,47,pumpkindose,1578371480,el6b73,Nan,"Young female in search for a temporary job. Been applying to jobs on Indeed etc. for the past two weeks and stressing out. I’m looking to do Lyft/Uber if my finances do get into critical condition, but not working is driving me crazy. I have a bachelors degree in music and a masters that I am currently pursuing in accounting. 

I will take a job in any field for the time-being. Thanks for taking your time to read this.",RhodeIsland,Urgent job
48,48,WolfKingJS54,1578397265,elagnw,Nan,Are dash cams legal in the State of Rhode Island? I just got one for Christmas but know I don't know if it's legal for me to put it in my car.,RhodeIsland,Dash Cams
49,49,gmt87,1578402943,elbexw,Nan,,RhodeIsland,"This project is such nonsense. It’s not even MLS soccer, which isn’t even good anyways. It’s bush league soccer that no one should have to pay to see. Why not entice the Revs? What about lacrosse? And the project is expected to generate enough revenue to pay back the State tax break? What. A. Joke."
50,50,BookwormAP,1578420813,elf9c3,Nan,"Baby was born about a week or so ago...does anyone know if we should apply for TDI or TCI, or both? TCI says you have to pay within 30 days but which one pays more?",RhodeIsland,TDI vs TCI
51,51,ValencourtMusic,1578425691,elgf3y,Nan,,RhodeIsland,Smithfield: Mystery tenants finally revealed for former Benny’s site
52,52,amorellee,1578430405,elhkau,Nan,Does anyone know if there’s a place or breeder where I can purchase a baby sulcata tortoise? Much appreciated.,RhodeIsland,Tortoise???
53,53,gah514,1578430421,elhkg2,Nan,"Hello,

I've lived in Rhode Island for the majority of the last five years, and recently moved to Providence within the last year. In the next couple weeks, my girlfriend will be moving to Providence with me from out of state. I want to have a fun housewarming party to welcome my friends to our new place, but I also want to help my girlfriend explore the city and start to meet people. My thought is to have a housewarming party pregame at our new apartment, and then separate my friends into teams for a night out scavenger hunt. I'm thinking of including actions at some of the big spots throughout Providence, and would love help thinking of things to include. While the point of it is to be a night out, I'm open to any landmark type of ideas anyone has as well. I'd also like to consider cover costs/prices to make sure the night is inclusive to people who don't have a ton of money to spend, and also include activities that don't involve drinking to make sure people who don't want to drink/are DDing are still having fun. Ideally, as many signature Providence experiences we can cram into one night, the better.

Some thoughts about what to include so far:

\-If any member of your team brought a party pizza to the pregame, your team earns one point

\-If any member of your team lands a ball in the 50 hole at skee ball, your team earns one point

\-If any member of your team lands a ball in the 100 hole at skee ball, your team earns two points

\-Go to Boombox and get at least two of your team members to sing karaoke to earn five points

\-If your team is at Whiskey Republic when Mr. Brightside is played, your team earns one point

\-Take a photo in front of a mural to earn one point",RhodeIsland,Scavenger Hunt Ideas
54,54,t5sgrl,1578434594,eliks3,Nan,,RhodeIsland,Potowomut Sunrise
55,55,Beezlegrunk,1578436066,elixmj,State Goverment,,RhodeIsland,Mattiello signals new openness to gun-control legislation
56,56,LilPeanutt,1578440676,elk04p,Warwick,,RhodeIsland,Recently visited Wonderland Smoke Shop in Warwick - spotted these smoke stones which really capture the State’s seemingly split stance on making weed fully legal
57,57,CellarDarling,1578450343,elm3ss,Nan,,RhodeIsland,"Ryan Struyk on Twitter: ""Asked about whether the US should retaliate again, Democratic Sen. Jack Reed says if there are significant casualties in this Iranian strike, then it would be “very difficult to just simply say, let’s stop.”"""
58,58,Zackariah05,1578457484,elnm37,Cumberland,,RhodeIsland,I feel like a shitty Rhode Island Citizen as I hate seafood. Please don’t ban me.
59,59,Beezlegrunk,1578505576,elw1s6,State Wide,,RhodeIsland,"HousingWorksRI found only 3 cities — Burrillville, Smithfield, and Woonsocket — where a household earning less than $50K can afford an average 2-bedroom apartment. And a household earning $70K can only afford a median-priced home in Central Falls, Pawtucket, Providence (non-East Side) and Woonsocket"
60,60,lionofyhwh,1578512833,elxraa,Nan,Haven’t heard anything since they announced it in 2017. Any news from anyone in the know?,RhodeIsland,Any news on the Crimetown TV Show?
61,61,Randall6,1578523365,em09p5,Nan,"Does anyone know what happened with Vic's Ice Cream in Barrington? They were open all through the spring, summer and fall and then just abruptly closed down. They seemed to be doing really well with product in Stock, Knead Doughnuts and Rebelle Bagels. Her buttermilk cornbread ice cream was legit some of the best ice cream I've ever had. I would love to see her come back with something new.",RhodeIsland,Vic's Craft Ice Cream?
62,62,UnrealBeachBum,1578579311,ema6qj,Discussion,,RhodeIsland,The Most Popular Male Names In The United States By State (1960-2019)
63,63,Beezlegrunk,1578585483,embjxg,State Goverment,,RhodeIsland,"“A group of lawmakers and advocates are hosting a conversation at the RI State House with Dr. João Goulão, otherwise known as Portugal’s drug czar. Dr. Goulão helped craft his country’s plan to decriminalize all drugs and apply administrative penalties in most possession cases.”"
64,64,DJShadow,1578585770,embmcw,Nan,,RhodeIsland,GoLocalProv | Battle Between Raimondo and Mattiello Over Compassion Centers Takes a New Turn
65,65,smokejaguar,1578595600,emdz6r,Nan,,RhodeIsland,North Providence-Lombardi expects to run for another term
66,66,iandavid,1578601464,emfcsq,Discussion,"As in the village in West Warwick. Is it:

- “ark-tick” (like how I would expect people to pronounce the icy northernmost part of the world)
- “ar-tick” (without the hard C sound in the middle)

(Note that I’m not asking whether the “r” in either is pronounced “ah”, because this is Rhode Island so of course it is.)

I don’t personally know anyone who lives in West Warwick, but for some reason I have a memory of people using the second pronunciation to refer to that particular place. I’m just not sure if it was their own personal thing, or the way everyone says it.",RhodeIsland,How do you pronounce Arctic?
67,67,smokejaguar,1578617674,emj608,Nan,,RhodeIsland,"Providence, Warwick have no money saved for $1.4B in health care liabilities"
68,68,Beezlegrunk,1578664667,emr8yl,Nan,,RhodeIsland,"Centrism on display: Half of RI’s Congressional delegation opposes legalizing recreational cannabis at the federal level, and a third will only go as far as decriminalization and removing it from the list of Schedule 1 drugs"
69,69,LucasSmolcicLarson,1578667624,emrw71,Nan,,RhodeIsland,"Providence Police refused to change their gang database policy, even after a community organization told them it was illegal. Now they're being sued in federal court because it ""tramples fundamental constitutional rights,"" according to the lawsuit."
70,70,OctoberRust13,1578675418,emtpe5,Nan,,RhodeIsland,"What's RI's ""most famous mythical creature"" ??"
71,71,radioflea,1578695032,emy9zd,Nan,,RhodeIsland,I’m glad people actually started to do this.
72,72,nangell94,1578697443,emyt39,Glocester,,RhodeIsland,Shot this sunset on my iPhone
73,73,Artistic_Inflation,1578704937,en0fk2,Narragansett,,RhodeIsland,Narragansett sunset the other day
74,74,KazamaSmokers,1578706029,en0noo,Nan,,RhodeIsland,"This is for weed, right? I am useless at slang."
75,75,JohnKimble111,1578710683,en1m3z,Nan,,RhodeIsland,A twisted Christian rock singer has avoided jail for downloading child sex abuse images and falsely accusing a 13 year-old boy of rape.
76,76,intheskyewithdiamond,1578711657,en1szp,Nan,"Looking for alittle extra cash after work. Which one do you recommend for our state? I don’t want to do it everyday, would like to pick which days, some weeks I only want one day a couple hours some weeks might do 3 days a weeks.",RhodeIsland,Grub hub or door dash!?
77,77,marksalmo,1578719340,en37da,Nan,"Hey Rhode Islanders, I’m a New Yorker looking to visit Rhode Island next weekend. I’m trying to decide whether I should go to Newport or Providence. Which would you recommend? Or if you have another city in RI you would recommend, that would be appreciated too. Thank you.",RhodeIsland,Newport or Providence?
78,78,wholesomemomhugs,1578721391,en3jwk,Nan,[removed],RhodeIsland,Looking for some help
79,79,mech94,1578724002,en3yfy,Nan,[RI Anti Gun Laws](https://facebook.com/events/s/defend-the-2nd-rally/597411437717814/?ti=cl),RhodeIsland,The wicked witch of RI is at it again.
80,80,AnyMisinterpretation,1578751595,en7sjt,Nan,"Can anybody on this subreddit explain to me how our politicians/compassion centers line their pockets with little to no regard for patients? To get a medical card in this state you now have to pay a hundred and twenty-five dollar kickback to the state. To only then, pay an exorbitant amount at the compassion centers. sixty dollar quarters for their low tier flower. Maine medical goes for forty a quarter whilst Quebec boasts twenty six dollar quarters. You're better off going to your local farmer or someone who can give it to you for much cheaper. So, two hundred dollars for a card to then only pay grotesque prices at the dispensaries? I have to say our medical program here is C O R R U P T. And they all know exactly what they are doing but don't seem to care.  Why is there no consideration for the patient? Does money truly talk? Sick of bullshit programs run by the state.",RhodeIsland,Regarding medical and recreational marijuana laws:
81,81,Beezlegrunk,1578753799,en86z4,State Goverment,,RhodeIsland,"“The RI House resolution honoring retiring lobbyist John Simmons shows how close the [centrist] Democratic leadership is to certain special interests. Simmons and the RI Public Expenditure Council were and are consistent voices in opposing workers’ rights legislation.” — Steve Ahlquist, Uprise RI"
82,82,smokejaguar,1578761658,en9toj,Nan,,RhodeIsland,Rhode Island Named Among Best States To Raise A Family
83,83,quigley4par,1578766211,enausb,Nan,[removed],RhodeIsland,New Gun Range in Exeter
84,84,jamezbren2,1578767098,enb1st,Nan,"I just witnessed an accident in the center lane on I-95S near Pawtucket. 3 cars involved, 2 stopped and pulled over, 1 fled. Car that left the scene was a dark gray Chrysler PT Cruiser. Heavy front end damage, radiotor was obviously cracked. THE FRONT LISENCE PLATE OF THE CAR THAT FLED WAS LEFT IN THE CENTER LANE. 

I hope whoever needs to see this sees it. If you're in an accident, always stop even if you don't have insurance, running is not worth the price.",RhodeIsland,Hit and run on I-95 South in Pawtucket
85,85,Sybertron,1578769829,enbodx,Nan,,RhodeIsland,Andrew Wessen from Grouplove signing on the beach before his Rhode Island show
86,86,Beezlegrunk,1578776448,end7eg,State Goverment,,RhodeIsland,“Online and vulnerable: Experts find nearly three dozen U.S. voting systems connected to the Internet” — including Rhode Island
87,87,york100,1578781899,enegss,Nan,,RhodeIsland,Reapportionment could force a Rhode Island showdown
88,88,31calvin,1578806509,enjfds,Nan,,RhodeIsland,"Check out my twitter page, if you are interested in franco culture of Woonsocket."
89,89,ClearLavishness,1578839064,eno0lq,Nan,,RhodeIsland,Bernie Sanders rally draws hundreds to Providence theatre
90,90,GuudZilla,1578851452,enqnhb,Nan,"I hope you see this you jerk.

Car was smashed in Bristol, Rhode Island at Aidens Pub around 12:30 today. In their god damn parking lot.",RhodeIsland,"To the asshole who hit and run my cah, F************** YOOOOUUUUU"
91,91,xuorig_b,1578854994,enrhap,East Greenwich,"I am trying to be less of a hermit in life and get out of my comfort zone doing my work outside of my home.  I’ve been to Main St Coffee and Hill cigar bar but am wondering if there in a ..time limit, in staying at these places? I don’t have much money to spend since I’m in school so I just leave whenever I finished what ever I bought. Too nervous to ask so here I am. 
Thank you in advance.",RhodeIsland,Question in regards to doing work
92,92,DontWorryAboutIt00,1578858650,enscng,Nan,,RhodeIsland,What are some good places to go on a nice day where you can just walk around and hangout?
93,93,york100,1578861509,ent1j5,Nan,,RhodeIsland,How the Boston Globe is affecting Rhode Island media
94,94,00musdan,1578862383,ent9c0,Kent County,"Coventry closed in the middle of a Saturday shift and west Warwick is closed today and has a for lease sign on the door.

They have great pizza and wings and are always busy it doesn’t make sense that they can’t survive",RhodeIsland,What is happening to Westcott house restaurant?
95,95,Lunaesa,1578866331,enu7r4,Nan,,RhodeIsland,This tiny room in a Rhode Island bookstore
96,96,cryssybrjd,1578878419,enwwd3,Nan,,RhodeIsland,Help this cutie he needs a surgery tomorrow on his kidney. https://www.gofundme.com/f/6l595ag?utm_source=customer&amp;utm_medium=copy_link-tip&amp;utm_campaign=p_cp+share-sheet
