,Unnamed: 0,author,created_utc,id,link_flair_text,selftext,subreddit,title
1098,1098,medicmachinist38,1585867115,ftw7cu,Nan,"Before the corona times, did you ever go grocery shopping and think, “I’m clearly the only person who eats this stuff”? Like, say for example, cottage cheese with chives... and now deep in corona times, you can’t find it ANYWHERE and wonder “who the hell else eats this stuff and why is it sold out??”    Basically what I’m saying is does anyone have any Hood cottage cheese with chives that they’re hoarding and would like to part with?",RhodeIsland,An interesting title...
1099,1099,PravdaPaul,1585868457,ftwl6s,Nan,"**""The R.I. Division of Motor Vehicles was informed Wednesday evening that a DMV staff member  tested positive for COVID-19. We understand that this is a difficult time for both customers and state employees. Keeping everyone safe must be our first priority.**  **The DMV closed operations Thursday, April 2 and will remain closed Friday, April 3. All road tests are cancelled through Friday, April 10.**  **We apologize for any inconvenience this may cause you. Please check the DMV website for updates.**",RhodeIsland,"DMV office closed Friday, April 3 due to COVID-19 crisis"
1100,1100,radioflea,1585868608,ftwmrn,Nan,,RhodeIsland,Seems legit
1101,1101,masoncock,1585870411,ftx56q,Nan,First time driver and need corona money.,RhodeIsland,What is the best food delivery service to drive for in Rhode Island?
1102,1102,Beezlegrunk,1585871151,ftxcha,Richmond,,RhodeIsland,No Golf for You: Police charge 3 Massholes with golfing in RI in violation of quarantine order — and appear to have staked out their cars to catch them
1103,1103,Uncledrew401,1585876803,ftyugo,State Wide,,RhodeIsland,The ~~jew~~ new (york) hunter
1104,1104,Uncledrew401,1585877341,ftyzp7,State Wide,,RhodeIsland,Credit to @breddy_gud on twitter. Felt this belonged here
1105,1105,SeparateCellist7,1585883572,fu0lb6,Nan,[removed],RhodeIsland,This website to get rubox
1106,1106,thedayaftermine,1585916585,fu7gsm,Nan,,RhodeIsland,RI data on Google location tracking
1107,1107,Few_Proposal,1585917669,fu7pww,Nan,[removed],RhodeIsland,Rbx app
1108,1108,rhodyinthesky,1585919959,fu8a9r,Nan,,RhodeIsland,We still doing 2010 flood photos?
1109,1109,FilmAndFire,1585920016,fu8as4,Nan,,RhodeIsland,We still doing 2010 flood photos?
1110,1110,oneergoner,1585923125,fu93oa,Nan,What are all of your thoughts on hiking?  It seems like most of the time people are good about maintaining six feet of distance but I feel like there’s always one instance where people won’t push over enough.,RhodeIsland,Do you all think it’s safe to go hiking?
1111,1111,chancrescolex,1585923302,fu95du,Nan,"The Attorney Generals office is only offering it for healthcare professionals. Most local PD’s have suspended it due to social distancing.

The only one I’ve found so far to still be doing it is Westerly but it’s limited days and hours so I wouldn’t be able to go until Tuesday.

Trying to do it today if possible.

Thanks.",RhodeIsland,Does anyone know where I can currently get fingerprinted for a security clearance application?
1112,1112,Blueiskewl,1585928193,fuaj35,Nan,,RhodeIsland,Three Mass. men charged with violating governor’s quarantine order after golfing
1113,1113,Beezlegrunk,1585928606,fuanjj,State Goverment,,RhodeIsland,"The Clean Energy States Alliance (CESA) has launched the 100% Clean Energy Collaborative, a new initiative to share information among the 14 states — including Rhode Island — that have established 100% clean-energy goals for their electricity sectors."
1114,1114,k00k,1585930072,fub3b1,Nan,,RhodeIsland,RI to receive 100K N95 masks Patriots plane picked up from China
1115,1115,Trees-Make-Love,1585930848,fubbpp,Johnston,"We can all agree they are not essential. We have people from out of state coming to play because other courses in states are closed. Why are they open? Playing a game is not essential. 

Thanks in advance for the discussion.",RhodeIsland,Just a general question about why golf courses are open.
1116,1116,PravdaPaul,1585932555,fubtzf,Nan,AAA Northeast members should know AAA offices in Rhode Island will close April 6; reopen April 20 in response to COVID-19 crisis.,RhodeIsland,AAA offices in Rhode Island will close April 6; reopen April 20
1117,1117,Killjoy4eva,1585933969,fuc9uu,State Goverment,"***I don't have the opportunity to take notes right now. I will be able to re-watch and do it later. If anyone wants to take notes and send them to me, I will post them here and give you credit***

*****
# [Live Stream Link](https://turnto10.com/watch/)

#COVID-19 Hotline: 401-222-8022
*****
#DONATE:

#[COVID-19 Recovery Fund](https://www.uwri.org/2020/03/covid-19-response-fund/) 

# [GO DONATE BLOOD](https://www.ribc.org/)
*****

# [THE LATEST &amp;  PREVIOUS PRESS CONFERENCES](https://www.reddit.com/user/Killjoy4eva/comments/fnm2nw/all_covid19_press_conference_notes_for_the_state/)

*****

*Disclaimer: I am not a journalist nor am I a health professional. I am simply a citizen attempting to break down the Governor's and RIDOH daily press briefing the best I can and make it easily digestible.*

*I am not affiliated with the state or any of the corporations or non-profit organizations that may be linked in this posting.*",RhodeIsland,Thursday 4/3 - Notes: Rhode Island - COVID-19 Press Conf. w/ Gov. Raimondo
1118,1118,monkysandtools,1585935353,fucp0p,Nan,,RhodeIsland,Some additional photos from the flood
1119,1119,Mpicardd,1585935406,fucpks,Nan,,RhodeIsland,States Set Up Checkpoints to Detain Travelers
1120,1120,Lunaesa,1585935487,fucqf3,Nan,Listening to the governor's daily update now. Details to come.,RhodeIsland,Rhode Islanders advised to wear cloth face coverings in public
1121,1121,knoeKNAME,1585936018,fucw9f,Nan,A lot of people have been posting photos from the flood 10 years ago. Does anyone have any photos of UNO during the flood?,RhodeIsland,Does anyone have any photos of UNO on Bald Hill during the flood?
1122,1122,Hkny34,1585946096,fufy9g,Nan,,RhodeIsland,Color Rhode Island map with your own data easily.
1123,1123,mattdavey2,1585952663,fuhwl3,Nan,Are they closing the liquor stores? In RI and Mass? Thanks!,RhodeIsland,Are they closing the liquor stores?
1124,1124,ExecutiveChef1969,1585962853,fukmp6,Tourism,,RhodeIsland,Do you have the Corona Virus?
1125,1125,mattislinx,1585967869,fulvmd,Nan,"My work recently cut everyone's hours from 40 to 20. People have filed for unemployment to make up for the remaining 20 hours but unfortunately the company hasn't provided much information. One of the most commonly asked questions is how taking vacation/sick time changes unemployment benefits in any way. Can anyone shed any light on this?

Thanks.",RhodeIsland,How does paid time off affect unemployment benefits?
1126,1126,MonkeysDontEvolve,1585980689,fuoksj,Nan,,RhodeIsland,There is a serious lack of data for COVID on the county level for RI so I created some. All the data is sourced from the CDC.
1127,1127,newportstorm66,1585996196,furfum,Nan,My confirmation says I can call or go online to teleserve and set up payment tommorow April 5th.  Can I do it after midnight tonight or is there a certain time I have to wait until?,RhodeIsland,Teleserve unemployment time
1128,1128,djhart13,1585999586,fus440,Nan,,RhodeIsland,I’m aware of the full name. But no one uses it.
1129,1129,RiverTam218,1586004142,fut2fc,Nan,My husband and I are craving Chinese food. Our favorite local place is currently closed. What’s the best place to go to? We live in Smithfield and are willing to drive as far as Warwick to pick something up.,RhodeIsland,Chinese food suggestions
1130,1130,hangrymechanic,1586008626,fuu4hd,Nan,"Does anyone know of any local-ish wineries doing wine shipping to RI, during this time of pandemic (a la the restaurant situation)? I know of similar ones around the country, but would love to support local New England ones. Thanks!",RhodeIsland,Support nearby wineries?
1131,1131,dontburntheham,1586016390,fuw7as,Nan,[removed],RhodeIsland,Why should I...
1132,1132,Racing_Statistics,1586020097,fux9tj,Discussion,,RhodeIsland,Coronavirus Spread by Country until April 3!
1133,1133,lulububs,1586021606,fuxprn,State Goverment,,RhodeIsland,It do be like that
1134,1134,gah514,1586026293,fuz2ez,Nan,just for me and my girlfriend who i live with to move around. we live in Providence but are willing to drive anywhere in the state if it’s open,RhodeIsland,anyone know of any places to walk around that are open? ideally walking trails in the woods
1135,1135,gah514,1586026360,fuz33j,Nan,looking to grab take out from a local restaurant and eat it by the beach if it’s possible. wont be with anyone i don’t live with or even get out of the car.,RhodeIsland,any beaches with open parking lots?
1136,1136,rockferrys,1586030716,fv0bku,Nan,,RhodeIsland,Can someone explain this?
1137,1137,eightbitbrain,1586033623,fv14j6,Nan,,RhodeIsland,Anyone know if these can be stopped? Nobody effing wants them and they just end up littering the sides of our streets
1138,1138,wishihadaps4,1586036323,fv1vh6,Nan,,RhodeIsland,So I can't go to Price Rite Seekonk with new quarantine rules? It's .5m from border
1139,1139,safe-word,1586037816,fv2a6b,Nan,,RhodeIsland,Electric Boat worker in Quonset tests positive for COVID-19
1140,1140,OpticalFlatulence,1586047598,fv4tgq,Nan,"I'm not sure if it seems like a prudent business plan, but at some point, these masks everyone is making may be considered...part of someone's style? Not fashion, but decorative and such.

I don't know if any RI artists are thinking or producing such products, but I'd be willing to buy one because ""Made in RI"" is a thing.

Please PM if there is a local artist or business that is selling these things. Thanks.",RhodeIsland,Any RI artists making custom breathing masks?
1141,1141,vgntrtl,1586053494,fv682l,Nan,,RhodeIsland,"First time homebuyer here, anyone have a recommendation for a mortgage lender?"
1142,1142,madwilliamflint,1586055016,fv6kqw,Woonsocket,,RhodeIsland,"Guys, someone stole a K9 puppy from the PTSD Center. Keep an eye out wouldja?"
1143,1143,EliBruins63,1586055575,fv6pbb,Nan,I’m still fairly new to RI. If I purchased a car at an out of state auction and wanted to register in RI it requires a Vin check to register. How can I get the car to my towns PD in order to get the vin check done without it being registered?,RhodeIsland,Vin Check Question
1144,1144,pharmish,1586063821,fv8h2j,Discussion,"Here is an extensive list of reasons that Rhode Island sucks.

1. It is not an island",RhodeIsland,Rhode Island Sucks
1145,1145,FormalEnlightenment,1586064997,fv8p8w,Nan,,RhodeIsland,Unemployment error... sigh I guess I know what I’ll be doing all day Monday.
1146,1146,ksunk8,1586089033,fvcx33,State Wide,,RhodeIsland,Thought I would add on a few. Props to whoever made the original!!
1147,1147,wotifidontgetacceted,1586090318,fvd5sw,Nan,"Hello,

As the Coronavirus continues to spread across the U.S. and around the world, many college and university students are having to switch to online courses and end up having to stay inside most of the day. However, there is a college oriented discord server that currently has over 1200 members and growing where you can hangout and chat with others. The server has weekly events, numerous channels with various topics, and more! Below you will find the link to the server along with a link to the CDC website containing information about the Coronavirus.

Discord Link: https://discord.gg/83qvuvT

CDC Link: https://www.cdc.gov/coronavirus/2019-ncov/index.html",RhodeIsland,College discord community
1148,1148,BoneYardBetty,1586095107,fve4y8,Nan,"I was originally going to go to a Joann Fabrics to buy their fabric remnants, but, well, now I can't. Crafting up my wedding decor has always been something I thought a lot about, and it'd be super disappointing if I couldn't toss up some cutesy handmade bullshit on my wedding day. 

Wedding is planned for September, and with all the uncertainty going on, we're not sure if we'll be able to use our venue or caterer. And honestly, it won't be the end of the world if that comes to pass. We can always use my dad's backyard and kidnap his meat smoker for food.

But at least some decoration is definitely a must. 

I'm not looking for anything fancy - my ""wedding colors"" are sage greens and a range of muted/desaturated pinks and purples, but anything I can lighten/darken/dye without the fabric falling apart is suitable.

I can set up a no contact pick up, as well. 

Thank you!",RhodeIsland,"I know this might be a silly request with everything going on, but I'm in search of scraps of fabric that might be otherwise thrown away for my wedding decorations. Yes, really."
1149,1149,trombodie,1586104570,fvgnjl,Nan,,RhodeIsland,The Astrologer of Narragansett Bay
1150,1150,safe-word,1586107304,fvhffe,Nan,,RhodeIsland,"GovRaimondo reports another 8 more deaths from COVID-19, bringing total to 25. 116 new cases in Rhode Island, bringing total to 922, and 103 hospitalized."
1151,1151,[deleted],1586107361,fvhg10,Nan,[deleted],RhodeIsland,"Rhode Island suffers 8 deaths. We aren't a big state. If you aren't taking this seriously, you better do so now."
1152,1152,flignir,1586107750,fvhjxe,Nan,"This is insane.  This thing is out of control and it's because of these idiot crowds cramming themselves into big stores.   If the Governor wants to shut it down, it's time to start jailing people.   None of this ""post on social media; go to the website"" nonsense.   No one is afraid of the governor driving around the state in a truck, because no one believes they will get caught by her.   The state and local police can be all over the state at the same time.  If people are crowding into spaces, witnesses and people who don't want to get crowded should be calling the police, and if we all knew that cops are responding to those calls, the crowds will evaporate.  

This reckless behaviour by a fraction of the population is putting us all at risk, and she's going to solve it by closing down the stores for all of us. That makes no sense.   You can't get cleaning products online (everything is sold out).   You can't get food online (everything that keeps is sold out).  Let's attack the problem, not the populace.",RhodeIsland,Crowds in stores.
1153,1153,CellarDarling,1586110437,fvibxj,Nan,,RhodeIsland,"RI Dept. of Health on Twitter: "".@GovRaimondo : If you don't start getting more serious, I am going to shut it all down. I will go around in my truck all over the state today to check on things, and you will not want to be in that group if I see you. It's on every one of us. #KnockItOff"""
1154,1154,Circle_2_Circle,1586111177,fvijlh,Pawtucket,"Hello,

I know that kitten season is starting, but I'm having a terrible time finding a kitty to adopt. Craigslist posts have hundreds of applicants within a few minutes and all of the shelters I've called have suspended adoptions. 

We've been wanting to adopt about two years now and finally are in a place that we can afford one and this pandemic is happening! I had a miscarriage a couple of months ago, and though we're not ready to try again right now, we ARE ready to welcome a baby kitty into our home!

I have vet references and have had cats in the past. I've never surrendered an animal and promise that any fur baby that goes home with us is in for a whole lot of love.

Is anyone adopting out kittens or have any leads? We'd prefer a long/medium hair kitty and would like a female, but for the right little guy, we might adopt a boy. Please feel free to reach out.

Thank you all and stay safe!",RhodeIsland,Looking to adopt a kitten
1155,1155,HerbLion,1586112623,fviz3o,Nan,,RhodeIsland,‘This is unacceptable’: Magaziner calls on SBA lenders to accept ‘orphaned’ small business applicants.
1156,1156,highlysuspect21,1586121171,fvlieo,Nan,,RhodeIsland,#KnockItOff you Rhode Island rebel scum!
1157,1157,TheUncommonSense,1586121392,fvlknh,Nan,,RhodeIsland,"A massive fire tore through a mill complex in Pawtucket, I took my drone to see what's left [OC]"
1158,1158,11-110011,1586121535,fvlm43,Visitor Question,"I’m up here for work currently (working at EB), are dog parks and the sort still open? 

The hotel in at doesn’t have a huge area for my pup and I’d like to be able to get out for maybe an hour (social distancing still, North Kingstown dog park almost never has anyone there I’ve seen) or so. Is that kind of place still open?",RhodeIsland,Stay at home order question
1159,1159,safe-word,1586123601,fvm7o5,Nan,,RhodeIsland,"Gaspee Days parade, arts and crafts festival cancelled due to COVID-19"
1160,1160,Lrie13,1586124094,fvmcvg,Nan,,RhodeIsland,Guessing they will be closing the bike path next...any other reason for the DEM to drive through?
1161,1161,RILTC2020,1586128186,fvnhku,Nan,[removed],RhodeIsland,Rhode Islanders with family members in LTC facilities please read!
1162,1162,rhodyinthesky,1586128444,fvnk0d,Nan,,RhodeIsland,...
1163,1163,RaveRacerN64,1586130828,fvo6cs,Nan,"Just  like to say thank you. So I'm offering free wedding photography. I  don't want to post my website link here because I don't want to seem  like trying to benefit from COVID19 and get free press or anything.

If you are interested send me a PM or send me a email

[bostonfreeweddingphotography@gmail.com](mailto:bostonfreeweddingphotography@gmail.com)

Also  it does not have to be just wedding photography. You can get any kind  of portrait session also. Engagement photos, boudoir, family photos,  senior portraits, maternity photo shoot, pet photography, family day out  at the amusement park and I'll photograph it in a documentary style.

and I'll send you my website with a full wedding portfolio.

If the mods want to see my website please PM me and I'll send you my website also.

If I'm breaking the rules please delete post.",RhodeIsland,Free wedding photography for all front line workers.
1164,1164,stretchasmile,1586131082,fvo8ne,Nan,,RhodeIsland,For my R.I. friends staying home and healthy
1165,1165,Redstalin88,1586135812,fvpfna,Nan,[removed],RhodeIsland,Coronavirus update
1166,1166,AKingIsMissing,1586138860,fvq6vn,Nan,I’m in the guard and am in need of a haircut! Can anyone help me out? Pms please!,RhodeIsland,Haircuts?
1167,1167,wdale86,1586139157,fvq9gf,Nan,Does anyone have experience with local CSAs? Looking to set something up for spring - summer.,RhodeIsland,CSA
1168,1168,seemonkeysuicide,1586151443,fvt004,Nan,"So this will be a bit of a longshot, but Ive been searching for a band forever to no avail and its driving me batshit crazy. My cousin from RI was visiting me in Texas about 14 years ago and lent me a cd of a band he was a huge fan of from RI. Now the best way I can describe their sound was basically party rock/punk/drinking songs. And the only concrete detail I can remember is the album cover. Its a black and white photo of the 5 band members standing in thigh deep water, completely naked and facing away from the camera. I believe the album name was floodwaters but I honestly cant be sure. If any of yall could help me out I would seriously appreciate it",RhodeIsland,Looking for a band from RI
1169,1169,magentablue,1586179835,fvyrwl,Nan,"Pretty sure I'm SOL, but has anyone come across 1/8"" or 1/4"" elastic for sale in the Warwick area? All the websites I've checked are showing they're sold out. I can only find sellers online from China and the ETA is late April/early May.",RhodeIsland,"1/8"" Elastic"
1170,1170,BlinkerBeforeBrake,1586181870,fvzb4r,Nan,,RhodeIsland,"CVS Health brings free, rapid COVID-19 testing to RI, provide 1K more tests per day"
1171,1171,[deleted],1586186886,fw0pgi,State Wide,[deleted],RhodeIsland,Axios cites the University of Washington’s Institute for Health Metrics and Evaluation (IHME) as projecting the date of Rhode Island’s peak demand for hospital resources due to COVID-19 to be some time next week (April 13–20)
1172,1172,Beezlegrunk,1586187777,fw0ysf,State Wide,,RhodeIsland,The University of Washington’s Institute for Health Metrics and Evaluation (IHME) projects Rhode Island’s peak demand for hospital resources due to COVID-19 — “assuming full social distancing” — as April 27
1173,1173,inalilwhile,1586188244,fw13qe,Nan,"Hi everyone,

I'm 29 weeks pregnant with a low-risk pregnancy and no prior issues. My ObGyn, located in Providence, is still requiring that I go in for my monthly ""check in"" appointment. At this appointment they weigh me, take my BP, and hear the baby's heartbeat with a doppler. There are no scans or blood tests done.

**Anyone know if all RI ObGyn providers are requiring in-person appointments for the monthly check-in?** I'm not sure if my provider is in the minority, or if that's just how it's being done here. I have friends in other states whose providers have resorted to telehealth appointments for these non-essential appointments (these friends take their BP at home and discuss any questions in a call).

My provider does call in advance to make sure you don't have any symptoms, and they don't allow guests to come to your appointment. But with asymptomatic spread being so common, I'm not very reassured.

Curious if anyone has any insight on this.",RhodeIsland,Prenatal appointments in RI during COVID-19
1174,1174,princesscoley,1586190921,fw1xak,Cranston,,RhodeIsland,Fabulist Raimondo
1175,1175,Beezlegrunk,1586193861,fw2uld,State Wide,,RhodeIsland,Graphic metrics of Univ. of Washington / IHME projection of RI peak demand for hospital resources — “assuming full social distancing”
1176,1176,rathalos420,1586194103,fw2xcn,Nan,,RhodeIsland,"If you're looking for a place to get a summary of Gina's press conferences, Edward Fitzpatrick of The Boston Globe has been live Tweeting them every day."
1177,1177,sodomyeggo,1586194512,fw326w,Nan,Honest question. It seems like no one in food service right now is wearing masks and I'm alittle uncomfortable with it.,RhodeIsland,Why are food service workers not wearing masks?
1178,1178,12floz355,1586194899,fw36un,Nan,[removed],RhodeIsland,Looking for psychiatrists accepting new patients via telemedicine/teletherapy?
1179,1179,soucy666,1586196932,fw3u5b,Nan,,RhodeIsland,4/6/2020 Rhode Island Governor's Update
1180,1180,PattyPan420,1586198989,fw4gvy,State Wide,,RhodeIsland,Stay safe
1181,1181,Serpentarium666,1586203573,fw5xgu,Nan,"I filed, got everything all set, got paid last week...and now teleserve says no such account exists. Anybody encountered this issue?",RhodeIsland,Weird issue with Teleserve
1182,1182,AffectionateCredit9,1586204621,fw69c2,Nan,,RhodeIsland,The best twerk ever
1183,1183,LC8877,1586205074,fw6e5w,Nan,"I am tired of this. I understand it’s a difficult time and we all have to do our part. A business is violating the non essential and stay at home order, where should this be reported?",RhodeIsland,If a business is violating the current orders where should you report it?
