,author,created_utc,id,link_flair_text,selftext,subreddit,title
2086,Lavaidyn,1585415340,fqo309,Nan,,Ohio,I have never seen hail look like this. This storm is nasty.
2087,kliens7575,1585415446,fqo4ak,Nan,,Ohio,"Has anyone in the Cleveland area heard from the wonderful mayor Frank Jackson on the Coronavirus pandemic, or is he too busy trying to keep his felon grandson out of jail"
2088,krisdb2009,1585415634,fqo6d3,Nan,,Ohio,Dynamic duo
2089,Henrhallen743,1585415857,fqo8pp,Nan,,Ohio,Gotta love that Ohio weather
2090,gabsinoh,1585415948,fqo9ou,Nan,Hey everyone just wondering if anyone can see or file next weeks claim online. I did week ending 3/22 but still nothing has popped up for the next week.,Ohio,Unemployment
2091,whimsbee,1585417896,fqovue,Nan,Is there an email to send stuff to? If not what is the fax number I should send my information to? They need proof of identity because I was married and only changed my name on my SS card but nothing else.,Ohio,Unemployment Questions
2092,mindofdstructvtaste,1585418202,fqozar,Nan,,Ohio,"Got out for a bit a few days ago when it was nice out. Berea Falls, Rocky River Metroparks."
2093,PeaceIsSoftcoreWar,1585418407,fqp1sr,Nan,"Streaming at https://www.youtube.com/watch?v=VlIO63Hk6L8

and http://ohiochannel.org/governor-live-stream.html

I recommend using the youtube link.

I will be keeping this post updated with a summary as it continues. Things I find most important will be bold. Keep in mind it will often be paraphrased. The stream itself is the best source.

Previous streams can be found here: https://www.youtube.com/channel/UCporaXCeaOJgZKz7y3C0zbg

Thank you for all the awards and other offers but please save your money for the future economic uncertainty which is likely going to occur.

Ohio: 1406 confirmed cases, 344 hospitalizations, 123/344 in the ICU, 25/1406 deaths

March 11: 5 confirmed cases

March 12: No data

March 13: first case confirmed in Summit County.

March 14: 26 cases, 7 hospitalizations

March 15: 36 cases, 11 hospitalizations

March 16: 50 cases, 14 hospitalizations

March 17: 67 cases, 17 hospitalizations

March 18: 88 cases

March 19: 119 cases, 33 hospitalizations

March 20: 169 cases, 39 hospitalizations

March 21: 247 cases, 58 hospitalizations

March 22: 351 cases, 83 hospitalizations, 3/351 deaths

March 23: 442 cases, 104 hospitalizations, 6/442 deaths

March 24: 564 cases, 145 hospitalizations, 8/564 deaths

March 25: 704 cases, 182 hospitalizations, 75/182 in the ICU, 10/704 deaths

March 26: 867 cases, 223 hospitalizations, 91/223 in the ICU, 15/867 deaths

March 27: 1137 cases, 276 hospitalized, 107/276 in ICU, 19/1137 deaths confirmed.

March 28: 1406 cases, 344 hospitalizations, 123/344 in the ICU, 25/1406 deaths

United States: 113,031 confirmed cases and 1,895 deaths.

Thanks to /u/_vvitchyvvoman_
for some of this data
_______________________________________________
2:03 PM: The Governor starts speaking

Introduces Senator Brown

2:03 PM The Governor stops speaking
__________________________________________________
2:03 PM: Senator Brown starts speaking

Thanks the Governor and team. 

You cannot separate the people from the economy.

We are working  in Congress to give the resources to the people and the health care workers as necessary. A moratorium on evictions will be fought for. I do not feel that the Federal Government has gone far enough. 

Thanks to all Ohioans who are working in essential jobs and helping everyone get through this.

2:08 PM: Senator Brown stops speaking
_____________________________________________________
2:08 PM: The Governor begins speaking

Our setup is somewhat lower tech than before. One of the workers who set up our briefings have become sick with what was diagnosed as pneumonia. Luckily, they tested negative for COVID-19. However, we are running with a skeleton crew and this will have an affect on the quality of these briefings. 

We will be capable of sanitizing 160,000 masks a day due to the innovations of a company based in Ohio. The FDA must approve the use of the machines they have produced before they can be used and I implore that they do so as soon as possible. 

To testing centers, please get us your results as soon as possible.

I issued and order last night that any state contractor that has a contract they are fulfilling must be investigated to follow the proper guidelines.

Feel free to go outside but make sure you continue to practice social distancing.

Our estimates show that we have around two weeks before cases start ramping up and the peak may not come until May. We may have to increase our capacity by as much 2-3 times our current levels. Ohio has been split into 8 regions and drafts for a plan to combat the virus in each region have been submitted. These are being reviewed and will be sent back with suggestions as soon as possible.

Each region must be united, working closely together as each plan moves forward. 

We will ensure you understand what is going to happen in each region before the plans move forward. 

I would like to thank churches that have been innovating to ensure that their members do not contract the virus and follow social distancing. I would ask that people not congregate.

We need surgical gowns of all sizes, face/surgical masks (adult and pediatric), gloves (nitrile, vinyl, or butyl), N-95 particulate respirators, isolation gowns, and many more. We are seeking donations and to expand production from as many companies as possible.

2:28 PM: The Governor stops talking
_______________________________
2:28 PM: Amy Acton starts talking

We have 1406 confirmed cases, 344 hospitalizations, 123/344 in the ICU, 25/1406 deaths.

We absolutely need tests that have been completed to be reported to the Ohio Department of Health as soon as possible. This includes a total of all tests given out and a report on negative test as well.

This crisis is like when you see a report of a hurricane in the Caribbean and the east coast begins preparing as soon as possible to protect themselves. We must do this.

Every action you're taking at home is affecting how and when this storm of a virus will hit. We are spreading out the power of this storm and lowering its strength as much as possible. There is no health care system in the world that would have been prepared for how this would have affected us. We must do everything we can to continue to slow this down. 

I'd like the elderly to stay home as much as possible with help from their community. 

2:38 PM: Amy Acton stops speaking
_____________________________________________________________
2:38 PM: Lieutenant Governor starts speaking

Programs are beginning to promote learning from home for students. We don't want students falling behind because of this crisis. This begin Monday, March 30th. 

We have opted in to the package that was signed by President Trump earlier this week. This will allow many who will be facing unemployment including 1099 workers to receive the resources they need. We are increasing our unemployment website capacity by 20X and we are keeping our phone lines open as long and as often as possible. Even if there is a problem, you will be given your benefits retroactively based on when you were eligible.",Ohio,The Governor's 3/28 Coronavirus briefing will begin soon as of 2:00 PM
2094,journogabe,1585421305,fqpyqr,Nan,,Ohio,Coronavirus In Ohio: Battelle Pioneers Technology To Clean And Reuse PPE
2095,waynier,1585421321,fqpywd,Nan,,Ohio,Coronavirus In Ohio: Battelle Pioneers Technology To Clean And Reuse PPE
2096,malcolm_graves,1585422269,fqq9oi,Nan,,Ohio,2pm got me like
2097,hexydes,1585423793,fqqqhk,Nan,,Ohio,"I wanted to help restaurants understand what is driving their change in order-frequency during this pandemic, so I made an open survey."
2098,[deleted],1585424510,fqqyft,Nan,[deleted],Ohio,Is the Ohio-Michigan border still open?
2099,IslanderInOhio15,1585424674,fqr0cp,Nan,When completing the application if I select the “primary” option will that allow me to vote on everything including the levies that are on the ballot?,Ohio,Absentee Voting
2100,si_wecan,1585426396,fqrk5m,Nan,"I just left out of Meijers in the Polaris area. I went in with gloves on and had a mission on how to get what I need quickly and exit the store. Small problem though, it was crowded in every aisle. My anxiety immediately went through the roof because I thought ""if I get sick from any place, it's going to be here"".

But the real issue for me is an employee at meijer walked right beside me within 3 feet. I didn't talk to him or anything, but I wasn't sure how contracting this works. Did I put myself in jeopardy today by not being firm by telling this old man to give me space? 


Or can I only contract it from touching him? I know it's a silly question but I'm freaking out.,.",Ohio,Can I catch the virus by walking too closely to someone?
2101,bdubchile,1585427439,fqrvxf,Nan,,Ohio,Dr. Amy Acton and Fran DeWine advocate for homemade masks
2102,LennyZakatek,1585429992,fqsp3u,Nan,"I can't find it, can anyone hook me up?",Ohio,Wine with DeWine bingo card
2103,THUNDERSTORMS123,1585430242,fqsrv4,Nan,,Ohio,POTENTIAL TORNADO THREAT! Hook shaped severe thunderstorms approaching Ohio!
2104,dannylenwinn,1585430639,fqswdx,Nan,,Ohio,Officials remind parents that playgrounds are closed due to outbreak
2105,jordanmmccoy,1585430757,fqsxoa,Nan,Do you think they’ll announce school closings for the rest of the year soon?,Ohio,Question ab school closings
2106,lftenjamin,1585430784,fqsxzg,Nan,"My job is finally putting me on furlough starting this week. I was told I’m ok to start filing for unemployment. 

I did and my weekly benefit is a lot less than 50 percent of my earnings. My weekly gross is 525. My weekly benefit amount seems to be 174. 

Now that might be because I’ve only been working at my current job for the last 8 months and before that I was making like 275 gross per week. I’m confused on that point. I wanna call in and ask, but they’re closed and I’m sure I’ll just not get through. 

2nd question. All these news sites are talking about that cares act that passed and the unemployment  boost, but nobody mentions when it starts. I know the president has already signed it, but I was just wondering when that is supposed to start. Does anyone know? 

I work for a pretty big corporation, so I’m confident I’ll have a job to go back to in a month or so, but for now, and I’m sure it’s very similar to others, I have bills to pay. If this kicks in soon, I’ll be able to stay on top of my bills, but if it doesn’t, big oof, so I’m just tryna plan ahead as much as I can. 

If anyone has any information about this at all, can you help me, or maybe others who can’t google the answer either?",Ohio,Unemployment questions.
2107,confronted666,1585431335,fqt47i,Nan,,Ohio,The mosquitoes in NE Ohio are already SO BAD THIS YEAR!!!
2108,[deleted],1585431794,fqt9f4,Nan,[deleted],Ohio,POTENTIAL TORNADO THREAT! Update: Hook has transitioned into a bow shape. This can also mean rotation. Thunderstorms still remain severe with strong winds and large hail.
2109,[deleted],1585433379,fqtrkn,Nan,[deleted],Ohio,TORNADO THREAT DEMINISHED! Update: Bows and hooks have gone away and storms are weakening.
2110,PERCEPTOR16,1585434524,fqu459,Nan,,Ohio,Ohio closing alcohol sales.
2111,Reddit-JustSkimmedIt,1585435123,fquaq2,Nan,I’d be happy with at least Halloweekends happening.,Ohio,Any hope for Cedar Point opening at all this year?
2112,[deleted],1585435762,fquhbg,Nan,[deleted],Ohio,Liquor/alcohol sales shut down
2113,Redskull420,1585437342,fquy34,Nan,,Ohio,Hail
2114,MyNameIsntFlower,1585437536,fqv03s,Nan,"Why are the gas prices so low? It started happening before our lock down, and they keep dropping so it can’t be demand right?",Ohio,Gas prices
2115,HeyimaMetsfan,1585437932,fqv48q,Nan,"My employer told me that as of April 4th in will be furloughed. I know I qualify for unemployment but what I'm wondering is, are there any benefits to unemployment such as educational or career training opportunities?

I think it would be good to share as so many Buckeyes are in this boat together.

Let's come back stonger!

Edit: I'm an idiot and spelled Ohioan wrong.",Ohio,Furloughed Ohian here
2116,ohcalamity_,1585444764,fqx01i,Nan,,Ohio,Governor DeWine Announces Close of ALL Alcohol Sales in Ohio
2117,u-gonlearntoday,1585446800,fqxj93,Nan,"I hope this isn't a stupid question, but I have looked around and can't find an answer.. Can I send both requests for my household in one envelope? Voting means a great deal to us and I don't want to mess this up regardless of whether our votes mean jack diddly. There are two adults requesting ballots here. Cincinnati city. Thanks in advance!",Ohio,Absentee ballot request for primary
2118,toadstoolshadow,1585449410,fqy7n9,Nan,,Ohio,"Them faeries are back in Yellow Springs, in southwest Ohio. In a crack between two downtown buildings, a faerie power trio have a song to sing and a dance to dance."
2119,Yesh_Its_Michael,1585449471,fqy86s,Nan,I got court the 6th. Y'all think they'll reschedule?,Ohio,Question
2120,MadsMarie23,1585455400,fqznyj,Nan,"So I went to file my weekly claim just now. I submitted it and got a confirmation code but then got a message that I hadn't notified their office about work hours (my last day worked was 3/16, when I filed my weekly claim on 3/22 I 100% put those hours in). I answered the questions on the form and hit certify and submitted it, but it just looped me back to the beginning of the form with no confirmation that my responses were recorded. I tried this four or five more times with the same result. I know the phone lines are constantly jammed, but should I try to call at 8 tomorrow to see if they actually got this info? I really don't want to have my benefits denied (or worse) because of their shitty server system.",Ohio,Yet another unemployment issue - were my responses actually received?
2121,Willis8604,1585456194,fqzujq,Nan,Has any read anything that states when the new benfits will start. I know its only 4 months and it ends on July 31st.. Im also sure if it does take a couple weeks we should receive back pay from what i read. Does anyone have any insight. I know every state is different.,Ohio,New stimlus package ( unemoloyment)
2122,WittenMittens,1585459049,fr0h86,Nan,,Ohio,"[OC] I am working on a comprehensive guide for reliable, clearly sourced and non-reactionary information on Covid-19 and this is a screenshot from my ""state-by-state"" section. Please fact check me and let me know if you're interested in helping. (Link in comments)"
2123,HiPigdom,1585463531,fr1eco,Nan,"What are some major issues you have with Ohio that could possibly be fixed at the the state level? I’m not talking about the outbreak. Issues such as education, infrastructure, drug policy, fiscal responsibility, and stuff like that. 

What do you look for when voting for a governor? What are major issues you support/oppose? 

I’m not here to criticize or harass anyone for their viewpoints, I just want to hear what other Ohioans have to say about this state. I’m looking for issues I may have never thought about, from views I may never get to have.",Ohio,Major issues in Ohio
2124,fangirlsqueee,1585471868,fr2vwq,Nan,,Ohio,Our state bird is beautiful.
2125,Igorius,1585482884,fr4sbl,Nan,,Ohio,Shot from last night of the Guardian in Cleveland
2126,amy-kath-leen,1585488377,fr5uz1,Nan,"I got denied last December and got all my unemployment held til almost January so I'm very worried I've been denied again even though this time I know exactly what I did wrong. 

None of my correspondence mail is actually available to look at. Should I just try to call?",Ohio,Unemployment files not there. Is UI Additional bad mail bad?
2127,randomaccount173,1585488890,fr5yvz,Nan,,Ohio,Dr. Amy Acton Fan Club -International Edition
2128,WoahNowNelly,1585489160,fr60zo,Nan,,Ohio,DeWine blasts FDA limit on Battelle’s face mask technology
2129,M1A1Death,1585489576,fr647z,Nan,"I don't see the difference since the lockdown began. Closing bars and restaurants I believe works well but the lockdown added nothing more to that. ""Essential"" is too broad. I work for a company that should not at all be considered essential but we're still forced to go to work. I just don't understand the benefit",Ohio,"This ""lockdown"" is useless"
2130,Pariahdog119,1585491703,fr6l80,Nan,,Ohio,FDA limits Battelle to 1/16th of their capacity to sterilize masks.
2131,Cowtowny-Johnny,1585492392,fr6r5u,Nan,[removed],Ohio,Should nonviolent offenders and undocumenteds be immediately released?
2132,whosthe,1585494348,fr78oj,Nan,"My last day of work was March 15, and I filed on March 15. Last Sunday, I filed my first weekly claim, told them I worked 10 hours on March 15, and got my check on Tuesday. This week when I filed my weekly claim, I got a questionnaire saying I had a week of work followed by a week of no work and could be denied if I didn't provide more info. I provided the info, but now I'm concerned I be denied. This is stressing me out. It's nearly impossible to talk to someone, and the website only works half the time. I would 100% rather be back at work, but I don't really have a choice at the moment.",Ohio,So much anxiety over unemployment...
2133,tacticalbigot,1585495755,fr7lm3,Nan,,Ohio,"What the hell. This technology can sterilize up to 160,000 masks a day and the FDA is putting a limit on the number to 10,000. DeWine says it's ""nothing short of wreckless."" Absolute insanity, it's like they don't want to save lives. The FDA is useless"
2134,loganporterofficial,1585495965,fr7nlw,Nan,,Ohio,How we see Ohio
2135,tacticalbigot,1585496210,fr7pte,Nan,,Ohio,"Dewine ""Stunned"" the FDA is limiting life saving technology that can sterilize up to 160,000 masks a day. FDA put a cap at 10,000. Why? We should do it anyway to save healthcare workers lives. It's like they don't want people to survive. DeWine Urges FDA to approve it."
2136,Willis8604,1585497553,fr82g5,Nan,Is anybody else getting a error message when trying to log in? I was thinking maybe they are updating the system for the new unemployment benfits. Anyone else having an issue?,Ohio,Problem signing in online for unemployment
2137,StretchSmiley,1585497691,fr83sn,Nan,During a shelter-in-place. During an outbreak of a *highly contagious virus*. Like the poor bastard’s not a COVID-laced bumblebee cross-pollinating every goddamn house he touches. I see how DDN feels about our safety.,Ohio,Just had Dayton Daily News salesman knock on my door.
2138,jeffmelchorie3,1585501050,fr91er,Nan,,Ohio,Hello mate what's up with this shit check it it pretty cool
2139,GSareClassof2020,1585501585,fr96xo,Nan,"By July 4th, 2020, 20 states (Alabama, Arizona, Arkansas, Delaware, Florida, Georgia (U.S. state), Indiana, Kansas, Kentucky, Louisiana, Michigan, Mississippi, New Mexico, North Carolina, Ohio, Oklahoma, Pennsylvania, South Carolina, Tennessee, and West Virginia) will have dropped the front plate law.",Ohio,Two-Plate and One-Plate States
2140,benjisauce,1585502410,fr9ffu,Nan,,Ohio,Governor presser today (2pm) after saying there wouldn't be one unless needed
2141,twotimefind,1585502557,fr9guw,Nan,,Ohio,General strike
2142,faentedly,1585502590,fr9h6a,Nan,,Ohio,Are state parks and hiking trails still open?
2143,pandasweetss,1585503660,fr9s4c,Nan,"Any birders out there who could recommend a good book for a millennial wanting to get into birding? Bonus if I can order it online right now :) 

We got a bird feeder recently, and with all this time at home I’d love to learn about the birds I’m seeing.",Ohio,Attn Ohio Birders: Beginner Birding Book Rec?
2144,Nightcinder,1585504395,fr9zfs,Nan,,Ohio,FDA approves Battelle’s process to decontaminate N95 face masks
2145,PeaceIsSoftcoreWar,1585504861,fra4d1,Nan,"Streaming at https://www.youtube.com/watch?v=ZjhS8UCcB5s and http://ohiochannel.org/governor-live-stream.html

I recommend using the youtube link.

I will be keeping this post updated with a summary as it continues. Things I find most important will be bold. Keep in mind it will often be paraphrased. The stream itself is the best source.

Previous streams can be found here: https://www.youtube.com/channel/UCporaXCeaOJgZKz7y3C0zbg

**Thank you for all the awards and other offers but please save your money for the future economic uncertainty which is likely going to occur.**
_______________________________
Ohio: ? confirmed cases, ? hospitalizations, ? in the ICU, ? deaths

March 11: 5 confirmed cases

March 12: No data

March 13: first case confirmed in Summit County.

March 14: 26 cases, 7 hospitalizations

March 15: 36 cases, 11 hospitalizations

March 16: 50 cases, 14 hospitalizations

March 17: 67 cases, 17 hospitalizations

March 18: 88 cases

March 19: 119 cases, 33 hospitalizations

March 20: 169 cases, 39 hospitalizations

March 21: 247 cases, 58 hospitalizations

March 22: 351 cases, 83 hospitalizations, 3/351 deaths

March 23: 442 cases, 104 hospitalizations, 6/442 deaths

March 24: 564 cases, 145 hospitalizations, 8/564 deaths

March 25: 704 cases, 182 hospitalizations, 75/182 in the ICU, 10/704 deaths

March 26: 867 cases, 223 hospitalizations, 91/223 in the ICU, 15/867 deaths

March 27: 1137 cases, 276 hospitalized, 107/276 in ICU, 19/1137 deaths confirmed.

March 28: 1406 cases, 344 hospitalizations, 123/344 in the ICU, 25/1406 deaths

March 29: 1,653 cases, 403 hospitalizations, 139/403 in ICU, 29/1,653 deaths

United States: 125,903 confirmed cases and 2,149 deaths.
_________________________________________________
2:02 PM: The Governor starts talking

Apologizes for having to call everyone to meet today. Mentions that Amy Acton will be continuing to work as usual rather than speaking today. 

We do not have enough N-95 masks. They keep our medical personnel safe and healthy, preventing the spread of the virus. We are already having to conserve them and they are wearing them longer than usual. This is a problem that is not unique to Ohio. Battelle is an Ohio company that innovated and created a machine that can sanitize as many as 80,000 masks a day. They must be brought online as quickly as possible. They are already ready but we were waiting for FDA approval. Their response, just this morning, was to approve the use of these machines. We were obviously excited. 

I spoke to the man in charge of Battelle who told me that mass sanitation of the masks would not be possible due to the FDA limiting the number of masks they are allowed to sanitize to 10,000. 

I spoke to President Donald Trump, our senators, and several of our other representatives. All of them immediately understood our concerns and said they would work to fight for this limit to be removed. 

Several minutes ago, I also spoke to the leader of the FDA and he said that he would be clearing this up by the end of the day. We have no yet heard anything but I am hopeful and grateful for the understanding. 

2:12 PM: The Governor stops speaking
_____________________________________________________________
2:13 PM: The Lieutenant Governor starts speaking

I was thrilled when I got the call about the approval of this innovative process but when I heard about that limit all my enthusiasm was evaporated. These guidelines must be changed in order to protect our most vulnerable workers. We need to run at full speed rather than being limited. I have never seen the Governor more frustrated than he was today. 
_____________________________________________________________
2:15 PM: The Governor gives an update on the latest cases 

1,653 confirmed, 403 hospitalized, 139/403 in ICU, 29/1,653 deaths, 24,376 tested in total
_______________________________________________________________________
2:17 PM: The President and CEO of Battelle begins speaking

We developed a technology that would allow for decontamination of masks that is capable of sanitizing them of diseases that are actually worse than COVID-19. These masks can be decontaminated as many as 20 times per mask. We currently have machines ready to operate in Long Island and New York. We also have machines in route to Seattle and Washington D.C. We can produce as many as two additional machines a week depending on the supply chain we can develop. 

The President and CEO of Battelle stops speaking
_______________________________
2:20 PM: Question period begins

When do you expect to see this technology used in Ohio?

Governor: We expected something better than this days ago. I was assured by the FDA that we will be able to go full-speed into this today.

The President and CEO of Battelle: We can begin working tomorrow. We already have a machine capable of full operation tomorrow. 
______________________________________________________________
2:23 PM: Are both systems deployed in Columbus? Are you planning on focusing on Central Ohio or the whole state? How long does this take?

The President and CEO of Battelle: Yes. We plan on focusing on the entire state. We currently believe we can get the 80,000 masks sanitized in a single day barring logistics issues.
__________________________________________________________________________
2:24 PM: Did the FDA explain their reasoning? Governor, do you feel you can criticize the President? 

The President and CEO of Battelle: I hope being able to share our data and the exact process we use will improve the situation. 

Governor: I called the President this morning. I explained what was happening. He understood what was going on and he said he would get this done.
_____________________________________________________________
2:26 PM:",Ohio,The Governor's 3/29 Coronavirus briefing will begin soon as of 2:00 PM
2146,SoggyManziel,1585506023,fragg4,Nan,,Ohio,2pm daily..everyone’s watchin
2147,ScienceBill,1585506354,frajq5,Nan,,Ohio,Beautiful day outside today #covidbluesky
