,author,created_utc,id,link_flair_text,selftext,subreddit,title
760,GrillinGorilla,1582431932,f84jfj,Nan,"My dog was unprovoked and attacked my brother last night, causing a large abrasion on his nipple (nice aim, Dog), and several large scratches down his arm.

Anyway, what’s the significance of Franklin County Dog Shelter asking if my dog has bitten anyone in the last ten days? Does anyone know? You can see the question highlighted on their euthanasia/surrender form here:


https://dogs.franklincountyohio.gov/ANCL-website/media/Documents/surrender-form-2017.pdf",Ohio,"I’m about to euthanize my dog. First, a question..."
761,nitnatkitkat,1582466087,f89prj,Nan,,Ohio,hell yeah!
762,THUNDERSTORMS123,1582471439,f8aslp,Nan,,Ohio,10 tornado myths that can kill you!
763,stankmanly,1582473816,f8bc5i,Nan,,Ohio,Ohio Police Are Looking For Hotel Streaker
764,Joe33347,1582483370,f8dohr,Nan,,Ohio,Look at what i made
765,Joel_Hirschorrn,1582508801,f8jr1w,Nan,"Hello all! I'm a Columbus resident, and for the holidays this year I told my parents they could pick anywhere they like and I'd plan and pay for a vacation there.  They ended up picking the lake Erie islands (Put in bay, Kelley's island area).

I'm researching the area right now but would love any recommendations on stuff to do, the best places to stay, etc from people who are familiar with the area or have vacationed there in the past. 

My parents are in their late 60s, definitely wouldn't be interested in Cedar Pointe and don't want to go during any big festival weeks or anything. They like going to breweries, hiking, bike riding, exploring towns, and relaxing near the lake and reading. I'm thinking it makes the most sense to stay on the mainland, maybe catawba or lakeside marblehead, but to be honest I really know nothing about these areas.

Any insight would be greatly appreciated, thanks in advance!",Ohio,Lake Erie Islands - vacation ideas?
766,anubis_dragoon,1582509517,f8jwfn,Nan,,Ohio,Wanted to share this here as well. Hocking Hills in the deep cold!
767,JRepmek,1582510283,f8k2n7,Nan,,Ohio,What if...
768,Neoh330,1582516498,f8le7n,Nan,,Ohio,"Greetings from Youngstown, Ohio"
769,LiterallyIDK,1582516929,f8lhhv,Nan,,Ohio,Such power we hold
770,Boi_virgin,1582517416,f8ll61,Nan,"Seriously, I have no idea whatsoever.",Ohio,[Question] Why is ohio getting popular and has becoming a meme since then.
771,jbobby7,1582517785,f8lnyx,Nan,,Ohio,"The Bartley &amp; Standart Lofts | Toledo, Ohio - Warehouse District | 1890 to 2020 | $100 M investment"
772,Flabbles13,1582524005,f8mv37,Nan,"I’m looking to buy some property, wether it’s a dilapidated home or an abandoned warehouse, I want to own some land just for the hell of it.",Ohio,Where’s the cheapest property available in the Lucas County area?
773,26SobbingHorses,1582546451,f8qd64,Nan,Scott’s from here.,Ohio,Hey All
774,Igorius,1582549119,f8qum0,Nan,,Ohio,Whipps Ledges in Hinckley
775,NathanEmory,1582561600,f8toph,Nan,,Ohio,"Join a brand new community! New Albany, Ohio"
776,ReplacePelosi123,1582575741,f8xg16,Nan,"Outside my porch!! Only in OHIO!

https://preview.redd.it/q3pcgvtohxi41.png?width=594&amp;format=png&amp;auto=webp&amp;s=11c67d59d455a8ec2aa226fd2a77dfdac69b64eb",Ohio,This happened just now!
777,fairlywittyusername,1582579250,f8yens,Nan,,Ohio,"I came to visit Cleveland last year, and write about my favourite highlights, but I know I missed a lot. What are some lesser known experiences I might want to include when I'm back in the spring?!"
778,redditor01020,1582581767,f8z355,Nan,,Ohio,"Ohio Marijuana Legalization Measure To Be Filed For November Ballot This Week | Attorney Tom Haren, who is working with the campaign, said that they are not currently disclosing who is supporting the effort. He told Marijuana Moment they will have more information to share ""later this week."""
779,someguy831x,1582582172,f8z6zy,Nan,"Hello, 

So I’m trying to see if anybody would know of any amazing overlook points or lookout points that exist in North East Ohio? Preferably Near the Akron/Cleveland area? Going to be traveling there and would love to be able to drive somewhere and just look at the beauty that is the state! 

Thanks!",Ohio,Lookout Spots
780,OrganicPreparation,1582582196,f8z772,Nan,,Ohio,Fuel tax stickers to be placed on gas pumps in Ohio
781,OrganicPreparation,1582582208,f8z7as,Nan,,Ohio,Ohio Senate candidate Melissa Ackison lashes out after Bill Reineke attacks her supporters
782,OrganicPreparation,1582582218,f8z7f4,Nan,,Ohio,How an Ohio representative’s business could profit off the ‘stand your ground’ bill he co-sponsors
783,OrganicPreparation,1582582230,f8z7jy,Nan,,Ohio,"New GEM Center at Heidelberg University creating fire, passion for students, faculty"
784,OrganicPreparation,1582582240,f8z7n0,Nan,,Ohio,"John Kasich to join Kerry, Schwarzenegger at climate change town hall"
785,sandr-a90,1582588735,f90uxc,Nan,,Ohio,The best way to get past the haters is to kill them with a smile
786,piercen18,1582594510,f928kt,Nan,,Ohio,Am I wrong?
787,stankmanly,1582596350,f92o4a,Nan,,Ohio,"Ohio graduates won’t have to be “proficient” in math or English, under state superintendent’s plan"
788,grassrootbeer,1582599254,f93c7o,Nan,,Ohio,Senate Bill 33 Violates Ohioans’ Rights
789,bp_mighty18,1582600548,f93n6m,Nan,,Ohio,How did Pete's campaign send this the exact time I got my absentee ballot??
790,Igorius,1582633365,f99gv5,Nan,,Ohio,Marblehead Lighthouse
791,ReplacePelosi123,1582637158,f9a84a,Nan,,Ohio,Great Video! When she quotes Chris Matthews i was ROFLING!
792,missladytesha,1582641575,f9b73m,Nan,,Ohio,Rosary Cathedral Church in Toledo Ohio
793,RoughTourist,1582642202,f9bc9b,Nan,,Ohio,Ohio health officials have asked 175 travelers to self-quarantine to stop spread of potential COVID-19 coronavirus
794,Hoofstronger,1582646171,f9cb9q,Nan,,Ohio,Only in Portsmouth
795,trueslicky,1582650277,f9dd5c,Nan,,Ohio,"As Ohio Plans for Opioid Settlement, Treatment Should Come First"
796,OrganicPreparation,1582651656,f9dqa2,Nan,,Ohio,Police investigating after Fostoria man’s death is ruled a homicide
797,OrganicPreparation,1582651665,f9dqci,Nan,,Ohio,"Ohio priest charged with child pornography, child exploitation and juvenile sex trafficking"
798,OrganicPreparation,1582651685,f9dqj3,Nan,,Ohio,Tiffin mayor sounds off about viaduct-truck incidents: I’m not even trying to sound “like a jerk”
799,OrganicPreparation,1582651694,f9dqms,Nan,,Ohio,FedEx driver sentenced after making delivery to Seneca County Sheriff’s Office while on cocaine
800,candlesinthewindxx,1582656292,f9extm,Nan,"I am feeling extremely overwhelmed. I’m just beginning to research and figured it wouldn’t hurt to ask here as well. I am looking for a dentist. My teeth aren’t the worst but they also aren’t in great condition. This may come off as immature, but I am afraid of feeling judged.. so a place that is compassionate and kind would really help. If anybody has any recommendations please let me know! Thank you fellow Ohioans!",Ohio,Advice please!
801,BiBuckeye4243,1582657311,f9f7al,Nan,,Ohio,"My mom isn’t Karen, but is guilty of it"
802,John-doe-and-Smith,1582659372,f9fqwr,Nan,,Ohio,It be like that
803,celicajohn1989,1582660825,f9g4xp,Nan,"Last month I sent a letter to Senator Rob Portman's office expressing my dismay regarding his response/vote on the impeachment of Donald Trump. 

This is the (inadequate) response I got. I will point out that each of his reasons for voting against impeachment are easily discounted and debated. The president did commit criminal actions, that was determined by the GOA. The House process was not flawed nor was it rushed. The House did everything short of holding violators of subpoenas in contempt of congress and arresting them which surely would have been weaponized against them if they did that. Multiple constitutional scholars explained that Trump did commit high crimes and misdemeanors. Also, the senate obviously has no desire to pass any legislation seeing as there are hundreds of House bills sitting in the graveyard of Majority leader McConnell. 

I'm not buying your bullshit, Rob. 



Dear John,
Thank you for writing in to express your views regarding the impeachment of President Donald J. Trump. It is good to hear from you.
On February 5, I voted against both articles of impeachment brought before the Senate by the House of Representatives. In doing so, I joined a majority of my Senate colleagues in opposing removal of President Trump from office and taking him off the ballot this year.
The founders intended for impeachment to be extremely rare, and they required those seeking to remove the president to meet the burden of proving “high crimes and misdemeanors,” such as treason or bribery. In this case, unlike in other impeachments, no crime was alleged. Although there may be circumstances where a crime is not necessary for a president to be impeached, to be impeached under such a circumstance would require meeting an even higher bar, and I believe it was not met in this case.
In addition, the House engaged in a rushed process that lacked fundamental fairness. Instead of using the tools available to compel the administration to produce documents and witnesses, the House followed a self-imposed and entirely political deadline for voting on the articles of impeachment before Christmas. Rushing an impeachment case through the House without due process and giving the Senate an incomplete case to finish set a dangerous precedent. If the Senate had voted in favor of the articles, it would have risked making this kind of flawed, partisan impeachment in the House a regular occurrence, which would serve only to further deepen the divides that seem to permeate every part of our society today.
It is time to turn the page and begin a new chapter. We can do that by demonstrating that we can work together and address the issues our constituents care most about.
My focus will remain on working with my colleagues, on both sides of the aisle, and with the Trump Administration, to lower prescription drug costs, improve skills training for the jobs available today, expand retirement security, tackle the addiction crisis, and the many other priorities for Ohio families. I truly believe we can do more together as a united Senate, Congress, and country.
Thank you again for taking the time to contact my office. It is an honor to represent you and your family in the United States Senate. For more information you can visit my website at www.portman.senate.gov. Please keep in touch.
 
Sincerely,
Rob Portman
U.S. Senator
￼",Ohio,Response from Senator Portman's office
804,Kinglens311,1582661800,f9gedu,Nan,,Ohio,Response from Senator Portman's office
805,NewEnglandHappyMan,1582662447,f9gkqe,Nan,,Ohio,Coronavirus: 1 person in Ohio being monitored by ODH for virus
806,OrganicPreparation,1582663794,f9gxv0,Nan,,Ohio,Ohio Democrats look to wrangle down insulin costs
807,askcoronavirus,1582667171,f9huzv,Nan,,Ohio,Coronavirus: 1 person in Ohio being monitored by ODH for virus
808,ToKeepAndToHoldForev,1582669557,f9ii36,Nan,"I know Akron has two tombs in the two cemeteries and when I googled this there’s one in Steubenville. However, I have seen the highway one. I need to know. Is it near Boston Heights??",Ohio,Where is that one highway tomb for the unborn?
809,BobMcGeoff2,1582672343,f9j8dc,Nan,,Ohio,WEINER NUT
810,ReplacePelosi123,1582678921,f9ktgb,Nan,,Ohio,"How does anyone like Pete? He' so fake and manipulative. Swear he was made in a lab inside the DNC, so robotic and fake"
811,sterlingbeatshisgirl,1582679248,f9kw6u,Nan,"Im from Ireland and have never even been inside the US. But one day I was looking up a place called Bonneybrook in Dublin and got brought to Stoneybrook Farm Lake Dam.

The name Waynesville got my attention and I put the town into satellite to have a look around, straight away I saw the American football pitch with the Spartans name on it and from there just got fascinated with looking around the town, and always open up maps when I’m bored and just check around.

Would be really cool if anyone is from there or knows people from there would like to tell me about it. I’d love to visit in the future",Ohio,Anyone’s from Waynesville?
812,Goldgreenbluesilver,1582681908,f9lhzh,Nan,,Ohio,Do you ever assume things about people based on what part of Ohio/the Midwest they’re from?
813,chezburgerdreams,1582683004,f9lrhb,Nan,,Ohio,What’s happening in Mt. Vernon
814,OrganicPreparation,1582684724,f9m6bj,Nan,,Ohio,Ohio Senate candidate Bill Reineke accused of sending spy into Melissa Ackison campaign
815,OrganicPreparation,1582684781,f9m6sg,Nan,,Ohio,Bill Reineke campaign misquotes Blade in attack ad targeting Melissa Ackison
816,KarmaIsAbitsh,1582690256,f9nfon,Nan,,Ohio,U S A
817,Default_Lives_Matter,1582690561,f9nhyw,Nan,,Ohio,What if we've all just in a dream and Ohio doesn't really exist
818,discocrisco,1582691441,f9nol9,Nan,,Ohio,"Ohio troopers’ 100 mph chase through Strongsville, Brunswick ends in crash, arrests and is now under review"
819,prozacprodigy,1582696003,f9ol5w,Nan,,Ohio,MMJ Question: I am certain that I qualify for PTSD. I also want to get my medical marijuana card. Do I have to go to a psychiatrist to receive a diagnosis before I go to the licensing doctor?
820,RoughTourist,1582697134,f9osrp,Nan,,Ohio,Coronavirus: 1 person in Ohio being monitored by ODH for virus
821,K8Mc,1582698929,f9p40o,Nan,,Ohio,Who knew Ed Sheeran was in Portsmouth?
822,jacobdavies78,1582704515,f9q0rw,Nan,,Ohio,House Washing &amp; Building Washing Pittsburgh
823,corrinnevoconla,1582706913,f9qdui,Nan,,Ohio,YouTube
824,tylermcdowell91,1582724286,f9tbzy,Nan,,Ohio,Most accurate forecast for ohio this week
825,Igorius,1582728815,f9udb3,Nan,,Ohio,Ohio city at night (Cleveland)
826,Fstien03,1582732564,f9vabz,Nan,[removed],Ohio,would you say something ??
827,J-TrainTheFirst,1582733799,f9vltq,Nan,,Ohio,Article from yesterday
828,bijoucallipygian,1582735116,f9vyji,Nan,,Ohio,Only in Ohio
829,LsG133,1582740241,f9xb9o,Nan,,Ohio,Had to be our lovely state
830,Maximus411,1582741263,f9xl1j,Nan,,Ohio,The Mercantile Library: A Hidden Cincinnati Gem
831,chemisdirect,1582745804,f9ysjm,Nan,,Ohio,pure and excellent quality Xanax for pain killer
832,OhioTry,1582752749,fa0ool,Nan,,Ohio,"""A 33-year-old male was hospitalized after a Newark house fire that investigators believe was started by the manufacturing of drugs."""
833,Projectrage,1582771071,fa550u,Nan,,Ohio,CBS NEWS: “Reliability of expensive new voting machines called into question” Hackable voting machines in OHIO. Nothing to see here.
834,OrganicPreparation,1582774091,fa5szu,Nan,,Ohio,"Ohio troopers seize $50,000 worth of cocaine during traffic stop"
835,OrganicPreparation,1582774116,fa5t7i,Nan,,Ohio,Winter Weather Advisory in effect for parts of Northwest Ohio: Here’s what you need to know
836,OrganicPreparation,1582774131,fa5tbz,Nan,,Ohio,"New GEM Center at Heidelberg University creating fire, passion for students, faculty"
837,Igorius,1582813262,facrax,Nan,,Ohio,World's Largest Outdoor Chandelier at Playhouse Square in Cleveland.
838,Laceyfrommeetup,1582816279,fadgo0,Nan,"Sorry for very basic level of information that most people probably already know. 

I called the office of Frank LaRose the Secretary of State for Ohio to update my registration because I did not remember if I declared a party or undecided when I originally registered to vote. I asked “does Ohio have an open, semi closed, or closed primary?” to be sure that I could vote in the primary election I wanted. The Secretary of State could not answer this question and instead bounced me to my county’s office which immediately answered that Ohio has open primaries. 

Ohio having open primaries means you choose your party at the time of the primary elections so there is no need to preregister for a specific party. 

You must register or update your voter registration no later than 30 days prior to an election. Upcoming voter registration deadlines:
February 18, 2020 for the March 17, 2020 Primary Election
July 6, 2020 for the August 4, 2020 Special Election
October 5, 2020 for the November 3, 2020 General Election

You can also register online with a valid drivers license number 

[https://olvr.ohiosos.gov](https://olvr.ohiosos.gov)",Ohio,YSK Ohio has open primaries. Frank LaRose’s office did not know that and you should register if you want to vote in the upcoming primary elections. You can do this online.
839,ErrorUserUnknown,1582816484,fadif1,Nan,"Sorry for very basic level of information that most people probably already know. And sorry for formatting mobile yadda yadda yadda. 

I called the office of Frank LaRose the Secretary of State for Ohio to update my registration because I did not remember if I declared a party or undecided when I originally registered to vote. I asked “does Ohio have an open, semi closed, or closed primary?” to be sure that I could vote in the primary election I wanted. The Secretary of State could not answer this question and instead bounced me to my county’s office which immediately answered that Ohio has open primaries. 

Ohio having open primaries means you choose your party at the time of the primary elections so there is no need to preregister for a specific party. 

You must register or update your voter registration no later than 30 days prior to an election. Upcoming voter registration deadlines:
February 18, 2020 for the March 17, 2020 Primary Election
July 6, 2020 for the August 4, 2020 Special Election
October 5, 2020 for the November 3, 2020 General Election

You can also register online with a valid drivers license number 

[https://olvr.ohiosos.gov](https://olvr.ohiosos.gov)",Ohio,YSK Ohio has open primaries. Frank LaRose’s office did not know that and you should register if you want to vote in the upcoming primary elections. You can do this online.
840,MetalHeadLP,1582828465,fagk7s,Nan,,Ohio,Once again DNC is doing their rigging. Man F the DNC.
841,StuStutterKing,1582832886,fahpim,Nan,,Ohio,Millions of updated driver’s license photos to fill Ohio’s facial-recognition system - News - Akron Beacon Journal
842,horror_lover_girl,1582834944,fai8sc,Nan,"My grandma is sheltering this cat along with 7 others. She wants to have zozo (the cat I'm talking about) adopted out by spring minimum so if you are interested no adoption will happen until then. My grandma prefers someone with a wheelchair as her last owner had a wheelchair and as mentioned she loves sitting on your lap/chest! She's about 4 years old, fixed, and she likes to boss around other cats but she's never really mean. In order to qualify you must live in Ashland, Mansfield, Shelby, Wooster, or somewhere close to that. Send me a message if your interested! If you are please share this I want it to be seen by as many people as possible!",Ohio,Orange female rescue cat needs adopted preferably by someone with a wheel chair as she loves to sit on laps/chests!
843,MetalHeadLP,1582841764,fak1cy,Nan,,Ohio,WATCH HASANABI LIVE
844,THUNDERSTORMS123,1582842075,fak4b0,Nan,,Ohio,Snow Squall
845,OrangeJulius82,1582842997,fakchs,Nan,[removed],Ohio,"Attorney General Barr is not resigning; not before President Trump does. Barr is the same as Mueller,Pelosi,Schiff, Nadler: feign opposition to cover the true motive of obstruction to keep Trump in power. Supreme Court Justice Alito &amp; FBI Deputy Director Wray also on board. See latest updates📷"
846,AngelaMotorman,1582844709,fakrn9,Discussion,,Ohio,Jim Jordan’s role as enabler-in-chief poses a particular danger in the age of Trump
847,MetalHeadLP,1582850580,fam52c,Nan,,Ohio,Senator of Ohio Speaks!!
848,CincinnatiKelts,1582852709,fammb2,Nan,,Ohio,Gave me a good chuckle!!! Play rugby!!
849,Reonicles,1582857006,fankxq,Nan,,Ohio,And that's a fact
850,cherryBOOM_x2,1582861201,faoi4i,Nan,,Ohio,"[FOR SALE] Two mobile tickets to the Foo Fighters: Van Tour/25th Anniversary concert in Cleveland @ Rocket Mortgage FieldHouse on May 18th. Section M110, row 7, seats 1-2. $175 per ticket with 100% buyer protection via PayPal Goods &amp; Services. $0 transfer fees via Flash Seats."
851,MetalHeadLP,1582861228,faoicc,Nan,,Ohio,Shocking.
852,Igorius,1582893718,fau4rq,Nan,,Ohio,An evening stroll in downtown Cleveland
853,consensus_wins,1582896905,fausf5,Nan,,Ohio,Another black eye given to Toledo by none other than Toledo.
854,PeruvianRabil,1582897236,fauuwg,Nan,,Ohio,This is what I get for growing up in the south
855,jacobdavies78,1582898601,fav5gl,Nan,,Ohio,Window Cleaning South Hills &amp; Restaurants Cleaning Pittsburgh
856,Buckwild58,1582907682,faxd38,Nan,,Ohio,"Ohio man starts beer-only Lenten fast, aiming for a world record"
857,dhrubodt,1582909454,faxtxf,Nan,,Ohio,"Evening walk in toledo, ohio"
858,NASCARaddict24,1582914245,faz4df,Nan,,Ohio,Hello all! I am conducting research for my senior project at Cleveland State. Could you please take a quick survey? 18-25 year olds living in northeast Ohio. I need a minimum of 120 responses.
859,beatnikprints,1582922625,fb19ye,Nan,,Ohio,"artistic interpretation of Ohio Topography, every 100 ft, 5 repeating colors"
860,beatnikprints,1582922709,fb1aoq,Nan,,Ohio,"Ohio Topography 100 ft contours, artistic interpretation, 5 repeating colors"
861,pmpkns33d,1582940171,fb57cc,Nan,,Ohio,Beautiful Akron
862,joespofforth,1582941141,fb5ed2,Nan,,Ohio,Go Cinci!
863,MetalHeadLP,1582951624,fb7i21,Nan,"Not surprised

&amp;#x200B;

https://preview.redd.it/rq38vbscmsj41.png?width=600&amp;format=png&amp;auto=webp&amp;s=78ec5d6d05715769ef7596787014a7025eebf7b4

&amp;#x200B;

&amp;#x200B;

She's psychotic",Ohio,So hillary is getting a podcast
864,Joe33347,1582957257,fb8icr,Nan,We must invade r/ Michigan with pictures of ohio repost this to as many subreddits that are ohioan like r/ bowlinggreenohio,Ohio,Fellas
865,uglyboy4,1582957868,fb8lz2,Nan,"I’m a chef who loves fermentation and preservation. And I love Ohio. Especially for the agriculture. But after a lot of research, I found that almost none of it is NATIVE to Ohio. I want to work with ingredients that are native to this state but it’s almost impossible to find anything online. Anyone know of anything? With Sources?",Ohio,Agriculture native to Ohio
866,Igorius,1582975560,fbb8w6,Nan,,Ohio,Another shot of Playhouse Square
867,jacobdavies78,1582985381,fbcztf,Nan,,Ohio,Window Cleaning South Hills &amp; Restaurants Cleaning Pittsburgh
868,i-out-pizza-huts,1582985797,fbd30v,Nan,,Ohio,Never change Ohio
869,Stonewolf24,1582985839,fbd3b3,Nan,,Ohio,"Fall Colors, Warren County Lake Vesuvius"
870,jacobdavies78,1582989770,fbdysk,Nan,,Ohio,Building Washing Pittsburgh &amp; Gutter Cleaning Washington
871,Greekboy34,1582997205,fbft5y,Nan,,Ohio,Yay Ohio
872,hannah_exploration,1583003973,fbhis6,Nan,,Ohio,Chilling with a view. ✌
873,Dugillion,1583010222,fbj1t6,Nan,,Ohio,Rare Ohio Plants Rediscovered
874,rowdyrebbell,1583011891,fbjg04,Nan,,Ohio,Sign at a Gyro restaurant
875,Goldgreenbluesilver,1583014845,fbk5kz,Nan,,Ohio,What culture(s) would you say have had the most impact on Ohio and the Midwest in general?
876,KaiserreichOfPoland,1583022736,fblxvp,Nan,,Ohio,There was no other choice
877,throwaway3453536546,1583029528,fbnewv,Nan,"I am moving for work and looking for a very SAFE area near Mayfield Village. Any suggestions? 

I am in my mid 20s, so I'd like somewhere fun if possible. Thanks!",Ohio,Places to live in Ohio
878,pluey200,1583030765,fbnoes,Nan,,Ohio,Thank you Grafton very cool
879,clostridium_dead,1583031580,fbnua8,Nan,,Ohio,America is thicc
880,jbobby7,1583065185,fbtayt,Nan,,Ohio,"Jackson High School Commons - Massillon, Ohio | Addition Sol Architects 2008"
881,catnik,1583070233,fbu7qt,Nan,,Ohio,"Apparently, the road to success is in Ohio."
882,sprucey,1583075497,fbvaue,Nan,,Ohio,"Happy 217th Birthday, Ohio!!"
883,pettycandy,1583075559,fbvbbn,Nan,"Ohio became a state on March 1, 1803.",Ohio,"Happy Birthday, Ohio!!"
884,Dustlight_,1583076381,fbvi1o,Nan,,Ohio,Can’t wait for Ohio Horizons
885,ColDaddySupreme1,1583078459,fbvzm4,Nan,It's gone from 2.17 to 2.59 to 2.20 to 2.65 down to 2.05 today all in the past few weeks,Ohio,[Northeast] what's up with the gas prices
886,smurfin101,1583081736,fbwt0q,Nan,,Ohio,Ohioans be like
887,drazthedragon,1583085389,fbxqkb,Nan,[removed],Ohio,The simple card game to teach people how to spell Cincinnati
888,BiBuckeye4243,1583087245,fby7so,Nan,,Ohio,Why do we want Russia again?
889,Real_TSwany,1583090911,fbz5qi,Nan,,Ohio,Maybe the invasion was for the better
890,Hooloovoo_42,1583091950,fbzf8b,Nan,,Ohio,Shitty Ohio Science
891,clostridium_dead,1583093970,fbzxxx,Nan,,Ohio,Pretty close lol
892,kyrakyun,1583106514,fc30f8,Nan,"Hey! My friend and I will be traveling to Ohio mid-July this year, specifically Columbus, and we’re thinking of staying there for about a week or so :) 

Any places to recommend? We don’t mind traveling a bit as well!",Ohio,Must-see places in Ohio? :)
893,Godsshoeshine24,1583118541,fc5n2y,Nan,"Hello folks, my sister is moving to Denver from Boston, and we took a route up through Buffalo, into NE PA and into Ohio. It took forever to get through Ohio, and along the way I saw eleven abandoned cars on the highway. Not pulled over and waiting for a tow truck. They were straight up abandoned. What's the deal? Is it always so common to see?",Ohio,Road Trippin Ohio
894,OrganicPreparation,1583120401,fc6176,Nan,,Ohio,Students from Vanguard-Sentinel Career Center build custom desk for boy with achondroplasia
895,OrganicPreparation,1583121665,fc6amb,Nan,,Ohio,Coronavirus Outbreak: Here's what you need to know
