,author,created_utc,id,link_flair_text,selftext,subreddit,title
0,HereForTheSocializin,1577776203,ehziyh,Nan,"All-in-all, we’re looking to start over. We don’t have a vault of money saved and are coming from an entirely different state. How much does it cost to live in Dayton and what are the average wages? I got some numbers from google but who better to ask than you guys? Anything we should know before we make the move?",Ohio,"My SO and I are thinking of moving to Dayton, Ohio. What are somethings we should know before we pack up our things?"
1,Fey_fox,1577781820,ei0bww,Nan,"On January 1st 2020 the fees to renew your tags will go up an extra 100 for hybrids, and 200 for electric cars. 

[Go to oplates ](https://services.dps.ohio.gov/BMVOnlineServices/) to renew online. You can renew up to 5 years and have the stickers mailed to you. 

[More info about the price hike here](https://www.cleveland.com/open/2019/12/ohios-new-100-fee-for-hybrids-and-200-fee-for-electric-vehicles-goes-into-effect-next-week.html)

This does not affect regular cars btw. 

Also this isn’t just hitting Ohio, [there are states that are charging up to 200% of the registration fee for electric cars](https://www.consumerreports.org/hybrids-evs/more-states-hitting-electric-vehicle-owners-with-high-fees/)

Sooo yeah, if you’re one of those folks affected or know someone who might be, let them know.",Ohio,"PSA, if you have an electric or hybrid car, renew your tags before midnight (Dec 31st)"
2,THUNDERSTORMS123,1577804795,ei3ywy,Nan,"
Special Weather Statement issued December 31 at 10:04AM EST by NWS Cleveland OH

Areas Affected: Summit; Wayne; Portage; Cuyahoga; Lake; Ashland; Trumbull; Medina; Ashtabula Inland; Geauga; Richland; Lorain; Huron

At 1003 AM EST, an area of heavy snow was located along a lineextending from near Solon to near Polk. Movement was northeast at 35mph.Winds in excess of 35 mph are possible with this area of heavy snow.Locations impacted include...Cleveland, Akron, Lorain, Elyria, Mansfield, Warren, Medina, Wooster,Ashland, Painesville, Norwalk, Willowick, Conneaut, Ravenna,Vermilion, Chardon, Parma, Lakewood, Cuyahoga Falls and Euclid.Visibilities will drop quickly to less than a quarter of a mile inthis area of heavy snow.Icy roads are possible as the snow melts on the roads then quicklyrefreezes.Conditions can deteriorate rapidly in winter weather situations. Beprepared for snow or ice covered roads. Slow down and allow extratime when traveling.",Ohio,Special Weather Statement
3,tehForce,1577820680,ei7lsx,Nan,,Ohio,"Pike County deputy arrested, accused of threatening to kill himself, fiance"
4,JuicyJimothy,1577839747,eibmbq,Nan,,Ohio,We Must Resist Panera
5,4sporthufflepuff,1577840774,eibte1,Nan,,Ohio,sounds like us
6,Speedstormer123,1577853918,eie326,Nan,"It's really big and looks like it's been closed for a really long time, and it's looked like that for almost a decade.",Ohio,Does anyone know what the abandoned store on Route 4 north of Marion was?
7,Gragaina,1577855525,eiedon,Nan,WHOS READY FOR 2020?!! ANOTHER YEAR IN THE GREATEST STATE!,Ohio,HAPPY NEW YEAR OHIO!
8,xXoldplayerXx,1577925306,eiqgb6,Nan,,Ohio,In need of someone with lots of information about hocking county ohio.in search of information about a location with very few records
9,Original_Clorox,1577936794,eist8j,Nan,I am doing a project where I compare accents from diffrent states to people in Mexico who are learning English. I was wondering if I could get a sample saying anything as long as it's not offensive or obscene. Thank you :),Ohio,"People of Ohio,may I get a voice sample of your accent?"
10,LargePersianSenip,1577942004,eitshy,Nan,Moved here about 2 years ago and I'm willing to travel around to find the best steakhouses. What do you guys got?,Ohio,Best steakhouses around the state?
11,LsG133,1577946316,eiujyi,Nan,,Ohio,"Man was ‘popping off’ rounds to celebrate New Year’s Day when he fatally shot girlfriend, Cleveland police say"
12,Jessicabay5252,1577952823,eivj7v,Nan,"Hey, I moved out of ohio back in 2018, and I got a name change earlier this year, I was wondering if anyone here knew how to both change the name on and get a new certificate at the same time, if anyone knows or knows a good place for me to figure this out i'd appreciate it, thanks!  


I tried emailing the vital records office about it but didn't get a response.",Ohio,Anyone here gotten a name changed on their birth certificate?
13,HereForTheSocializin,1577964655,eix50r,Nan,"And I’m not talking about food unfortunately. I posted on here a few days ago about moving to Ohio when we thought of another hurdle: our ethnicities. My spouse and I are thinking of moving to Ohio and are feeling some places out. Rent, budgets, work, and many other things we’ve got a decent idea of. We’re just not sure how people in Ohio feel about Asians. We’re both of Asian descent but we’re born in another state. I get that Ohio is a big place and the opinions will differ greatly from city to city. So what’s your general take and which part are you from? I’ll take any and all opinions: good and bad!",Ohio,How do you guys feel about Asians?
14,Igorius,1577971650,eiy80l,Nan,,Ohio,Perry Nuclear Power Plant
15,sallyjohnshon254,1577974866,eiysl3,Nan,"&amp;#x200B;

https://preview.redd.it/c3i99n3mjd841.png?width=700&amp;format=png&amp;auto=webp&amp;s=d79a587bad51f45069432faa30cfab83d6ba654f

 Vince Neil of Motley Crue was slated to perform at the MGM Northfield Park – center Stage next month, but the show has been cancelled.

The gig was scheduled to take place on Friday, January 10 in Northfield, Ohio. However, Monday afternoon, the show was cancelled due to “circumstances out of the artist’s control.” Neil was set to perform amid a string of solo gigs in 2020; he’s still slated to make stops in Columbus, Ohio and Lawrenceburg, Indiana in March, followed by two gigs in Durant, Oklahoma in April.

Aside from his solo endeavors, Neil will head out on tour for the[ **highly-anticipated stadium tour**](https://www.ticketnews.com/2019/12/motley-crue-reveals-official-2020-tour-dates-with-def-leppard-poison/) with Motley Crue, Def Leppard, Poison, and Joan Jett &amp; the Blackhearts. Earlier this year, the band announced that they would reunite after five years, despite previous reports that they could no longer tour[(read more...)](https://www.ticketnews.com/2019/12/motley-crues-vince-neil-cancels-show/)",Ohio,Motley Crue’s Vince Neil Cancels January’s Ohio Show
16,sharkbait_hooohaha,1577992290,ej2mky,Nan,"Hello, I recently moved to Rootstown. I was wondering if anyone knew of any good spots to ride a dirtbike? I do have a trailer so distance isnt necessarily a problem, just looking for something close to go to on random days next season. Thanks!",Ohio,Good off-road riding spots near Ravenna?
17,journogabe,1577993343,ej2vo5,Nan,,Ohio,Ohio Republicans Sign Letter Urging Supreme Court To Reconsider 'Roe v. Wade'
18,OrganicPreparation,1577994906,ej390u,Nan,,Ohio,Mother of missing 14-year-old Ohio boy raises new questions with video posted to Facebook
19,rustbeltresident,1577996140,ej3jvm,Nan,,Ohio,"Cleveland Flats Grain Elevator - one of, if not the oldest grain elevators in the United States."
20,TicketForTheRoad,1578003494,ej5bv3,Nan,"Hi!

&amp;#x200B;

My SO is going to be starting a PhD and I'll be moving with her. I currently have my MBA in finance and I'm a junior financial analyst. I was wondering what the job prospects look like in terms of finance (I'm coming from NYC). I work at a non finance company for their finance team.

&amp;#x200B;

I'm wondering if anyone could tell me if there are banks or other large companies that would likely need analysts, etc in either city!

&amp;#x200B;

Thank you :)",Ohio,Columbus vs Cincinnati Finance Jobs
21,dallyinthealley,1578010530,ej6ykl,Nan,,Ohio,Cuyahoga Valley National Park is beautiful. I loved my time there this summer.
22,[deleted],1578012667,ej7fwn,Nan,[deleted],Ohio,FUCK Rita
23,cookke,1578018814,ej8rd7,Nan,"My buddy, Vic is opening up a new store in Ohio, just west of Dayton. The store is a restaurant. Y'all gonna go try it? It opens tomorrow morning at 11. God bless!",Ohio,New store opening! A really good restaurant!
24,StuStutterKing,1578035392,ejbxzn,Nan,,Ohio,Akron to shut down Chapel Hill Mall['s water] over late utility bill
25,Jarettx,1578058458,ejfgm4,Nan,"Where have been your favorite places to shoot? Whether it be landscape photos, portraits, etc. Looking to travel a bit more around Ohio and see all it's beauties. As well as find new places to shoot for clients!",Ohio,Photographers of Ohio
26,jacobdavies78,1578065643,ejgyf6,Nan,,Ohio,Power Washing Pittsburgh &amp; Pressure Washing Washington
27,Super_DM,1578079844,ejkd2d,Nan,[https://discord.gg/phU6wD](https://discord.gg/phU6wD),Ohio,Join discord server
28,FarteGaas,1578082204,ejkxy6,Nan,[removed],Ohio,"Wag The Dog: First was feigned impeachment hearings, now an attack on Iranians in Iraq. Here is what they are trying to distract from and cover up to retain power through obstruction. $75+ Billion in bribes to the highest offices in this country. Over 600 deaths from child rapes to prove loyalty."
29,CommanderBanjo,1578094431,ejntal,Nan,"Hey guys, I'm sorry if this isnt the right place but I'm desperate. Just found out that one of my closest friends has been in a bad car accident and was hit by a drunk driver. Shes currently in hospital in a medically induced coma, and desperately needs a blood transfusion. So if anyone here has AB Negative blood then please please let me know, we need it as soon as humanly possible. Thank you so much. If you have AB neg are willing to donate, please lemme know in the comments or message me. Thanks guys

Edit: weve found a match guys! Thanks for your help :)",Ohio,"Ohioans, I need your help"
30,Kunphen,1578094650,ejnv57,Nan,,Ohio,"Pennsylvania is Discharging Radioactive Fracking Waste Into Rivers As Landfill Leachate, Impacting The Chesapeake Bay &amp; Ohio River Watersheds"
31,JohnKimble111,1578108090,ejqu1h,Nan,,Ohio,American women raped in Spain latest news: Arrests made of 3 Afghan men
32,bsparks027,1578126864,eju5eg,Nan,,Ohio,Are there any other cities besides mine that added these blue lights that turn on when an Emergency Vehicle is approaching?
33,Bieterman,1578147150,ejx2kh,Nan,,Ohio,Yang to launch write-in campaign for Ohio primary.
34,Igorius,1578152023,ejxzt1,Nan,,Ohio,Cleveland at night
35,psychodogcat,1578154949,ejylqj,Nan,,Ohio,Ohio-class. Let's take over the world guys
36,stockholm182,1578155828,ejysib,Nan,,Ohio,Kings Island
37,GoonterTheBoy,1578160166,ejzs33,Nan,"Was anybody else at the game on New Year’s? We beat em 4-1, felt good.",Ohio,The Blue Jackets
38,buh_nanners,1578169993,ek216n,Nan,I’ve been wanting to get some pictures of interesting abandoned structures but am also concerned about inadvertently getting arrested for trespassing and such. Any suggestions in state? I’m in the SE part of Ohio (Marietta) but am always up for visiting other areas.,Ohio,Bando hunting
39,Bigcat0,1578184572,ek59lo,Nan,,Ohio,OhioJobsForAll has been created
40,OrganicPreparation,1578187107,ek5s7y,Nan,,Ohio,Northwest Ohio mayor to take leave of absence after 'sneezing incident' causes him to require back surgery
41,YamatoDamashii_,1578193896,ek75bb,Nan,"A few years ago the no front license plate law became a secondary offense, meaning that you could only be cited if you were violating another traffic/equipment law. 

Since then how often have you been pulled over/cited for not running a front plate for those of you who choose not to?",Ohio,How often have you been cited for no front plate?
42,psrE353,1578202385,ek8qve,Nan,"I'm from Michigan (I know, I know, ""BOOOO"") and here we have a lot of gravel roads, which I like, one because I find gravel roads more enjoyable, and also when it is a paved road, you know it goes somewhere important (most of the time). I've driven through Indiana (among other states) and noticed that while most of their roads are paved, they do have some. But I have driven through many parts of Ohio idk how many times now, and not just on the main highways either, and haven't found a single gravel road.

All the farm/country roads seem to be paved and I notice in some areas the road commission even paves some people's mailbox ""pull-offs.""

I've seen on the Ohio news that you guys are short on road funding as well, which I find ironic since I have never seen a single gravel Ohio road.",Ohio,I'm honestly curious - does Ohio have any dirt/gravel roads?
43,jacobdavies78,1578206629,ek9gdd,Nan,,Ohio,Roof Cleaning Pittsburgh &amp; Pressure Washing Washington
44,thinkB4WeSpeak,1578247000,ekgegr,Nan,,Ohio,Wright State University to build $7.6M workforce center
45,Gorillaz_Girl2000,1578256645,ekipgb,Nan,,Ohio,Cincinnati bridge view
46,EarlesFamily,1578264537,ekke5o,Nan,,Ohio,Losing our kids in the Cincinnati museum!
47,ScienceBill,1578271048,eklw37,Nan,,Ohio,Clifton Gorge
48,OrganicPreparation,1578273112,ekmchp,Nan,,Ohio,Andrew Yang to launch write-in campaign for Ohio primary after paperwork error blocks him from ballot
49,OrganicPreparation,1578273125,ekmcl8,Nan,,Ohio,Disappearance of 14-year-old Ohio boy Harley Dilly featured on Live PD
50,Melvin7Melvin7,1578276348,ekn1nk,Nan,"Hey does anyone know anything about the Mogadore Brick Company?  
  
A friend of mine had ancestors that worked at the brick company. She's looking for a brick stamped ""Mogadore."" I would like to find one of these bricks.",Ohio,Mogadore Brick Company
51,Igorius,1578276772,ekn4yj,Nan,,Ohio,Blue Hen Falls in Cuyahoga Valley National Park
52,loreguy11105,1578276939,ekn65i,Nan,,Ohio,Cuyahoga River view
53,elthiastar,1578319655,ekukvd,Nan,"Does anyone know if Ohio has an Attorney General office or commission on hospital billing?   Adena Hospital has been calling me and harassing me about a bill that is not only paid, has cleared my bank account and I have a transaction number.  I have had no luck trying to speak to a supervisor.   It is a bill that is on a payment plan, they can cancel the payment plan for a missed payment.",Ohio,Does Ohio have a resource for fraudulent hospital billing?
54,spacey2413,1578323368,ekvbqa,Nan,,Ohio,"Got to visit one of my bucket list places in Ohio! Totally recommend to anyone who has never been! The Mansfield Reformatory was an awesome experience, full of history, and ghosts!"
55,NinjaInfoCards420,1578331676,ekx7dk,Nan,"I moved up to Fairborn back in November 2019. My girlfriend moved in with me from Michigan and we both agree this place is really weird. I lived up in this fuck fest by myself for a month and a half. 

Being a kid who was forced to move around a lot, though I am seldom able to make friends because I never live anywhere long enough at the very least I'm able to get a few acquaintances I can occasionally drink or chat with. No such luck. Everyone here has their head stuck up there ass. 

In a bar you aren't allowed to have a friendly conversation with anyone even if it's just stupid smalltalk. The bartender will get on your ass about it. I actually almost got kicked out of a bar for politely asking how much a bag of chips cost once. Back in Florida no one gives a fuck if you ask questions like that.

Oddly enough, most of the bars are totally dead. Actually any place people would go to hang out here is fucking dead. The entire place is like a ghost town. Usually you only see 2-3 people in sight and usually they are old people, not anyone in our age range (we're in our 20s.)

At night when we go out for walks there's never anyone out walking around after 5pm. In fact you never see anyone during the day either for the most part. See what I mean? Ghost town. The one time we saw someone out we went out round 10 for a smoke and were followed for two blocks by some creepy drunk guy singing happy birthday to himself.

We had another creepy experience. That same night we had to leave cause my maintenance guy showed up late and he was gonna be there for a while. So we went out for a walk. I got thirsty so we stopped at the only place that was open - a bar called The New Chapter - and asked for a bottle of water. 

Back in Florida, also evidently Michigan you could just go into a bar during business hours, ask for a water and no one would give a fuck. The bartender (change of management. Old one used to be chill) got really snippy with us and was like, ""Well, you have to pay"". It's like she thought we were homeless even though I had my wallet right there in my hand and just seemed really fucking suspicious of us. Also, when I left for 5 minutes to use the bathroom she was really fucking rude to my girlfriend.

People just have a fucking stick up their collective asses in this town. I mean everyone. These are far from the only times we were just there doing normal things and people got really weird towards us. Like when I was at Walmart, asked to try on some pants from the boys section then got bitched at because the lady assumed I was a girl because I was short. Do that shit in Florida or Michigan and you might get a few funny looks but no one's gonna stop you or tell you you need to pay for the damages because some idiot ripped the tags off before you found them. 

We have had people try to run us over. On purpose. We had the right of way at the crosswalk and some guy went to a complete stop like he was going to let us go then once we were walking past suddenly stepped on the gas and tried to hit us. That same scenario has happened multiple times actually.

Anyway, I want to know if any other Fairborn residents have noticed how weird this town is? If they've noticed that people act all suspicious and hostile over stupid insignificant shit. If they've noticed that this place has a really weird vibe and seems like a ghost town (I came from a town not even half this size and there was more going on). If they've noticed how when you go outside, night or day, that no one is ever around? If they've noticed the weird sounds at night that sound like someone running their fingers along the rim of a crystal glass? And how no one seems to live here but angry old people. And how many of the drivers are outright psychopaths who will try to hit you on purpose (the drivers here are actually crazier than the ones in Florida. I didn't think that was possible). Any other Fairborn residents completely weirded out by this place or know why it's so weird in the first place?",Ohio,Anyone Else think Fairborn is Fucking Weird?
56,Brian_M_Hill,1578339340,ekyzuw,Nan,,Ohio,Taken at Conkle's Hollow on New Years Day
57,electrichamster89,1578342075,ekzo6j,Nan,"My husband and I are retired and are ready to get out of Columbus due to rents and traffic. We are looking for anywhere east of Franklin county all the way to east of Dayton/ Huber heights.  We've been looking at the Springfield area particularly. Are there any parts of Springfield we need to stay clear of due to crime? We really don't care about night life or other activities, we just want some place we won't need to have bars on the windows.",Ohio,Moving to Springfield region from Columbus
58,FarteGaas,1578344941,el0czi,Nan,[removed],Ohio,"Wag The Dog: First was feigned impeachment hearings meant to obstruct, now an attack on Iranians in Iraq. Here is what they are trying to distract from &amp; cover up to retain power. $84+ billion in bribes to the highest offices in this country. 600+ deaths from child rapes to prove loyalty. See latest"
59,JescoWhiteLightning,1578345479,el0hq9,Nan,,Ohio,2020 Gathering of the Juggalos comes to Garrettsville this August
60,ScrimmyBinguz,1578346207,el0o3c,Nan,,Ohio,always has been
61,theycallmewil_,1578351368,el1wom,Nan,,Ohio,"""Best state"" yeah okay. Wisconsin could've had the UP if it wasn't for you losers."
62,zsreport,1578356189,el30ge,Nan,,Ohio,"Three coyote carcasses skinned, dropped off near Mt. Airy Forest"
63,Jelfff,1578356207,el30l5,Nan,"Below is a link to an interactive map I produced.  When the map opens the **Ohio state house districts** are displayed with semi-transparent coloring (red=R, blue=D).  The data for the map is hosted on a GIS server operated by the state.  I am \*assuming\* the data is current.

To change the map so it shows the **Ohio state senate districts**:

1. Click the basemap button (Next to the ""Menu"" button)

2. Look under the ""Overlay"" heading (mobile users scroll down)

3. Click the house layers to turn them off

4. Click the senate ""fill"" layer and then the senate ""boundary"" layer.

It may take a few seconds for the data to appear.  It depends on how busy the GIS server is and the speed of your internet connection.  

The map is displayed by GISsurfer which is a general purpose web map I developed as a public service and part of my way to ""pay it forward"".  There is a **""Map tips""** link in the upper left corner with some general ‘Help' information.

Open Ohio legislative district map:

[https://mappingsupport.com/p2/gissurfer.php?center=40.313589,-82.534485&amp;zoom=7&amp;basemap=USA\_basemap&amp;overlay=Ohio\_state\_house\_fill,Ohio\_state\_house\_boundary&amp;txtfile=https://mappingsupport.com/p2/political/ohio/ohio\_legislature.txt](https://mappingsupport.com/p2/gissurfer.php?center=40.313589,-82.534485&amp;zoom=7&amp;basemap=USA_basemap&amp;overlay=Ohio_state_house_fill,Ohio_state_house_boundary&amp;txtfile=https://mappingsupport.com/p2/political/ohio/ohio_legislature.txt)

Finally, here is a PDF I prepared with step-by-step instructions showing how anyone can **use GIS data to make a Google map of any single state legislature district** or congressional district.

[https://mappingsupport.com/p2/political/google-map-political-district.pdf](https://mappingsupport.com/p2/political/google-map-political-district.pdf)",Ohio,Interactive map with Ohio legislative districts shaded by party
64,JohnKimble111,1578359623,el3s07,Nan,,Ohio,A university ‘welcomed’ everyone but men in STEM events. A professor filed a Title IX complaint
65,cyndiafedericiz,1578391353,el9m6r,Nan,,Ohio,Home | SOLID SKILLS
66,ReginaPhD,1578397095,elafs9,Nan,,Ohio,"Upper Falls, Old Man’s Cave (Hocking Hills)"
67,intertubeluber,1578410441,elcvgp,Nan,,Ohio,Why Are Residential Natural Gas Prices So High In Ohio Despite The Suppliers Getting the Gas For Less?
68,jacobdavies78,1578413436,eldja8,Nan,,Ohio,High Rise Window Cleaning &amp; Building Washing Pittsburgh
69,heartofitall,1578416093,ele54k,Nan,,Ohio,"Frozen Upper Falls, Old Man’s Cave (Hocking Hills)"
70,juanqp,1578435020,elioi9,Nan,,Ohio,State Medical Board of Ohio to consider if being a Browns or Bengals fan qualifies for medical marijuana use
71,weareea,1578435193,eliq3c,Nan,"Every single republican except trump has been disqualified on technicalities so now Trump will be the only republican candidate on the ballot for our primaries. 

Some republican friends of mine said that’s fine they’ll vote for Andrew Yang, but he, as the democratic candidate with the highest percentage of previous trump voters as supporters, was also disqualified on technicalities. 

How do you feel about this?",Ohio,Frank LaRose (secretary of state) is manipulating Ohio voters
72,stupid-rook-pawn,1578436425,elj0n2,Nan,"Are there any origami clubs, or organizations in the dayton area?",Ohio,Origami artists in Ohio?
73,konimoo,1578437016,elj5rn,Nan,Any tips on getting an entry level engineering/stem job in the central Ohio area ?,Ohio,Career Search
74,Gotthafooda,1578450977,elm8jc,Nan,Im thinking of moving to Sylvania Ohio because I got quoted 530 a month for basic insurance in Michigan. Im 28 and Ive been on my parents insurance and pay 100 a month for non full coverage. No points on my record ever. The apartments in the the Sylvania area are cheap like 400-500 a month and its not even ghetto at all. In Michigan the apartments downriver are 800 a month average.,Ohio,Insurance rates in Ohio vs Michigan.
75,thisabadusername,1578453097,elmotp,Nan,,Ohio,Denver Broncos’ Derek Wolfe makes donation to Beaver Local Schools
76,ExhaustedBirb,1578458445,elnsog,Nan,"Does anyone know of any good pantry’s that don’t require an Ohio State ID? I have my valid ID from a previous state to prove who I am but I haven’t switched it over to Ohio yet since I haven’t gotten mail at my new address. 

I just need assistance for about a week or two so I can save money that’d go to food to put it towards my rent. 

Context: I left my narcissistic ex fiancé in KY and just got a new job here in Ohio. I literally have next to nothing because my previous location had bedbugs and the treatment didn’t work (I suspect my former roommate didn’t work). I’m just really trying to keep this apartment so I can comfortably keep my job here in Moraine.",Ohio,"Food assistance (Fairborn, OH or Dayton, OH area)"
77,Koochiegrabber69,1578460677,elo7vg,Nan,,Ohio,Welcome to Ohio
78,MujamerSHVATILika,1578480042,elr3tx,Nan,,Ohio,Wooow try this
79,MujamerSHVATILika,1578488242,elscz1,Nan,,Ohio,No way
80,excoriator,1578493837,eltf1p,Nan,,Ohio,"Mike Bloomberg making big Ohio push: 13 field offices, 60 staffers already"
81,slerm-guzzler,1578496802,elu1pp,Nan,"For the past couple years, my parents have been very critical of me and lately it’s escalated a lot. Today I decided that i’ve had enough after my dad called me to tell me how stupid I am and how “fucking retarded” all of my decisions are. I’ve been actively pursuing jobs and I have some savings. I just want to get out of my house and away from this bad environment. 
My parents have an unstable relationship, they get in fights all the time. My dad has physically and verbally abused me. On top of that, he’s an alcoholic, edibles, and has even given me some.",Ohio,What can I (17m) legally do to cut my toxic family out of my life until I turn 18?
