,author,created_utc,id,link_flair_text,selftext,subreddit,title
1420,Oliver-ToyCatFriend,1584456592,fk6io3,Nan,,Ohio,Ohioans exiting quarantine (circa June 2020).
1421,lostrouteros,1584457230,fk6ows,Nan," 

When will they start shutting down construction sites. I am working at a large construction site in Cleveland and feel like I'm the only person not showing up. Day after they announce social distancing the GC has everyone gather in one area to talk about this and tell everyone business as usual. That was when no groups larger than 100 now it's 10. There are hundreds on this job.",Ohio,Construction Sites
1422,thismyusername69,1584458141,fk6xt8,Nan,,Ohio,"Lake county confirms its first case of coronavirus, female age 20-30."
1423,drake4lyfe,1584459461,fk7b0s,Nan,,Ohio,PA liquor stores closing please don't let this happen in Ohio!!!!
1424,thehofstetter,1584459535,fk7brc,Nan,"I did what I could to not cancel my shows, but the writing is on the wall, and it's spelled out in hand sanitizer. I am postponing my entire northeast tour.

A few of the venues I was supposed to be performing at are now closed indefinitely. And more have reached out to let us know they're considering doing the same. Rather than wait til all the dominoes fall, we've decided to cancel the tour so people have time to make alternate plans. Anyone who had tickets to the following shows will be getting a refund. 

CT - Manchester

MA - Boston

MI - Westland

NH - Manchester

NJ - Atlantic City, Point Pleasant

NY - Albany, NYC, Poughkeepsie, Rochester, Syracuse, White Plains

OH - Cleveland, Perrysburg

ON - Kingston, London

PA - Philly

QC - Montreal

RI - East Greenwich

VT - Burlington

I will be rescheduling these shows ASAP (Poughkeepsie, Manchester NH, and Cleveland have already been rescheduled for October). Meanwhile, I will be hosting free YouTube livestreams while I'm home (assuming my internet doesn't go down because people stormed the Spectrum offices looking for toilet paper.). Some are Q&amp;As with famous people, others are stand-up shows with my comedy buddies from our houses. If you wanna watch, they're free at [YouTube.com/thehofstetter](https://YouTube.com/thehofstetter) every day at 2PM and 8PM ET. 

The refunds will be processed automatically, give it a week or two to show up on your statement. My statement is that this sucks. 

Also for future shows - if any show is ever cancelled, you will get your money back. You don't have to worry about that before buying tickets. If you request a refund because you see a video you don't like (it's happened) or because your babysitter cancelled (it's happened) or because the weather suddenly got nice and you want to eat outdoors (yes, it's happened) you'll politely be told to go have intercourse with yourself.

Thank you to the thousands of you who tried to come to shows anyway. You are warriors, and I love you all. I hope you can make the show when I return to your area. As for future tours, they're on for now, but we'll wait and see. 

I'm not sure what to do with all this time at home. Maybe I'll go on a vacation. I hear Italy is nice this time of year.

Hugs,

\-Steve",Ohio,Steve Hofstetter here. My shows in Cleveland and Toledo are postponed. Refunds will be processed automatically.
1425,thexafterglow,1584459697,fk7dhg,Nan,,Ohio,First Positive Case of COVID-19 Confirmed in Lake County
1426,THUNDERSTORMS123,1584463583,fk8hh6,Nan,,Ohio,Possibility for strong storms on Thursday because of storms entering Ohio after leaving marginal risk area.
1427,harshwinds,1584464451,fk8qmm,Nan,,Ohio,Im impressed with DeWine and how hes handling the situation
1428,tony-_-joe,1584467714,fk9pg0,Nan,"Some people were standing there for an hour. Buy your ammo online if you can, no idea of their prices.",Ohio,If anyone is trying to buy anything from the Fin in canton they are limiting 10 people at a time and theres a line out there.
1429,Lepisosteus,1584468258,fk9ux1,Nan,,Ohio,"Gov. Dewine is having a live press conference momentarily. March 17, 2020 (2:00 PM)"
1430,whimsbee,1584469164,fka5fj,Nan,"I really hope we shutdown, all these people getting sick over dumb stuff, I work in an office supply chain and its RIDICULOUS  that people come in just to buy a pack of staples or to even bother asking ""y'all got hand sanitizer?"" 

It's so stupid",Ohio,Hopeful thinking
1431,KingHooley,1584470266,fkahco,Nan,,Ohio,"Meme Lords of Ohio, do what you do best - sign language interpreter at DeWine presser"
1432,-ow-my-balls-,1584470849,fkanj7,Nan,Is hot!,Ohio,Dr. Amy Acton
1433,StressedUniKid123,1584471449,fkau1h,Nan,,Ohio,Watch the results here!
1434,plokijuh1229,1584471932,fkaz92,Nan,,Ohio,I-71.jpg
1435,richieguy309,1584472514,fkb5jy,Nan,,Ohio,Inside the chaos that engulfed Ohio’s postponed primary election
1436,GrundleGhoul72,1584472592,fkb6cr,Nan,,Ohio,Does anyone else get the feeling that the shutdown was just a ploy to send people running to the new amazon warehouse. Just seems too convenient.
1437,HauntingJackfruit,1584473386,fkbezh,Nan,,Ohio,"67 confirmed Ohio coronavirus cases : Gov. Mike DeWine Tuesday, March 17 briefing"
1438,StressedUniKid123,1584473463,fkbfrx,Nan,,Ohio,"How can you still support Trump? Tax cuts for corps but not people, WTF?!"
1439,irottodeath,1584476367,fkcaib,Nan,"i’m not eligible for unemployment in this crisis, am i? i’m working through filing a claim right now, but i have no start date to list for this new job.

i’m running out of money and feeling pretty fucked!",Ohio,"i’ve been out of a job since January, was offered a new job last Thursday and set to start Monday the 23rd, and now my start date is “tentatively” pushed back to April 6th due to COVID-19."
1440,aintscurrdscars,1584476422,fkcb2a,Nan,,Ohio,"Just a little reminder for any of you in IL, AZ, FL or OH voting today!"
1441,StuStutterKing,1584478259,fkcu0c,Nan,"I've been trying to find the text of DeWine's executive order so I can understand the specifics, but I haven't been able to find it. Anybody got a link?",Ohio,Does anybody have a link to the Unemployment EO?
1442,couchbagel,1584485629,fkevn5,Nan,,Ohio,Soon
1443,scrotalbatwings-0v0-,1584488286,fkfkmb,Nan,"I work for a small manufacturing company located in Ohio with 60 or so employees.  Throughout the day, I along with other managers  have heard rumors about our tech's wife that works with someone who as been quarantined due to the possibility of being in contact with the virus (we don't know their results).  Seeing that the tech that works with us didn't show up for work,   has a stellar attendance record, and didn't have the day scheduled off it really has people talking and worried.

 My question is, with all the ""rules"" regarding HIPAA  and a persons right to privacy, how responsible is senior management to make their employees aware of this circumstance and  in what way does the company convey this situation?  I understand they don't want to cause panic, and they can't say it outright, but I feel that the employees should at least know; especially since the individual is in contact with a lot of the equipment and resources all of us use.

Not to mention, our ""human resource manager"" is the owner of the company as well as someone who thinks this whole thing is being blown out of proportion via the media.   

Thanks and be kind to one another.",Ohio,"At what point does ""employee confidently"" trump other employer safety?"
1444,consensus_wins,1584489441,fkfvhs,Nan,,Ohio,Insight into Covid-19
1445,BimblesMcPippens,1584491934,fkgi0i,Nan,"I am NOT in fear of government conspiracy or any of the other ridiculous hype going around - I have been living my life as I typically would with no change to my typical day to day routine. Within the last week I have watched not only my house-mates but my co-workers start to grow extremely paranoid and am now forced to listen to these nut jobs talk about chem-trails, the 144,000, Georgia Guidestones, and now Facebook being ""in-bed"" with the government by blocking COVID related posts and FEMA preparing to enact Martial-Law and put people in concentration camps. SERIOUSLY, WTF is wrong with these people, they can't even get they're conspiracies right!!! I feel like I'm living amongst the crazy  hill-folk?!?!? I have nowhere to go as my car died a month ago and am now living with loaded weapons laying around the living room. And tonight it turns out that they've invited they're drug dealer over to smoke pot in the house!!!!! Now I'M AT RISK FOR DRUG POSSESSION BY LIVING WITH THESE DERANGED LUNATICS!!! I've been living with these people for almost a year now and I am just now finding out these people are gun toting drug addicts! SOMEONE NEEDS TO GET THESE PEOPLE TO CALM THE $&amp;\^% DOWN, they all believe I'M THE CRAZY ONE FOR NOT WANTING TO JOIN THE TEAM!!!! GET ME THE HELL OUT OF HERE!",Ohio,"Arizona transplant now fearing for my life as Ohio Natives are stockpiling ammunition, weapons and pot in our shared home!!!!!! WHAT IS WRONG WITH THE PEOPLE IN OHIO!!!!!"
1446,robotzor,1584493912,fkgzcb,Nan,,Ohio,Ohio Democratic Party sues over delay of primary election
1447,Kmcampbe09,1584494306,fkh2vp,Nan,,Ohio,Looking for some help from my Ohio fam. A friend of mine discovered that her grandparents wedding rings we stolen and probably pawned. She lives in the Wooster area and is looking for any possible leads to get them back. (Photo of rings in comments)
1448,kliens7575,1584494450,fkh465,Nan,Anyone know what's going on with supposed national guard presence on Ohio turnpike,Ohio,Wondering
1449,whimsbee,1584494627,fkh5qj,Nan,I wonder why my store is still open?,Ohio,4 customers in 8 hours.
1450,Kmcampbe09,1584495152,fkhag1,Nan,,Ohio,Looking for some help from my Ohio fam. A friend of mine discovered that her grandparent’s wedding rings were stolen and probably pawned. She lives in the Wooster area and is looking for any possible leads to get them back.
1451,tomsfoolery,1584497409,fkhtt2,Nan,Neighbor was saying property owners might lose out on rental income (something about the governor). Of course that income pays landlords bills so then what happens? Mortgages aside.,Ohio,Anyone know what's going on with Ohio rent?
1452,HaydenHaydenn,1584500198,fkihgr,Nan,,Ohio,Yea basically.
1453,Kellyb86,1584503138,fkj5hl,Nan,,Ohio,Shaving cream pranks(4)
1454,Pali_uncensored,1584503710,fkj9zv,Nan,,Ohio,[Emergency COVID-19 Unemployment ](https://unemployment.ohio.gov/PublicSelfServiceChoice.html)
1455,msangeld,1584511868,fkkve1,Nan,,Ohio,"As someone who has been home-bound for over 10 years, Here are some things you can do to help you overcome your feelings of isolation."
1456,ronniedarko,1584523277,fkmrcf,Nan,,Ohio,After a few days off I’m starting to feel it...
1457,ronniedarko,1584523550,fkmsup,Nan,,Ohio,Day 3 of no job as a restaurant worker
1458,Pariahdog119,1584525575,fkn4sy,Nan,,Ohio,"Speaker Householder calls for a special legislative session to deal with primary, wants to challenge limits on assembly, says they don't apply to the legislature"
1459,wolf_on_the_fold,1584530863,fko127,Nan,,Ohio,"PSA Remain Indoors, everyone"
1460,THUNDERSTORMS123,1584531289,fko3vy,Nan,,Ohio,Possibility fee or strong to severe thunderstorms. Marginal risk for portions of ohio on Thursday and Friday.
1461,THUNDERSTORMS123,1584533331,fkohz5,Nan,,Ohio,Hazardous Weather Outlook
1462,HappyCicada,1584535267,fkow3y,Nan,"Greetings fellow house-bound Ohioans,

My kids are bored and driving me crazy. Assuming I'm not alone in this, I thought it would be a good idea to make a list of some outdoor places we can explore. Something to get us outside and away from video games and dire news stories. So what are some of your lesser known hiking spots, outdoor places, hidden gems that would be great to explore while maintaining social distancing? 

One of my favorites is the Moonville Tunnel in Vinton County. There was a great graveyard here, too, but unfortunately it suffered some recent vandalism.

Thanks in advance and stay safe everyone!",Ohio,Favorite hiking/outdoor places we can explore while maintaining social distance.
1463,mortiseman,1584535905,fkp11w,Nan,"Has anyone tried to call the Department of Unemployment (Jobs and Family Services)?  I started yesterday, picked it back up at 7:59 AM this morning. I find it strange they will not let you wait on hold (I got nothing but time). They say ""We are experiencing high call volume"" and then they hang up. All I need to do is reset my PIN but they are telling me I need to call because I do not have an email on file?!?",Ohio,Jobs and Family Services
1464,a_complex_kid,1584537148,fkpazn,Nan,,Ohio,Viruses don't know politics
1465,ScootinFruity,1584537357,fkpcl1,Nan,"I'm an optician and there's points where I'm a couple of inches from someone's face and it's a little scary being so up close and personal with people during this crisis. 

My company says that they aren't shutting down until were forced to, so I'm stuck going to work with the very real possibility of coming in contact w COVID-19. 

I thought for sure that DeWine was going to shut down non essential business yesterday, but nothing happened. 

What are you thinking about today?",Ohio,Anyone else think they're going to shut down non essential business today?
1466,Notyourdadsmom,1584537415,fkpd1j,Nan,Because this call center doesnt care about our well being or who that extends to outside. We shouldnt have to fear losing our job during this.,Ohio,Does anyone any legitimate sources saying we should expect a full lockdown?
1467,onions_aggressively,1584538884,fkpom3,Nan,,Ohio,"Cincinnati bar boarded up after defying statewide order to close, police say"
1468,consensus_wins,1584539469,fkpth4,Nan,,Ohio,And I was looking forward to spring.
1469,bdubchile,1584539538,fkpu18,Nan,,Ohio,What steps would you like to see Ohio government take next on coronavirus?
1470,imspooked777,1584539672,fkpv4s,Nan,,Ohio,OSU engineering student makes simple but effective health home video
1471,imspooked777,1584540742,fkq4j6,Nan,,Ohio,OSU student's corona workout goes apeshit
1472,SmartnSad,1584541361,fkq9yc,Nan,The Cleveland Clinic announced they are now restricting their testing to those 61+ and/or those already hospitalized. How can one get a test? Where is the curbside testing that the President said would be offered by large retail chains?,Ohio,"COVID-19: Is there a Walmart, Target, CVS or Walgreens anywhere in Ohio that is offering testing?"
1473,Mongoosemancer,1584543057,fkqpgm,Nan,"I have been with my family in another state for a while and i need to drive home to my house in Ohio on Sunday and i was just curious about this. If things are in full lockdown mode, will i not be able to get gas? I'm afraid i wont be able to get home.",Ohio,"In the event of a lockdown where all non essential businesses close, will all gas stations be closed?"
1474,rogue_optimism,1584543330,fkqs2h,Nan,,Ohio,"Our healthcare system is going to collapse, it's not even bad yet just wait"
1475,jefferson_lives,1584543546,fkqu2f,Nan,1:07:34 and still holding here,Ohio,What kind of hold times have people experienced when calling the department of health coronavirus hotline?
1476,Mememaker90,1584543642,fkquzb,Nan,,Ohio,Facts
1477,Justaguyinohio123,1584544071,fkqz62,Nan,"Rule 1.Stay calm. Humans have been through much worse. This too will pass.

Rule 2.Be patient. People are people. They are still going to do things they annoy and confound you. Kids at home being imperfect, co-workers doing things you don't like ,this is all part of life 

Rule 3.Be kind. People will have fears for themselves and their families.

Rule 4.Be positive. We have overcome much worse problems before.Use positive words and actions. Imagine that people are looking to you for guidance.

Rule 5.Get a goal. Try learning to bake, rewatch all 9 seasons of the Office, exercise, learn magic, learn to bartend. Something besides worrying and watching the news. The goal will help you from going stir crazy.

Rule 6.Always remember that this sucks for everybody. We are the adults here. If you only think about how it's affected you then that's not helpful.

Rule 7.Listen what's asked to be done and do it. The government is trying their best to figure things out. We have a partisanship problem propped up by social media in this country and its self defeating to try to paint either side as the enemy of this issue. Don't spew hate online about a political affiliations, those comments aren't changing anyone's opinion on the matter or helping right now. 

Rule 8.Don't spread misinformation. Vet your sources. Your Facebook friend probably doesn't have a trusted nurse who shared a letter with her about how hot liquids stop viruses.

Rule 9.Help out. If you can afford it then donate to a food bank, play the piano and send the video to your friends, call someone you haven't seen for a while, make sure your neighbors are ok, start an online Scrabble tournament.

Rule10.Support a business if you can. Order a milkshake and have it delivered, buy something online if you need it from a box store. Every little bit helps.

Bonus rule

Try to remember the lessons of past. WWII, post 9-11 all the times we've banded together as Americans to face down what will be our biggest enemies during this time which are fear, ignorance and selfishness. Hope is a good thing, maybe the best of things and a good thing never dies .",Ohio,10 rules for a Pandemic and 1 Bonus rule (new)
1478,THUNDERSTORMS123,1584544565,fkr43p,Nan,,Ohio,Possibility for strong to severe thunderstorms on Thursday and Friday. Marginal risk for portions of Ohio on both of those days. (repost because of spelling error in title when I posted previously)
1479,Inevitable_Rough,1584549937,fksmz4,Nan,Is Gov Mike talking today? If so what time?,Ohio,Gov update today?
1480,[deleted],1584553261,fktlns,Nan,[deleted],Ohio,Updates
1481,ecb1912,1584554288,fktwor,Nan,,Ohio,Some humor for those who are currently unemployed
1482,PeaceIsSoftcoreWar,1584555063,fku569,Nan,Streaming at http://ohiochannel.org/governor-live-stream.html,Ohio,The Governor's Livestream just started as of 2:08 PM EST
1483,thexafterglow,1584555699,fkubv1,Nan,,Ohio,Just finished a 12 hour shift swabbing symptomatic covid19 patients are our drive thru testing site in Cleveland. We collectively swabbed 629.
1484,joho3883,1584556344,fkuino,Nan,,Ohio,Nice
1485,whimsbee,1584556651,fkulsv,Nan,"Temperatures have to be taken before entering your place of work. Barbers, spas, salons, tattoo shops are closed. BMV is closed too",Ohio,Get ready
1486,ronnieseeger,1584557449,fkutzm,Nan,,Ohio,"88 people in Ohio have tested positive coronavirus: Gov. Mike DeWine’s Wednesday, March 18 coronavirus briefing"
1487,ronnieseeger,1584558091,fkv0pc,Nan,,Ohio,Delaware Co. Reports First COVID-19 Case
1488,HauntingJackfruit,1584559360,fkvdy4,Nan,,Ohio,Live video: Ohio Gov. DeWine provides daily coronavirus update
1489,ronnieseeger,1584560137,fkvm3w,Nan,,Ohio,"Got a call today from ""OJFS"" (Ohio Jobs and Family Services, I think). Thought it was a scam, didn't answer, didn't leave a message. Anyone else here get a call?"
1490,THUNDERSTORMS123,1584560384,fkvop9,Nan,,Ohio,Possibility for strong to severe thunderstorms on Thursday and Friday. Higher levels of risk expanding further into ohio. I reccomend checking the SPC Convective Outlooks often. I will be posting updates for this severe weather threat often.
1491,irottodeath,1584562183,fkw7br,Nan,,Ohio,Northwest Ohio is experiencing a shortage of blood and i’m sure most other areas of the state are as well.
1492,ProbablyNotAYak,1584562265,fkw891,Nan,,Ohio,Columbus Mayor Ginther declares state of emergency - approx. 1300 employees asked to remain home/work from home if possible.
1493,gaymanreads,1584562425,fkwa01,Nan,,Ohio,It sounds like we slowly getting ready for a full shutdown in Ohio.
1494,sunnieebee,1584562920,fkwf4w,Nan,"Saw some odd looking slate colored military like vehicles on 77N bound around the 70 exit about 1.5hrs ago. About 5 off then, on no symbols exactly some sort of weird hazard looking symbol I have never seen before. They were going quick. Any ideas?",Ohio,Spotted weird vehicles on 77N
1495,redditstealsyoursoul,1584563205,fkwi4s,Nan,"Hi all, lost my job due to corona. I was wondering if anyone else is having trouble filing for unemployment. When I try to file online I just keep getting an error that says the connection was reset. I tried on a different browser, as well as on my phone but get the same results.

After troubleshooting and retrying for an hour I decided to try by phone, but get an automated message that they have too many calls and to try again later.

Is anyone else having this type of trouble? Is there anything else I can do? Thanks!",Ohio,Unemployment Help
1496,HauntingJackfruit,1584564259,fkwszk,Nan,,Ohio,"Worried you have coronavirus but can’t get a test? Here’s what to do, who to call, and when"
1497,swoosan,1584564639,fkwwxl,Nan,,Ohio,"Shit is hitting the fan in Canton, Ohio. Waffle House has changed their hours"
1498,StrmCentry,1584564708,fkwxnk,Nan,,Ohio,Ohio BMV’s Ordered Closed
1499,LifesPotential,1584565951,fkxaw4,Nan,"The way she was explaining, we're going to have 1 or 2 thermometers to take all employees temps? I'm highly agaisnt using a thermometer other people have used, even if sterilized.



Can anybody confirm?",Ohio,"Arrived at work today, my manager is telling me something about everybody having their temperature taken?"
1500,Yopauolo,1584566070,fkxc6z,Nan,"In light of current events, I will be forced to. I recently had a birthday and have yet been unable to renew my license. Now it looks like I won't be able to for a while. Also, if this closure extends beyond any grace period, will that still be honored (or do they even still give you a couple weeks after your bday to renew?)? Anyone know of anything official yet? I haven't found anything pertinent.",Ohio,Is it okay to drive with an expired license for now?
1501,THUNDERSTORMS123,1584567669,fkxsiw,Nan,,Ohio,Hazardous Weather Outlook UPDATE
1502,owlmom04,1584568608,fky1wb,Nan,"DeWine has shut down nail salons, beauty shops, tattoo parlors, etc but what about tanning salons",Ohio,Tanning salons
1503,Malicoire,1584569248,fky8il,Nan,"If we truly want to stop the spread of this virus, as much as it hurts, we need to shut down and lock in.

We've all heard that you can be infectious for up to two weeks before you exhibit any symptoms at all.

Now, we're to ask employees to check the temperatures of others, putting them into close enough proximity to every other person in the company to contract and spread the disease. 

Then, if you're lucky, the person who has had it for two weeks, and now has a fever, was tested AFTER you were, because now, we're going to scan the rest of the company with that device.

Oh, we should be using distance thermometers? So every company in Ohio should have at least one no-contact thermometer by tomorrow? There should be plenty on the shelves, right? Oh and this box says for use at 1-4 feet? But I thought we needed a 6 foot bubble.

This is not a solution at all. It's a show. Worthless gesture to avoid doing the inevitable.

I know that when I get to work tomorrow, I'm going to be told that I have to take my worker's temperatures. Refusing may cost me my job.",Ohio,"Taking temperatures is too little, too late"
1504,MooneyedJack,1584573378,fkzdk4,Nan,,Ohio,🎵Proud to be an Ohioan 🎵(with apologies to Lee Greenwood)
1505,legend216oh,1584574773,fkzqwr,Nan,"It seems like we are trending towards a non-essential shutdown, in that event. My Main job probably ends up closing (42+ hours per week) I have an additional income where I work from home (16-20 hours per week) Will I still be eligible for unemployment if I happen to lose my main income?",Ohio,Question about Unemployment with two jobs.
1506,crazyira-thedouche,1584575994,fl0238,Nan,,Ohio,Watchin those 2pm press conferences like
1507,CoCblocking,1584577023,fl0b0j,Nan,,Ohio,Nice
1508,THUNDERSTORMS123,1584577500,fl0fc4,Nan,,Ohio,Another Hazardous Weather Outlook UPDATE
1509,trytobefitrunner,1584579192,fl0vbj,Nan,"As the title states our company is in industrial and warehouse automation.

We have one critical business site where 20+ engineers have been on site to support a new warehouse

The warehouse is located in Southern California and I have heard some colleague that some of the employees in the warehouses have exhibited symptoms (cough) are still on site 

The on site sanitation is barely enough, they just started disinfecting work spaces once every few days. And there are barely any cleaning supplies at local supermarkets 

The management is still business as usual and keep insisting and planning more people to fly in on site next week. 

Hotels are planning to shutdown and food choices for the team is limited since very few places have take out right now 

On top of this every week of two different people fly in as part of the rotation to support the team. And they are high risk of contacting the virus as well due to air travel 

Honestly Management has been deaf, they are creating new measure but are not even considering full shutdown of some operations. They do have changed all in house activities to be work from home but on site especially to non critical sites like this one is unnecessary 

Is there anything that I can do as a normal citizen to bring a light to these? Get help from Govt? Or at least let them know 

What else can I do so that they won’t ask me to travel?

Any help would be appreciated",Ohio,Employer asking us to continue travel to California to support a customer warehouse. Not a lot of sanitation practices at customer warehouse.
